Sheet: Trump Timeline
B2: Inauguration | C2: 2017-01-20
B3: Last Day
B4: Days | C4: of:=TODAY()-[.C2] -> 91

Sheet: Obama Timeline
B2: Inauguration | C2: 2009-01-20
B3: Last Day | C3: 2017-01-20
B4: Days | C4: of:=[.C3]-[.C2] -> 2922
B5: Hannity ‘Not My President’ | C5: 2015-01-12
B6: Days | C6: of:=[.C5]-[.C2] -> 2183

Sheet: Reagan Timeline
B2: Inauguration | C2: January 20, 1981
B3: Last Day | C3: January 20, 1989
B4: Days | C4: of:=[.C3]-[.C2] -> 2922
B5: Assassination Attempt | C5: March 30, 1981
B6: Days | C6: of:=[.C5]-ReaganInauguration -> 69

Sheet: Judicial Vacancies
A1: https://www.nytimes.com/interactive/2017/02/14/upshot/trump-poised-to-transform-american-courts.html
B2: President | C2: Vacant Seats | D2: Senior Seats | E2: Median Age | F2: Expected Vacancies
B3: Trump | C3: of:=108/870 -> 0.124137931034483 | D3: 24% | E3: 62.6 | F3: 38%
B4: Clinton | C4: 14% | D4: 9% | E4: 58.6 | F4: 31%
B5: Obama | C5: 6% | D5: 15% | E5: 60.6 | F5: 29%
B6: W. Bush | C6: 10% | D6: 10% | E6: 57.6 | F6: 26%
B7: Nixon | C7: 4% | D7: 9% | E7: 59.6 | F7: 22%
B8: Carter | C8: 5% | D8: 10% | E8: 58.8 | F8: 22%
B9: Bush | C9: 5% | D9: 9% | E9: 58.6 | F9: 22%
B10: Reagan | C10: 5% | D10: 10% | E10: 58.1 | F10: 21%
B11: Ford | C11: 3% | D11: 8% | E11: 58.3 | F11: 13%

Sheet: Obama Judicial Nominations
B2: Name | C2: Nominated to: | D2: First nomination date | E2: Hearing date | F2: Nomination withdrawn | G2: Confirmation date | H2: Senate confirmation vote | I2: Days since Inauguration
B3: David Barron | C3: United States Court of Appeals for the First Circuit | D3: September 24, 2013 | E3: November 30, 2013 | G3: May 22, 2014 | H3: 53-45 | I3: of:=[.D3]-ObamaInauguration -> 1708
B4: Albert G. Lauber
B5: George L. Russell, III | C5: District of Maryland | D5: 11/10/2011 | E5: 1/26/2012 | G5: 5/14/2012 | I5: of:=[.D5]-ObamaInauguration -> 1024
B6: George Hanks | C6: United States District Court for the Southern District of Texas | D6: September 18, 2014 | E6: January 21, 2015 | G6: April 20, 2015 | H6: 91-0 | I6: of:=[.D6]-ObamaInauguration -> 2067
B7: Donald Schott | C7: United States Court of Appeals for the Seventh Circuit | D7: January 12, 2016 | E7: May 18, 2016 | I7: of:=[.D7]-ObamaInauguration -> 2548
B8: Todd Sunhwae Kim | C8: District of Columbia Court of Appeals | D8: February 24, 2014 | I8: of:=[.D8]-ObamaInauguration -> 1861
B9: Rainey Ransom Brandt | C9: Superior Court of the District of Columbia | D9: November 15, 2016 | I9: of:=[.D9]-ObamaInauguration -> 2856
B10: Carmen Guerricagoitia McLean | C10: Superior Court of the District of Columbia | D10: September 27, 2016 | I10: of:=[.D10]-ObamaInauguration -> 2807
B11: Deborah Israel | C11: Superior Court of the District of Columbia | D11: September 27, 2016 | I11: of:=[.D11]-ObamaInauguration -> 2807
B12: Julie Breslow | C12: Superior Court of the District of Columbia | D12: September 27, 2016 | I12: of:=[.D12]-ObamaInauguration -> 2807
B13: Diane Gujarati | C13: United States District Court for the Eastern District of New York | D13: September 13, 2016 | I13: of:=[.D13]-ObamaInauguration -> 2793
B14: Abid Qureshi | C14: United States District Court for the District of Columbia | D14: September 6, 2016 | I14: of:=[.D14]-ObamaInauguration -> 2786
B15: Jennifer Puhl | C15: United States Court of Appeals for the Eighth Circuit | D15: January 28, 2016 | E15: June 21, 2016 | I15: of:=[.D15]-ObamaInauguration -> 2564
B16: Jason D. Tulley | C16: Superior Court of the District of Columbia | D16: June 29, 2016 | I16: of:=[.D16]-ObamaInauguration -> 2717
B17: John E. Sparks | C17: United States Court of Appeals for the Armed Forces | D17: July 30, 2015 | E17: December 9, 2015 | G17: April 5, 2016 | H17: Voice | I17: of:=[.D17]-ObamaInauguration -> 2382
B18: Anne Traum | C18: United States District Court for the District of Nevada | D18: April 28, 2016 | I18: of:=[.D18]-ObamaInauguration -> 2655
B19: Patricia Timmons-Goodson | C19: United States District Court for the Eastern District of North Carolina | D19: April 28, 2016 | I19: of:=[.D19]-ObamaInauguration -> 2655
B20: Regina Rodriguez | C20: United States District Court for the District of Colorado | D20: April 28, 2016 | I20: of:=[.D20]-ObamaInauguration -> 2655
B21: Philip Lammens | C21: United States District Court for the Northern District of Florida | D21: April 28, 2016 | I21: of:=[.D21]-ObamaInauguration -> 2655
B22: William Jung | C22: United States District Court for the Middle District of Florida | D22: April 28, 2016 | I22: of:=[.D22]-ObamaInauguration -> 2655
B23: Patricia D. Barksdale | C23: United States District Court for the Middle District of Florida | D23: April 28, 2016 | I23: of:=[.D23]-ObamaInauguration -> 2655
B24: Rebecca Ross Haywood | C24: United States Court of Appeals for the Third Circuit | D24: March 15, 2016 | I24: of:=[.D24]-ObamaInauguration -> 2611
B25: Kathleen Marie Sweet | C25: United States District Court for the Western District of New York | D25: March 15, 2016 | E25: June 21, 2016 | I25: of:=[.D25]-ObamaInauguration -> 2611
B26: Karen Gren Scholer | C26: United States District Court for the Eastern District of Texas | D26: March 15, 2016 | E26: September 7, 2016 | I26: of:=[.D26]-ObamaInauguration -> 2611
B27: Irma Ramirez | C27: United States District Court for the Northern District of Texas | D27: March 15, 2016 | E27: September 7, 2016 | I27: of:=[.D27]-ObamaInauguration -> 2611
B28: James Wesley Hendrix | C28: United States District Court for the Northern District of Texas | D28: March 15, 2016 | E28: September 7, 2016 | I28: of:=[.D28]-ObamaInauguration -> 2611
B29: Scott Frost | C29: United States District Court for the Northern District of Texas | D29: March 15, 2016 | E29: September 7, 2016 | I29: of:=[.D29]-ObamaInauguration -> 2611
B30: David Counts | C30: United States District Court for the Western District of Texas | D30: March 15, 2016 | E30: September 7, 2016 | I30: of:=[.D30]-ObamaInauguration -> 2611
B31: Lisabeth Tabor Hughes | C31: United States Court of Appeals for the Sixth Circuit | D31: March 17, 2016 | I31: of:=[.D31]-ObamaInauguration -> 2613
B32: Donald Coggins Jr. | C32: United States District Court for the District of South Carolina | D32: February 25, 2016 | E32: June 21, 2016 | I32: of:=[.D32]-ObamaInauguration -> 2592
B33: Claude Kelly | C33: United States District Court for the Eastern District of Louisiana | D33: February 4, 2016 | E33: May 18, 2016 | I33: of:=[.D33]-ObamaInauguration -> 2571
B34: Stephanie A. Finley | C34: United States District Court for the Western District of Louisiana | D34: February 4, 2016 | E34: May 18, 2016 | I34: of:=[.D34]-ObamaInauguration -> 2571
B35: Terrence Campbell | C35: United States District Court for the District of Kansas | D35: January 28, 2016 | I35: of:=[.D35]-ObamaInauguration -> 2564
B36: Winfield Ong | C36: United States District Court for the Southern District of Indiana | D36: January 12, 2016 | E36: May 18, 2016 | I36: of:=[.D36]-ObamaInauguration -> 2548
B37: Myra Selby | C37: United States Court of Appeals for the Seventh Circuit | D37: January 12, 2016 | I37: of:=[.D37]-ObamaInauguration -> 2548
B38: Scott Palk | C38: United States District Court for the Western District of Oklahoma | D38: December 16, 2015 | E38: April 20, 2016 | I38: of:=[.D38]-ObamaInauguration -> 2521
B39: Suzanne Mitchell | C39: United States District Court for the Western District of Oklahoma | D39: December 16, 2015 | E39: April 20, 2016 | I39: of:=[.D39]-ObamaInauguration -> 2521
B40: Paul Abrams | C40: United States District Court for the Central District of California | D40: December 16, 2015 | E40: May 18, 2016 | I40: of:=[.D40]-ObamaInauguration -> 2521
B41: Ronald Russell | C41: United States District Court for the District of Utah | D41: December 16, 2015 | E41: April 20, 2016 | I41: of:=[.D41]-ObamaInauguration -> 2521
B42: Steven Nathan Berk | C42: Superior Court of the District of Columbia | D42: November 30, 2015 | E42: March 2, 2016 | G42: June 23, 2016 | H42: Voice vote | I42: of:=[.D42]-ObamaInauguration -> 2505
B43: Elizabeth Carroll Wingo | C43: Superior Court of the District of Columbia | D43: November 30, 2015 | E43: March 2, 2016 | G43: June 23, 2016 | H43: Voice vote | I43: of:=[.D43]-ObamaInauguration -> 2505
B44: Vik Edwin Stoll | C44: United States Tax Court | D44: November 9, 2015 | E44: February 4, 2016 | I44: of:=[.D44]-ObamaInauguration -> 2484
B45: Mary S. McElroy | C45: United States District Court for the District of Rhode Island | D45: September 8, 2015 | E45: December 9, 2015 | I45: of:=[.D45]-ObamaInauguration -> 2422
B46: Stephanie A. Gallagher | C46: United States District Court for the District of Maryland | D46: September 8, 2015 | E46: April 20, 2016 | I46: of:=[.D46]-ObamaInauguration -> 2422
B47: Clare E. Connors | C47: United States District Court for the District of Hawaii | D47: September 8, 2015 | E47: January 27, 2016 | I47: of:=[.D47]-ObamaInauguration -> 2422
B48: Rebecca Goodgame Ebinger | C48: United States District Court for the Southern District of Iowa | D48: September 15, 2015 | E48: October 21, 2015 | G48: February 8, 2016 | H48: 83-0 | I48: of:=[.D48]-ObamaInauguration -> 2429
B49: John M. Younge | C49: United States District Court for the Eastern District of Pennsylvania | D49: July 30, 2015 | E49: December 9, 2015 | I49: of:=[.D49]-ObamaInauguration -> 2382
B50: Dax E. Lopez | C50: United States District Court for the Northern District of Georgia | D50: July 30, 2015 | I50: of:=[.D50]-ObamaInauguration -> 2382
B51: Marilyn J. Horan | C51: United States District Court for the Western District of Pennsylvania | D51: July 30, 2015 | E51: December 9, 2015 | I51: of:=[.D51]-ObamaInauguration -> 2382
B52: Robert J. Colville | C52: United States District Court for the Western District of Pennsylvania | D52: July 30, 2015 | E52: December 9, 2015 | I52: of:=[.D52]-ObamaInauguration -> 2382
B53: Gary R. Brown | C53: United States District Court for the Eastern District of New York | D53: July 30, 2015 | E53: October 21, 2015 | I53: of:=[.D53]-ObamaInauguration -> 2382
B54: Inga S. Bernstein | C54: United States District Court for the District of Massachusetts | D54: July 30, 2015 | E54: April 20, 2016 | I54: of:=[.D54]-ObamaInauguration -> 2382
B55: Susan Baxter | C55: United States District Court for the Western District of Pennsylvania | D55: July 30, 2015 | E55: December 9, 2015 | I55: of:=[.D55]-ObamaInauguration -> 2382
B56: Gary Katzmann | C56: United States Court of International Trade | D56: July 30, 2015 | E56: January 27, 2016 | G56: June 6, 2016 | H56: Voice vote | I56: of:=[.D56]-ObamaInauguration -> 2382
B57: Jennifer Choe Groves | C57: United States Court of International Trade | D57: July 30, 2015 | E57: January 27, 2016 | G57: June 6, 2016 | H57: Voice vote | I57: of:=[.D57]-ObamaInauguration -> 2382
B58: Elizabeth J. Drake | C58: United States Court of International Trade | D58: July 30, 2015 | E58: January 27, 2016 | I58: of:=[.D58]-ObamaInauguration -> 2382
B59: Leonard T. Strand | C59: United States District Court for the Northern District of Iowa | D59: July 21, 2015 | E59: October 21, 2015 | G59: February 11, 2016 | H59: 93-0 | I59: of:=[.D59]-ObamaInauguration -> 2373
B60: Mark A. Young | C60: United States District Court for the Central District of California | D60: July 16, 2015 | E60: October 21, 2015 | I60: of:=[.D60]-ObamaInauguration -> 2368
B61: Darlene Michele Soltys | C61: Superior Court of the District of Columbia | D61: July 9, 2015 | E61: December 3, 2015 | G61: December 17, 2015 | H61: Voice | I61: of:=[.D61]-ObamaInauguration -> 2361
B62: Robert F. Rossiter, Jr. | C62: United States District Court for the District of Nebraska | D62: June 11, 2015 | E62: September 30, 2015 | G62: June 27, 2016 | H62: 90-0 | I62: of:=[.D62]-ObamaInauguration -> 2333
B63: Brian R. Martinotti | C63: United States District Court for the District of New Jersey | D63: June 11, 2015 | E63: September 30, 2015 | G63: July 6, 2016 | H63: 92-5 | I63: of:=[.D63]-ObamaInauguration -> 2333
B64: Edward L. Stanton III | C64: Western District of Tennessee | D64: May 21, 2015 | E64: September 30, 2015 | I64: of:=[.D64]-ObamaInauguration -> 2312
B65: Elizabeth Ann Copeland | C65: United States Tax Court | D65: May 1, 2015 | E65: February 4, 2016 | I65: of:=[.D65]-ObamaInauguration -> 2292
B66: Julie Helene Becker | C66: Superior Court of the District of Columbia | D66: April 30, 2015 | E66: March 2, 2016 | G66: June 23, 2016 | H66: Voice vote | I66: of:=[.D66]-ObamaInauguration -> 2291
B67: Wilhelmina Wright | C67: District of Minnesota | D67: April 15, 2015 | E67: July 22, 2015 | G67: January 19, 2016 | H67: 58-36 | I67: of:=[.D67]-ObamaInauguration -> 2276
B68: Paula Xinis | C68: District of Maryland | D68: March 26, 2015 | E68: July 22, 2015 | G68: May 16, 2016 | H68: 53-34 | I68: of:=[.D68]-ObamaInauguration -> 2256
B69: John Michael Vazquez | C69: District of New Jersey | D69: March 26, 2015 | E69: July 22, 2015 | G69: January 27, 2016 | H69: 84-2 | I69: of:=[.D69]-ObamaInauguration -> 2256
B70: Lawrence Joseph Vilardo | C70: Western District of New York | D70: February 4, 2015 | E70: May 6, 2015 | G70: October 26, 2015 | H70: 88-0 | I70: of:=[.D70]-ObamaInauguration -> 2206
B71: Waverly D. Crenshaw Jr. | C71: Middle District of Tennessee | D71: February 4, 2015 | E71: June 10, 2015 | G71: April 11, 2016 | H71: 92-0 | I71: of:=[.D71]-ObamaInauguration -> 2206
B72: Travis Randall McDonough | C72: United States District Court for the Eastern District of Tennessee | D72: November 20, 2014 | E72: June 10, 2015 | G72: December 7, 2015 | H72: 89-0 | I72: of:=[.D72]-ObamaInauguration -> 2130
B73: LaShann Moutique DeArcy Hall | C73: United States District Court for the Eastern District of New York | D73: November 12, 2014 | E73: May 6, 2015 | G73: November 16, 2015 | H73: 93-1 | I73: of:=[.D73]-ObamaInauguration -> 2122
B74: Elizabeth K. Dillon | C74: United States District Court for the Western District of Virginia | D74: September 18, 2014 | E74: November 13, 2014 | G74: December 16, 2014 | H74: Voice vote | I74: of:=[.D74]-ObamaInauguration -> 2067
B75: Loretta Copeland Biggs | C75: United States District Court for the Middle District of North Carolina | D75: September 18, 2014 | E75: November 13, 2014 | G75: December 16, 2014 | H75: Voice vote | I75: of:=[.D75]-ObamaInauguration -> 2067
B76: Haywood Stirling Gilliam, Jr. | C76: United States District Court for the Northern District of California | D76: August 18, 2014 | E76: September 17, 2014 | G76: December 16, 2014 | H76: Voice vote | I76: of:=[.D76]-ObamaInauguration -> 2036
B77: Jeanne E. Davidson | C77: United States Court of International Trade | D77: August 18, 2014 | E77: September 17, 2014 | I77: of:=[.D77]-ObamaInauguration -> 2036
B78: Roseann A. Ketchmark | C78: Western District of Missouri | D78: November 20, 2014 | E78: March 11, 2015 | G78: September 8, 2015 | H78: 96-0 | I78: of:=[.D78]-ObamaInauguration -> 2130
B79: John Robert Blakey | C79: United States District Court for the Northern District of Illinois | D79: August 5, 2014 | E79: 9/9/2014 | G79: December 16, 2014 | H79: Voice vote | I79: of:=[.D79]-ObamaInauguration -> 2023
B80: Allison Dale Burroughs | C80: United States District Court for the District of Massachusetts | D80: July 31, 2014 | E80: September 17, 2014 | G80: December 16, 2014 | H80: Voice vote | I80: of:=[.D80]-ObamaInauguration -> 2018
B81: Amit Priyavadan Mehta | C81: United States District Court for the District of Columbia | D81: July 31, 2014 | E81: September 17, 2014 | G81: December 16, 2014 | H81: Voice vote | I81: of:=[.D81]-ObamaInauguration -> 2018
B82: Robert William Schroeder III | C82: Eastern District of Texas | D82: June 26, 2014 | E82: September 9, 2014 | G82: December 16, 2014 | H82: Voice vote | I82: of:=[.D82]-ObamaInauguration -> 1983
B83: Robert Lee Pitman | C83: Western District of Texas | D83: June 26, 2014 | E83: 9/9/2014 | G83: December 16, 2014 | H83: Voice vote | I83: of:=[.D83]-ObamaInauguration -> 1983
B84: Greg N. Stivers | C84: Western District of Kentucky | D84: June 19, 2014 | E84: July 29, 2014 | G84: December 4, 2014 | H84: Voice vote | I84: of:=[.D84]-ObamaInauguration -> 1976
B85: David J. Hale | C85: Western District of Kentucky | D85: June 19, 2014 | E85: July 29, 2014 | G85: December 3, 2014 | H85: Voice vote | I85: of:=[.D85]-ObamaInauguration -> 1976
B86: Victor Allen Bolden | C86: District of Connecticut | D86: June 16, 2014 | E86: July 29, 2014 | G86: November 20, 2014 | H86: 49-46 | I86: of:=[.D86]-ObamaInauguration -> 1973
B87: Gerald J. Pappert | C87: Eastern District of Pennsylvania | D87: June 16, 2014 | E87: July 24, 2014 | G87: December 3, 2014 | H87: Voice vote | I87: of:=[.D87]-ObamaInauguration -> 1973
B88: Joseph F. Leeson, Jr. | C88: Eastern District of Pennsylvania | D88: June 16, 2014 | E88: July 24, 2014 | G88: December 4, 2014 | H88: 76-16 | I88: of:=[.D88]-ObamaInauguration -> 1973
B89: Mark A. Kearney | C89: Eastern District of Pennsylvania | D89: June 16, 2014 | E89: July 24, 2014 | G89: December 3, 2014 | H89: Voice vote | I89: of:=[.D89]-ObamaInauguration -> 1973
B90: Wendy Beetlestone | C90: Eastern District of Pennsylvania | D90: June 16, 2014 | E90: July 24, 2014 | G90: November 20, 2014 | H90: Voice vote | I90: of:=[.D90]-ObamaInauguration -> 1973
B91: Jeri Kaylene Somers | C91: United States Court of Federal Claims | D91: May 21, 2014 | E91: June 24, 2014, | I91: of:=[.D91]-ObamaInauguration -> 1947
B92: Patricia M. McCarthy | C92: United States Court of Federal Claims | D92: May 21, 2014 | E92: June 24, 2014 | I92: of:=[.D92]-ObamaInauguration -> 1947
B93: Armando Omar Bonilla | C93: United States Court of Federal Claims | D93: May 21, 2014 | E93: July 24, 2014 | I93: of:=[.D93]-ObamaInauguration -> 1947
B94: Pamela A. Harris | C94: United States Court of Appeals for the Fourth Circuit | D94: May 8, 2014 | E94: June 24, 2014 | G94: July 28, 2014 | H94: 50-43 | I94: of:=[.D94]-ObamaInauguration -> 1934
B95: Brenda K. Sannes | C95: Northern District of New York | D95: May 8, 2014 | E95: June 24, 2014 | G95: November 20, 2014 | H95: 96-0 | I95: of:=[.D95]-ObamaInauguration -> 1934
B96: Thomas L. Halkowski | C96: United States Court of Federal Claims | D96: April 10, 2014 | E96: June 4, 2014 | I96: of:=[.D96]-ObamaInauguration -> 1906
B97: Lydia Kay Griggsby | C97: United States Court of Federal Claims | D97: April 10, 2014 | E97: June 4, 2014 | G97: December 4, 2014 | H97: Voice vote | I97: of:=[.D97]-ObamaInauguration -> 1906
B98: André Birotte, Jr. | C98: Central District of California | D98: April 3, 2014 | E98: May 20, 2014 | G98: July 22, 2014 | H98: 100-0 | I98: of:=[.D98]-ObamaInauguration -> 1899
B99: Randolph D. Moss | C99: District of Columbia | D99: April 3, 2014 | E99: May 20, 2014 | G99: November 13, 2014 | H99: 54-45 | I99: of:=[.D99]-ObamaInauguration -> 1899
B100: John W. deGravelles | C100: Middle District of Louisiana | D100: March 13, 2014 | E100: May 20, 2014 | G100: July 22, 2014 | H100: 100-0 | I100: of:=[.D100]-ObamaInauguration -> 1878
B101: Leslie Joyce Abrams | C101: Middle District of Georgia | D101: March 11, 2014 | E101: May 13, 2014 | G101: November 18, 2014 | H101: 100-0 | I101: of:=[.D101]-ObamaInauguration -> 1876
B102: Paul G. Byron | C102: Middle District of Florida | D102: February 6, 2014 | E102: April 1, 2014 | G102: June 24, 2014 | H102: 94-0 | I102: of:=[.D102]-ObamaInauguration -> 1843
B103: Cheryl Ann Krause | C103: United States Court of Appeals for the Third Circuit | D103: February 6, 2014 | E103: March 12, 2014 | G103: July 7, 2014 | H103: 93-0 | I103: of:=[.D103]-ObamaInauguration -> 1843
B104: Staci Michelle Yandle | C104: Southern District of Illinois | D104: January 16, 2014 | E104: March 12, 2014 | G104: June 17, 2014 | H104: 52-44 | I104: of:=[.D104]-ObamaInauguration -> 1822
B105: Richard Franklin Boulware II | C105: District of Nevada | D105: January 16, 2014 | E105: March 12, 2014 | G105: June 10, 2014 | H105: 58-35 | I105: of:=[.D105]-ObamaInauguration -> 1822
B106: Stephen R. Bough | C106: Western District of Missouri | D106: January 16, 2014 | E106: July 24, 2014 | G106: December 16, 2014 | H106: 51-38 | I106: of:=[.D106]-ObamaInauguration -> 1822
B107: Leigh Martin May | C107: Northern District of Georgia | D107: December 19, 2013 | E107: May 13, 2014 | G107: November 13, 2014 | H107: 99-0 | I107: of:=[.D107]-ObamaInauguration -> 1794
B108: Mark Howard Cohen | C108: Northern District of Georgia | D108: December 19, 2013 | E108: May 13, 2014 | G108: November 18, 2014 | H108: Voice vote | I108: of:=[.D108]-ObamaInauguration -> 1794
B109: Tanya S. Chutkan | C109: District of Columbia | D109: December 19, 2013 | E109: February 25, 2014 | G109: June 4, 2014 | H109: 95-0 | I109: of:=[.D109]-ObamaInauguration -> 1794
B110: Kara Farnandez Stoll | C110: United States Court of Appeals for the Federal Circuit | D110: November 12, 2014 | E110: March 11, 2015 | G110: July 7, 2015 | H110: 95-0 | I110: of:=[.D110]-ObamaInauguration -> 2122
B111: Nancy J. Rosenstengel | C111: Southern District of Illinois | D111: November 7, 2013 | E111: January 8, 2014 | G111: May 8, 2014 | H111: 95-0 | I111: of:=[.D111]-ObamaInauguration -> 1752
B112: Ronnie L. White | C112: Eastern District of Missouri | D112: November 7, 2013 | E112: May 20, 2014 | G112: July 16, 2014 | H112: 53-44 | I112: of:=[.D112]-ObamaInauguration -> 1752
B113: James D. Peterson | C113: Western District of Wisconsin | D113: November 7, 2013 | E113: January 8, 2014 | G113: May 8, 2014 | H113: 70-24 | I113: of:=[.D113]-ObamaInauguration -> 1752
B114: Kevin A. Ohlson | C114: United States Court of Appeals for the Armed Forces | D114: September 14, 2011 | E114: September 19, 2013 | G114: October 16, 2013 | H114: Voice | I114: of:=[.D114]-ObamaInauguration -> 967
B115: Mary Barzee Flores | C115: United States District Court for the Southern District of Florida | D115: February 26, 2015 | I115: of:=[.D115]-ObamaInauguration -> 2228
B116: Joseph W. Nega
B117: Indira Talwani | C117: District of Massachusetts | D117: September 24, 2013 | E117: January 8, 2014 | G117: May 8, 2014 | H117: 94-0 | I117: of:=[.D117]-ObamaInauguration -> 1708
B118: Mark G. Mastroianni | C118: District of Massachusetts | D118: September 24, 2013 | E118: February 11, 2014 | G118: June 4, 2014 | H118: 92-2 | I118: of:=[.D118]-ObamaInauguration -> 1708
B119: George Jarrod Hazel | C119: District of Maryland | D119: September 25, 2013 | E119: December 19, 2013 | G119: May 1, 2014 | H119: 95-0 | I119: of:=[.D119]-ObamaInauguration -> 1709
B120: Theodore Chuang | C120: District of Maryland | D120: September 25, 2013 | E120: December 19, 2013 | G120: May 1, 2014 | H120: 53-42 | I120: of:=[.D120]-ObamaInauguration -> 1709
B121: Manish Shah | C121: Northern District of Illinois | D121: September 19, 2013 | E121: November 13, 2013 | G121: April 30, 2014 | H121: 95-0 | I121: of:=[.D121]-ObamaInauguration -> 1703
B122: Stanley Bastian | C122: Eastern District of Washington | D122: September 19, 2013 | E122: November 13, 2013 | G122: April 30, 2014 | H122: 95-0 | I122: of:=[.D122]-ObamaInauguration -> 1703
B123: John Tuchi | C123: District of Arizona | D123: September 19, 2013 | E123: January 28, 2014 | G123: May 14, 2014 | H123: 96-0 | I123: of:=[.D123]-ObamaInauguration -> 1703
B124: Diane Humetewa | C124: District of Arizona | D124: September 19, 2013 | E124: January 28, 2014 | G124: May 14, 2014 | H124: 96-0 | I124: of:=[.D124]-ObamaInauguration -> 1703
B125: Julien Xavier Neals | C125: United States District Court for the District of New Jersey | D125: February 26, 2015 | E125: September 30, 2015 | I125: of:=[.D125]-ObamaInauguration -> 2228
B126: Margaret Bartley | C126: United States Court of Appeals for Veterans Claims | E126: 3/28/2012 | G126: 6/2012
B127: Coral W. Pietsch | C127: United States Court of Appeals for Veterans Claims | D127: November 1, 2011 | E127: March 28, 2012 | G127: May 24, 2012 | H127: Voice vote | I127: of:=[.D127]-ObamaInauguration -> 1015
B128: Gerald Austin McHugh, Jr | C128: Eastern District of Pennsylvania | D128: August 1, 2013 | E128: November 6, 2013 | G128: March 26, 2014 | H128: 59-41 | I128: of:=[.D128]-ObamaInauguration -> 1654
B129: Sheryl H. Lipman | C129: Western District of Tennessee | D129: August 1, 2013 | E129: November 13, 2013 | G129: April 30, 2014 | H129: 95-0 | I129: of:=[.D129]-ObamaInauguration -> 1654
B130: M. Douglas Harpool | C130: Western District of Missouri | D130: August 1, 2013 | E130: November 6, 2013 | G130: March 26, 2014 | H130: 93-5 | I130: of:=[.D130]-ObamaInauguration -> 1654
B131: Daniel D. Crabtree | C131: District of Kansas | D131: August 1, 2013 | E131: December 19, 2013 | G131: April 30, 2014 | H131: 94-0 | I131: of:=[.D131]-ObamaInauguration -> 1654
B132: Christopher Reid Cooper | C132: District of Columbia | D132: August 1, 2013 | E132: November 6, 2013 | G132: March 26, 2014 | H132: 100-0 | I132: of:=[.D132]-ObamaInauguration -> 1654
B133: Michelle T. Friedland | C133: United States Court of Appeals for the Ninth Circuit | D133: August 1, 2013 | E133: November 6, 2013 | G133: April 28, 2014 | H133: 51-40 | I133: of:=[.D133]-ObamaInauguration -> 1654
B134: John B. Owens | C134: United States Court of Appeals for the Ninth Circuit | D134: August 1, 2013 | E134: October 30, 2013 | G134: March 31, 2014 | H134: 56-43 | I134: of:=[.D134]-ObamaInauguration -> 1654
B135: Vince Girdhari Chhabria | C135: Northern District of California | D135: July 25, 2013 | E135: September 25, 2013 | G135: March 5, 2014 | H135: 58-41 | I135: of:=[.D135]-ObamaInauguration -> 1647
B136: Matthew Frederick Leitman | C136: Eastern District of Michigan | D136: July 25, 2013 | E136: October 20, 2013 | G136: March 12, 2014 | H136: 98-0 | I136: of:=[.D136]-ObamaInauguration -> 1647
B137: Judith Ellen Levy | C137: Eastern District of Michigan | D137: July 25, 2013 | E137: October 30, 2013 | G137: March 12, 2014 | H137: 97-0 | I137: of:=[.D137]-ObamaInauguration -> 1647
B138: Pedro A. Delgado Hernández | C138: District of Puerto Rico | D138: June 26, 2013 | E138: September 11, 2013 | G138: March 5, 2014 | H138: 98-0 | I138: of:=[.D138]-ObamaInauguration -> 1618
B139: Jennifer May-Parker
B140: James Donato | C140: Northern District of California | D140: June 20, 2013 | E140: September 11, 2013 | G140: February 25, 2014 | H140: 90-5 | I140: of:=[.D140]-ObamaInauguration -> 1612
B141: Timothy Brooks | C141: Western District of Arkansas | D141: June 7, 2013 | E141: September 11, 2013 | G141: March 5, 2014 | H141: 100-0 | I141: of:=[.D141]-ObamaInauguration -> 1599
B142: Jeffrey Meyer | C142: District of Connecticut | D142: June 07, 2013 | E142: July 24, 2013 | G142: February 24, 2014 | H142: 91-2 | I142: of:=[.D142]-ObamaInauguration -> 1599
B143: Cornelia T. L. Pillard | C143: District of Columbia Circuit | D143: June 4, 2013 | E143: July 24, 2013 | G143: December 12, 2013 | H143: 51-44 | I143: of:=[.D143]-ObamaInauguration -> 1596
B144: Patricia Ann Millett | C144: District of Columbia Circuit | D144: June 4, 2013 | E144: July 10, 2013 | G144: December 10, 2013 | H144: 56-38 | I144: of:=[.D144]-ObamaInauguration -> 1596
B145: Roy W. McLeese | C145: District of Columbia Court of Appeals | D145: 11/17/2011 | G145: 5/24/2012 | I145: of:=[.D145]-ObamaInauguration -> 1031
B146: Elizabeth A. Wolford | C146: Western District of New York | D146: May 16, 2013 | E146: July 10, 2013 | G146: December 12, 2013 | H146: 70-29 | I146: of:=[.D146]-ObamaInauguration -> 1577
B147: Pamela L. Reeves | C147: Eastern District of Tennessee | D147: May 16, 2013 | E147: September 25, 2013 | G147: March 5, 2014 | H147: 99-0 | I147: of:=[.D147]-ObamaInauguration -> 1577
B148: Debra M. Brown | C148: Northern District of Mississippi | D148: May 16, 2013 | E148: July 10, 2013 | G148: November 4,2013 | H148: 90-0 | I148: of:=[.D148]-ObamaInauguration -> 1577
B149: Gregory Howard Woods | C149: Southern District of New York | D149: May 9, 2013 | E149: July 10, 2013 | G149: November 4, 2013 | H149: Voice vote | I149: of:=[.D149]-ObamaInauguration -> 1570
B150: Kathleen Kerrigan
B151: Ronald L. Buch
B152: Andrea R. Wood | C152: Northern District of Illinois | D152: May 6, 2013 | E152: June 19, 2013 | G152: October 14, 2013 | H152: Voice vote | I152: of:=[.D152]-ObamaInauguration -> 1567
B153: Sara Lee Ellis | C153: Northern District of Illinois | D153: May 6, 2013 | E153: June 19, 2013 | G153: October 7, 2013 | H153: Voice | I153: of:=[.D153]-ObamaInauguration -> 1567
B154: Colin Stirling Bruce | C154: Central District of Illinois | D154: May 6, 2013 | E154: June 19, 2013 | G154: October 7, 2013 | H154: 98-0 | I154: of:=[.D154]-ObamaInauguration -> 1567
B155: Sal Mendoza, Jr. | C155: Eastern District of Washington | D155: January 16, 2014 | E155: March 12, 2014 | G155: June 17, 2014 | H155: 92-4 | I155: of:=[.D155]-ObamaInauguration -> 1822
B156: Vernon Broderick | C156: Southern District of New York | D156: April 15, 2013 | E156: May 23, 2013 | G156: September 9, 2013 | H156: voice vote | I156: of:=[.D156]-ObamaInauguration -> 1546
B157: Alison Renee Lee | C157: District of South Carolina | D157: June 26, 2013 | F157: September 18, 2014 | I157: of:=[.D157]-ObamaInauguration -> 1618
B158: Robert Okun | C158: Superior Court of the District of Columbia | D158: March 19, 2013 | E158: May 15, 2013 | G158: May 22, 2013 | I158: of:=[.D158]-ObamaInauguration -> 1519
B159: Michael Kenny O'Keefe | C159: Superior Court of the District of Columbia | D159: March 19, 2013 | E159: May 15, 2013 | G159: May 22, 2013 | I159: of:=[.D159]-ObamaInauguration -> 1519
B160: Elaine Kaplan | C160: Federal Claims | D160: March 19, 2013 | E160: May 8, 2013 | G160: September 19, 2013 | I160: of:=[.D160]-ObamaInauguration -> 1519
B161: Todd Hughes | C161: Federal Circuit | D161: February 7, 2013 | E161: June 19, 2013 | G161: September 24, 2013 | H161: 98-0 | I161: of:=[.D161]-ObamaInauguration -> 1479
B162: Raymond Chen | C162: Federal Circuit | D162: February 7, 2013 | E162: April 24, 2013 | G162: August 1, 2013 | H162: 97-0 | I162: of:=[.D162]-ObamaInauguration -> 1479
B163: Jane Kelly | C163: United States Court of Appeals for the Eighth Circuit | D163: January 31, 2013 | E163: February 27, 2013 | G163: April 24, 2013 | H163: 96-0 | I163: of:=[.D163]-ObamaInauguration -> 1472
B164: Brian J. Davis | C164: Middle District of Florida | D164: February 29, 2012 | E164: May 9, 2012 | G164: December 20, 2013 | H164: 68-26 | I164: of:=[.D164]-ObamaInauguration -> 1135
B165: Stuart G. Nash
B166: Kimberley S. Knowles | C166: Superior Court of the District of Columbia | D166: 6/11/2012 | G166: 12/2/2012 | I166: of:=[.D166]-ObamaInauguration -> 1238
B167: William Greenberg | C167: United States Court of Appeals for Veterans Claims | D167: 11/15/2012 | G167: 12/21/2012 | I167: of:=[.D167]-ObamaInauguration -> 1395
B168: Claire R. Kelly | C168: International Trade | D168: November 14, 2012 | E168: January 23, 2013 | G168: May 23, 2013 | H168: Voice | I168: of:=[.D168]-ObamaInauguration -> 1394
B169: Derrick Kahala Watson | C169: District of Hawaii | D169: November 15, 2012 | E169: January 23, 2013 | G169: April 18, 2013 | H169: 94-0 | I169: of:=[.D169]-ObamaInauguration -> 1395
B170: Raymond P. Moore | C170: District of Colorado | D170: November 15, 2012 | E170: January 23, 2013 | G170: March 23, 2013 | H170: Voice | I170: of:=[.D170]-ObamaInauguration -> 1395
B171: Kenneth John Gonzales | C171: District of New Mexico | D171: November 15, 2012 | E171: February 13, 2013 | G171: June 17, 2013 | H171: 89-0 | I171: of:=[.D171]-ObamaInauguration -> 1395
B172: Valerie Caproni | C172: Southern District of New York | D172: November 15, 2012 | E172: May 23, 2013 | G172: September 9, 2013 | H172: 73-24 | I172: of:=[.D172]-ObamaInauguration -> 1395
B173: Madeline Haikala | C173: Northern District of Alabama | D173: May 9, 2013 | E173: June 19, 2013 | G173: October 14, 2013 | H173: 90-0 | I173: of:=[.D173]-ObamaInauguration -> 1570
B174: Andrew Gordon | C174: District of Nevada | D174: September 19, 2012 | E174: December 12, 2012 | G174: March 11, 2013 | H174: Voice | I174: of:=[.D174]-ObamaInauguration -> 1338
B175: Jennifer Dorsey | C175: District of Nevada | D175: September 19, 2012 | E175: April 24, 2013 | G175: July 9, 2013 | H175: 54-41 | I175: of:=[.D175]-ObamaInauguration -> 1338
B176: Ketanji Brown Jackson | C176: District of Columbia | D176: September 20, 2012 | E176: December 12, 2012 | G176: March 23, 2013 | H176: Voice | I176: of:=[.D176]-ObamaInauguration -> 1339
B177: Danya Ariel Dayson | C177: Superior Court of the District of Columbia | D177: 7/11/2011 | E177: 11/8/2011 | G177: 11/18/2011 | I177: of:=[.D177]-ObamaInauguration -> 902
B178: Pamela Ki Mai Chen | C178: Eastern District of New York | D178: August 2, 2012 | E178: September 19, 2012 | G178: March 4, 2013 | H178: Voice | I178: of:=[.D178]-ObamaInauguration -> 1290
B179: Mark A. Barnett | C179: Court of International Trade | D179: July 12, 2012 | E179: September 19, 2012 | G179: May 23, 2013 | H179: Voice | I179: of:=[.D179]-ObamaInauguration -> 1269
B180: Katherine Failla | C180: Southern District of New York | D180: June 26, 2012 | E180: September 19, 2012 | G180: March 4, 2013 | H180: 91-0 | I180: of:=[.D180]-ObamaInauguration -> 1253
B181: William Orrick III | C181: Northern District of California | D181: June 12, 2012 | E181: July 11, 2012 | G181: May 15, 2013 | H181: 56-41 | I181: of:=[.D181]-ObamaInauguration -> 1239
B182: Srikanth Srinivasan | C182: District of Columbia Circuit | D182: June 11, 2012 | E182: April 10, 2013 | G182: May 23, 2013 | H182: 97-0 | I182: of:=[.D182]-ObamaInauguration -> 1238
B183: Thomas M. Durkin | C183: Northern District of Illinois | D183: 5/21/2012 | E183: 7/11/2012 | G183: 12/17/2012 | H183: Voice vote | I183: of:=[.D183]-ObamaInauguration -> 1217
B184: Matthew Brann | C184: Middle District of Pennsylvania | D184: May 17, 2012 | E184: June 27, 2012 | G184: December 21, 2012 | H184: Voice | I184: of:=[.D184]-ObamaInauguration -> 1213
B185: Lorna Schofield | C185: Southern District of New York | D185: April 25, 2012 | E185: June 6, 2012 | G185: December 13, 2012 | I185: of:=[.D185]-ObamaInauguration -> 1191
B186: Shelly Deckert Dick | C186: Middle District of Louisiana | D186: April 25, 2012 | E186: December 12, 2012 | G186: May 9, 2013 | H186: Voice Vote | I186: of:=[.D186]-ObamaInauguration -> 1191
B187: Jesus Bernal | C187: Central District of California | D187: April 25, 2012 | E187: June 6, 2012 | G187: December 11, 2012 | H187: Voice | I187: of:=[.D187]-ObamaInauguration -> 1191
B188: Terrence Berg | C188: Eastern District of Michigan | D188: April 25, 2012 | E188: June 6, 2012 | G188: December 6, 2012 | H188: Voice | I188: of:=[.D188]-ObamaInauguration -> 1191
B189: Peter Arno Krauthamer | C189: Superior Court of the District of Columbia | D189: 7/11/2011 | E189: 11/8/2011 | G189: 11/18/2011 | I189: of:=[.D189]-ObamaInauguration -> 902
B190: Steven Logan | C190: District of Arizona | D190: September 19, 2013 | E190: January 28, 2014 | G190: May 14, 2014 | H190: 96-0 | I190: of:=[.D190]-ObamaInauguration -> 1703
B191: Laurie Michelson | C191: Eastern District of Michigan | D191: July 25, 2013 | E191: October 30, 2013 | G191: March 12, 2014 | H191: 97-0 | I191: of:=[.D191]-ObamaInauguration -> 1647
B192: John Dowdell | C192: Northern District of Oklahoma | D192: February 29, 2012 | E192: May 9, 2012 | G192: December 11, 2012 | H192: 95-0 | I192: of:=[.D192]-ObamaInauguration -> 1135
B193: Jill Pryor | C193: United States Court of Appeals for the Eleventh Circuit | D193: February 16, 2012 | E193: May 13, 2014 | G193: September 8, 2014 | H193: 97-0 | I193: of:=[.D193]-ObamaInauguration -> 1122
B194: Catharine Easterly | C194: District of Columbia Court of Appeals | D194: 8/2/2011 | G194: 11/18/2011 | I194: of:=[.D194]-ObamaInauguration -> 924
B195: Stephanie Rose | C195: Southern District of Iowa | D195: 2/3/2012 | E195: 3/14/2012 | G195: 9/10/2012 | I195: of:=[.D195]-ObamaInauguration -> 1109
B196: Michael Shea | C196: District of Connecticut | D196: 2/3/2012 | E196: 3/28/2012 | G196: 12/5/2012 | I196: of:=[.D196]-ObamaInauguration -> 1109
B197: William Kayatta | C197: United States Court of Appeals for the First Circuit | D197: January 23, 2012 | E197: March 14, 2012 | G197: February 13, 2013 | H197: 88-12 | I197: of:=[.D197]-ObamaInauguration -> 1098
B198: Kevin McNulty | C198: District of New Jersey | D198: 12/16/2011 | E198: 3/14/2012 | G198: 7/16/2012 | I198: of:=[.D198]-ObamaInauguration -> 1060
B199: Patricia Campbell-Smith | C199: United States Court of Federal Claims | D199: March 19, 2013 | E199: May 8, 2013 | G199: September 19, 2013 | I199: of:=[.D199]-ObamaInauguration -> 1519
B200: Robert Shelby | C200: District of Utah | D200: 11/30/2011 | E200: 3/28/2012 | G200: 9/22/2012 | I200: of:=[.D200]-ObamaInauguration -> 1044
B201: Nancy B. Firestone | C201: United States Court of Federal Claims | D201: April 10, 2014 | E201: June 4, 2014 | I201: of:=[.D201]-ObamaInauguration -> 1906
B202: John Tharp, Jr. | C202: Northern District of Illinois | D202: 11/10/2011 | E202: 1/26/2012 | G202: 5/14/2012 | I202: of:=[.D202]-ObamaInauguration -> 1024
B203: John Z. Lee | C203: Northern District of Illinois | D203: 11/10/2011 | E203: 1/26/2011 | G203: 5/7/2012 | I203: of:=[.D203]-ObamaInauguration -> 1024
B204: Richard Gary Taranto | C204: Federal Circuit | D204: November 10, 2011 | E204: February 29, 2012 | G204: March 11, 2013 | H204: 91-0 | I204: of:=[.D204]-ObamaInauguration -> 1024
B205: Kristine Gerhard Baker | C205: Eastern District of Arkansas | D205: November 2, 2011 | E205: January 26, 2012 | G205: May 7, 2012 | H205: Voice Vote | I205: of:=[.D205]-ObamaInauguration -> 1016
B206: Yvonne Williams (Washington D.C.)
B207: Jennifer Di Toro
B208: Paul Watford | C208: Ninth Circuit | D208: October 17, 2011 | E208: December 13, 2011 | G208: May 21, 2012 | H208: 61-34 | I208: of:=[.D208]-ObamaInauguration -> 1000
B209: Gregg Costa | C209: United States Court of Appeals for the Fifth Circuit | D209: December 19, 2013 | E209: February 25, 2014 | G209: May 20, 2014 | H209: 97-0 | I209: of:=[.D209]-ObamaInauguration -> 1794
B210: Stephanie Thacker | C210: United States Court of Appeals for the Fourth Circuit | D210: September 8, 2011 | E210: October 4, 2011 | G210: April 16, 2012 | H210: 91-3 | I210: of:=[.D210]-ObamaInauguration -> 961
B211: Miranda Du | C211: District of Nevada | D211: 8/2/2011 | E211: 10/4/2011 | G211: 3/28/2012 | I211: of:=[.D211]-ObamaInauguration -> 924
B212: Rudolph Contreras | C212: District of Columbia | D212: July 28, 2011 | E212: October 4, 2011 | G212: March 22, 2012 | H212: Voice | I212: of:=[.D212]-ObamaInauguration -> 919
B213: Ronnie Abrams | C213: Southern District of New York | D213: July 28, 2011 | E213: October 4, 2011 | G213: March 22, 2012 | H213: 96-2 | I213: of:=[.D213]-ObamaInauguration -> 919
B214: Michael Fitzgerald (California) | C214: Central District of California | D214: July 20, 2011 | G214: March 15, 2012 | I214: of:=[.D214]-ObamaInauguration -> 911
B215: Carlos E. Mendoza | C215: Middle District of Florida | D215: February 6, 2014 | E215: April 1, 2014 | G215: June 24, 2014 | H215: 94-0 | I215: of:=[.D215]-ObamaInauguration -> 1843
B216: Thomas Rice
B217: Rosemary Marquez | C217: District of Arizona | D217: June 23, 2011 | E217: January 28, 2014 | G217: May 15, 2014 | H217: 81-15 | I217: of:=[.D217]-ObamaInauguration -> 884
B218: Jennifer Zipps | C218: District of Arizona | D218: 6/23/2011 | G218: 10/3/2011 | I218: of:=[.D218]-ObamaInauguration -> 884
B219: Mary Elizabeth Phillips | C219: Western District of Missouri | D219: 6/7/2011 | G219: 3/6/2012 | I219: of:=[.D219]-ObamaInauguration -> 868
B220: Susie Morgan | C220: Eastern District of Louisiana | D220: 6/7/2011 | E220: 10/19/2011 | G220: 3/28/2012 | I220: of:=[.D220]-ObamaInauguration -> 868
B221: Jesse Furman | C221: Southern District of New York | D221: June 7, 2011 | E221: July 28, 2011 | G221: February 17, 2012 | H221: 62-34 | I221: of:=[.D221]-ObamaInauguration -> 868
B222: Margo Brodie | C222: Eastern District of New York | D222: June 7, 2011 | E222: September 7, 2011 | G222: February 27, 2012 | H222: 86-2 | I222: of:=[.D222]-ObamaInauguration -> 868
B223: James Gilstrap | C223: Eastern District of Texas | D223: 5/19/2011 | E223: 7/28/2011 | G223: 12/5/2011 | I223: of:=[.D223]-ObamaInauguration -> 849
B224: Jeffrey J. Helmick | C224: Northern District of Ohio | D224: May 11, 2011 | E224: 2/15/2012 | G224: June 6, 2012 | I224: of:=[.D224]-ObamaInauguration -> 841
B225: Richard G. Andrews | C225: District of Delaware | D225: May 11, 2011 | E225: July 13, 2011 | G225: November 3, 2011 | H225: 96-0 | I225: of:=[.D225]-ObamaInauguration -> 841
B226: Stephen Higginson | C226: United States Court of Appeals for the Fifth Circuit | D226: May 9, 2011 | E226: June 8, 2011 | G226: October 31, 2011 | H226: 88-0 | I226: of:=[.D226]-ObamaInauguration -> 839
B227: Katherine Forrest | C227: Southern District of New York | D227: May 4, 2011 | E227: June 8, 2011 | G227: October 13, 2011 | H227: Voice vote | I227: of:=[.D227]-ObamaInauguration -> 834
B228: Edgardo Ramos | C228: Southern District of New York | D228: May 4, 2011 | E228: July 28, 2011 | G228: December 5, 2011 | I228: of:=[.D228]-ObamaInauguration -> 834
B229: Dana Christensen | C229: District of Montana | D229: May 4, 2011 | E229: September 7, 2011 | G229: December 5, 2011 | H229: Voice | I229: of:=[.D229]-ObamaInauguration -> 834
B230: Nannette Jolivette-Brown | C230: Eastern District of Louisiana | D230: March 2, 2011 | E230: May 4, 2011 | G230: October 3, 2011 | H230: Voice | I230: of:=[.D230]-ObamaInauguration -> 771
B231: William Kuntz | C231: Eastern District of New York | D231: 3/9/2011 | E231: 5/4/2011 | G231: 10/3/2011 | I231: of:=[.D231]-ObamaInauguration -> 778
B232: James Moody (Arkansas) | C232: Eastern District of Arkansas | D232: July 25, 2013 | E232: September 25, 2013 | G232: February 25, 2014 | H232: 95-4 | I232: of:=[.D232]-ObamaInauguration -> 1647
B233: Eleanor L. Ross | C233: Northern District of Georgia | D233: December 19, 2013 | E233: May 13, 2014 | G233: November 18, 2014 | H233: Voice vote | I233: of:=[.D233]-ObamaInauguration -> 1794
B234: Corinne Ann Beckwith | C234: District of Columbia Court of Appeals | D234: 3/31/2011 | G234: 11/18/2011 | I234: of:=[.D234]-ObamaInauguration -> 800
B235: Alison J. Nathan | C235: Southern District of New York | D235: March 31, 2011 | E235: June 8, 2011 | G235: October 13, 2011 | I235: of:=[.D235]-ObamaInauguration -> 800
B236: Arvo Mikkanen | C236: Northern District of Oklahoma | D236: February 2, 2011 | I236: of:=[.D236]-ObamaInauguration -> 743
B237: Mary Geiger Lewis | C237: District of South Carolina | D237: 3/16/2011 | E237: 2/15/2012 | G237: 6/18/2012 | I237: of:=[.D237]-ObamaInauguration -> 785
B238: Nitza I. Quinones Alejandro | C238: Eastern District of Pennsylvania | D238: November 27, 2012 | E238: February 13, 2013 | G238: June 13, 2013 | H238: Voice | I238: of:=[.D238]-ObamaInauguration -> 1407
B239: Juan F. Vasquez
B240: Michael B. Thornton
B241: Nancy Torresen | C241: District of Maine | D241: 3/2/2011 | E241: 5/4/2011 | G241: 10/3/2011 | I241: of:=[.D241]-ObamaInauguration -> 771
B242: Wilma A. Lewis | C242: District Court of the Virgin Islands | D242: 3/2/2011 | E242: 5/24/2011 | G242: 6/30/2011 | I242: of:=[.D242]-ObamaInauguration -> 771
B243: L. Paige Marvel
B244: Joseph H. Gale
B245: Jorge L. Alonso | C245: United States District Court for the Northern District of Illinois | D245: August 5, 2014 | E245: September 9, 2014 | G245: December 16, 2014 | H245: Voice vote | I245: of:=[.D245]-ObamaInauguration -> 2023
B246: Ann M. Donnelly | C246: United States District Court for the Eastern District of New York | D246: November 20, 2014 | E246: May 6, 2015 | G246: October 20, 2015 | H246: 95-2 | I246: of:=[.D246]-ObamaInauguration -> 2130
B247: Paul A. Engelmayer | C247: Southern District of New York | D247: 2/2/2011 | E247: 3/16/2011 | G247: 7/26/2011 | I247: of:=[.D247]-ObamaInauguration -> 743
B248: Kevin Hunter Sharp | C248: Middle District of Tennessee | D248: 11/17/2010 | E248: 3/2/2011 | G248: 5/2/2011 | I248: of:=[.D248]-ObamaInauguration -> 666
B249: Sara Lynn Darrow | C249: Central District of Illinois | D249: November 17, 2010 | E249: April 13, 2011 | G249: August 2, 2011 | H249: Voice | I249: of:=[.D249]-ObamaInauguration -> 666
B250: Roy Bale Dalton, Jr. | C250: Middle District of Florida | D250: 11/17/2010 | E250: 3/2/2011 | G250: 5/2/2011 | H250: Voice | I250: of:=[.D250]-ObamaInauguration -> 666
B251: Vincent L. Briccetti | C251: Southern District of New York | D251: November 17, 2010 | E251: February 16, 2011 | G251: April 12, 2011 | H251: Voice | I251: of:=[.D251]-ObamaInauguration -> 666
B252: Mark Raymond Hornak | C252: Middle District of Pennsylvania | D252: 12/1/2010 | E252: 6/22/2011 | G252: 10/19/2011 | I252: of:=[.D252]-ObamaInauguration -> 680
B253: Arenda L. Wright Allen | C253: Eastern District of Virginia | D253: December 1, 2010 | E253: February 16, 2011 | G253: May 11, 2011 | H253: 96-0 | I253: of:=[.D253]-ObamaInauguration -> 680
B254: Natasha P. Silas | C254: Northern District of Georgia | D254: January 26, 2011 | I254: of:=[.D254]-ObamaInauguration -> 736
B255: J. Paul Oetken | C255: Southern District of New York | D255: January 26, 2011 | E255: March 16, 2011 | G255: July 18,2011 | I255: of:=[.D255]-ObamaInauguration -> 736
B256: Ramona V. Manglona | C256: United States District Court for the Northern Mariana Islands | D256: 1/26/2011 | E256: 3/16/2011 | G256: 7/26/2011 | I256: of:=[.D256]-ObamaInauguration -> 736
B257: Michael C. Green | C257: Western District of New York | D257: January 26, 2011 | E257: May 24, 2011 | I257: of:=[.D257]-ObamaInauguration -> 736
B258: Robert David Mariani | C258: Middle District of Pennsylvania | D258: 12/1/2010 | E258: 6/22/2011 | G258: 10/19/2011 | I258: of:=[.D258]-ObamaInauguration -> 680
B259: Diana Saldana | C259: Southern District of Texas | D259: July 14, 2010 | E259: September 29, 2010 | G259: February 7, 2011 | I259: of:=[.D259]-ObamaInauguration -> 540
B260: Analisa Torres | C260: Southern District of New York | D260: November 15, 2012 | E260: January 23, 2013 | G260: April 18, 2013 | H260: Voice vote | I260: of:=[.D260]-ObamaInauguration -> 1395
B261: Jimmie V. Reyna | C261: Federal Circuit | D261: September 29, 2010 | E261: February 16, 2011 | G261: April 4, 2011 | H261: 86-0 | I261: of:=[.D261]-ObamaInauguration -> 617
B262: Caitlin J. Halligan | C262: District of Columbia Circuit | D262: September 29, 2010 | E262: February 2, 2011 | I262: of:=[.D262]-ObamaInauguration -> 617
B263: Mae A. D'Agostino | C263: Northern District of New York | D263: September 29, 2010 | E263: February 2, 2011 | G263: March 28, 2011 | H263: 88-0 | I263: of:=[.D263]-ObamaInauguration -> 617
B264: Susan Hickey | C264: Western District of Arkansas | D264: 4/6/2011 | E264: 6/8/2011 | G264: 10/13/2011 | I264: of:=[.D264]-ObamaInauguration -> 806
B265: Marina Marmolejo | C265: Southern District of Texas | D265: 7/28/2010 | E265: 5/24/2011 | G265: 10/3/2011 | I265: of:=[.D265]-ObamaInauguration -> 554
B266: Maria Elizabeth Raffinan
B267: Nelson S. Roman | C267: Southern District of New York | D267: September 20, 2012 | E267: January 23, 2013 | G267: May 9, 2013 | H267: 97-0 | I267: of:=[.D267]-ObamaInauguration -> 1339
B268: Kathleen M. Williams | C268: Southern District of Florida | D268: 7/21/2010 | E268: 2/2/2011 | G268: 8/2/2011 | I268: of:=[.D268]-ObamaInauguration -> 547
B269: Michael H. Simon | C269: District of Oregon | D269: 7/14/2010 | E269: 11/17/2010 | G269: 6/21/2011 | I269: of:=[.D269]-ObamaInauguration -> 540
B270: Beryl A. Howell | C270: District of Columbia | D270: July 14, 2010 | E270: July 28, 2010 | G270: December 22, 2010 | H270: Voice vote | I270: of:=[.D270]-ObamaInauguration -> 540
B271: Victoria F. Nourse | C271: Seventh Circuit | D271: July 14, 2010 | I271: of:=[.D271]-ObamaInauguration -> 540
B272: Jane Triche-Milazzo | C272: Eastern District of Louisiana | D272: 3/16/2011 | E272: 8/8/2011 | G272: 10/11/2011 | I272: of:=[.D272]-ObamaInauguration -> 785
B273: Linda V. Parker | C273: Eastern District of Michigan | D273: July 25, 2013 | E273: October 30, 2013 | G273: March 12, 2014 | H273: 60-37 | I273: of:=[.D273]-ObamaInauguration -> 1647
B274: Amy B. Jackson | C274: United States District Court for the District of Columbia | D274: 6/17/2010 | E274: 9/15/2010 | G274: 3/17/2011 | I274: of:=[.D274]-ObamaInauguration -> 513
B275: Max O. Cogburn, Jr. | C275: Western District of North Carolina | D275: May 27, 2010 | E275: November 17, 2010 | G275: March 10, 2011 | H275: 96-0 | I275: of:=[.D275]-ObamaInauguration -> 492
B276: Robert Leon Wilkins | C276: District of Columbia Circuit | D276: June 4, 2013 | E276: September 11, 2013 | G276: January 13, 2014 | H276: 55-43 | I276: of:=[.D276]-ObamaInauguration -> 1596
B277: Susan L. Carney (Second Circuit) | C277: United States Court of Appeals for the Second Circuit | D277: May 20, 2010 | E277: September 15, 2010 | G277: May 17, 2011 | H277: 71-28 | I277: of:=[.D277]-ObamaInauguration -> 485
B278: Denise Casper | C278: District of Massachusetts | D278: April 28, 2010 | E278: July 15, 2010 | G278: December 17, 2010 | H278: Voice vote | I278: of:=[.D278]-ObamaInauguration -> 463
B279: Carlton W. Reeves | C279: Southern District of Mississippi | D279: April 28, 2010 | E279: July 15, 2010 | G279: December 19, 2010 | H279: Voice vote | I279: of:=[.D279]-ObamaInauguration -> 463
B280: Edmond E. Chang | C280: Northern District of Illinois | D280: April 21, 2010 | E280: July 15, 2010 | G280: December 18, 2010 | H280: Voice vote | I280: of:=[.D280]-ObamaInauguration -> 456
B281: John A. Gibney | C281: Eastern District of Virginia | D281: April 14, 2010 | E281: April 28, 2010 | G281: December 16, 2010 | H281: Voice vote | I281: of:=[.D281]-ObamaInauguration -> 449
B282: Edward C. DuMont | C282: Federal Circuit | D282: April 14, 2010 | F282: November 10, 2011 | I282: of:=[.D282]-ObamaInauguration -> 449
B283: Paul K. Holmes | C283: Western District of Arkansas | D283: 4/28/2010 | E283: 9/29/2010 | G283: 2/7/2011 | I283: of:=[.D283]-ObamaInauguration -> 463
B284: Todd E. Edelman | C284: United States District Court for the District of Columbia | D284: April 28, 2016 | I284: of:=[.D284]-ObamaInauguration -> 2655
B285: Jon S. Tigar | C285: Northern District of California | D285: 6/11/2012 | E285: 7/1/2012 | G285: 12/21/2012 | I285: of:=[.D285]-ObamaInauguration -> 1238
B286: Yvonne Gonzalez Rogers | C286: Northern District of California | D286: 5/4/2011 | E286: 7/13/2011 | G286: 11/15/2011 | I286: of:=[.D286]-ObamaInauguration -> 834
B287: Amy Totenberg | C287: Northern District of Georgia | D287: 3/17/2010 | E287: 9/15/2010 | G287: 2/28/2011 | I287: of:=[.D287]-ObamaInauguration -> 421
B288: Raymond Lohier | C288: United States Court of Appeals for the Second Circuit | D288: March 10, 2010 | E288: April 22, 2010 | G288: December 19, 2010 | H288: 92-0 | I288: of:=[.D288]-ObamaInauguration -> 414
B289: John J. McConnell, Jr. | C289: District of Rhode Island | D289: 3/10/2010 | E289: 5/13/2010 | G289: 5/4/2011 | H289: 50-44 | I289: of:=[.D289]-ObamaInauguration -> 414
B290: Scott Matheson | C290: United States Court of Appeals for the Tenth Circuit | D290: March 3, 2010 | E290: May 13, 2010 | G290: December 22, 2010 | H290: Voice vote | I290: of:=[.D290]-ObamaInauguration -> 407
B291: William J. Martinez | C291: District of Colorado | D291: February 24, 2010 | E291: March 10, 2010 | G291: December 21, 2010 | H291: 58-37 | I291: of:=[.D291]-ObamaInauguration -> 400
B292: Gary Feinerman | C292: Northern District of Illinois | D292: February 24, 2010 | E292: March 10, 2010 | G292: June 28, 2010 | H292: 80-0 | I292: of:=[.D292]-ObamaInauguration -> 400
B293: Goodwin Liu | C293: Ninth Circuit | D293: February 24, 2010 | E293: April 16, 2010 | F293: May 25, 2011 | I293: of:=[.D293]-ObamaInauguration -> 400
B294: Darrin P. Gayles | C294: Southern District of Florida | D294: February 6, 2014 | E294: April 1, 2014 | G294: June 17, 2014 | H294: 98-0 | I294: of:=[.D294]-ObamaInauguration -> 1843
B295: Beth Bloom | C295: Southern District of Florida | D295: February 6, 2014 | E295: April 1, 2014 | G295: June 24, 2014 | H295: 95-0 | I295: of:=[.D295]-ObamaInauguration -> 1843
B296: Marc Thomas Treadwell | C296: Middle District of Georgia | D296: February 4, 2010 | E296: February 24, 2010 | G296: June 21, 2010 | H296: 89-0 | I296: of:=[.D296]-ObamaInauguration -> 380
B297: Elizabeth Erny Foote | C297: Western District of Louisiana | D297: February 4, 2010 | E297: February 24, 2010 | G297: June 15, 2010 | H297: Voice vote | I297: of:=[.D297]-ObamaInauguration -> 380
B298: Steve C. Jones | C298: Northern District of Geogia | D298: 7/14/2010 | E298: 11/17/2010 | G298: 2/28/2011 | I298: of:=[.D298]-ObamaInauguration -> 540
B299: Jon E. DeGuilio | C299: Northern District of Indiana | D299: January 20, 2010 | E299: February 11, 2010 | G299: May 11, 2010 | H299: Voice vote | I299: of:=[.D299]-ObamaInauguration -> 365
B300: Landya McCafferty | C300: District of New Hampshire | D300: May 23, 2013 | E300: July 24, 2013 | G300: December 12, 2013 | H300: 79-19 | I300: of:=[.D300]-ObamaInauguration -> 1584
B301: Pamela Pepper | C301: Eastern District of Wisconsin | D301: May 1, 2014 | E301: June 24, 2014 | G301: November 20, 2014 | H301: 95-0 | I301: of:=[.D301]-ObamaInauguration -> 1927
B302: Michael P. Boggs | C302: Northern District of Georgia | D302: December 19, 2013 | E302: May 13, 2014 | I302: of:=[.D302]-ObamaInauguration -> 1794
B303: Tanya Walton Pratt | C303: Southern District of Indiana | D303: January 20, 2010 | E303: February 11, 2010 | G303: June 15, 2010 | H303: 95-0 | I303: of:=[.D303]-ObamaInauguration -> 365
B304: James E. Shadid | C304: Central District of Illinois | D304: 5/27/2010 | E304: 9/15/2010 | G304: 3/7/2011 | I304: of:=[.D304]-ObamaInauguration -> 492
B305: Judith A. Smith
B306: John McCabe | C306: Superior Court of the District of Columbia | D306: 7/11/2011 | E306: 11/8/2011 | G306: 11/18/2011 | I306: of:=[.D306]-ObamaInauguration -> 902
B307: Milton C. Lee
B308: Marisa Demeo
B309: Florence Pan | C309: United States District Court for the District of Columbia | D309: April 28, 2016 | E309: July 13, 2016 | I309: of:=[.D309]-ObamaInauguration -> 2655
B310: James E. Boasberg | C310: District of Columbia | D310: June 17, 2010 | E310: September 15, 2010 | G310: March 14, 2011 | H310: 96-0 | I310: of:=[.D310]-ObamaInauguration -> 513
B311: Frank P. Geraci, Jr. | C311: Western District of New York | D311: May 14, 2012 | E311: June 27, 2012 | G311: December 13, 2012 | H311: Voice vote | I311: of:=[.D311]-ObamaInauguration -> 1210
B312: Gloria M. Navarro
B313: R. Brooke Jackson | C313: District of Colorado | D313: 9/29/2010 | E313: 4/13/2011 | G313: 8/2/2011 | I313: of:=[.D313]-ObamaInauguration -> 617
B314: Lucy H. Koh | C314: United States Court of Appeals for the Ninth Circuit | D314: February 25, 2016 | E314: July 13, 2016 | I314: of:=[.D314]-ObamaInauguration -> 2592
B315: Edward J. Davila | C315: Northern District of California | D315: May 20, 2010 | E315: September 29, 2010 | G315: February 14, 2011 | H315: Voice | I315: of:=[.D315]-ObamaInauguration -> 485
B316: Beth Labson Freeman | C316: Northern District of California | D316: June 20, 2013 | E316: September 11, 2013 | G316: February 25, 2014 | H316: 91-7 | I316: of:=[.D316]-ObamaInauguration -> 1612
B317: Gonzalo Curiel | C317: Southern District of California | D317: November 10, 2011 | E317: March 28, 2012 | G317: September 22, 2012 | H317: Voice | I317: of:=[.D317]-ObamaInauguration -> 1024
B318: Cynthia A. Bashant | C318: Southern District of California | D318: September 19, 2013 | E318: December 19, 2013 | G318: April 30, 2014 | H318: 94-0 | I318: of:=[.D318]-ObamaInauguration -> 1703
B319: Troy L. Nunley | C319: Eastern District of California | D319: June 25, 2012 | E319: September 19, 2012 | G319: March 23, 2013 | H319: Voice | I319: of:=[.D319]-ObamaInauguration -> 1252
B320: Josephine S. Tucker | C320: Central District of California | D320: February 4, 2010 | E320: February 24, 2010 | G320: June 21, 2010 | H320: Voice vote | I320: of:=[.D320]-ObamaInauguration -> 380
B321: John A. Kronstadt | C321: Central District of California | D321: 11/17/2010 | E321: 2/16/2011 | G321: 4/12/2011 | I321: of:=[.D321]-ObamaInauguration -> 666
B322: Beverly Reid O'Connell | C322: Central District of California | D322: November 15, 2012 | E322: December 12, 2012 | G322: April 11, 2013 | H322: 92-0 | I322: of:=[.D322]-ObamaInauguration -> 1395
B323: Richard Mark Gergel | C323: District of South Carolina | D323: December 22, 2009 | E323: April 16, 2010 | G323: August 5, 2010 | H323: Voice vote | I323: of:=[.D323]-ObamaInauguration -> 336
B324: J. Michelle Childs | C324: District of South Carolina | D324: December 22, 2009 | E324: April 16, 2010 | G324: August 5, 2010 | H324: Voice vote | I324: of:=[.D324]-ObamaInauguration -> 336
B325: Robin L. Rosenberg | C325: Southern District of Florida | D325: February 26, 2014 | E325: May 20, 2014 | G325: July 22, 2014 | H325: 100-0 | I325: of:=[.D325]-ObamaInauguration -> 1863
B326: James A. Soto | C326: District of Arizona | D326: December 19, 2013 | E326: January 28, 2014 | G326: May 15, 2014 | H326: 93-1 | I326: of:=[.D326]-ObamaInauguration -> 1794
B327: Douglas Rayes | C327: District of Arizona | D327: September 19, 2013 | E327: January 28, 2014 | G327: May 15, 2014 | H327: 77-19 | I327: of:=[.D327]-ObamaInauguration -> 1703
B328: Robert N. Scola, Jr. | C328: Southern District of Florida | D328: 5/4/2011 | E328: 6/22/2011 | G328: 10/19/2011 | I328: of:=[.D328]-ObamaInauguration -> 834
B329: Susan P. Watters | C329: District of Montana | D329: May 23, 2013 | E329: July 24, 2013 | G329: December 12, 2013 | H329: 77-19 | I329: of:=[.D329]-ObamaInauguration -> 1584
B330: John A. Ross | C330: Eastern District of Missouri | D330: 12/1/2010 | E330: 5/4/2011 | G330: 9/20/2011 | I330: of:=[.D330]-ObamaInauguration -> 680
B331: Brian C. Wimes
B332: Mark E. Walker | C332: Northern District of Florida | D332: 2/12/2012 | E332: 5/9/2012 | G332: 12/6/2012 | I332: of:=[.D332]-ObamaInauguration -> 1118
B333: Nancy D. Freudenthal | C333: District of Wyoming | D333: December 4, 2009 | E333: January 20, 2010 | G333: May 5, 2010 | H333: 96-1 | I333: of:=[.D333]-ObamaInauguration -> 318
B334: Scott W. Skavdahl | C334: District of Wyoming | D334: 2/16/2011 | E334: 7/13/2011 | G334: 11/3/2011 | I334: of:=[.D334]-ObamaInauguration -> 757
B335: Timothy M. Cain | C335: District of South Carolina | D335: February 16, 2011 | E335: May 4, 2011 | G335: September 20, 2011 | H335: 99-0 | I335: of:=[.D335]-ObamaInauguration -> 757
B336: Nelva Gonzales Ramos | C336: Southern District of Texas | D336: 1/27/2011 | E336: 4/13/2011 | G336: 8/2/2011 | I336: of:=[.D336]-ObamaInauguration -> 737
B337: David Guaderrama | C337: Western District of Texas | D337: 9/14/2011 | E337: 11/2/2011 | G337: 4/26/2012 | I337: of:=[.D337]-ObamaInauguration -> 967
B338: Rolando Olvera | C338: United States District Court for the Southern District of Texas | D338: September 18, 2014 | E338: January 21, 2015 | G338: May 21, 2015 | H338: 100-0 | I338: of:=[.D338]-ObamaInauguration -> 2067
B339: Andrew L. Carter, Jr. | C339: Southern District of New York | D339: May 19, 2011 | E339: July 28, 2011 | G339: December 5, 2011 | H339: Voice | I339: of:=[.D339]-ObamaInauguration -> 849
B340: Brian Jackson (Louisiana) | C340: Brian Jackson | D340: October 29, 2009 | E340: February 24, 2010 | G340: June 15, 2010 | H340: 96-0 | I340: of:=[.D340]-ObamaInauguration -> 282
B341: William Conley (Wisconsin)
B342: John T. Fowlkes | C342: Western District of Tennessee | D342: December 16, 2011 | E342: March 14, 2012 | G342: July 10, 2012 | H342: 94-2 | I342: of:=[.D342]-ObamaInauguration -> 1060
B343: Edward G. Smith | C343: Eastern District of Pennsylvania | D343: August 1, 2013 | E343: November 6, 2013 | G343: March 26, 2014 | H343: 69-31 | I343: of:=[.D343]-ObamaInauguration -> 1654
B344: Albert Diaz | C344: Fourth Circuit | D344: November 4, 2009 | E344: December 16, 2009 | G344: December 18, 2010 | H344: Voice vote | I344: of:=[.D344]-ObamaInauguration -> 288
B345: Jeffrey L. Schmehl | C345: Eastern District of Pennsylvania | D345: November 27, 2012 | E345: February 13, 2013 | G345: June 13, 2013 | H345: 100-0 | I345: of:=[.D345]-ObamaInauguration -> 1407
B346: Marco A. Hernandez | C346: District of Oregon | D346: 7/14/2010 | E346: 11/17/2010 | G346: 2/7/2011 | I346: of:=[.D346]-ObamaInauguration -> 540
B347: Sharon L. Gleason | C347: District of Alaska | D347: 4/6/2011 | E347: 7/13/2011 | G347: 11/15/2011 | I347: of:=[.D347]-ObamaInauguration -> 806
B348: Michael McShane | C348: District of Oregon | D348: September 19, 2012 | E348: February 13, 2013 | G348: May 20, 2013 | H348: Voice vote | I348: of:=[.D348]-ObamaInauguration -> 1338
B349: William Thomas (Florida) | C349: Southern District of Florida | D349: November 15, 2012 | I349: of:=[.D349]-ObamaInauguration -> 1395
B350: Rosanna Peterson | C350: Eastern District of Washington | D350: October 13, 2009 | E350: November 18, 2009 | G350: January 25, 2010 | H350: 89-0 | I350: of:=[.D350]-ObamaInauguration -> 266
B351: O. Rogeriee Thompson | C351: United States Court of Appeals for the First Circuit | D351: October 6, 2009 | E351: December 1, 2009 | G351: March 17, 2010 | H351: 98-0 | I351: of:=[.D351]-ObamaInauguration -> 259
B352: Abdul Kallon | C352: United States Court of Appeals for the Eleventh Circuit | D352: February 11, 2016 | I352: of:=[.D352]-ObamaInauguration -> 2578
B353: Gina Marie Groh | C353: Northern District of West Virginia | D353: 5/19/2011 | E353: 9/7/2011 | G353: 3/15/2012 | I353: of:=[.D353]-ObamaInauguration -> 849
B354: Geoffrey Crawford | C354: District of Vermont | D354: May 20, 2014 | E354: June 4, 2014 | G354: June 24, 2014 | H354: 95-0 | I354: of:=[.D354]-ObamaInauguration -> 1946
B355: Al Bennett | C355: United States District Court for the Southern District of Texas | D355: September 18, 2014 | E355: January 21, 2015 | G355: April 13, 2015 | H355: 95-0 | I355: of:=[.D355]-ObamaInauguration -> 2067
B356: Jane Stranch | C356: United States Court of Appeals for the Sixth Circuit | D356: August 6, 2009 | E356: October 21, 2009 | G356: September 13, 2010 | H356: 71-21 | I356: of:=[.D356]-ObamaInauguration -> 198
B357: Jacqueline Nguyen | C357: Ninth Circuit | D357: September 22, 2011 | E357: November 2, 2011 | G357: May 7, 2012 | H357: 91-3 | I357: of:=[.D357]-ObamaInauguration -> 975
B358: Jacqueline Nguyen | C358: Central District of California | D358: July 31, 2009 | E358: September 23, 2009 | G358: December 1, 2009 | H358: 97-0 | I358: of:=[.D358]-ObamaInauguration -> 192
B359: Dolly Gee | C359: Central District of California | D359: August 6, 2009 | E359: September 23, 2009 | G359: December 24, 2009 | H359: Voice vote | I359: of:=[.D359]-ObamaInauguration -> 198
B360: Benita Pearson | C360: Northern District of Ohio | D360: December 3, 2009 | E360: January 20, 2010 | G360: December 21, 2010 | H360: 56-39 | I360: of:=[.D360]-ObamaInauguration -> 317
B361: Christina Reiss | C361: District of Vermont | D361: October 13, 2009 | E361: November 4, 2009 | G361: November 21, 2009 | H361: Voice vote | I361: of:=[.D361]-ObamaInauguration -> 266
B362: Catherine Eagles | C362: Middle District of North Carolina | D362: March 10, 2010 | E362: April 16, 2010 | G362: December 16, 2010 | H362: Voice vote | I362: of:=[.D362]-ObamaInauguration -> 414
B363: Roberto Lange | C363: District of South Dakota | D363: July 8, 2009 | E363: September 9, 2009 | G363: October 21, 2009 | H363: 100-0 | I363: of:=[.D363]-ObamaInauguration -> 169
B364: Irene Berger | C364: Southern District of West Virginia | D364: July 8, 2009 | E364: September 9, 2009 | G364: October 27, 2009 | H364: 97-0 | I364: of:=[.D364]-ObamaInauguration -> 169
B365: Charlene Honeywell | C365: Middle District of Florida | D365: June 25, 2009 | E365: September 9, 2009 | G365: November 9, 2009 | H365: 88-0 | I365: of:=[.D365]-ObamaInauguration -> 156
B366: Jeffrey Viken | C366: District of South Dakota | D366: June 25, 2009 | E366: July 29, 2009 | G366: September 29, 2009 | H366: 99-0 | I366: of:=[.D366]-ObamaInauguration -> 156
B367: Robin Rosenbaum | C367: United States Court of Appeals for the Eleventh Circuit | D367: November 7, 2013 | E367: February 11, 2014 | G367: May 12, 2014 | H367: 91-0 | I367: of:=[.D367]-ObamaInauguration -> 1752
B368: Sheri Chappell | C368: Middle District of Florida | D368: June 25, 2012 | E368: September 19, 2012 | G368: May 20, 2013 | H368: 90-0 | I368: of:=[.D368]-ObamaInauguration -> 1252
B369: Linda T. Walker | C369: Northern District of Georgia | D369: January 26, 2011 | I369: of:=[.D369]-ObamaInauguration -> 736
B370: Edward Chen | C370: Northern District of California | D370: August 6, 2009 | E370: September 23, 2009 | G370: May 10, 2011 | H370: 56-42 | I370: of:=[.D370]-ObamaInauguration -> 198
B371: Kimberly Mueller | C371: Eastern District of California | D371: March 10, 2010 | E371: April 16, 2010 | G371: December 16, 2010 | H371: Voice vote | I371: of:=[.D371]-ObamaInauguration -> 414
B372: Dale A. Drozd | C372: United States District Court for the Eastern District of California | D372: November 12, 2014 | E372: May 6, 2015 | G372: October 5, 2015 | H372: 69-21 | I372: of:=[.D372]-ObamaInauguration -> 2122
B373: Fernando Olguin | C373: Central District of California | D373: 5/14/2012 | E373: 6/27/2012 | G373: 12/17/2012 | I373: of:=[.D373]-ObamaInauguration -> 1210
B374: Cathy Bencivengo | C374: Southern District of California | D374: May 11, 2011 | E374: September 7, 2011 | G374: February 9, 2012 | H374: 90-6 | I374: of:=[.D374]-ObamaInauguration -> 841
B375: Anthony J. Battaglia | C375: Southern District of California | D375: May 20, 2010 | E375: September 29, 2010 | G375: March 7, 2011 | H375: 89-0 | I375: of:=[.D375]-ObamaInauguration -> 485
B376: Richard Seeborg | C376: Northern District of California | D376: August 6, 2009 | E376: September 23, 2009 | G376: December 24, 2009 | H376: Voice vote | I376: of:=[.D376]-ObamaInauguration -> 198
B377: Leslie Kobayashi | C377: District of Hawaii | D377: April 21, 2010 | E377: July 15, 2010 | G377: December 18, 2010 | H377: Voice vote | I377: of:=[.D377]-ObamaInauguration -> 456
B378: Robert Bacharach | C378: United States Court of Appeals for the Tenth Circuit | D378: January 23, 2012 | E378: May 9, 2012 | G378: February 25, 2013 | H378: 93-0 | I378: of:=[.D378]-ObamaInauguration -> 1098
B379: Cathy Bissoon | C379: Western District of Pennsylvania | D379: November 17, 2010 | E379: June 22, 2011 | G379: October 17, 2011 | H379: 82-3 | I379: of:=[.D379]-ObamaInauguration -> 666
B380: Sharon Coleman | C380: Northern District of Illinois | D380: February 24, 2010 | E380: March 10, 2010 | G380: July 12, 2010 | H380: 86-0 | I380: of:=[.D380]-ObamaInauguration -> 400
B381: Bruce Hendricks | C381: District of South Carolina | D381: June 26, 2013 | E381: February 11, 2014 | G381: June 4, 2014 | H381: 95-0 | I381: of:=[.D381]-ObamaInauguration -> 1618
B382: David Nuffer | C382: District of Utah | D382: 6/29/2011 | E382: 9/20/2011 | G382: 3/22/2012 | I382: of:=[.D382]-ObamaInauguration -> 890
B383: Paul Grimm | C383: District of Maryland | D383: 2/16/2012 | E383: 5/9/2012 | G383: 12/3/2012 | I383: of:=[.D383]-ObamaInauguration -> 1122
B384: Charles Day | C384: District of Maryland | D384: July 21, 2010 | F384: October 31, 2011 | I384: of:=[.D384]-ObamaInauguration -> 547
B385: James Bredar | C385: District of Maryland | D385: April 21, 2010 | E385: ay 13, 2010 | G385: December 16, 2010 | H385: Voice vote | I385: of:=[.D385]-ObamaInauguration -> 456
B386: Michael Urbanski | C386: Western District of Virginia | D386: 12/1/2010 | E386: 2/16/2011 | G386: 5/12/2011 | I386: of:=[.D386]-ObamaInauguration -> 680
B387: Evan Wallach | C387: United States Court of Appeals for the Federal Circuit | D387: July 28, 2011 | E387: September 7, 2011 | G387: November 8, 2011 | H387: 99-0 | I387: of:=[.D387]-ObamaInauguration -> 919
B388: Timothy S. Black | C388: Southern District of Ohio | D388: December 24, 2009 | E388: January 20, 2010 | G388: May 11, 2010 | H388: Voice vote | I388: of:=[.D388]-ObamaInauguration -> 338
B389: Audrey Fleissig | C389: Eastern District of Missouri | D389: January 20, 2010 | E389: February 11, 2010 | G389: June 7, 2010 | H389: 90-0 | I389: of:=[.D389]-ObamaInauguration -> 365
B390: Susan Richard Nelson | C390: District of Minnesota | D390: April 21, 2010 | E390: May 13, 2010 | G390: December 17, 2010 | H390: Voice vote | I390: of:=[.D390]-ObamaInauguration -> 456
B391: Jane Magnus-Stinson | C391: Southern District of Indiana | D391: January 20, 2010 | E391: February 11, 2010 | G391: June 7, 2010 | H391: Voice vote | I391: of:=[.D391]-ObamaInauguration -> 365
B392: James Wynn | C392: Fourth Circuit | D392: November 4, 2009 | E392: December 16, 2009 | G392: August 5, 2010 | H392: Voice vote | I392: of:=[.D392]-ObamaInauguration -> 288
B393: Morgan Christen | C393: United States Court of Appeals for the Ninth Circuit | D393: May 18, 2011 | E393: July 13, 2011 | G393: December 15, 2011 | H393: 95-3 | I393: of:=[.D393]-ObamaInauguration -> 848
B394: Ellen Hollander | C394: District of Maryland | D394: April 21, 2010 | E394: May 13, 2010 | G394: December 18, 2010 | H394: 95-0 | I394: of:=[.D394]-ObamaInauguration -> 456
B395: Nancy Moritz | C395: United States Court of Appeals for the Tenth Circuit | D395: August 1, 2013 | E395: November 13, 2013 | G395: May 5, 2014 | H395: 90-3 | I395: of:=[.D395]-ObamaInauguration -> 1654
B396: Amos Mazzant | C396: Eastern District of Texas | D396: June 26, 2014 | E396: September 9, 2014 | G396: December 16, 2014 | H396: Voice vote | I396: of:=[.D396]-ObamaInauguration -> 1983
B397: D.P. Marshall
B398: Mary Murguia | C398: United States Court of Appeals for the Ninth Circuit | D398: March 25, 2010 | E398: July 15, 2010 | G398: December 22, 2010 | H398: 89-0 | I398: of:=[.D398]-ObamaInauguration -> 429
B399: Carolyn McHugh | C399: United States Court of Appeals for the Tenth Circuit | D399: May 16, 2013 | E399: September 25, 2013 | G399: March 12, 2014 | H399: 98-0 | I399: of:=[.D399]-ObamaInauguration -> 1577
B400: Henry Floyd | C400: United States Court of Appeals for the Fourth Circuit | D400: January 26, 2011 | E400: April 13, 2011 | G400: October 3, 2011 | H400: 96-0 | I400: of:=[.D400]-ObamaInauguration -> 736
B401: Andre Davis | C401: United States Court of Appeals for the Fourth Circuit | D401: April 2, 2009 | E401: April 29, 2009 | G401: November 9, 2009 | H401: 72-16 | I401: of:=[.D401]-ObamaInauguration -> 72
B402: Hannah Lauck | C402: Eastern District of Virginia | D402: December 19, 2013 | E402: February 25, 2014 | G402: June 10, 2014 | H402: 90-0 | I402: of:=[.D402]-ObamaInauguration -> 1794
B403: Sonia Sotomayor | C403: Supreme Court of the United States | D403: June 1, 2009 | E403: January 9-13, 2006 | G403: August 6, 2009 | H403: 68-31 | I403: of:=[.D403]-ObamaInauguration -> 132
B404: Julie Carnes | C404: United States Court of Appeals for the Eleventh Circuit | D404: December 19, 2013 | E404: May 13, 2014 | G404: July 21, 2014 | H404: 94-0 | I404: of:=[.D404]-ObamaInauguration -> 1794
B405: Beverly Martin | C405: United States Court of Appeals for the Eleventh Circuit | D405: June 19, 2009 | E405: July 29, 2009 | G405: January 20, 2010 | H405: 97-0 | I405: of:=[.D405]-ObamaInauguration -> 150
B406: David Hamilton (Seventh Circuit) | C406: United States Court of Appeals for the Seventh Circuit | D406: March 17, 2009 | E406: April 29, 2009 | G406: November 19, 2009 | H406: 59-39 | I406: of:=[.D406]-ObamaInauguration -> 56
B407: Adalberto Jordan | C407: United States Court of Appeals for the Eleventh Circuit | D407: August 2, 2011 | E407: September 20, 2011 | G407: February 15, 2012 | H407: 94-5 | I407: of:=[.D407]-ObamaInauguration -> 924
B408: Mark Goldsmith | C408: Eastern District of Michigan | D408: February 4, 2010 | E408: February 24, 2010 | G408: June 21, 2010 | H408: 89-0 | I408: of:=[.D408]-ObamaInauguration -> 380
B409: Malachy Mannion | C409: Middle District of Pennsylvania | D409: 5/17/2012 | E409: 6/27/2012 | G409: 12/21/2012 | I409: of:=[.D409]-ObamaInauguration -> 1213
B410: Thomas Vanaskie | C410: United States Court of Appeals for the Third Circuit | D410: August 6, 2009 | E410: November 4, 2009 | G410: April 21, 2010 | H410: 77-20 | I410: of:=[.D410]-ObamaInauguration -> 198
B411: Felipe Restrepo | C411: United States Court of Appeals for the Third Circuit | D411: November 12, 2014 | E411: June 10, 2015 | G411: January 11, 2016 | H411: 82-6 | I411: of:=[.D411]-ObamaInauguration -> 2122
B412: Michael Shipp | C412: District of New Jersey | D412: 1/23/2012 | E412: 3/14/2012 | G412: 7/23/2012 | I412: of:=[.D412]-ObamaInauguration -> 1098
B413: Patty Shwartz | C413: United States Court of Appeals for the Third Circuit | D413: October 5, 2011 | E413: February 15, 2012 | G413: April 19, 2013 | H413: 64-34 | I413: of:=[.D413]-ObamaInauguration -> 988
B414: Esther Salas | C414: District of New Jersey | D414: 12/1/2010 | E414: 3/2/2011 | G414: 6/14/2011 | I414: of:=[.D414]-ObamaInauguration -> 680
B415: Claire Cecchi | C415: District of New Jersey | D415: December 1, 2010 | E415: March 2, 2011 | G415: June 14, 2011 | H415: 98-0 | I415: of:=[.D415]-ObamaInauguration -> 680
B416: Madeline Arleo | C416: District of New Jersey | D416: June 16, 2014 | E416: July 29, 2014 | G416: November 20, 2014 | H416: Voice vote | I416: of:=[.D416]-ObamaInauguration -> 1973
B417: Joseph Greenaway | C417: Third Circuit | D417: June 19, 2009 | E417: September 9, 2009 | G417: February 9, 2010 | H417: 84-0 | I417: of:=[.D417]-ObamaInauguration -> 150
B418: Leonard Stark | C418: District of Delaware | D418: March 17, 2010 | E418: April 22, 2010 | G418: August 5, 2010 | H418: Voice vote | I418: of:=[.D418]-ObamaInauguration -> 421
B419: Gerard Lynch | C419: United States Court of Appeals for the Second Circuit | D419: April 2, 2009 | E419: May 12, 2009 | G419: September 17, 2009 | H419: 94-3 | I419: of:=[.D419]-ObamaInauguration -> 72
B420: Denny Chin | C420: United States Court of Appeals for the Second Circuit | D420: October 6, 2009 | E420: November 18, 2009 | G420: April 22, 2010 | H420: 98-0 | I420: of:=[.D420]-ObamaInauguration -> 259
B421: Joan Azrack | C421: United States District Court for the Eastern District of New York | D421: September 18, 2014 | E421: November 13, 2014 | G421: December 16, 2014 | H421: Voice vote | I421: of:=[.D421]-ObamaInauguration -> 2067
B422: Christopher Droney | C422: United States Court of Appeals for the Second Circuit | D422: May 4, 2011 | E422: June 22, 2011 | G422: November 28, 2011 | H422: 88-0 | I422: of:=[.D422]-ObamaInauguration -> 834
B423: Robert Chatigny | C423: United States Court of Appeals for the First Circuit | D423: August 5, 1994 | E423: September 14, 1994 | G423: September 28, 1994 | H423: Voice vote
B424: Robert Chatigny | C424: United States Court of Appeals for the Second Circuit | D424: February 24, 2010 | E424: April 28, 2010 | I424: of:=[.D424]-ObamaInauguration -> 400
B425: Timothy Hillman
B426: Leo Sorokin | C426: District of Massachusetts | D426: December 19, 2013 | E426: February 25, 2014 | G426: June 10, 2014 | H426: 91-0 | I426: of:=[.D426]-ObamaInauguration -> 1794
B427: Gershwin Drain | C427: Eastern District of Michigan | D427: 11/17/2011 | E427: 2/29/2012 | G427: 8/2/2012 | I427: of:=[.D427]-ObamaInauguration -> 1031
B428: Bernice Donald | C428: United States Court of Appeals for the Sixth Circuit | D428: December 1, 2010 | E428: March 16, 2011 | G428: September 6, 2011 | H428: 96-2 | I428: of:=[.D428]-ObamaInauguration -> 680
B429: Kathleen M. O'Malley | C429: Federal Circuit | D429: March 10, 2010 | E429: July 28, 2010 | G429: December 22, 2010 | H429: Voice vote | I429: of:=[.D429]-ObamaInauguration -> 414
B430: Elissa Cadish | C430: District of Nevada | D430: February 16, 2012 | I430: of:=[.D430]-ObamaInauguration -> 1122
B431: Barbara Keenan | C431: United States Court of Appeals for the Fourth Circuit | D431: September 14, 2009 | E431: October 7, 2009 | G431: March 2, 2010 | H431: 99-0 | I431: of:=[.D431]-ObamaInauguration -> 237
B432: John Gerrard | C432: District of Nebraska | D432: 5/4/2011 | E432: 9/20/2011 | G432: 1/23/2012 | I432: of:=[.D432]-ObamaInauguration -> 834
B433: Brian Morris | C433: District of Montana | D433: May 23, 2013 | E433: July 24, 2013 | G433: December 12, 2013 | H433: 75-20 | I433: of:=[.D433]-ObamaInauguration -> 1584
B434: Andrew Hurwitz | C434: United States Court of Appeals for the Ninth Circuit | D434: November 2, 2011 | E434: January 26, 2012 | G434: June 12, 2012 | H434: Voice vote | I434: of:=[.D434]-ObamaInauguration -> 1016
B435: James Graves | C435: United States Court of Appeals for the Fifth Circuit | D435: June 10, 2010 | E435: September 29, 2010 | G435: February 14, 2011 | H435: Voice vote | I435: of:=[.D435]-ObamaInauguration -> 506
B436: Louis Butler | C436: Western District of Wisconsin | D436: September 30, 2009 | E436: November 4, 2009 | I436: of:=[.D436]-ObamaInauguration -> 253
B437: Sue Myerscough | C437: Central District of Illinois | D437: 6/17/2010 | E437: 9/15/2010 | G437: 3/7/2011 | I437: of:=[.D437]-ObamaInauguration -> 513
B438: Jon Levy | C438: District of Maine | D438: September 19, 2013 | E438: December 19, 2013 | G438: April 30, 2014 | H438: 75-20 | I438: of:=[.D438]-ObamaInauguration -> 1703
B439: Jill Parrish | C439: United States District Court for the District of Utah | D439: September 18, 2014 | E439: January 21, 2015 | G439: May 21, 2015 | H439: 100-00 | I439: of:=[.D439]-ObamaInauguration -> 2067
B440: Elena Kagan | C440: Supreme Court of the United States | D440: May 10, 2010 | E440: June 28, 2010 | G440: August 5, 2010 | H440: 63-37 | I440: of:=[.D440]-ObamaInauguration -> 475
B441: Stephen Six | C441: Tenth Circuit | D441: March 9, 2011 | E441: May 24, 2011 | I441: of:=[.D441]-ObamaInauguration -> 778
B442: Gregory Alan Phillips | C442: United States Court of Appeals for the Tenth Circuit | D442: January 31, 2013 | E442: March 19, 2013 | G442: July 8, 2013 | H442: 88-0 | I442: of:=[.D442]-ObamaInauguration -> 1472

Sheet: Reagan Judicial Nominations
B2: Judge | C2: Final post: | D2: Term: | E2: Previous Post: | F2: Term: | G2: Bachelors: | H2: Law: | I2: Term begins | J2: Term ends
B3: Antonin Scalia | C3: Supreme Court | D3: 9/26/1986-Present | E3: District of Columbia Court of Appeals | F3: 1982-1986 | G3: Georgetown U., B.A., 1957 | H3: Harvard Law, J.D., 1960
B4: Anthony Kennedy | C4: Supreme Court | D4: 2/17/1988-Present | E4: Ninth Circuit | F4: 1975-1988 | G4: Standford, B.A., 1958 | H4: Harvard Law, LL.B., 1961
B5: Charles Edward Wiggins
B6: William Rehnquist | C6: Supreme Court | D6: 9/25/1986 - 9/3/2005 | E6: Supreme Court, Associate Justice | F6: 12/15/1971 - 9/26/1986 | G6: Stanford, B.A., 1948 | H6: Stanford Law, LL.B, 1952
B7: Alex Kozinski | C7: Ninth Circuit | D7: 11/7/1985 - Present | E7: Court of Federal Claims | F7: 1982-1985 | G7: UCLA 1972 | H7: UCLA School of Law 1975
B8: Sandra Day O'Connor | C8: Supreme Court | D8: 9/25/1981-1/31/2006 | G8: Stanford, A.B., 1950 | H8: Stanford Law, LL.B., 1952
B9: John Shabaz | C9: Western District of Wisconsin | D9: 12/10/1981-1/20/2009 | G9: UW-Madison | H9: Marquette U. Law School, LL.B., 1957
B10: Thomas Curran | C10: Eastern District of Wisconsin | D10: 11/7/1983 - 1/1/1997 | G10: Marquette U., B.N.S., 1945 | H10: Marquette U. Law School, LL.B., 1948
B11: Joseph Stadtmueller | C11: Eastern District of Wisconsin | D11: 6/1/1987 - Present | G11: Marquette U., B.A., 1964 | H11: Marquette U. Law School, J.D., 1967
B12: James Holderman | C12: Northern District of Illinois | D12: 4/4/1985 - Present | G12: U. of Illinois, B.S., 1968 | H12: U. of Illinois College of Law, J.D., 1971
B13: Suzanne Conlon | C13: Northern District of Illinois | D13: 2/22/1988 - 4/17/2004 | G13: Mundelein College, B.A., 1963 | H13: Loyola U. Chicago School of Law, J.D., 1968
B14: William Hart | C14: Northern District of Illinois | D14: 4/21/1982 - 6/1/1996 | H14: Loyola U. Chicago School of Law, J.D., 1951
B15: Harry Leinenweber | C15: Northern District of Illinois | D15: 12/17/1985 - 6/3/2002 | G15: U. of Notre Dame, B.A., 1959 | H15: U. of Chicago Law School, J.D., 1962
B16: George Marovich | C16: Northern District of Illinois | D16: 4/1/1988 - 1/2/2000 | G16: U. of Illinois at Urbana-Champaign, B.S., 1952 | H16: U. of Illinois College of Law, J.D., 1954
B17: John Nordberg | C17: Northern District of Illinois | D17: 4/21/1982 - 6/18/1994 | G17: Carleton College | H17: U. of Michigan Law School, J.D., 1950
B18: Charles Norgle | C18: Northern District of Illinois | D18: 10/4/1984 - Present | G18: Northwestern U., B.B.A., 1964 | H18: John Marshall Law School, J.D., 1969
B19: James Zagel | C19: Northern District of Illinois | D19: 4/22/1987 - Present | G19: U. of Chicago, B.A., 1962 | H19: Harvard Law School, J.D., 1965
B20: Michael Mihm | C20: Central District of Illinois | D20: 8/6/1982 - 10/1/2009 | G20: Loras College, B.A., 1964 | H20: Saint Louis U. School of Law, J.D., 1967
B21: Richard Mills | C21: Central District of Illinois | D21: 7/22/1985 - 10/7/1997 | G21: Illinois College, B.A., 1951 | H21: Mercer U. School of Law, J.D., 1957
B22: William Stiehl | C22: Southern District of Illinois | D22: 6/16/1986 - 11/30/1996 | H22: Saint Louis U. School of Law, LL.B., 1949
B23: Robert Miller | C23: Northern District of Indiana | D23: 12/17/1985 - Present | G23: Northwestern U., B.A., 1972 | H23: Indiana U. School of Law, J.D., 1975
B24: James T. Moody | C24: Northern District of Indiana | D24: 2/9/1982 - 6/17/2003 | E24: Magistrate Judge | F24: 1979 - 1982 | G24: Indiana U., A.B., 1960 | H24: Indiana U. School of Law, LL.B., 1963
B25: William Lee | C25: Northern District of Indiana | D25: 7/28/1981 - 2/3/2003 | G25: Yale U., A.B., 1959 | H25: U. of Chicago Law School, J.D., 1962
B26: Bernard Friedman | C26: Eastern District of Michigan | D26: 4/20/1988 - 1/1/2009 | H26: Detroit College of Law, J.D., 1968
B27: Patrick Duggan | C27: Eastern District of Michigan | D27: 10/14/1986 - 9/29/2000 | G27: Xavier U., Ohio, B.S., 1955 | H27: U. of Detroit School of Law, LL.B., 1958
B28: Paul Gadola | C28: Eastern District of Michigan | D28: 10/17/1988 - 1/31/2001 | G28: Michigan State U., A.B., 1951 | H28: U. of Michigan Law School, J.D., 1953
B29: Lawrence Zatkoff | C29: Eastern District of Michigan | D29: 3/4/1986 - 6/16/2004 | G29: U. of Detroit, B.S., 1962 | H29: Detroit College of Law, J.D., 1966
B30: Robert Holmes Bell | C30: Western District of Michigan | D30: 7/2/1987 - Present | G30: Wheaton College, B.A., 1966 | H30: Wayne State U. Law School, J.D., 1969
B31: Sam Bell | C31: Northern District of Ohio | D31: 12/22/1982 - 10/30/1996 | G31: College of Wooster, B.A., 1947 | H31: University of Akron School of Law, J.D., 1952
B32: David Dowd | C32: Northern District of Ohio | D32: 9/23/1982 - 6/30/1996 | G32: College of Wooster, B.A., 1951 | H32: U. of Michigan Law School, J.D., 1954
B33: Herman Weber | C33: Southern District of Ohio | D33: 4/4/1985 - 1/1/2002 | G33: Otterbein College, B.A., 1949 | H33: Ohio State U. College of Law, J.D., 1952
B34: George Smith | C34: Southern District of Ohio | D34: 11/9/1987 - 1/1/2002 | G34: Ohio State U., B.A., 1957 | H34: Ohio State U. College of Law, J.D., 1959
B35: James Graham | C35: Southern District of Ohio | D35: 9/26/1986 - 8/31/2004 | G35: Ohio State U., B.A., 1962 | H35: Ohio State U. College of Law, J.D., 1962
B36: Allan Edgar | C36: Eastern District of Tennessee | D36: 4/16/1985 - 10/7/2005 | G36: Davidson College, B.A., 1962 | H36: Duke U. School of Law, LL.B., 1965
B37: Robert Leon Jordan | C37: Eastern District of Tennessee | D37: 10/17/1988 - 11/30/2001 | G37: U. of Tennessee, B.S., 1958 | H37: U. of Tennessee College of Law, J.D., 1960
B38: James D. Todd | C38: Western District of Tennessee | D38: 7/11/1985 - 5/20/2008 | G38: Lambuth College, B.S., 1965 | H38: U. of Mississippi, Master of Combined Sciences, 1968
B39: Karl Forester | C39: Eastern District of Kentucky | D39: 7/27/1988 - 5/2/2005 | G39: U. of Kentucky, B.A., 1962 | H39: U. of Kentucky College of Law, J.D., 1966
B40: Charles Simpson | C40: Western District of Kentucky | D40: 8/4/1986 - 2/1/2013 | G40: U. of Louisville, B.A., 1967 | H40: U. of Louisville School of Law, J.D., 1970
B41: James Rosenbaum | C41: District of Minnesota | D41: 7/18/1985 - 10/26/2009 | G41: U. of Minnesota, B.A., 1966 | H41: U. of Minnesota Law School, J.D., 1969
B42: David Doty | C42: District of Minnesota | D42: 5/8/1987 - 6/30/1998 | G42: U. of Minnesota, B.A., 1952 | H42: U. of Minnesota Law School, J.D., 1961
B43: Paul Magnuson | C43: District of Minnesota | D43: 10/29/1981 - 2/9/2002 | G43: Gustavus Adolphus College, B.A., 1959 | H43: William Mitchell College of Law, J.D., 1963
B44: Richard Battey | C44: District of South Dakota | D44: 10/28/1985 - 1/1/1999 | G44: U. of South Dakota, 1950 | H44: U. of South Dakota School of Law, J.D., 1953
B45: John B. Jones | C45: District of South Dakota | D45: 11/18/1981 - 1/1/1995 | G45: U. of South Dakota, B.S., 1951 | H45: U. of South Dakota School of Law, LL.B., 1953
B46: Patrick Conmy | C46: District of North Dakota | D46: 12/17/1985 - 5/5/2000 | G46: Harvard College, B.A., 1955 | H46: Georgetown U. Law Center, J.D., 1959
B47: Rodney Webb | C47: District of North Dakota | D47: 12/21/1987 - 12/31/2001 | G47: U. of North Dakota, B.S., 1957 | H47: U. of North Dakota School of Law, J.D., 1959
B48: Lyle Strom | C48: District of Nebraska | D48: 10/28/1985 - 11/2/1995 | G48: Creighton U., B.A., 1950 | H48: Creighton U. School of Law, J.D., 1953
B49: Charles Wolle | C49: Southern District of Iowa | D49: 8/6/1987 - 10/16/2001 | G49: Harvard College, A.B., 1959 | H49: U. of Iowa College of Law, J.D., 1961
B50: Dean Whipple | C50: Western District of Missouri | D50: 12/9/1987 - 4/30/2007 | G50: Drury College, A.B, 1961 | H50: U. of Missouri-Kansas City School of Law, J.D., 1965
B51: Scott Wright | C51: Western District of Missouri | D51: 9/26/1979 - 10/5/1991 | H51: U. of Missouri-Columbia School of Law, LL.B., 1950
B52: Mark Wolf | C52: District of Massachusetts | D52: 4/4/1985-1/1/2013 | G52: Yale U., B.A., 1968 | H52: Harvard U. Law, J.D., 1971
B53: Edward Harrington | C53: District of Massachusetts | D53: 2/2/1988 - 3/1/2001 | G53: College of the Holy Cross, A.B., 1955 | H53: Boston College Law School, J.D., 1960
B54: William G. Young (Massachusetts) | C54: District of Massachusetts | D54: 4/4/1985 - Present | E54: Superior Court of Massachusetts | F54: 1978-1985 | G54: Harvard U., A.B., 1962 | H54: Harvard Law, LL.B., 1967
B55: Douglas Woodlock | C55: District of Massachusetts | D55: 6/16/1986 - Present | G55: Yale U., B.A., 1969 | H55: Georgetown U., Law, J.D., 1975
B56: Jose Fuste | C56: District of Puerto Rico | D56: 10/28/1985 - Present | G56: U. of Puerto Rico, B.B.A., 1965 | H56: U. Puerto Rico Law, LL.B., 1968
B57: Jaime Pieras | C57: District of Puerto Rico | D57: 7/15/1982 - 8/1/1993 | G57: Catholic U. of America, B.A., 1945 | H57: Georgetown U. Law, J.D., 1948
B58: Raymond Acosta | C58: District of Puerto Rico | D58: 9/30/1982 - 6/1/1994 | G58: Princeton, 1948 | H58: Rutgers U. Law, J.D., 1951
B59: Ronald Lagueux | C59: District of Rhode Island | D59: 3/4/1986 - 11/30/2001 | E59: Rhode Island Supreme Court | F59: 1968-1986 | G59: Bowdoin College, 1953 | H59: Harvard Law, 1956
B60: Ernest Torres | C60: District of Rhode Island | D60: 11/6/1987 - 12/1/2006 | G60: Dartmouth, A.B., 1963 | H60: Duke U. Law, J.D., 1968
B61: Peter Dorsey | C61: District of Connecticut | D61: 7/19/1983 - 1/2/1998 | G61: Yale, B.A., 1953 | H61: Harvard Law, LL.B, 1959
B62: Alan Nevas | C62: District of Connecticut | D62: 10/17/1985 - 3/27/1997 | G62: Syracuse U., A.B., 1949 | H62: New York U. Law, LL.B., 1951
B63: Raymond Dearie | C63: Eastern District of New York | D63: 03/19/1986 - 04/02/2011 | G63: Fairfield University, B.A., 1966 | H63: St. John's University School of Law, J.D., 1969
B64: Leo Glasser | C64: Eastern District of New York | D64: 12/10/1981 - 06/30/1993 | G64: College of the City of New York, B.A., 1943 | H64: Brooklyn Law, LL.B., 1948
B65: Edward Korman | C65: Eastern District of New York | D65: 11/04/1985 - 10/24/2007 | G65: Brooklyn College, B.A., 1963 | H65: Brooklyn Law School, LL.B., 1966
B66: Leonard Wexler | C66: Eastern District of New York | D66: 06/22/1983 - 06/29/1994 | G66: Indiana U., B.S., 1947 | H66: New York U. School of Law, J.D., 1950
B67: Thomas McAvoy | C67: Northern District of New York | D67: 03/04/1986 - 09/16/2003 | G67: Villanova U., A.B., 1960 | H67: Albany Law, J.D., 1964
B68: Lewis Babcock | C68: District of Colorado | D68: 10/17/1988 - 4/4/2008 | G68: U. of Denver, B.A., 1965 | H68: U. of Denver Law, J.D., 1968
B69: Kimba Wood | C69: Southern District of New York | D69: 04/20/1988 - 05/31/2009 | G69: Connecticut College, B.A., 1965 | H69: Harvard Law, J.D., 1969
B70: Miriam Goldman Cedarbaum | C70: Southern District of New York | D70: 03/04/1986 - 03/30/1998 | G70: Barnard College, B.A., 1950 | H70: Columbia Law, LL.B., 1953
B71: John Keenan | C71: Southern District of New York | D71: 09/20/1983 - 12/30/1996 | G71: Manhattan College, B.B.A., 1951 | H71: Fordham U. Law, LL.B., 1954
B72: Shirley Kram | C72: Southern District of New York | D72: 03/02/1983 - 05/22/1993 | H72: Brooklyn Law, LL.B., 1950
B73: Peter Leisure | C73: Southern District of New York | D73: 06/15/1984 - 03/20/1997 | G73: Yale, B.A., 1952 | H73: U. of Virginia Law, LL.B., 1958
B74: Robert Patterson | C74: Southern District of New York | D74: 10/06/1988 - 12/30/1998 | G74: Harvard, B.A., 1947 | H74: Columbia Law, LL.B., 1950
B75: John Sprizzo | C75: Southern District of New York | D75: 9/25/1981 - 1/1/2000 | G75: St. John's University (1956) | H75: St. John's University School of Law (1959)
B76: Louis Stanton | C76: Southern District of New York | D76: 07/18/1985 - 09/30/1996 | G76: Yale, B.A., 1950 | H76: U. of Virginia Law, J.D. and L.L.B., 1955
B77: Richard Arcara | C77: Western District of New York | D77: 2/22/1988 - Present | G77: St. Bonaventure U., B.A., 1962 | H77: Villanova U. Law, J.D., 1965
B78: David Larimer | C78: Western District of New York | D78: 11/06/1987 - 03/02/2009 | E78: Western District of New York, Magistrate Judge | F78: 1983 - 1987 | G78: St. John Fisher College, B.A., 1966 | H78: Notre Dame Law, J.D. 1969
B79: Michael Telesca | C79: Western District of New York | D79: 04/21/1982 - 05/02/1996 | E79: Monroe County, New York, Surrogate Court Judge | F79: 1973 - 1982 | G79: U. of Rochester, B.A., 1952 | H79: U. of Buffalo Law, LL.B., 1955
B80: Joseph Farnan | C80: District of Delaware | D80: 7/16/1985 - 7/31/2010 | G80: King's College, B.A., 1967 | H80: U. of Toledo Law, J.D., 1970
B81: Garrett Brown | C81: District of New Jersey | D81: 12/17/1985 - 1/2/2012 | G81: Lafayette College, A.B., 1965 | H81: Duke U. Law, J.D., 1968
B82: Joseph Rodriguez | C82: District of New Jersey | D82: 05/10/1985 - 05/21/1998 | G82: LaSalle U., A.B., 1955 | H82: Rutgers U. Law, LL.B., 1958
B83: Lowell Reed | C83: Eastern District of Pennsylvania | D83: 04/20/1988 - 06/20/1999 | G83: U. of Wisconsin, B.B.A., 1952 | H83: Temple U. Law, J.D., 1958
B84: Thomas O'Neill | C84: Eastern District of Pennsylvania | D84: 08/05/1983 - 07/05/1996 | G84: Catholic U. of America, A.B., 1950 | H84: U. of Pennsylvania, LL.B., 1953
B85: Edmund Ludwig | C85: Eastern District of Pennsylvania | D85: 10/17/1985 - 05/20/1997 | E85: Bucks County Court of Common Pleas, Judge | F85: 1968 - 1985 | G85: Harvard, A.B., 1949 | H85: Harvard Law, LL.B., 1952
B86: Robert Kelly | C86: Eastern District of Pennsylvania | D86: 06/26/1987 - 07/16/2001 | E86: Pennsylvania Court of Common Pleas, Judge | F86: 1976 - 1987 | G86: Villanova U., B.S., 1957 | H86: Temple U. Law, LL.B., 1960
B87: Jan Dubois | C87: Eastern District of Pennsylvania | D87: 07/27/1988 - 04/14/2002 | G87: U. of Pennsylvania, B.S., 1952 | H87: Yale Law , LL.B., 1957
B88: Alice Batchelder | C88: Sixth Circuit | D88: 12/2/1991 - Present | E88: Northern District of Ohio | F88: 1985-1991 | G88: Ohio Wesleyan U. '64 | H88: Akron U. Law '71
B89: Ralph Guy | C89: Sixth Circuit | D89: 10/17/1985 - 9/1/1994 | E89: Eastern District of Michigan | F89: 1976-1985 | G89: U. of Michigan '51 | H89: U. of Michigan Law '53
B90: James L. Ryan | C90: Sixth Circuit | D90: 10/17/1985 - 1/1/2000 | E90: Michigan Supreme Court | F90: 1975-1985 | G90: U. of Detroit '92 | H90: U. of Detroit Law '56 (B.L.)
B91: Alan Norris | C91: Sixth Circuit | D91: 7/1/1986 - 7/1/2001 | E91: Ohio Court of Appeals, Tenth District | F91: 1980-1986 | G91: Otterbein College '57 | H91: New York U. Law '60
B92: Richard Suhrheinrich | C92: Sixth Circuit | D92: 7/10/1990 - 8/15/2001 | E92: Eastern District of Michigan | F92: 1984-1990 | G92: Wayne State U. '60 | H92: Detroit College of Law '63
B93: Frank Easterbrook | C93: Seventh Circuit | D93: 4/4/1985 - Present | G93: Swarthmore College '70 | H93: U. of Chicago Law '73
B94: William Caldwell | C94: Middle District of Pennsylvania | D94: 03/19/1982 - 05/30/1994 | E94: Dauphin County Court of Common Pleas, Judge | F94: 1970 - 1982 | G94: Dickinson College, A.B., 1948 | H94: Dickinson Law, LL.B., 1951
B95: Edwin Kosik | C95: Middle District of Pennsylvania | D95: 06/16/1986 - 07/14/1996 | E95: Lackawanna County Court of Common Pleas, Judge | F95: 1969 - 1979 | G95: Wilkes College, B.A., 1949 | H95: Dickinson Law, LL.B., 1951
B96: Ann Williams | C96: Seventh Circuit | D96: 11/15/1999 - Present | E96: Northern District of Illinois | F96: 1985-1999 | G96: Wayne State U. '70 | H96: Notre Dame Law '75
B97: Sam Crow | C97: District of Kansas | D97: 12/10/1981 - 11/15/1996 | E97: District of Kansas, Magistrate judge | F97: 1975-1981 | G97: U. of Kansas, B.A., 1949 | H97: Washburn U. Law, J.D., 1952
B98: John Conway | C98: District of New Mexico | D98: 6/16/1986 - 9/1/2000 | G98: U.S. Naval Academy, B.S., 1956 | H98: Washburn U. Law, LL.B., 1963
B99: John Greene | C99: District of Utah | D99: 4/4/1985-11/28/1997 | G99: University of Utah, B.A., 1952 | H99: University of Utah College of Law, J.D., 1955
B100: David Sam | C100: District of Utah | D100: 10/16/1985 - 11/1/1999 | G100: Brigham Young University, B.S., 1957 | H100: University of Utah College of Law, J.D., 1960
B101: Alan Johnson | C101: District of Wyoming | D101: 12/17/1985 - Present | E101: Federal Magistrate Judge | F101: 1971 - 1974 | G101: Vanderbilt U., B.A., 1961 | H101: U. of Wyoming Law, J.D., 1964
B102: David L. Russell | C102: Western District of Oklahoma | D102: 12/17/1981 - 7/7/2013 | E102: Eastern District of Oklahoma | F102: 1981 - 1990 | G102: Oklahoma Baptist U.,, B.S., 1963 | H102: U. of Oklahoma Law, J.D., 1965
B103: William Acker | C103: Northern District of Alabama | D103: 8/18/1982 - 5/31/1996 | G103: Birmingham-Southern College, B.A., 1949 | H103: Yale Law, LL.B., 1952
B104: Gene Carter | C104: District of Maine | D104: 6/23/1983 - 1/2/2003 | G104: University of Maine, B.A., 1958 | H104: New York University School of Law, LL.B., 1961
B105: Conrad Cyr | C105: First Circuit | D105: 11/20/1989 - 1/31/1997 | E105: District of Maine | F105: 1981-1989 | G105: Holy Cross College, B.S., 1953 | H105: Yale Law, J.D., 1956
B106: Bruce Marshall Selya | C106: First Circuit | D106: 10/14/1986 - 12/31/2006 | E106: District of Rhode Island | F106: 1982-1986 | G106: Harvard '55 | H106: Harvard Law '58
B107: Juan Torruella | C107: First Circuit | D107: 10/4/1984 - Present | E107: District of Puerto Rico | F107: 1974-1984 | G107: U. of Pennsylvania, B.S., 1954 | H107: Boston U. Law, J.D., 1957
B108: Frank Altimari | C108: Second Circuit | D108: 12/16/1985 - 1/1/1996 | E108: Eastern District of New York | F108: 11/23/1982-12/23/1985 | G108: Saint Francis College, Brooklyn, 1948 | H108: Brooklyn Law, L.B., 1951
B109: Charles Butler | C109: Southern District of Alabama | D109: 10/17/1988 - 3/28/2005 | G109: Washington and Lee University, B.A., 1962 | H109: University of Alabama School of Law, LL.B., 1966
B110: Patricia Fawsett | C110: Middle District of Florida | D110: 6/9/1986 - 8/25/2008 | G110: University of Florida, B.A., 1965 | H110: Florida Law School, J.D., 1973
B111: John Moore | C111: Middle District of Florida | D111: 12/1/1981 - 12/31/1995 | G111: Syracuse University, B.S., 1952 | H111: University of Florida College of Law, J.D., 1961
B112: George Sharp | C112: Middle District of Florida | D112: 11/16/1983 - 1/1/2000 | G112: Yale University, B.A., 1957 | H112: University of Virginia School of Law, J.D., 1963
B113: Elizabeth Kovachevich | C113: Middle District of Florida | D113: 3/9/1982 - Present | E113: Florida 6th Circuit Court | F113: 1973-1982 | G113: U. of Miami, B.A., 1958 | H113: Stetson U. Law, J.D., 1961
B114: Maurice Paul | C114: Northern District of Florida | D114: 6/21/1982 - 7/31/1997 | G114: University of Florida, B.A., 1954 | H114: University of Florida College of Law, LL.B., 1960
B115: Clyde Roger Vinson | C115: Northern District of Florida | D115: 10/5/1983 - 3/31/2005 | G115: Naval Academy, B.A., 1962 | H115: Vanderbilt University Law School, J.D., 1971
B116: Paul Plunkett | C116: Northern District of Illinois | D116: 12/11/1982 - 7/10/1998 | G116: Harvard University (1957) | H116: Harvard Law School (1960)
B117: Joel Flaum | C117: Seventh Circuit | D117: 5/5/1983 - Present | E117: Northern District of Illinois | F117: 1974-1983 | G117: Union College '58 | H117: Northwestern U. Law '63
B118: Daniel Manion | C118: Seventh Circuit | D118: 7/24/1986 - 12/18/2007 | E118: Northern District of Illinois | F118: 1971-1975 | G118: Notre Dame '64 | H118: Indiana U. Law '73
B119: Brian Duff | C119: Northern District of Illinois | D119: 10/17/1985 - 10/30/1996 | G119: U. of Notre Dame, A.B., 1953 | H119: DePaul U. College of Law, J.D., 1962
B120: Ilana Rovner | C120: Seventh Circuit | D120: 8/17/1992 - Present | E120: Northern District of Illinois | F120: 1984-1992 | G120: Bryn Mawr College '60 | H120: Chicago-Kent Law '66
B121: Michael Kanne | C121: Seventh Circuit | D121: 5/20/1987 - Present | E121: Northern District of Indiana | F121: 1982-1987 | G121: Indiana U. '62 | H121: Indiana U. Law '68
B122: Richard Posner | C122: Seventh Circuit | D122: 12/1/1981 - Present | G122: Yale University, 1959 | H122: Harvard Law, 1962
B123: John Coffey | C123: Seventh Circuit | D123: 5/10/1982 - 7/2/2004 | E123: Wisconsin Supreme Court | F123: 1978-1982 | G123: Marquette U. '43 | H123: Marquette U. Law '58
B124: Kenneth Ryskamp | C124: Southern District of Florida | D124: 4/24/1986 - 1/1/2000 | G124: Calvin College, B.A., 1955 | H124: University of Miami School of Law, J.D., 1956
B125: William Zloch | C125: Southern District of Florida | D125: 11/4/1985 - Present | G125: University of Notre Dame, B.A., 1966 | H125: University of Notre Dame Law, J.D., 1974
B126: David R. Hansen | C126: Eighth Circuit | D126: 11/18/1991 - 4/1/2003 | E126: Northern District of Iowa | F126: 1986-1991 | G126: Northwest Missouri State U. '60 | H126: George Washington U. Law '63
B127: Jesse Eschbach | C127: Seventh Circuit | D127: 12/1/1981 - 11/4/1985 | E127: Northern District of Indiana | F127: 4/13/1962 - 12/11/1981 | G127: Indiana University, B.S., 1943 | H127: Indiana University School of Law, J.D., 1949
B128: John Potter | C128: Northern District of Ohio | D128: 6/21/1982 - 8/1/1992 | G128: U. of Toledo, Ph.B., 1940 | H128: U. of Michigan Law School, J.D., 1946
B129: Rudy Lozano | C129: Northern District of Indiana | D129: 2/26/1988 - 7/10/2007 | G129: Indiana U., B.S., 1963 | H129: Indiana U. School of Law, LL.B., 1966
B130: Sarah Barker | C130: Southern District of Indiana | D130: 3/14/1984 - Present | G130: Indiana U., B.S., 1965 | H130: American U., Washington College of Law, J.D., 1969
B131: Larry McKinney | C131: Southern District of Indiana | D131: 7/20/1987 - 7/4/2009 | G131: MacMurray College, B.A., 1966 | H131: Indiana U. School of Law, J.D., 1969
B132: John Tinder | C132: Seventh Circuit | D132: 12/21/2007 - Present | E132: Southern District of Indiana | F132: 1987-2007 | G132: Indiana U. '72 | H132: Indiana U. Law '75
B133: Stanley Marcus | C133: Eleventh Circuit | D133: 11/12/1997 - Present | E133: Southern District of Florida | F133: 1985-1997 | G133: Queens College CUNY, 1967 | H133: Harvard Law, 1971
B134: Jack Camp | C134: Northern District of Georgia | D134: 4/20/1988 - 12/31/2008 | G134: The Citadel (1965) | H134: University of Virginia (1973)
B135: Owen Forrester | C135: Northern District of Georgia | D135: 12/10/1981 - 4/27/2004 | E135: Federal magistrate judge | F135: 1976 - 1981 | G135: Georgia Institute of Technology, B.A., 1961 | H135: Emory University School of Law, J.D., 1966
B136: Duross Fitzpatrick | C136: Middle District of Georgia | D136: 12/17/1985 - 2/1/2001 | G136: U. of Georgia, B.S.F.., 1961 | H136: U. of Georgia Law, LL.B., 1966
B137: William Cambridge | C137: District of Nebraska | D137: 6/6/1988 - 7/11/2000 | G137: U. of Nebraska at Lincoln, B.S., 1953 | H137: U. of Nebraska College of Law, J.D., 1955
B138: Morris Arnold | C138: Eighth Circuit | D138: 5/26/1992 - 10/9/2006 | E138: Western District of Arkansas | F138: 1985-1992 | G138: U. of Arkansas '65 | H138: U. of Arkansas '68
B139: Barbara Hackett | C139: Eastern District of Michigan | D139: 4/7/1986 - 4/8/1997 | G139: University of Detroit (1948) | H139: University of Detroit School of Law (1950)
B140: Ken Ripple | C140: Seventh Circuit | D140: 5/10/1985 - 9/1/2008 | G140: Fordham University, 1965 | H140: University of Virginia Law, 1968
B141: Julia Gibbons | C141: Sixth Circuit | D141: 7/31/2002 - Present | E141: Western District of Tennessee | F141: 6/7/1983 - 8/2/2002 | G141: Vanderbilt U., B.A., 1972 | H141: U. of Virginia School of Law, J.D., 1975
B142: Hugh Waters | C142: Western District of Arkansas | D142: 10/26/1981 - 8/1/1997 | G142: U. of Arkansas, B.S.Ag.E., 1955 | H142: Saint Louis U. School of Law, LL.B., 1964
B143: Danny Boggs | C143: Sixth Circuit | D143: 3/25/1986 - Present | G143: Harvard '65 | H143: U. of Chicago Law '68
B144: Harry Wellford | C144: Sixth Circuit | D144: 8/20/1982 - 1/15/1991 | E144: Western District of Tennessee | F144: 1970-1991 | G144: Washington and Lee U. '47 | H144: Vanderbilt U. Law '50
B145: Robert Krupansky | C145: Sixth Circuit | D145: 3/10/1982 - 7/1/1991 | E145: Northern District of Ohio | F145: 1970 -1982 | G145: Case Western Reserve University (1946) | H145: Case Western Reserve University School of Law (1948)
B146: Leroy Contie | C146: Northern District of Ohio | D146: 3/9/1982 - 6/30/1986 | E146: Northern District of Ohio | F146: 1971 - 1982 | G146: University of Michigan (1941) | H146: University of Michigan Law School (1948)
B147: Herbert Milburn | C147: Sixth Circuit | D147: 10/4/1984 - 7/1/1996 | E147: Eastern District of Tennessee | F147: 6/7/1983 - 10/9/1984 | G147: East Tennessee State U., B.S., 1953 | H147: U. of Tennessee College of Law, J.D., 1959
B148: George La Plata | C148: Eastern District of Michigan | D148: 4/4/1985 - 8/3/1996 | G148: Wayne State University (1951) | H148: Detroit College of Law (1956)
B149: Roger Wollman | C149: Eighth Circuit | D149: 7/22/1985 - Present | G149: Tabor College '57 | H149: U. of South Dakota '62
B150: John Gibson | C150: Eighth Circuit | D150: 3/9/1982 - 1/1/1994 | E150: Western District of Missouri | F150: 1981-1982 | G150: U. of Missouri '49 | H150: U. of Missouri Law '52
B151: Pasco Bowman | C151: Eighth Circuit | D151: 7/19/1983 - 8/1/2003 | G151: Bridgewater College '55 | H151: New York U. Law '58
B152: Arlen Beam | C152: Eighth Circuit | D152: 11/9/1987 - 2/1/2001 | E152: District of Nebraska | F152: 11/18/1981 - 11/9/1987 | G152: U. of Nebraska, B.S., 1951 | H152: U. of Nebraska College of Law, J.D., 1965
B153: David Ebel | C153: Tenth Circuit | D153: 04/20/1988 - 01/15/2006 | G153: Northwestern U., B.A., 1962 | H153: U. of Michigan Law, J.D., 1965
B154: Wade Brorby | C154: Tenth Circuit | D154: 2/17/1988 - 5/25/2001 | G154: U. of Wyoming '56 | H154: U. of Wyoming Law '58
B155: Bobby Baldock | C155: Tenth Circuit | D155: 12/17/1985 - 1/26/2001 | E155: District of New Mexico | F155: 1983-1986 | G155: New Mexico Military Institute '56 | H155: U. of Arizona Law '60
B156: Deanell Tacha | C156: Tenth Circuit | D156: 12/16/1985 - 1/27/2011 | G156: U. of Kansas '68 | H156: U. of Michigan Law '71
B157: Stephen Anderson | C157: Tenth Circuit | D157: 10/16/1985 - 1/1/2000 | H157: U. of Utah Law '60
B158: John Porfilio | C158: Tenth Circuit | D158: 5/10/1985 - 10/15/1999 | E158: District of Colorado | F158: 1982-1985 | G158: Denver U. '56 | H158: U. of Denver Law '59
B159: James L. Edmondson | C159: Eleventh Circuit | D159: 5/7/1986 - 7/15/2012 | G159: Emory U., B.A., 1968 | H159: U. of Georgia Law, J.D., 1971
B160: Emmett Cox | C160: Eleventh Circuit | D160: 4/18/1988 - 12/18/2000 | E160: Southern District of Alabama | F160: 1981-1988 | G160: U. of Alabama '57 | H160: U. of Alabama Law '59
B161: Joel Dubina | C161: Eleventh Circuit | D161: 9/15/1986 - Present | E161: Middle District of Alabama | F161: 1986-1990 | G161: U. of Alabama, B.S., 1970 | H161: Samford U. Law, J.D., 1973
B162: George Fagg | C162: Eighth Circuit | D162: 10/1/1982 - 5/1/1999 | E162: Iowa 2nd Judicial District | F162: 1972-1982 | G162: Drake U. '56 | H162: Drake U. '58
B163: Ralph Winter | C163: Second Circuit | D163: 12/10/1981 - 9/30/2000 | G163: Yale, B.A., 1957 | H163: Yale Law, LL.B., 1960
B164: Roger Miner | C164: Second Circuit | D164: 7/22/1985 - 1/1/1997 | E164: Northern District of New York | F164: 1981-1985 | G164: SUNY, B.S., 1977 | H164: New York Law School, LL.B., 1956
B165: John Walker | C165: Second Circuit | D165: 11/27/1989 - 10/1/2006 | E165: Southern District of New York | F165: 1985-1989 | G165: Yale, B.A., 1962 | H165: U. Michigan Law, J.D., 1966
B166: Joseph McLaughlin | C166: Second Circuit | D166: 10/17/1990 - 3/20/1998 | E166: Eastern District of New York | F166: 1981-1990 | G166: Fordham College, A.B., 1954 | H166: Fordham U. Law, LL.B., 1959
B167: Reena Raggi | C167: Second Circuit | D167: 10/4/2002 - Present | E167: Eastern District of New York | F167: 1987 - 2002 | G167: Wellesley College '73 | H167: Harvard Law '76
B168: John Mahoney | C168: Second Circuit | D168: 4/7/1986 - 10/23/1996 | G168: St. Bonaventure U., B.A., 1952 | H168: Columbia Law, LL.B., 1955
B169: George Pratt | C169: Second Circuit | D169: 6/21/1982 - 5/22/1993 | E169: Eastern District of New York | F169: 5/7/1976 - 6/29/1982 | G169: Yale, B.A., 1950 | H169: Yale Law, J.D., 1953
B170: Richard Cardamone | C170: Second Circuit | D170: 10/29/1981- 11/13/1993 | E170: New York Supreme Court | F170: 1963-1981 | G170: Harvard, B.A., 1948 | H170: Syracuse U. Law, LL.B., 1952
B171: Lawrence Pierce | C171: Second Circuit | D171: 11/18/1981 - 1/1/1990 | E171: Southern District of New York | F171: 5/20/1971 - 11/30/1981 | G171: St. Joseph's U., B.S., 1948 | H171: Fordham U. Law, LL.B., 1951
B172: Edith Jones | C172: Fifth Circuit | D172: 04/04/1985 - Present | G172: Cornell University, 1971 | H172: University of Texas Law School, 1974
B173: Patrick Higginbotham | C173: Fifth Circuit | D173: 07/30/1982 - 08/27/2006 | E173: Northern District of Texas | F173: 1975 - 1982 | G173: University of Alabama, Tuscaloosa, 1960 | H173: University of Alabama School of Law, 1961
B174: John Duhe | C174: Fifth Circuit | D174: 10/17/1988 - 04/06/1999 | E174: Western District of Louisiana | F174: 1984 - 1988 | G174: Tulane University, 1955 | H174: Tulane University Law School, 1957
B175: Edward Prado | C175: Fifth Circuit | D175: 05/05/2003 -Present | G175: University of Texas, 1969 | H175: University of Texas School of Law, 1972
B176: Emilio Garza | C176: Fifth Circuit | D176: 05/30/1991 - 8/1/2012 | E176: Western District of Texas | F176: 1988 - 1991 | G176: University of Notre Dame, 1969 | H176: University of Texas School of Law, 1976
B177: Jerry Smith | C177: Fifth Circuit | D177: 12/21/1987 -Present | G177: Yale University, 1969 | H177: Yale Law School, 1972
B178: Eugene Davis | C178: Fifth Circuit | D178: 11/16/1983 -Present | E178: Western District of Louisiana | F178: 1976 - 1983 | H178: Tulane Law School, 1960
B179: Grady Jolly | C179: Fifth Circuit | D179: 07/30/1992 -Present | G179: University of Mississippi, 1959 | H179: University of Mississippi School of Law, 1962
B180: William Garwood | C180: Fifth Circuit | D180: 10/26/1981 - 01/22/1997 | G180: Princeton University, 1952 | H180: University of Texas School of Law, 1955
B181: Robert Madden Hill | C181: Fifth Circuit | D181: 6/15/1984 - 10/19/1987 | E181: Northern District of Texas | F181: 1984 - 1987 | G181: University of Texas (1948) | H181: University of Texas School of Law (1950)
B182: Clyde Hamilton | C182: Fourth Circuit | D182: 7/22/1991 - 11/30/1999 | E182: District of South Carolina | F182: 1981-1991 | G182: Wofford College '56 | H182: George Washington U. Law '61
B183: Harvie Wilkinson | C183: Fourth Circuit | D183: 8/13/1984 - Present | G183: Yale '67 | H183: U. Virginia Law '72
B184: Paul Niemeyer | C184: Fourth Circuit | D184: 8/7/1990 - Present | E184: District of Maryland | F184: 1988-1990 | G184: Kenyon College '62 | H184: Notre Dame Law '66
B185: Emory Sneeden
B186: Anthony Scirica | C186: Third Circuit | D186: 8/6/1987 - 7/1/2013 | E186: Eastern District of Pennsylvania | F186: 1984-1987 | G186: Wesleyan U., B.A., 1962 | H186: U. of Michigan Law, J.D., 1965
B187: Walter Stapleton | C187: Third Circuit | D187: 4/4/1985 - 6/2/1999 | E187: District of Delaware | F187: 1970 - 1985 | G187: Princeton '56 | H187: Harvard Law '59
B188: Morton Greenberg | C188: Third Circuit | D188: 3/23/1987 - 6/30/2000 | G188: U. of Pennsylvania '54 | H188: Yale Law '57
B189: Robert Cowen | C189: Third Circuit | D189: 11/9/1987 - 9/4/1998 | E189: District of New Jersey | F189: 1985-1987 | G189: Drake U. '52 | H189: Rutgers U. Law '58
B190: Jane Roth | C190: Third Circuit | D190: 7/2/1991 - 5/31/2006 | E190: District of Delaware | F190: 1985-1991 | G190: Smith College '56 | H190: Harvard Law '65
B191: Franklin Van Antwerpen | C191: Third Circuit | D191: 5/24/2004 - 10/23/2006 | E191: Eastern District of Pennsylvania | F191: 1987-2004 | G191: U. of Maine '64 | H191: Temple U. Law '67
B192: Richard Nygaard | C192: Third Circuit | D192: 10/17/1988 - 7/9/2005 | G192: U. of Southern California '69 | H192: U. of Michigan Law '71
B193: Maryanne Barry | C193: Third Circuit | D193: 9/22/1999 - 6/30/2011 | E193: District of New Jersey | F193: 1983-1999 | G193: Mount Holyoke College '62 | H193: Hofstra U. Law '74
B194: Brooks Smith | C194: Third Circuit | D194: 8/2/2002 - Present | E194: Western District of Pennsylvania | F194: 1988-2002 | G194: Franklin and Marshall College '73 | H194: Dickinson School of Law '76
B195: James Spencer | C195: Eastern District of Virginia | D195: 10/14/1986 - Present | G195: Clark College, Atlanta, Georgia, B.A., 1971 | H195: Harvard Law, J.D., 1974
B196: T.S. Ellis | C196: Eastern District of Virginia | D196: 08/06/1987 - 03/31/2007 | G196: Princeton, B.S.E., 1961 | H196: Harvard, J.D., 1969
B197: Claude Hilton | C197: Eastern District of Virginia | D197: 07/11/1985 - 12/30/2005 | G197: Ohio State U., B.S., 1963 | H197: American U. Law, J.D., 1966
B198: James Cacheris | C198: Eastern District of Virginia | D198: 12/01/1981 - 03/29/1998 | E198: Fairfax Circuit Court, Judge | F198: 1971 - 1981 | G198: U. of Pennsylvania, B.S., 1955 | H198: George Washington U. Law, J.D., 1960
B199: Robert Doumar | C199: Eastern District of Virginia | D199: 12/03/1981 - 04/29/1996 | G199: U. of Virginia, B.A., 1951 | H199: U. of Virginia School of Law, LL.B., 1953
B200: Jackson Kiser | C200: Western District of Virginia | D200: 12/03/1981 - 04/29/1997 | G200: Concord College, B.A., 1951 | H200: Washington and Lee U. Law, LL.B., 1952
B201: Walter Black | C201: District of Maryland | D201: 04/21/1982 - 10/20/1994 | G201: Harvard, A.B., 1947 | H201: Harvard Law, LL.B., 1949
B202: Frederick Motz | C202: District of Maryland | D202: 07/12/1985 - 12/16/2010 | G202: Wesleyan U., A.B., 1964 | H202: U. of Virginia Law, LL.B., 1967
B203: Joseph Anderson | C203: District of South Carolina | D203: 10/14/1986 - Present | G203: Clemson U., B.A., 1972 | H203: U. of South Carolina Law Center, J.D., 1975
B204: James Fox | C204: Eastern District of North Carolina | D204: 09/30/1982 - 01/30/2001 | G204: U. of North Carolina, B.S., 1950 | H204: U. of North Carolina Law, J.D., 1957
B205: Malcolm Howard | C205: Eastern District of North Carolina | D205: 02/26/1998 - 12/30/2005 | G205: U.S. Military Academy, West Point, B.S., 1962 | H205: Wake Forest Law, J.D., 1970
B206: Terrence Boyle | C206: Eastern District of North Carolina | D206: 05/03/1984 - Present | G206: Brown, B.A., 1967 | H206: American U. Law, J.D., 1970
B207: Norwood Tilley | C207: Middle District of North Carolina | D207: 10/17/1988 - 12/15/2008 | G207: Wake Forest, B.S., 1966 | H207: Wake Forest Law, J.D., 1969
B208: Richard Voorhees | C208: Western District of North Carolina | D208: 10/17/1988 - Present | G208: Davidson College, B.A., 1963 | H208: U. of North Carolina Law, J.D., 1968
B209: Martin Feldman | C209: Eastern District of Louisiana | D209: 10/05/1983 - Present | G209: Tulane U., B.A., 1955 | H209: Tulane Law, J.D., 1957
B210: A.J. McNamara | C210: Eastern District of Louisiana | D210: 06/21/1982 - 06/08/2001 | G210: Louisiana State U., B.S., 1959 | H210: Loyola Law, J.D., 1968
B211: Marcel Livaudais
B212: Donald Walter | C212: Western District of Louisiana | D212: 07/11/1985 - 11/29/2001 | G212: Louisiana State U., B.A., 1961 | H212: Louisiana State U. Law, J.D., 1964
B213: Henry Wingate | C213: Southern District of Mississippi | D213: 10/17/1985 - Present | G213: Grinnell College, B.A., 1969 | H213: Yale Law, J.D., 1972
B214: William Barbour | C214: Southern District of Mississippi | D214: 04/25/1983 - 02/03/2006 | G214: Princeton, B.A., 1963 | H214: U. of Mississippi Law, J.D., 1966
B215: Walter Gex | C215: Southern District of Mississippi | D215: 02/26/1986 - 03/23/2004 | G215: U. of Mississippi, B.A., 1962 | H215: U. of Mississippi Law, LL.B., 1963
B216: Tom Lee | C216: Southern District of Mississippi | D216: 06/11/1984 - 04/07/2006 | E216: City of Forest, Municipal Judge | F216: 1982 | G216: Mississippi College, B.A., 1963 | H216: U. of Mississippi Law, J.D., 1965
B217: Neal Biggers | C217: Northern District of Mississippi | D217: 03/28/1984 - 09/30/2000 | E217: Mississippi First Judicial District, Judge | F217: 1975 - 1984 | G217: Millsaps College, B.A., 1956 | H217: U. of Mississippi Law School, J.D., 1963
B218: Glen Davidson | C218: Northern District of Mississippi | D218: 10/17/1985 - 05/31/2007 | G218: U. of Mississippi, B.A., 1962 | H218: U. of Mississippi Law, J.D., 1965
B219: Sidney Fitzwater | C219: Northern District of Texas | D219: 3/19/1986 - Present | E219: Texas District 298, District Judge | F219: 1982 - 1986 | G219: Baylor U., B.A., 1975 | H219: Baylor U. School of Law, J.D., 1976
B220: Joe Fish | C220: Northern District of Texas | D220: 2/24/1983 - 11/12/2007 | G220: Yale College, B.A., 1965 | H220: Yale Law School, LL.B., 1968
B221: Robert Maloney | C221: Northern District of Texas | D221: 10/17/1985 - 8/31/2000 | G221: Southern Methodist U., B.B.A., 1956 | H221: Southern Methodist U. School of Law, J.D., 1960
B222: Sam Cummings | C222: Northern District of Texas | D222: 12/9/1987 - Present | G222: Texas Tech U., B.B.A., 1967 | H222: Baylor U. School of Law, J.D., 1970
B223: Richard Schell | C223: Eastern District of Texas | D223: 6/6/1988 - Present | G223: Southern Methodist U., B.A., 1972 | H223: Southern Methodist U., J.D., 1975
B224: Hayden Head | C224: Southern District of Texas | D224: 10/26/1981 - 11/13/2009 | G224: U. of Texas, B.A., 1966 | H224: U. of Texas School of Law, LL.B., 1968
B225: Lynn Hughes | C225: Southern District of Texas | D225: 12/17/1985 - Present | E225: Texas District 189, Judge | F225: 1981 - 1985 | G225: U. of Alabama, Tuscaloosa, B.A., 1963 | H225: U. of Texas Law, J.D., 1966
B226: Ricardo Hinojosa | C226: Southern District of Texas | D226: 05/05/1983 - Present | G226: U. of Texas, Austin, B.A., 1972 | H226: Harvard Law, J.D., 1975
B227: David Hittner | C227: Southern District of Texas | D227: 06/09/1986 - 11/10/2004 | E227: Texas District 133, Judge | F227: 1978 - 1986 | G227: New York U., B.S., 1961 | H227: New York U. Law, J.D., 1964
B228: Kenneth Hoyt | C228: Southern District of Texas | D228: 04/01/1988 - 3/2/2013 | E228: Texas First District Court of Appeals, Justice | F228: 1985 - 1988 | G228: Texas Southern U., A.B., 1969 | H228: Texas Southern U. Law, J.D., 1972
B229: Sim Lake | C229: Southern District of Texas | D229: 08/12/1988 - Present | G229: Texas A&M U., B.A., 1966 | H229: U. of Texas Law, J.D., 1969
B230: Hilda Tagle | C230: Southern District of Texas | D230: 05/17/1998 - 12/31/2012 | E230: Texas District 148, Judge | F230: 1995 - 1998 | G230: East Texas State U., B.A., 1969 | H230: U. of Texas School of Law, J.D., 1977
B231: Walter Smith, Jr. | C231: Western District of Texas | D231: 10/4/1984 - Present | E231: Western District of Texas, Magistrate Judge | F231: 1983 - 1984 | G231: Baylor U., B.A., 1964 | H231: Baylor U. School of Law, J.D., 1966
B232: William Standish | C232: Western District of Pennsylvania | D232: 11/06/1987 - 02/28/2002 | E232: Allegheny County Court of Common Pleas, Judge | F232: 1980 - 1987 | G232: Yale, B.A., 1953 | H232: U. of Virginia School of Law, LL.B., 1956
B233: Phil Pro | C233: District of Nevada | D233: 7/23/1987 - 12/31/2011 | G233: San Francisco State U., B.A., 1968 | H233: Golden Gate U. School of Law, J.D., 1972
B234: Lloyd George | C234: District of Nevada | D234: 5/3/1984 - 12/1/1997 | G234: Brigham Young U., B.S., 1955 | H234: U. of California, Berkeley, Boalt Hall School of Law, J.D., 1961
B235: Howard McKibben | C235: District of Nevada | D235: 10/4/1984 - 4/1/2005 | G235: Bradley U., B.S., 1962 | H235: U. of Michigan Law School, J.D., 1967
B236: Robert Broomfield | C236: District of Arizona | D236: 7/11/1985 - 8/12/1999 | G236: Pennsylvania State U., B.S., 1955 | H236: U. of Arizona, LL.B., 1961
B237: Paul Rosenblatt | C237: District of Arizona | D237: 6/11/1984 - 10/30/2003 | G237: U. of Arizona, A.B., 1958 | H237: U. of Arizona College of Law, J.D., 1963
B238: Roger Strand | C238: District of Arizona | D238: 7/22/1985 - 4/28/2000 | G238: Hamilton College, B.A., 1955 | H238: Cornell Law School, LL.B., 1961
B239: Russel Holland | C239: District of Alaska | D239: 7/16/1984 - 9/18/2001 | G239: U. of Michigan, B.B.A., 1958 | H239: U. of Michigan Law School, LL.B., 1961
B240: Charles Lovell | C240: District of Montana | D240: 4/4/1985 - 6/14/2000 | G240: U. of Montana, B.S., 1952 | H240: U. of Montana School of Law, J.D., 1959
B241: Alan Cooke Kay | C241: District of Hawaii | D241: 9/15/1986 - 1/2/2000 | G241: Princeton U., A.B., 1957 | H241: U. of California, Berkeley, Boalt Hall School of Law, LL.B., 1960
B242: David Alan Ezra | C242: District of Hawaii | D242: 5/20/1988 - 6/27/2012 | G242: St. Mary`s U., B.B.A., 1969 | H242: St. Mary`s U. School of Law, J.D., 1972
B243: Edward Garcia | C243: Eastern District of California | D243: 3/14/1984-11/24/1996 | G243: Sacramento City College, A.A., 1951 | H243: McGeorge School of Law, LL.B., 1958
B244: Robert Coyle | C244: Eastern District of California | D244: 4/1/1982 - 5/13/1996 | G244: Fresno State College, A.B., 1953 | H244: U. of California, Hastings College of Law, J.D., 1956
B245: Alicemarie Stotler | C245: Central District of California | D245: 5/3/1984 - 1/5/2009 | G245: U. of Southern California, B.A., 1964 | H245: U. of Southern California Law School, J.D., 1967
B246: Bill Keller | C246: Central District of California | D246: 10/4/1984 - 10/29/1999 | G246: U. of California, Berkeley, B.S., 1956 | H246: U. of California, Los Angeles, School of Law, LL.B., 1960
B247: Spencer Letts | C247: Central District of California | D247: 12/17/1985 - 12/19/2000 | G247: Yale U., B.A., 1956 | H247: Harvard Law School, LL.B., 1960
B248: Ronald Lew | C248: Central District of California | D248: 5/7/1987 - 9/19/2006 | G248: Loyola U., Los Angeles, CA, B.A., 1964 | H248: Southwestern U. School of Law, J.D., 1971
B249: Stephen V. Wilson | C249: Central District of California | D249: 10/17/1985 - Present | G249: Lehigh U., B.A., 1963 | H249: Brooklyn Law School, J.D., 1967
B250: Frank Schwelb | C250: District of Columbia Court of Appeals | D250: 1988-2012 | E250: Judge, District of Columbia Superior Court | F250: 1979-1988 | G250: Yale University | H250: Harvard Law School
B251: John Terry | C251: District of Columbia Court of Appeals | D251: 1982-2006 | G251: Yale University | H251: Georgetown University
B252: John Steadman | C252: District of Columbia Court of Appeals | D252: 1985-2004 | E252: Associate Academic Dean, Georgetown | F252: 1978-1984 | G252: Yale College, 1952 | H252: Harvard Law School, 1955
B253: Warren King | C253: District of Columbia Court of Appeals | D253: 1981-Present | E253: Office for Improvements in the Administration of Justice, United States Department of Justice | F253: 1977-1981 | G253: Rensselaer Polytechnic Institute, 1960 | H253: American University Law School, 1967
B254: James Belson | C254: District of Columbia Court of Appeals | D254: 1981-1991 | E254: Associate Judge, District of Columbia Superior Court | F254: 1968-1981 | G254: Georgetown University, 1953 | H254: Georgetown Law Center, 1956
B255: Rudi Brewster | C255: Southern District of California | D255: 6/15/1984 - 7/1/1998 | G255: Princeton U., B.A., 1954 | H255: Stanford Law School, J.D., 1960
B256: Robert Bryan | C256: Western District of Washington | D256: 5/7/1986 - 11/1/2000 | G256: U. of Washington, B.A., 1956 | H256: U. of Washington School of Law, J.D., 1958
B257: John Coughenour | C257: Western District of Washington | D257: 9/28/1981 - 7/27/2006 | G257: Kansas State College of Pittsburgh, B.S., 1963 | H257: U. of Iowa College of Law, J.D., 1966
B258: Carol Dimmick | C258: Western District of Washington | D258: 4/4/1985 - 11/1/1997 | G258: U. of Washington, B.A., 1951 | H258: U. of Washington School of Law, J.D., 1953
B259: Thomas Zilly | C259: Western District of Washington | D259: 4/20/1988 - 1/1/2004 | G259: U. of Michigan, B.A., 1956 | H259: Cornell Law School, J.D., 1962
B260: Royce Lamberth | C260: D.C. District Court | D260: 11/13/1987 - 7/15/2013 | G260: U. Texas, Austin '65 | H260: U. Texas, Austin '67
B261: Thomas Hogan | C261: D.C. District Court | D261: 8/20/1982 - 5/1/2008 | G261: Georgetown '60 | H261: Goergetown Law '66
B262: Robert Chapman | C262: Fourth Circuit | D262: 9/19/1981 - 5/31/1991 | E262: District of South Carolina | F262: 1971-1981 | G262: U. of South Carolina '45 | H262: U. of South Carolina Law '49
B263: Diarmuid O'Scannlain | C263: Ninth Circuit | D263: 9/26/1986 - Present | G263: St. John`s University 1957 | H263: Harvard Law School 1963
B264: Pamela Rymer | C264: Ninth Circuit | D264: 5/22/1989 - 9/2011 | E264: Central District of California | F264: 1983 - 1989 | G264: Vassar College 1961 | H264: Stanford Law School 1964
B265: Andrew Kleinfeld | C265: Ninth Circuit | D265: 9/16/1991 - 6/12/2010 | E265: District of Alaska | F265: 1986-1991 | G265: Wesleyan University 1966 | H265: Harvard Law School 1969
B266: Cynthia Holcomb Hall | C266: Ninth Circuit | D266: 10/4/1984 - 8/31/1997 | E266: Central District of California | F266: 1981 - 1984 | G266: Stanford University 1951 | H266: Stanford Law School 1954
B267: Robert Beezer | C267: Ninth Circuit | D267: 3/28/1984 - 7/31/1996 | E267: Seattle Municipal Court | F267: 1962-1976 | G267: University of Virginia 1951 | H267: University of Virginia School of Law 1956
B268: Melvin Brunetti
B269: John Noonan | C269: Ninth Circuit | D269: 12/17/1985-12/27/1996 | E269: Professor, Boalt Hall School of Law | F269: 1966 - 1986 | G269: Harvard College 1946 | H269: Catholic University of America 1949
B270: Edward Leavy | C270: Ninth Circuit | D270: 3/23/1987 - 5/19/1997 | E270: District of Oregon | F270: 1984 - 1987 | G270: University of Portland 1950 | H270: Notre Dame Law School 1953
B271: David Thompson | C271: Ninth Circuit | E271: Private practice | F271: 1957 - 1985 | G271: University of Southern California 1952 | H271: University of Southern California Law School 1955
B272: Stephen Trott | C272: Ninth Circuit | D272: 3/25/1988 - 12/31/2004 | E272: Associate attorney general | F272: 1986 - 1988 | G272: Wesleyan University 1962 | H272: Harvard Law School 1965
B273: Ferdinand Francis Fernandez | C273: Ninth Circuit | D273: 5/22/1989-6/1/2002 | E273: Central District of California | F273: 1985 - 1989 | G273: University of Southern California 1958 | H273: University of Southern California Law School 1962
B274: Herbert Hutton | C274: Eastern District of Pennsylvania | D274: 8/12/1988 - 9/5/2003 | G274: Lincoln University (1959) | H274: Temple University School of Law (1962)
B275: James McGirr Kelly | C275: Eastern District of Pennsylvania | D275: 8/6/1983 - 3/30/1996 | G275: University of Pennsylvania (1951) | H275: Temple University School of Law (1957)
B276: Marvin Katz | C276: Eastern District of Pennsylvania | D276: 8/6/1983 - 8/25/1997 | G276: University of Pennsylvania (1951) | H276: Yale Law School (1954)
B277: Stephen F. Williams | C277: D.C. Circuit | D277: 6/16/1986 - 9/30/2008 | G277: Yale U. '58 | H277: Harvard Law '61
B278: David Sentelle | C278: D.C. Circuit | D278: 9/11/1987 - 2/12/2013 | E278: Western District of North Carolina | F278: 1985-1987 | G278: U. of North Carolina, Chapel Hill '65 | H278: U. of North Carolina Law '68
B279: Douglas Ginsburg | C279: D.C. Circuit | D279: 10/14/1986 - 10/14/2011 | G279: Cornell'70 | H279: U. of Chicago Law '73
B280: Karen Henderson | C280: D.C. Circuit | D280: 7/5/1990 - Present | E280: District of South Carolina | F280: 1986-1990 | G280: Duke U. '66 | H280: U. of North Carolina Law '69
B281: Laurence Silberman | C281: D.C. Circuit | D281: 10/28/1985 - 11/1/2000 | G281: Dartmouth '57 | H281: Harvard Law '61
B282: Pauline Newman
B283: Haldane Mayer
B284: Glenn Archer
B285: Thomas Penfield Jackson
B286: Franklin Billings | C286: District of Vermont | D286: 06/15/1984 - 09/08/1994 | E286: Vermont Supreme Court, Justice | F286: 1975 - 1983 | G286: Harvard, B.S., 1943 | H286: U. of Virginia Law, J.D., 1947
B287: Hector Laffitte | C287: District of Puerto Rico | D287: 7/27/1983 - 11/15/2005 | G287: Polytechnic Institute of Puerto Rico, B.A., 1955 | H287: U. of Puerto Rico Law, LL.B., 1959
B288: Kenneth Conboy | C288: Southern District of New York | D288: 12/19/1987 - 12/31/1993 | G288: Fordham College (1961) | H288: University of Virginia School of Law (1964)
B289: Richard Daronco | C289: Southern District of New York | D289: 5/7/1987 - 5/21/1988 | G289: Providence College (1953) | H289: Albany Law School (1956)
B290: Thomas Hull | C290: Eastern District of Tennessee | D290: 11/14/1983 - 10/1/2002 | H290: U. of Tennessee College of Law, J.D., 1951
B291: James Jarvis | C291: Eastern District of Tennessee | D291: 10/12/1984 - 2/28/2002 | G291: U. of Tennessee, B.A., 1958 | H291: U. of Tennessee College of Law, J.D., 1960
B292: Constantine Cholakis | C292: Northern District of New York | D292: 3/17/1986-6/29/1996 | G292: Siena College, 1955 | H292: Albany Law School, 1958
B293: Thomas Higgins | C293: Middle District of Tennessee | D293: 10/4/1984 - 2/28/1999 | G293: Christian Brother College (1952), University of Tennessee (1954) | H293: Vanderbilt University Law School (1957)
B294: John Bissell | C294: District of New Jersey | D294: 12/10/1982 - 9/1/2005 | E294: Superior Court of New Jersey | F294: 1981-1982 | G294: Princeton, A.B., 1962 | H294: U. of Virginia Law, LL.B., 1965
B295: Alfred Lechner | C295: District of New Jersey | D295: 6/9/1986 - 10/1/2001 | G295: Xavier University (1969) | H295: Notre Dame Law School (1972)
B296: John Lifland | C296: District of New Jersey | D296: 5/20/1988 - 6/14/2001 | G296: Yale University (1954) | H296: Harvard Law School (1957)
B297: Nicholas Politan | C297: District of New Jersey | D297: 11/9/1987 - 1/4/2002 | G297: Rutgers University (1957) | H297: Rutgers University School of Law (1960)
B298: Alfred Wolin | C298: District of New Jersey | D298: 12/9/1987 - 9/18/2000 | G298: University of Michigan (1954) | H298: Rutgers University School of Law (1959)
B299: Joseph Longobardi | C299: District of Delaware | D299: 5/03/1984 - 6/14/1997 | E299: Delaware Court of Chancery, Vice Chancellor | F299: 1982 - 1984 | G299: Washington College, B.A., 1952 | H299: Temple U. Law, LL.B., 1957
B300: Edward Becker | C300: Third Circuit | D300: 12/31/1981 - 5/4/2003 | E300: Eastern District of Pennsylvania | F300: 1970-1981 | G300: U. Pennsylvania '54 | H300: Yale Law '57
B301: Robert Gawthrop | C301: Eastern District of Pennsylvania | D301: 12/9/1987 - 8/1/1999 | G301: Amherst College (1964) | H301: Dickinson School of Law (1970)
B302: Jay Waldman | C302: Eastern District of Pennsylvania | D302: 10/17/1988 - 5/30/2003 | G302: University of Wisconsin (1966) | H302: University of Pennsylvania Law School (1969)
B303: Carol Mansmann | C303: Third Circuit | D303: 4/4/1985 - 3/9/2002 | E303: Western District of Pennsylvania | F303: 3/19/1982 - 4/22/1985 | G303: Duquesne University (1964) | H303: Duquesne University (1967)
B304: Glenn Mencer | C304: Western District of Pennsylvania | D304: 3/18/1982 - 4/17/1994 | G304: University of Michigan (1949) | H304: University of Michigan Law School (1952)
B305: Paul N. Brown | C305: Eastern District of Texas | D305: 10/17/1985 - 1/1/2001 | H305: U. of Texas School of Law, J.D., 1950
B306: John Hargrove | C306: District of Maryland | D306: 2/10/1984 - 2/20/1994 | G306: Howard University (1947) | H306: University of Maryland School of Law (1950)
B307: Jane Restani | C307: United States Court of International Trade | D307: 11/16/1983 - Present | G307: U. of California, Berkeley, B.A., 1969 | H307: U. of California, Davis Law, J.D., 1973
B308: Gregory Carman | C308: United States Court of International Trade | D308: 3/2/1983 - Present | G308: St. Lawrence U., B.A., 1958 | H308: St. Johns U. Law, J.D., 1961
B309: Thomas Aquilino | C309: United States Court of International Trade | D309: 4/4/1985 - 12/10/2004 | G309: Drew U., B.A., 1962 | H309: Rutgers U. Law, J.D., 1969
B310: Frederic Smalkin | C310: District of Maryland | D310: 09/26/1986 - 01/07/2003 | E310: District of Maryland, Magistrate Judge | F310: 1976 - 1986 | G310: Johns Hopkins U., B.A., 1968 | H310: U. of Maryland Law, J.D., 1971
B311: Kenton Musgrave | C311: United States Court of International Trade | G311: U. of Washington, B.A., 1948 | H311: Emory U., J.D., 1953
B312: Frank Bullock | C312: Middle District of North Carolina | D312: 12/10/1982 - 12/31/2005 | G312: U. of North Carolina, Chapel Hill, B.S., 1961 | H312: U. of North Carolina Law, LL.B., 1963
B313: Robert Potter | C313: Western District of North Carolina | D313: 10/29/1981 - 5/1/1994 | G313: Duke University, A.B., 1947 | H313: Duke University School of Law, LL.B., 1950
B314: Elizabeth Hallanan | C314: Southern District of West Virginia | D314: 11/14/1983 - 12/1/1996 | G314: Morris Harvey College (1946) | H314: West Virginia University College of Law (1951)
B315: Henry Mentz | C315: Eastern District of Louisiana | D315: 6/25/1982 - 7/1/1992 | G315: Tulane University (1941) | H315: Louisiana State University Law School (1943)
B316: F.A. Little | C316: Western District of Louisiana | D316: 10/12/1984 - 5/30/2002 | G316: Tulane U., B.A., 1958 | H316: Tulane Law, J.D., 1961
B317: Howell Cobb | C317: Eastern District of Texas | D317: 4/4/1985 - 3/1/2001 | H317: University of Virginia School of Law (1948)
B318: James Nowlin | C318: Western District of Texas | D318: 10/26/1981 - 05/30/2003 | G318: Trinity U., B.A., 1959 | H318: U. of Texas Law, J.D., 1963
B319: Ronald Meredith | C319: Western District of Kentucky | D319: 4/4/1985 - 12/1/1994 | G319: Georgetown College, Kentucky, B.A., 1967 | H319: George Washington U. Law School, J.D., 1971
B320: George Woods | C320: Eastern District of Michigan | D320: 11/16/1983 - 11/16/1993 | H320: Detroit College of Law (1949)
B321: Alvin Krenzler | C321: Northern District of Ohio | D321: 12/10/1981 - 1/1/1992 | G321: Case Western Reserve University (1946) | H321: Case Western Reserve University (1948), (1963)
B322: Richard McQuade | C322: Northern District of Ohio | D322: 9/15/1986 - 9/30/1989 | G322: University of Toledo (1961) | H322: University of Toledo (1965)
B323: James Alesia | C323: Northern District of Illinois | D323: 5/20/1987 - 2/1/1998 | G323: Loyola University Chicago (1956) | H323: Chicago-Kent College of Law (1960)
B324: Stephen Reasoner | C324: Eastern District of Arkansas | D324: 2/26/1988 - 9/17/2002 | G324: U. of Arkansas, B.A., 1966 | H324: U. of Arkansas School of Law, J.D., 1969
B325: William Browning | C325: District of Arizona | D325: 5/3/1984 - 5/14/1998 | G325: University of Arizona, B.S./B.A., 1954 | H325: University of Arizona College of Law, LL.B., 1960
B326: John Davies | C326: Central District of California | D326: 6/9/1986 - 7/18/1998 | G326: University of Michigan (1953) | H326: University of California, Los Angeles, School of Law (1959)
B327: Joseph Stevens | C327: Eastern District of Missouri | D327: 9/18/1981 - 7/1/1995 | E327: Western District of Missouri | F327: 9/18/1981 - 12/18/1998 | G327: Yale U., B.A., 1949 | H327: U. of Michigan Law School, J.D., 1952
B328: Richard Gadbois | C328: Central District of California | D328: 7/28/1982 - 10/2/1996 | G328: St. John's University (1955) | H328: Loyola Law School (1958), Universityo f Southern California Law School (1960)
B329: George Gunn | C329: Eastern District of Missouri | D329: 5/10/1985 - 12/1/1996 | G329: Westminster College (1950) | H329: Washington University School of Law (1955)
B330: Brook Bartlett | C330: Western District of Missouri | D330: 9/19/1981 - 1/21/2000 | G330: Princeton U., B.A., 1959 | H330: Stanford Law School, LL.B., 1962
B331: Harry Hupp | C331: Central District of California | D331: 3/21/1984 - 4/1/1997 | G331: Stanford University (1953) | H331: Stanford Law School (1955)
B332: James Ideman | C332: Central District of California | D332: 6/15/1984 - 4/2/1998 | G332: The Citadel (1953) | H332: University of Southern California Law School (1963)
B333: Edward Rafeedie | C333: Central District of California | D333: 9/24/1982 - 1/6/1996 | G333: University of Southern California (1956) | H333: University of Southern California Law School (1959)
B334: William Rea | C334: Central District of California | D334: 6/15/1984 - 3/31/1998 | G334: Loyola University (1942) | H334: University of Colorado School of Law (1949)
B335: Ross Roberts | C335: Western District of Missouri | D335: 8/20/1982 - 4/24/1987 | G335: DePauw University (1960) | H335: University of Missouri-Columbia School of Law (1963)
B336: Wayne Alley | C336: Western District of Oklahoma | D336: 7/11/1985 - 5/16/1999 | G336: Stanford U., A.B., 1952 | H336: Stanford Law, J.D., 1957
B337: Layn Phillips | C337: Western District of Oklahoma | D337: 6/15/1987 - 6/22/1991 | G337: University of Tulsa (1974) | H337: University of Tulsa College of Law (1977)
B338: Dickran Tevrizian | C338: Central District of California | D338: 12/16/1985 - 8/5/2005 | G338: University of Southern California (1962) | H338: University of Southern California Law School (1965)
B339: Lawrence Irving | C339: Southern District of California | D339: 7/28/1982 - 12/31/1990 | G339: University of Southern California (1959) | H339: University of Southern California Law School (1963)
B340: John Rhoades | C340: Southern District of California | D340: 10/28/1985 - 11/4/1995 | G340: Stanford University (1948) | H340: University of California, Hastings College of Law (1951)
B341: Lenore Nesbitt
B342: Thomas Scott | C342: Southern District of Florida | D342: 7/18/1985 - 10/31/1990 | G342: University of Miami (1969) | H342: University of Miami School of Law (1972), University of Virginia School of Law (1989)
B343: Charles Legge | C343: Northern District of California | D343: 9/18/1984 - 6/30/2001 | G343: Stanford University (1952) | H343: Stanford Law School (1954)
B344: Eugene Lynch | C344: Northern District of California | D344: 3/9/1982 - 3/14/1997 | G344: University of Santa Clara (1953) | H344: University of California, Hastings College of Law (1958)
B345: Fern Smith | C345: Northern District of California | D345: 7/27/1988 - 5/15/2003 | G345: Stanford University (1972) | H345: Stanford Law School (1975)
B346: John Vukasin | C346: Northern District of California | D346: 9/20/1983 - 9/20/1993 | G346: University of California, Berkeley (1950) | H346: University of California, Berkeley, Boalt Hall School of Law (1956)
B347: Delwen Jensen | C347: Northern District of California | D347: 6/25/1986 - 6/27/1997 | G347: U. of California, Berkeley, A.B., 1949 | H347: U. of California, Berkeley, Boalt Hall School of Law, LL.B., 1952
B348: Harold Fong | C348: District of Hawaii | D348: 6/21/1982 - 4/20/1995 | G348: U. of Southern California, A.B., 1960 | H348: U. of Michigan Law School, J.D., 1964
B349: Harold Ryan | C349: District of Idaho | D349: 12/17/1981 - 12/30/1992 | H349: U. of Idaho College of Law, LL.B., 1950
B350: Alan McDonald | C350: Eastern District of Washington | D350: 10/17/1985 - 12/13/1996 | G350: University of Washington (1950) | H350: University of Washington School of Law (1952)
B351: William Hutchinson
B352: William Dwyer | C352: Western District of Washington | D352: 11/6/1987 - 12/1/1998 | G352: University of Washington (1951) | H352: New York University School of Law (1953)
B353: David Aldrich Nelson
B354: Stanley Harris
B355: George Revercomb
B356: Stanley Sporkin
B357: Robert Bork
B358: Kenneth Starr
B359: James L. Buckley | C359: D.C. Circuit | D359: 12/17/1985 - 8/31/1996 | G359: Yale '43 | H359: Yale Law '49
B360: William Walter Wilkins | C360: Fourth Circuit | D360: 6/16/1986 - 7/1/2007 | E360: District of South Carolina | F360: 1981-1986 | G360: Davidson College '64 | H360: U. of South Carolina Law '67
B361: Malcolm Marsh | C361: District of Oregon | D361: 3/24/1987 - 4/16/1998 | G361: U. of Oregon, B.S., 1951 | H361: U. of Oregon Law School, LL.B., 1954
B362: Alex Howard | C362: Southern District of Alabama | D362: 10/14/1986 - 10/21/1996 | H362: Vanderbilt University Law School, LL.B., 1950
B363: Geoffrey M. Alprin | C363: Superior Court of the District of Columbia | D363: 1/7/1983-2/1/2010 | E363: Assistant Director, National Institute of Law Enforcement and Criminal Justice | F363: 1973-1977 | G363: University of Pennsylvania, 1961 | H363: Georgetown University Law Center, 1964
B364: A. Franklin Burgess, Jr. | C364: Superior Court of the District of Columbia | D364: 1983-8/3/2013 | E364: Chief of the Appellate Division, Public Defender Service | F364: 1982-1983 | G364: Princeton University | H364: Harvard
B365: Harold L. Cushenberry, Jr. | C365: Superior Court of the District of Columbia | D365: 1986-Present | G365: Harvard College | H365: Georgetown University Law Center
B366: Herbert B. Dixon, Jr. | C366: Superior Court of the District of Columbia | D366: 1985-Present | G366: Howard University | H366: Georgetown University Law Center
B367: Michael L. Rankin | C367: Superior Court of the District of Columbia | D367: 1986-Present | E367: Deputy Chief, Felony Trial Division, United States Attorney's Office | F367: 1984-1986 | G367: Lincoln University | H367: Howard University School of Law
B368: Robert I. Richter | C368: Superior Court of the District of Columbia | D368: 1984-Present | E368: Assistant Chief of Operations, U.S. Dept of Justice | F368: 1978-1984 | G368: University of Vermont, 1969 | H368: University of Chicago Law School, 1972
B369: Bruce D. Beaudin | C369: Superior Court of the District of Columbia | D369: 10/15/1984-1994 | G369: Fairfield University, 1961 | H369: Georgetown Law School, 1964
B370: Stephen F. Eilperin | C370: Superior Court of the District of Columbia | G370: Columbia University | H370: Columbia University
B371: Richard A. Levie | C371: Superior Court of the District of Columbia | D371: 1985-2000 | G371: Dickinson College | H371: George Washington University School of Law
B372: Cheryl M. Long | C372: Superior Court of the District of Columbia | D372: 1988-2009 | E372: Director, Public Defender Service for the District of Columbia | F372: 1985-1988 | G372: Georgetown University | H372: Georgetown University School of Law
B373: Nan R. Shuker | C373: Superior Court of the District of Columbia | D373: 1983-2004 | G373: SUNY at Binghamton, 1966 | H373: The American University, 1969
B374: Robert S. Tignor | C374: Superior Court of the District of Columbia | G374: Howard University | H374: George Washington University
B375: Curtis Von Kann | C375: Superior Court of the District of Columbia | D375: 1985-1995 | G375: Harvard College, 1964 | H375: Harvard Law School, 1969
B376: Ronald P. Wertheim | C376: Superior Court of the District of Columbia | D376: 1981-1992 | G376: University of Pennsylvania, 1954 | H376: University of Pennsylvania Law School, 1957
B377: Susan R. Winfield | C377: Superior Court of the District of Columbia | D377: 1984-2006 | G377: University of Pennsylvania | H377: Boston College Law School
B378: John O. Colvin | C378: United States Tax Court | D378: 9/1/1988 - Present | G378: University of Missouri, A.B., 1968 | H378: University of Missouri, J.D., 1971
B379: Mary Ann Cohen | C379: United States Tax Court | D379: 9/24/1982 - 9/30/2012 | G379: University of California, B.S., 1964 | H379: University of Southern California School of Law, J.D., 1967
B380: Joel Gerber | C380: United States Tax Court | D380: 6/18/1984 - 6/17/1999 and 12/15/2000 - 5/31/2006 | G380: Roosevelt University, B.S., 1962 | H380: DePaul University, J.D., 1965
B381: Julian I. Jacobs | C381: United States Tax Court | D381: 3/30/1984 - 3/29/1999 | G381: University of Maryland, B.A., 1958 | H381: University of Maryland Law School, LL.B., 1960
B382: Robert P. Ruwe | C382: United States Tax Court | D382: 11/20/1987 - 11/19/2002 | H382: Salmon P. Chase College of Law, J.D., 1970
B383: Thomas B. Wells | C383: United States Tax Court | D383: 10/13/1986 - 1/1/2011 | G383: Miami University, Oxford, B.S., 1967 | H383: Emory University Law School, J.D., 1973
B384: Laurence J. Whalen | C384: United States Tax Court | D384: 11/23/1987 - 11/22/2002 | G384: Georgetown University, A.B., 1967 | H384: Georgetown University Law Center, J.D., 1970
B385: Frank J. Magill | C385: Eighth Circuit | D385: 3/4/1986 - 4/1/1997 | G385: Georgetown U. '51 | H385: Georgetown U. Law '55
B386: Marian Blank Horn | C386: United States Court of Federal Claims | D386: 1986 - 2018 | G386: Barnard College, Columbia University | H386: Fordham U. Law, J.D.
B387: Christine Odell Cook Miller | C387: United States Court of Federal Claims | D387: 1/24/1983 - 2/28/2013 | G387: Stanford, B.A., 1966 | H387: U. of Utah Law, J.D., 1969
B388: Bohdan A. Futey | C388: United States Court of Federal Claims | D388: 5/27/1987 - 2002 | G388: Western Reserve U., B.A., 1962 | H388: Cleveland Marshall Law, J.D., 1968
B389: Lawrence S. Margolis | C389: United States Court of Federal Claims | D389: 12/10/1982 - 12/15/1997 | G389: Drexel U., B.S., 1957 | H389: George Washington U. Law, J.D., 1961
B390: James F. Merow | C390: United States Court of Federal Claims | D390: 10/1/1982 - 8/5/1998 | E390: United States Court of Claims | F390: 1978-1982
B391: Loren A. Smith | C391: United States Court of Federal Claims | D391: 9/12/1985 - 2000 | G391: Northwestern U., B.A., 1966 | H391: Northwestern U. Law, J.D., 1969
B392: John Paul Wiese | C392: United States Court of Federal Claims | D392: 10/1/1982 - 1997 | G392: Hobart College, 1962 | H392: U. of Virginia Law, L.L.B., 1965
B393: Robert J. Yock | C393: United States Court of Federal Claims | D393: 10/1/1982 - 8/5/1998 | E393: Trial Judge, United States Court of Claims | F393: 1977-1982 | G393: St. Olaf College, B.A., 1959 | H393: U. of Michigan Law, J.D., 1962
B394: Eric G. Bruggink | C394: United States Court of Federal Claims | D394: 4/21/1986 - 2001 | G394: Auburn U., B.A., 1971 | H394: U. of Alabama Law, J.D., 1975
B395: Thomas J. Lydon | C395: United States Court of Federal Claims | D395: 10/1/1982 - 8/1/1987 | E395: Commissioner (Judge), United States Court of Claims | F395: 1972-1982 | G395: U. of Maine, B.A., 1952 | H395: Georgetown Law, L.L.B., 1955
B396: Reginald W. Gibson | C396: United States Court of Federal Claims | D396: 12/15/1982 - 8/15/1995 | G396: Virginia Union U., B.S., 1962 | H396: Howard U. Law, L.L.B., 1956
B397: Eugene Sullivan | C397: United States Court of Appeals for the Armed Forces | D397: 5/27/1986 - 9/30/2002
B398: Walter Cox III | C398: United States Court of Appeals for the Armed Forces | D398: 9/6/1984 - 9/18/2000
B399: John L. Napier | C399: United States Court of Federal Claims | D399: 1986-1989 | G399: Davidson College, 1969 | H399: University of South Carolina Law School, 1972

Sheet: Trump Executive Orders
B1: Executive Orders | L1: Memoranda
B2: Relative No. | C2: Absolute No. | D2: Title/Description | E2: Date signed | F2: Date published | G2: FR Citation | H2: FR Doc. Number | I2: Ref. | J2: Days since Inauguration | L2: No. | M2: Title/Description | N2: Date signed | O2: Date published | P2: Document citation | Q2: Document number | R2: Ref. | S2: Days since Inauguration
B3: 1 | C3: 13765 | D3: Minimizing the Economic Burden of the Patient Protection and Affordable Care Act Pending Repeal | E3: January 20, 2017 | F3: January 24, 2017 | G3: 82 FR 8351 | H3: 2017-01799 | I3: [4][5] | J3: of:=[.E3]-TrumpInauguration -> 0 | L3: 1 | M3: Regulatory Freeze Pending Review for the Heads of Executive Departments and Agencies | N3: January 20, 2017 | O3: January 24, 2017 | P3: 82 FR 8346 | Q3: 2017-01766 | R3: [34] | S3: of:=[.N3]-TrumpInauguration -> 0
B4: 2 | C4: 13766 | D4: Expediting Environmental Reviews and Approvals for High Priority Infrastructure Projects | E4: January 24, 2017 | F4: January 30, 2017 | G4: 82 FR 8657 | H4: 2017-02029 | I4: [6][7] | J4: of:=[.E4]-TrumpInauguration -> 4 | L4: 2 | M4: Regarding the Hiring Freeze | N4: January 23, 2017 | O4: January 25, 2017 | P4: 82 FR 8493 | Q4: 2017-01842 | R4: [35] | S4: of:=[.N4]-TrumpInauguration -> 3
B5: 3 | C5: 13767 | D5: Border Security and Immigration Enforcement Improvements | E5: January 25, 2017 | F5: January 30, 2017 | G5: 82 FR 8793 | H5: 2017-02095 | I5: [8][9][10] | J5: of:=[.E5]-TrumpInauguration -> 5 | L5: 3 | M5: Barring international non-governmental organizations that perform or promote abortions from receiving US government funding | N5: January 23, 2017 | O5: January 25, 2017 | P5: 82 FR 8495 | Q5: 2017-01843 | R5: [36] | S5: of:=[.N5]-TrumpInauguration -> 3
B6: 4 | C6: 13768 | D6: Enhancing Public Safety in the Interior of the United States | E6: January 25, 2017 | F6: January 30, 2017 | G6: 82 FR 8799 | H6: 2017-02102 | I6: [11][12] | J6: of:=[.E6]-TrumpInauguration -> 5 | L6: 4 | M6: Regarding Withdrawal of the United States from the Trans-Pacific Partnership Negotiations and Agreement | N6: January 23, 2017 | O6: January 25, 2017 | P6: 82 FR 8497 | Q6: 2017-01845 | R6: [37] | S6: of:=[.N6]-TrumpInauguration -> 3
B7: 5 | C7: 13769 | D7: Protecting the Nation from Foreign Terrorist Entry into the United States | E7: January 27, 2017 | F7: February 1, 2017 | G7: 82 FR 8977 | H7: 2017-02281 | I7: [13][14] | J7: of:=[.E7]-TrumpInauguration -> 7 | L7: 5 | M7: Regarding Construction of American Pipelines | N7: January 24, 2017 | O7: January 30, 2017 | P7: 82 FR 8659 | Q7: 2017-02031 | R7: [38][39] | S7: of:=[.N7]-TrumpInauguration -> 4
B8: 6 | C8: 13770 | D8: Ethics Commitments by Executive Branch Appointees | E8: January 28, 2017 | F8: February 3, 2017 | G8: 82 FR 9333 | H8: 2017-02450 | I8: [15][16][17] | J8: of:=[.E8]-TrumpInauguration -> 8 | L8: 6 | M8: Regarding Construction of the Dakota Access Pipeline | N8: January 24, 2017 | O8: January 30, 2017 | P8: 82 FR 8661 | Q8: 2017-02032 | R8: [40][41] | S8: of:=[.N8]-TrumpInauguration -> 4
B9: 7 | C9: 13771 | D9: Reducing Regulation and Controlling Regulatory Costs | E9: January 30, 2017 | F9: February 3, 2017 | G9: 82 FR 9339 | H9: 2017-02451 | I9: [18][19][20] | J9: of:=[.E9]-TrumpInauguration -> 10 | L9: 7 | M9: Regarding Construction of the Keystone XL Pipeline | N9: January 24, 2017 | O9: January 30, 2017 | P9: 82 FR 8663 | Q9: 2017-02035 | R9: [40][41] | S9: of:=[.N9]-TrumpInauguration -> 4
B10: 8 | C10: 13772 | D10: Core Principles for Regulating the United States Financial System | E10: February 3, 2017 | F10: February 8, 2017 | G10: 82 FR 9965 | H10: 2017-02762 | I10: [21][22][23][24] | J10: of:=[.E10]-TrumpInauguration -> 14 | L10: 8 | M10: Reducing Regulatory Burdens for Domestic Manufacturing | N10: January 24, 2017 | O10: January 30, 2017 | P10: 82 FR 8667 | Q10: 2017-02044 | R10: [42][43][44] | S10: of:=[.N10]-TrumpInauguration -> 4
B11: 9 | C11: 13773 | D11: Enforcing Federal Law with Respect to Transnational Criminal Organizations and Preventing International Trafficking | E11: February 9, 2017 | F11: February 14, 2017 | G11: 82 FR 10691 | H11: 2017-03113 | I11: [25][26] | J11: of:=[.E11]-TrumpInauguration -> 20 | L11: 9 | M11: Rebuilding the U.S. Armed Forces | N11: January 27, 2017 | O11: February 1, 2017 | P11: 82 FR 8983 | Q11: 2017-02282 | R11: [45][46][47] | S11: of:=[.N11]-TrumpInauguration -> 7
B12: 10 | C12: 13774 | D12: Preventing Violence Against Federal, State, Tribal, and Local Law Enforcement Officers | E12: February 9, 2017 | F12: February 14, 2017 | G12: 82 FR 10695 | H12: 2017-03115 | I12: [26][27][28] | J12: of:=[.E12]-TrumpInauguration -> 20 | L12: 10 | M12: Plan to Defeat the Islamic State of Iraq and Syria | N12: January 28, 2017 | O12: February 2, 2017 | P12: 82 FR 9125 | Q12: 2017-02386 | R12: [48][49][50] | S12: of:=[.N12]-TrumpInauguration -> 8
B13: 11 | C13: 13775 | D13: Providing an Order of Succession Within the Department of Justice | E13: February 9, 2017 | F13: February 14, 2017 | G13: 82 FR 10697 | H13: 2017-03116 | I13: [29][30][31] | J13: of:=[.E13]-TrumpInauguration -> 20 | L13: 11 | M13: Organization of the National Security Council and the Homeland Security Council | N13: January 28, 2017 | O13: February 2, 2017 | P13: 82 FR 9119 | Q13: 2017-02381 | R13: [51][52][53] | S13: of:=[.N13]-TrumpInauguration -> 8
B14: 12 | C14: 13776 | D14: Task Force on Crime Reduction and Public Safety | E14: February 9, 2017 | F14: February 14, 2017 | G14: 82 FR 10699 | H14: 2017-03118 | I14: [26][32][33] | J14: of:=[.E14]-TrumpInauguration -> 20 | L14: 12 | M14: Fiduciary Duty Rule | N14: February 3, 2017 | O14: February 7, 2017 | P14: 82 FR 9675 | Q14: 2017-02656 | R14: [54][55][56] | S14: of:=[.N14]-TrumpInauguration -> 14

Sheet: Obama Executive Orders
B1: Executive Orders | G1: Memoranda
B2: No. | C2: Title/Description | D2: Date signed | E2: Days since Inauguration | G2: No. | H2: Title/Description | I2: Date signed | J2: Days since Inauguration
B3: 13489 | C3: Presidential Records | D3: 2009-01-21 | E3: of:=[.D3]-ObamaInauguration -> 1 | G3: 1 | H3: Pay Freeze | I3: 2009-01-21 | J3: of:=[.I3]-ObamaInauguration -> 1
B4: 13490 | C4: Ethics Commitments by Executive Branch Personnel | D4: 2009-01-21 | E4: of:=[.D4]-ObamaInauguration -> 1 | G4: 2 | H4: Freedom of Information Act | I4: 2009-01-21 | J4: of:=[.I4]-ObamaInauguration -> 1
B5: 13491 | C5: Ensuring Lawful Interrogations | D5: 2009-01-22 | E5: of:=[.D5]-ObamaInauguration -> 2 | G5: 3 | H5: Transparency and Open Government | I5: 2009-01-21 | J5: of:=[.I5]-ObamaInauguration -> 1
B6: 13492 | C6: Review and Disposition of Individuals Detained at the Guantanamo Bay Naval Base and Closure of Detention Facilities | D6: 2009-01-22 | E6: of:=[.D6]-ObamaInauguration -> 2 | G6: 4 | H6: Memorandum -- Transparency and Open Government | I6: 2009-01-21 | J6: of:=[.I6]-ObamaInauguration -> 1
B7: 13493 | C7: Review of Detention Policy Options | D7: 2009-01-22 | E7: of:=[.D7]-ObamaInauguration -> 2 | G7: 5 | H7: Review of the Detention of Ali Saleh Kahlah | I7: 2009-01-22 | J7: of:=[.I7]-ObamaInauguration -> 2
B8: 13494 | C8: Economy in Government Contracting | D8: 2009-01-30 | E8: of:=[.D8]-ObamaInauguration -> 10 | G8: 6 | H8: Mexico City Policy and Assistance for Voluntary Population Planning | I8: 2009-01-23 | J8: of:=[.I8]-ObamaInauguration -> 3
B9: 13495 | C9: Nondisplacement of Qualified Workers Under Service Contracts | D9: 2009-01-30 | E9: of:=[.D9]-ObamaInauguration -> 10 | G9: 7 | H9: The Energy Independence and Security Act of 2007 | I9: 2009-01-26 | J9: of:=[.I9]-ObamaInauguration -> 6
B10: 13496 | C10: Notification of Employee Rights Under Federal Labor Laws (Repealed Executive Order 13201) | D10: 2009-01-30 | E10: of:=[.D10]-ObamaInauguration -> 10 | G10: 8 | H10: California Request for Waiver Under the Clean Air Act | I10: 2009-01-26 | J10: of:=[.I10]-ObamaInauguration -> 6
B11: 13497 | C11: Revocation of Certain Executive Orders Concerning Regulatory Planning and Review | D11: 2009-02-05 | E11: of:=[.D11]-ObamaInauguration -> 16 | G11: 9 | H11: Presidential Memorandum -- EPA Waiver | I11: 2009-01-26 | J11: of:=[.I11]-ObamaInauguration -> 6
B12: 13498 | C12: Amendments to Executive Order 13199 and Establishment of the President's Advisory Council for Faith-Based and Neighborhood Partnerships[4] | D12: 2009-02-09 | E12: of:=[.D12]-ObamaInauguration -> 20 | G12: 10 | H12: Presidential Memorandum -- Fuel Economy | I12: 2009-01-26 | J12: of:=[.I12]-ObamaInauguration -> 6
B13: 13499 | C13: Further Amendments to Executive Order 12835, Establishment of the National Economic Council | D13: 2009-02-05 | E13: of:=[.D13]-ObamaInauguration -> 16 | G13: 11 | H13: Unexpected Urgent Refugee and Migration Needs Related to Gaza | I13: 2009-01-27 | J13: of:=[.I13]-ObamaInauguration -> 7
B14: 13500 | C14: Further Amendments to Executive Order 12859, Establishment of the Domestic Policy Council | D14: 2009-02-05 | E14: of:=[.D14]-ObamaInauguration -> 16 | G14: 12 | H14: Memorandum for the Heads of Executive Departments and Agencies | I14: 2009-01-30 | J14: of:=[.I14]-ObamaInauguration -> 10
B15: 13501 | C15: Establishing the President's Economic Recovery Advisory Board | D15: 2009-02-06 | E15: of:=[.D15]-ObamaInauguration -> 17 | G15: 13 | H15: Presidential Memorandum -- State Children's Health Insurance Program | I15: 2009-02-04 | J15: of:=[.I15]-ObamaInauguration -> 15
B16: 13502 | C16: Use of Project Labor Agreements for Federal Construction Projects | D16: 2009-02-06 | E16: of:=[.D16]-ObamaInauguration -> 17 | G16: 14 | H16: Appliance Efficiency Standards | I16: 2009-02-05 | J16: of:=[.I16]-ObamaInauguration -> 16
B17: 13503 | C17: Establishment of the White House Office of Urban Affairs | D17: 2009-02-19 | E17: of:=[.D17]-ObamaInauguration -> 30 | G17: 15 | H17: Transfer of Detainee to Control of the Attorney General | I17: 2009-02-27 | J17: of:=[.I17]-ObamaInauguration -> 38
B18: 13504 | C18: Amending Executive Order 13390 | D18: 2009-02-19 | E18: of:=[.D18]-ObamaInauguration -> 30 | G18: 16 | H18: Memorandum for the Heads of Executive Departments and Agencies | I18: 2009-03-03 | J18: of:=[.I18]-ObamaInauguration -> 42
B19: 13505 | C19: Removing Barriers to Responsible Scientific Research Involving Human Stem Cells | D19: 2009-03-09 | E19: of:=[.D19]-ObamaInauguration -> 48 | G19: 17 | H19: Memorandum for the Heads of Executive Departments and Agencies - Subject: Government Contracting | I19: 2009-03-04 | J19: of:=[.I19]-ObamaInauguration -> 43
B20: 13506 | C20: Establishing a White House Council on Women and Girls | D20: 2009-03-11 | E20: of:=[.D20]-ObamaInauguration -> 50 | G20: 18 | H20: Message to Congress from the President Regarding Export Certification | I20: 2009-03-04 | J20: of:=[.I20]-ObamaInauguration -> 43
B21: 13507 | C21: Establishment of the White House Office of Health Reform | D21: 2009-04-08 | E21: of:=[.D21]-ObamaInauguration -> 78 | G21: 19 | H21: Memorandum for the Heads of Executive Departments and Agencies 3-9-09 | I21: 2009-03-09 | J21: of:=[.I21]-ObamaInauguration -> 48
B22: 13508 | C22: Chesapeake Bay Protection and Restoration | D22: 2009-05-12 | E22: of:=[.D22]-ObamaInauguration -> 112 | G22: 20 | H22: Memorandum on Presidential Signing Statements | I22: 2009-03-09 | J22: of:=[.I22]-ObamaInauguration -> 48
B23: 13509 | C23: Establishing a White House Council on Automotive Communities and Workers | D23: 2009-06-23 | E23: of:=[.D23]-ObamaInauguration -> 154 | G23: 21 | H23: Unexpected Urgent Refugee and Migration Needs Related to the Continuing Conflict in Pakistan | I23: 2009-03-11 | J23: of:=[.I23]-ObamaInauguration -> 50
B24: 13510 | C24: Waiver Under the Trade Act of 1974 With Respect to the Republic of Belarus | D24: 2009-07-01 | E24: of:=[.D24]-ObamaInauguration -> 162 | G24: 22 | H24: Memorandum for the Heads of Executive Departments and Agencies, 3/20/09 | I24: 2009-03-20 | J24: of:=[.I24]-ObamaInauguration -> 59
B25: 13511 | C25: Continuance of Certain Federal Advisory Committees | D25: 2009-09-29 | E25: of:=[.D25]-ObamaInauguration -> 252 | G25: 23 | H25: Presidential Memorandum Regarding Deferred Enforced Departure for Liberians | I25: 2009-03-23 | J25: of:=[.I25]-ObamaInauguration -> 62
B26: 13512 | C26: Amending Executive Order 13390 | D26: 2009-09-29 | E26: of:=[.D26]-ObamaInauguration -> 252 | G26: 24 | H26: Memorandum: Promoting Democracy and Human Rights in Cuba | I26: 2009-04-13 | J26: of:=[.I26]-ObamaInauguration -> 83
B27: 13513 | C27: Federal Leadership on Reducing Text Messaging While Driving | D27: 2009-10-01 | E27: of:=[.D27]-ObamaInauguration -> 254 | G27: 25 | H27: Message to Congress from the President | I27: 2009-04-21 | J27: of:=[.I27]-ObamaInauguration -> 91
B28: 13514 | C28: Federal Leadership in Environmental, Energy, and Economic Performance | D28: 2009-10-05 | E28: of:=[.D28]-ObamaInauguration -> 258 | G28: 26 | H28: Presidential Memorandum Regarding Regulatory Review | I28: 2009-04-23 | J28: of:=[.I28]-ObamaInauguration -> 93
B29: 13515 | C29: Increasing Participation of Asian Americans and Pacific Islanders in Federal Programs | D29: 2009-10-14 | E29: of:=[.D29]-ObamaInauguration -> 267 | G29: 27 | H29: Presidential Memorandum for the Secretary of Defense | I29: 2009-04-27 | J29: of:=[.I29]-ObamaInauguration -> 97
B30: 13516 | C30: Amending Executive Order 13462 | D30: 2009-10-28 | E30: of:=[.D30]-ObamaInauguration -> 281 | G30: 28 | H30: Presidential Memorandum for the Secretary of State, 4-30-09 | I30: 2009-04-30 | J30: of:=[.I30]-ObamaInauguration -> 100
B31: 13517 | C31: Amendments to Executive Orders 13183 and 13494 | D31: 2009-10-30 | E31: of:=[.D31]-ObamaInauguration -> 283 | G31: 29 | H31: Presidential Memorandum Regarding The United States Peru Trade Promotion Agreement Implementation Act | I31: 2009-05-01 | J31: of:=[.I31]-ObamaInauguration -> 101
B32: 13518 | C32: Employment of Veterans in the Federal Government | D32: 2009-11-09 | E32: of:=[.D32]-ObamaInauguration -> 293 | G32: 30 | H32: Memorandum from the President for the Chair of the Council on Environmental Quality | I32: 2009-05-15 | J32: of:=[.I32]-ObamaInauguration -> 115
B33: 13519 | C33: Establishment of the Financial Fraud Enforcement Task Force | D33: 2009-11-17 | E33: of:=[.D33]-ObamaInauguration -> 301 | G33: 31 | H33: Presidential Memorandum Regarding Preemption | I33: 2009-05-20 | J33: of:=[.I33]-ObamaInauguration -> 120
B34: 13520 | C34: Reducing Improper Payments | D34: 2009-11-20 | E34: of:=[.D34]-ObamaInauguration -> 304 | G34: 32 | H34: Presidential Memorandum Regarding Nuclear Agreement with the United Arab Emirates | I34: 2009-05-20 | J34: of:=[.I34]-ObamaInauguration -> 120
B35: 13521 | C35: Establishing the Presidential Commission for the Study of Bioethical Issues | D35: 2009-11-24 | E35: of:=[.D35]-ObamaInauguration -> 308 | G35: 33 | H35: Presidential Memorandum-Classified Information and Controlled Unclassified Information | I35: 2009-05-27 | J35: of:=[.I35]-ObamaInauguration -> 127
B36: 13522 | C36: Creating Labor-Management Forums to Improve Delivery of Government Services | D36: 2009-12-09 | E36: of:=[.D36]-ObamaInauguration -> 323 | G36: 34 | H36: Presidential Memorandum on the Embassy in Jerusalem | I36: 2009-06-05 | J36: of:=[.I36]-ObamaInauguration -> 136
B37: 13523 | C37: Half-Day Closing of Executive Departments and Agencies on Thursday, December 24, 2009 | D37: 2009-12-11 | E37: of:=[.D37]-ObamaInauguration -> 325 | G37: 35 | H37: Memorandum from the President to the Secretary of State, 6-9-09 | I37: 2009-06-09 | J37: of:=[.I37]-ObamaInauguration -> 140
B38: 13524 | C38: Amending Executive Order 12425 Designating Interpol as a Public International Organization Entitled to Enjoy Certain Privileges, Exemptions, and Immunities | D38: 2009-12-17 | E38: of:=[.D38]-ObamaInauguration -> 331 | G38: 36 | H38: Memorandums from the President regarding Cambodia and Laos | I38: 2009-06-12 | J38: of:=[.I38]-ObamaInauguration -> 143
B39: 13525 | C39: Adjustments of Certain Rates of Pay | D39: 2009-12-23 | E39: of:=[.D39]-ObamaInauguration -> 337 | G39: 37 | H39: Memorandum for the Heads of Executive Departments and Agencies on Federal Benefits and Non-Discrimination, 6-17-09 | I39: 2009-06-17 | J39: of:=[.I39]-ObamaInauguration -> 148
B40: 13526 | C40: Classified National Security Information | D40: 2009-12-29 | E40: of:=[.D40]-ObamaInauguration -> 343 | G40: 38 | H40: FACT SHEET: Memorandum of Understanding on Cooperation in the Field of Public Health and Medical Sciences | I40: 2009-07-06 | J40: of:=[.I40]-ObamaInauguration -> 167
B41: 13527 | C41: Establishing Federal Capability for the Timely Provision of Medical Countermeasures Following a Biological Attack | D41: 2009-12-30 | E41: of:=[.D41]-ObamaInauguration -> 344 | G41: 39 | H41: Memorandum from the President to the Secretary of State Concerning the Palestinian Authority | I41: 2009-07-08 | J41: of:=[.I41]-ObamaInauguration -> 169
B42: 13528 | C42: Establishment of the Council of Governors | D42: 2010-01-11 | E42: of:=[.D42]-ObamaInauguration -> 356 | G42: 40 | H42: Memorandum from the President Assigning Certain Reporting Functions Under the Supplemental Appropriations Act | I42: 2009-07-17 | J42: of:=[.I42]-ObamaInauguration -> 178
B43: 13529 | C43: Ordering the Selected Reserve and Certain Individual Ready Reserve Members of the Armed Forces to Active Duty | D43: 2010-01-16 | E43: of:=[.D43]-ObamaInauguration -> 361 | G43: 41 | H43: Memorandum from the President for the Heads of Executive Departments and Agencies Regarding Guidelines for Human Stem Cell Research | I43: 2009-07-30 | J43: of:=[.I43]-ObamaInauguration -> 191
B44: 13530 | C44: President's Advisory Council on Financial Capability | D44: 2010-01-29 | E44: of:=[.D44]-ObamaInauguration -> 374 | G44: 42 | H44: Memorandum from the President on the Office of Science and Technology Policy | I44: 2009-08-05 | J44: of:=[.I44]-ObamaInauguration -> 197
B45: 13531 | C45: National Commission on Fiscal Responsibility and Reform | D45: 2010-02-18 | E45: of:=[.D45]-ObamaInauguration -> 394 | G45: 43 | H45: Memorandum from the President to the Secretary of Homeland Security | I45: 2009-08-06 | J45: of:=[.I45]-ObamaInauguration -> 198
B46: 13532 | C46: Promoting Excellence, Innovation, and Sustainability at Historically Black Colleges and Universities | D46: 2010-02-26 | E46: of:=[.D46]-ObamaInauguration -> 402 | G46: 44 | H46: Presidential Memorandum regarding drug interdiction assistance to Colombia | I46: 2009-08-13 | J46: of:=[.I46]-ObamaInauguration -> 205
B47: 13533 | C47: Providing an Order of Succession within the Department of Defense | D47: 2010-03-01 | E47: of:=[.D47]-ObamaInauguration -> 405 | G47: 45 | H47: Memorandum from the President to the Secretary of Transportation | I47: 2009-08-21 | J47: of:=[.I47]-ObamaInauguration -> 213
B48: 13534 | C48: National Export Initiative | D48: 2010-03-11 | E48: of:=[.D48]-ObamaInauguration -> 415 | G48: 46 | H48: Presidential Memorandum-International Boundary and Water Commission Designations | I48: 2009-08-31 | J48: of:=[.I48]-ObamaInauguration -> 223
B49: 13535 | C49: Ensuring Enforcement and Implementation of Abortion Restrictions in the Patient Protection and Affordable Care Act | D49: 2010-03-23 | E49: of:=[.D49]-ObamaInauguration -> 427 | G49: 47 | H49: Presidential Determination of Assistance to the Economic Community of Central African States | I49: 2009-09-08 | J49: of:=[.I49]-ObamaInauguration -> 231
B50: 13536 | C50: Blocking Property of Certain Persons Contributing to the Conflict in Somalia | D50: 2010-04-12 | E50: of:=[.D50]-ObamaInauguration -> 447 | G50: 48 | H50: Presidential Determination of Assistance to the Maldives | I50: 2009-09-08 | J50: of:=[.I50]-ObamaInauguration -> 231
B51: 13537 | C51: Interagency Group on Insular Areas | D51: 2010-04-14 | E51: of:=[.D51]-ObamaInauguration -> 449 | G51: 49 | H51: Memorandum For The Secretary Of Commerce The Secretary Of Labor The United State Trade Representative | I51: 2009-09-11 | J51: of:=[.I51]-ObamaInauguration -> 234
B52: 13538 | C52: Establishing the President's Management Advisory Board | D52: 2010-04-19 | E52: of:=[.D52]-ObamaInauguration -> 454 | G52: 50 | H52: Memorandum from the President regarding the Trading With the Enemy Act | I52: 2009-09-14 | J52: of:=[.I52]-ObamaInauguration -> 237
B53: 13539 | C53: President's Council of Advisors on Science and Technology | D53: 2010-04-21 | E53: of:=[.D53]-ObamaInauguration -> 456 | G53: 51 | H53: Presidential Determination regarding trafficking in persons | I53: 2009-09-15 | J53: of:=[.I53]-ObamaInauguration -> 238
B54: 13540 | C54: Interagency Task Force on Veterans Small Business Development | D54: 2010-04-26 | E54: of:=[.D54]-ObamaInauguration -> 461 | G54: 52 | H54: Presidential Memorandum Concerning Medical Liability Reform | I54: 2009-09-17 | J54: of:=[.I54]-ObamaInauguration -> 240
B55: 13541 | C55: Temporary Organization to Facilitate a Strategic Partnership with the Republic of Iraq | D55: 2010-05-07 | E55: of:=[.D55]-ObamaInauguration -> 472 | G55: 53 | H55: Presidential Determiniation regarding major illicit drug transit | I55: 2009-09-18 | J55: of:=[.I55]-ObamaInauguration -> 241
B56: 13542 | C56: Providing an Order of Succession Within the Department of Agriculture | D56: 2010-05-13 | E56: of:=[.D56]-ObamaInauguration -> 478 | G56: 54 | H56: Presidential Memorandum Concerning National Security | I56: 2009-09-21 | J56: of:=[.I56]-ObamaInauguration -> 244
B57: 13543 | C57: National Commission on the BP Deepwater Horizon Oil Spill and Offshore Drilling | D57: 2010-05-21 | E57: of:=[.D57]-ObamaInauguration -> 486 | G57: 55 | H57: Presidential Memorandum to the Secretary of Commerce | I57: 2009-09-29 | J57: of:=[.I57]-ObamaInauguration -> 252
B58: 13544 | C58: Establishing the National Prevention, Health Promotion, and Public Health Council | D58: 2010-06-10 | E58: of:=[.D58]-ObamaInauguration -> 506 | G58: 56 | H58: Presidential Memoranda, 9/30/09 | I58: 2009-09-30 | J58: of:=[.I58]-ObamaInauguration -> 253
B59: 13545 | C59: President's Council on Fitness, Sports, and Nutrition | D59: 2010-06-22 | E59: of:=[.D59]-ObamaInauguration -> 518 | G59: 57 | H59: Presidential Memorandum to the Secretary of State | I59: 2009-10-08 | J59: of:=[.I59]-ObamaInauguration -> 261
B60: 13546 | C60: Optimizing the Security of Biological Select Agents and Toxins in the United States | D60: 2010-07-02 | E60: of:=[.D60]-ObamaInauguration -> 528 | G60: 58 | H60: Presidential Memorandum Brazil Assistance | I60: 2009-10-16 | J60: of:=[.I60]-ObamaInauguration -> 269
B61: 13547 | C61: Stewardship of the Ocean, Our Coasts, and the Great Lakes | D61: 2010-07-19 | E61: of:=[.D61]-ObamaInauguration -> 545 | G61: 59 | H61: Presidential Memorandum on Tribal Consultation | I61: 2009-11-05 | J61: of:=[.I61]-ObamaInauguration -> 289
B62: 13548 | C62: Increasing Federal Employment of Individuals With Disabilities | D62: 2010-07-26 | E62: of:=[.D62]-ObamaInauguration -> 552 | G62: 60 | H62: Presidential Memorandum on Inventory of Files Related to Fort Hood Shooting | I62: 2009-11-12 | J62: of:=[.I62]-ObamaInauguration -> 296
B63: 13549 | C63: Classified National Security Information Program for State, Local, Tribal, and Private Sector Entities | D63: 2010-08-18 | E63: of:=[.D63]-ObamaInauguration -> 575 | G63: 61 | H63: Presidential Memorandum-- Assignment of Functions Under the National Defense | I63: 2009-11-30 | J63: of:=[.I63]-ObamaInauguration -> 314
B64: 13550 | C64: Establishment of Pakistan and Afghanistan Support Office | D64: 2010-08-18 | E64: of:=[.D64]-ObamaInauguration -> 575 | G64: 62 | H64: Presidential Memorandum - Suspension of Limitations Under the Jerusalem Embassy Act | I64: 2009-12-03 | J64: of:=[.I64]-ObamaInauguration -> 317
B65: 13551 | C65: Blocking Property of Certain Persons With Respect to North Korea | D65: 2010-08-30 | E65: of:=[.D65]-ObamaInauguration -> 587 | G65: 63 | H65: Presidential Memorandum - Community Health Centers | I65: 2009-12-09 | J65: of:=[.I65]-ObamaInauguration -> 323
B66: 13552 | C66: 2010 Amendments to the Manual for Courts-Martial, United States | D66: 2010-08-31 | E66: of:=[.D66]-ObamaInauguration -> 588 | G66: 64 | H66: Presidential Memorandum - Eleventh Quadrennial Review of Military Compensation | I66: 2009-12-11 | J66: of:=[.I66]-ObamaInauguration -> 325
B67: 13553 | C67: Blocking Property of Certain Persons With Respect to Serious Human Rights Abuses by the Government of Iran and Taking Certain Other Actions | D67: 2010-09-28 | E67: of:=[.D67]-ObamaInauguration -> 616 | G67: 65 | H67: Presidential Memorandum--Closure of Dentention Facilities at the Guantanamo Bay Naval Base | I67: 2009-12-15 | J67: of:=[.I67]-ObamaInauguration -> 329
B68: 13554 | C68: Establishing the Gulf Coast Ecosystem Restoration Task Force | D68: 2010-10-05 | E68: of:=[.D68]-ObamaInauguration -> 623 | G68: 66 | H68: Presidential Memorandum - Implementation of the Executive Order, "Classified National Security Information" | I68: 2009-12-29 | J68: of:=[.I68]-ObamaInauguration -> 343
B69: 13555 | C69: White House Initiative on Educational Excellence for Hispanics | D69: 2010-10-19 | E69: of:=[.D69]-ObamaInauguration -> 637 | G69: 67 | H69: Presidential Memorandum - Aviation Screening | I69: 2009-12-29 | J69: of:=[.I69]-ObamaInauguration -> 343
B70: 13556 | C70: Controlled Unclassified Information | D70: 2010-11-04 | E70: of:=[.D70]-ObamaInauguration -> 653 | G70: 68 | H70: Presidential Memorandum - Watchlisting Procedures | I70: 2009-12-29 | J70: of:=[.I70]-ObamaInauguration -> 343
B71: 13557 | C71: Providing an Order of Succession Within the Department of Justice | D71: 2010-11-04 | E71: of:=[.D71]-ObamaInauguration -> 653 | G71: 69 | H71: Memorandum of Disapproval | I71: 2009-12-30 | J71: of:=[.I71]-ObamaInauguration -> 344
B72: 13558 | C72: Export Enforcement Coordination Center | D72: 2010-11-09 | E72: of:=[.D72]-ObamaInauguration -> 658 | G72: 70 | H72: Presidential Memorandum Regarding 12/25/2009 Attempted Terrorist Attack | I72: 2010-01-07 | J72: of:=[.I72]-ObamaInauguration -> 352
B73: 13559 | C73: Fundamental Principles and Policymaking Criteria for Partnerships With Faith-Based and Other Neighborhood Organizations | D73: 2010-11-17 | E73: of:=[.D73]-ObamaInauguration -> 666 | G73: 71 | H73: Memorandum for the Heads of Executive Departments and Agencies | I73: 2010-01-20 | J73: of:=[.I73]-ObamaInauguration -> 365
B74: 13560 | C74: White House Council for Community Solutions | D74: 2010-12-14 | E74: of:=[.D74]-ObamaInauguration -> 693 | G74: 72 | H74: Presidential Memorandum -- Blue Ribbon Commission on America's Nuclear Future | I74: 2010-01-29 | J74: of:=[.I74]-ObamaInauguration -> 374
B75: 13561 | C75: Adjustments to Certain Rates of Pay | D75: 2010-12-22 | E75: of:=[.D75]-ObamaInauguration -> 701 | G75: 73 | H75: Presidential Memorandum -- A Comprehensive Federal Strategy on Carbon Capture and Storage | I75: 2010-02-03 | J75: of:=[.I75]-ObamaInauguration -> 379
B76: 13562 | C76: Recruiting and Hiring Students and Recent Graduates | D76: 2010-12-27 | E76: of:=[.D76]-ObamaInauguration -> 706 | G76: 74 | H76: Presidential Memorandum Regarding India | I76: 2010-02-03 | J76: of:=[.I76]-ObamaInauguration -> 379
B77: 13563 | C77: Improving Regulation and Regulatory Review | D77: 2011-01-18 | E77: of:=[.D77]-ObamaInauguration -> 728 | G77: 75 | H77: Presidential Memorandum -- Establishing a Task Force on Childhood Obesity | I77: 2010-02-09 | J77: of:=[.I77]-ObamaInauguration -> 385
B78: 13564 | C78: Establishment of The President's Council on Jobs and Competitiveness | D78: 2011-01-31 | E78: of:=[.D78]-ObamaInauguration -> 741 | G78: 76 | H78: Presidential Memorandum Regarding Finding and Recapturing Improper Payments | I78: 2010-03-10 | J78: of:=[.I78]-ObamaInauguration -> 414
B79: 13565 | C79: Establishment of the Intellectual Property Enforcement Advisory Committees | D79: 2011-02-08 | E79: of:=[.D79]-ObamaInauguration -> 749 | G79: 77 | H79: Presidential Memorandum - US-India Nuclear Cooperation Approval and Nonproliferation Enhancement Act | I79: 2010-03-10 | J79: of:=[.I79]-ObamaInauguration -> 414
B80: 13566 | C80: Blocking Property and Prohibiting Certain Transactions Related to Libya | D80: 2011-02-25 | E80: of:=[.D80]-ObamaInauguration -> 766 | G80: 78 | H80: Presidential Memorandum-- Deferred Enforced Departure for Liberians | I80: 2010-03-19 | J80: of:=[.I80]-ObamaInauguration -> 423
B81: 13567 | C81: Periodic Review of Individuals Detained at Guantánamo Bay Naval Station Pursuant to the Authorization for Use of Military Force | D81: 2011-03-07 | E81: of:=[.D81]-ObamaInauguration -> 776 | G81: 79 | H81: Presidential Memorandum--United States Outer Continental Shelf | I81: 2010-03-31 | J81: of:=[.I81]-ObamaInauguration -> 435
B82: 13568 | C82: Extending Provisions of the International Organization Immunities Act to the Office of the High Representative in Bosnia and Herzegovina and the International Civilian Office in Kosovo | D82: 2011-03-08 | E82: of:=[.D82]-ObamaInauguration -> 777 | G82: 80 | H82: Presidential Memorandum-Delegation of a Reporting Authority | I82: 2010-04-07 | J82: of:=[.I82]-ObamaInauguration -> 442
B83: 13569 | C83: Amendments to Executive Orders 12824, 12835, 12859, and 13532, Reestablishment Pursuant to Executive Order 13498, and Revocation of Executive Order 13507 | D83: 2011-04-05 | E83: of:=[.D83]-ObamaInauguration -> 805 | G83: 81 | H83: Presidential Determination - Waiver of and Certification of Statutory Provisions Regarding the Palestine Liberation Organization Office | I83: 2010-04-07 | J83: of:=[.I83]-ObamaInauguration -> 442
B84: 13570 | C84: Prohibiting Certain Transactions with Respect to North Korea | D84: 2011-04-18 | E84: of:=[.D84]-ObamaInauguration -> 818 | G84: 82 | H84: Presidential Determination - Waiver of Restriction on Providing Funds to the Palestinian Authority | I84: 2010-04-07 | J84: of:=[.I84]-ObamaInauguration -> 442
B85: 13571 | C85: Streamlining Service Delivery and Improving Customer Service | D85: 2011-04-27 | E85: of:=[.D85]-ObamaInauguration -> 827 | G85: 83 | H85: Presidential Memorandum - Hospital Visitation | I85: 2010-04-15 | J85: of:=[.I85]-ObamaInauguration -> 450
B86: 13572 | C86: Blocking Property of Certain Persons with Respect to Human Rights Abuses in Syria | D86: 2011-04-29 | E86: of:=[.D86]-ObamaInauguration -> 829 | G86: 84 | H86: Presidential Memorandum -- America's Great Outdoors | I86: 2010-04-16 | J86: of:=[.I86]-ObamaInauguration -> 451
B87: 13573 | C87: Blocking Property of Senior Officials of the Government of Syria | D87: 2011-05-18 | E87: of:=[.D87]-ObamaInauguration -> 848 | G87: 85 | H87: Presidential Proclamation- National Day of Service and Remembrance for Victims and Survivors of Terrorism | I87: 2010-04-16 | J87: of:=[.I87]-ObamaInauguration -> 451
B88: 13574 | C88: Authorizing the Implementation of Certain Sanctions Set Forth in the Iran Sanctions Act of 1996, as Amended | D88: 2011-05-23 | E88: of:=[.D88]-ObamaInauguration -> 853 | G88: 86 | H88: Presidential Memorandum -- National Defense Authorization Act | I88: 2010-04-22 | J88: of:=[.I88]-ObamaInauguration -> 457
B89: 13575 | C89: Establishment of the White House Rural Council | D89: 2011-06-09 | E89: of:=[.D89]-ObamaInauguration -> 870 | G89: 87 | H89: Presidential Memorandum on the Interagency Task Force on Federal Contracting Opportunities for Small Businesses | I89: 2010-04-26 | J89: of:=[.I89]-ObamaInauguration -> 461
B90: 13576 | C90: Delivering an Efficient, Effective, and Accountable Government | D90: 2011-06-13 | E90: of:=[.D90]-ObamaInauguration -> 874 | G90: 88 | H90: Presidential Memorandums -- National Defense Authorization Act | I90: 2010-04-28 | J90: of:=[.I90]-ObamaInauguration -> 463
B91: 13577 | C91: Establishment of the SelectUSA Initiative | D91: 2011-06-15 | E91: of:=[.D91]-ObamaInauguration -> 876 | G91: 89 | H91: Presidential Memorandums--United States-India Peaceful Atomic Energy Cooperation Act | I91: 2010-04-28 | J91: of:=[.I91]-ObamaInauguration -> 463
B92: 13578 | C92: Coordinating Policies on Automotive Communities and Workers | D92: 2011-07-06 | E92: of:=[.D92]-ObamaInauguration -> 897 | G92: 90 | H92: Presidential Memoranda-- Task Force on Space Industry WorkForce and Economic Development | I92: 2010-05-03 | J92: of:=[.I92]-ObamaInauguration -> 468
B93: 13579 | C93: Regulation and Independent Regulatory Agencies | D93: 2011-07-11 | E93: of:=[.D93]-ObamaInauguration -> 902 | G93: 91 | H93: Presidential Memorandum - United States-India Nuclear Cooperation Approval and Nonproliferation Enhancement Act | I93: 2010-05-04 | J93: of:=[.I93]-ObamaInauguration -> 469
B94: 13580 | C94: Interagency Working Group on Coordination of Domestic Energy Development and Permitting in Alaska | D94: 2011-07-12 | E94: of:=[.D94]-ObamaInauguration -> 903 | G94: 92 | H94: Presidential Memorandum--- Concerning a Nuclear Agreement with Australia. | I94: 2010-05-05 | J94: of:=[.I94]-ObamaInauguration -> 470
B95: 13581 | C95: Blocking Property of Transnational Criminal Organizations | D95: 2011-07-24 | E95: of:=[.D95]-ObamaInauguration -> 915 | G95: 93 | H95: Memorandum from the President Regarding a Peaceful Nuclear Agreement with Russia | I95: 2010-05-10 | J95: of:=[.I95]-ObamaInauguration -> 475
B96: 13582 | C96: Blocking Property of the Government of Syria and Prohibiting Certain Transactions With Respect to Syria | D96: 2011-08-17 | E96: of:=[.D96]-ObamaInauguration -> 939 | G96: 94 | H96: Presidential Memorandum -- Improving the Federal Recruitment and Hiring Process | I96: 2010-05-11 | J96: of:=[.I96]-ObamaInauguration -> 476
B97: 13583 | C97: Establishing a Coordinated Government-Wide Initiative to Promote Diversity and Inclusion in the Federal Workforce | D97: 2011-08-18 | E97: of:=[.D97]-ObamaInauguration -> 940 | G97: 95 | H97: Presidential Memorandum--Oil Supplemental Package | I97: 2010-05-12 | J97: of:=[.I97]-ObamaInauguration -> 477
B98: 13584 | C98: Developing an Integrated Strategic Counterterrorism Communications Initiative and Establishing a Temporary Organization to Support Certain Government-Wide Communications Activities Directed Abroad | D98: 2011-09-09 | E98: of:=[.D98]-ObamaInauguration -> 962 | G98: 96 | H98: Text of a Letter from the President Regarding the National Defense Authorization Act | I98: 2010-05-13 | J98: of:=[.I98]-ObamaInauguration -> 478
B99: 13585 | C99: Continuance of Certain Federal Advisory Committees | D99: 2011-09-30 | E99: of:=[.D99]-ObamaInauguration -> 983 | G99: 97 | H99: Presidential Memorandum Regarding Fuel Efficiency Standards | I99: 2010-05-21 | J99: of:=[.I99]-ObamaInauguration -> 486
B100: 13586 | C100: Establishing an Emergency Board to Investigate Disputes Between Certain Railroads Represented by the National Carriers' Conference Committee of the National Railway Labor Conference and Their Employees Represented by Certain Labor Organizations | D100: 2011-10-06 | E100: of:=[.D100]-ObamaInauguration -> 989 | G100: 98 | H100: Presidential Memorandum Designating the Chairperson of the Defense Production Act Committee | I100: 2010-06-01 | J100: of:=[.I100]-ObamaInauguration -> 497
B101: 13587 | C101: Structural Reforms to Improve the Security of Classified Networks and the Responsible Sharing and Safeguarding of Classified Information | D101: 2011-10-07 | E101: of:=[.D101]-ObamaInauguration -> 990 | G101: 99 | H101: Presidential Memorandum-Extension of Benefits to Same-Sex Domestic Partners of Federal Employees | I101: 2010-06-02 | J101: of:=[.I101]-ObamaInauguration -> 498
B102: 13588 | C102: Reducing Prescription Drug Shortages | D102: 2011-10-31 | E102: of:=[.D102]-ObamaInauguration -> 1014 | G102: 100 | H102: Presidential Memorandum--Suspension of Limitations Under the Jerusalem Embassy Act | I102: 2010-06-02 | J102: of:=[.I102]-ObamaInauguration -> 498
B103: 13589 | C103: Promoting Efficient Spending | D103: 2011-11-09 | E103: of:=[.D103]-ObamaInauguration -> 1023 | G103: 101 | H103: Presidential Memorandum--Delegation of Authority to Appoint Commissioned Officers of the Ready Reserve Corps of the Public Health Service | I103: 2010-06-02 | J103: of:=[.I103]-ObamaInauguration -> 498
B104: 13590 | C104: Authorizing the Imposition of Certain Sanctions with Respect to the Provision of Goods, Services, Technology, or Support for Iran's Energy and Petrochemical Sectors | D104: 2011-11-20 | E104: of:=[.D104]-ObamaInauguration -> 1034 | G104: 102 | H104: Presidential Memorandum--Unexpected Urgent Refugee and Migration Needs Related to Somalia and Food Pipeline Breaks for Refugee and Other Displaced Populations of Concern Globally | I104: 2010-06-09 | J104: of:=[.I104]-ObamaInauguration -> 505
B105: 13591 | C105: Continuance of Certain Federal Advisory Committees | D105: 2011-11-23 | E105: of:=[.D105]-ObamaInauguration -> 1037 | G105: 103 | H105: Presidential Memorandum--Disposing of Unneeded Federal Real Estate | I105: 2010-06-10 | J105: of:=[.I105]-ObamaInauguration -> 506
B106: 13592 | C106: Improving American Indian and Alaska Native Educational Opportunities and Strengthening Tribal Colleges and Universities | D106: 2011-12-02 | E106: of:=[.D106]-ObamaInauguration -> 1046 | G106: 104 | H106: Presidential Memorandum--Enhancing Payment Accuracy Through a "Do Not Pay List" | I106: 2010-06-18 | J106: of:=[.I106]-ObamaInauguration -> 514
B107: 13593 | C107: 2011 Amendments to the Manual for Courts-Martial, United States | D107: 2011-12-13 | E107: of:=[.D107]-ObamaInauguration -> 1057 | G107: 105 | H107: Presidential Memorandum--Lobbyists on Agency Boards and Commissions | I107: 2010-06-18 | J107: of:=[.I107]-ObamaInauguration -> 514
B108: 13594 | C108: Adjustments of Certain Rates of Pay | D108: 2011-12-19 | E108: of:=[.D108]-ObamaInauguration -> 1063 | G108: 106 | H108: Memorandum from the President to the Secretary of Health and Human Services Regarding H.R. 3962 | I108: 2010-06-25 | J108: of:=[.I108]-ObamaInauguration -> 521
B109: 13595 | C109: Instituting a National Action Plan on Women, Peace, and Security | D109: 2011-12-19 | E109: of:=[.D109]-ObamaInauguration -> 1063 | G109: 107 | H109: Presidential Memorandum: Unleashing the Wireless Broadband Revolution | I109: 2010-06-28 | J109: of:=[.I109]-ObamaInauguration -> 524
B110: 13596 | C110: Amendments to Executive Orders 12131 and 13539 | D110: 2011-12-19 | E110: of:=[.D110]-ObamaInauguration -> 1063 | G110: 108 | H110: Memorandum from the President on the Long-Term Gulf Coast Restoration Support Plan | I110: 2010-06-30 | J110: of:=[.I110]-ObamaInauguration -> 526
B111: 13597 | C111: Establishing Visa and Foreign Visitor Processing Goals and the Task Force on Travel and Competitiveness | D111: 2012-01-19 | E111: of:=[.D111]-ObamaInauguration -> 1094 | G111: 109 | H111: Presidential Memorandum--Implementation of the National HIV/AIDS Strategy | I111: 2010-07-13 | J111: of:=[.I111]-ObamaInauguration -> 539
B112: 13598 | C112: Assignment of Functions Relating to Certain Promotion and Appointment Actions in the Armed Forces | D112: 2012-01-27 | E112: of:=[.D112]-ObamaInauguration -> 1102 | G112: 110 | H112: Presidential Memorandum--The Presidential POWER Initiative: Protecting Our Workers and Ensuring Reemployment | I112: 2010-07-19 | J112: of:=[.I112]-ObamaInauguration -> 545
B113: 13599 | C113: Blocking Property of the Government of Iran and Iranian Financial Institutions | D113: 2012-02-05 | E113: of:=[.D113]-ObamaInauguration -> 1111 | G113: 111 | H113: Presidential Memorandum -- Delegation of Certain Functions and Authorities | I113: 2010-07-21 | J113: of:=[.I113]-ObamaInauguration -> 547
B114: 13600 | C114: Establishing the President's Global Development Council | D114: 2012-02-09 | E114: of:=[.D114]-ObamaInauguration -> 1115 | G114: 112 | H114: Presidential Memorandum--Delegation of Certain Functions Under Section 3134 of the National Defense Authorization Act | I114: 2010-07-21 | J114: of:=[.I114]-ObamaInauguration -> 547
B115: 13601 | C115: Establishment of the Interagency Trade Enforcement Center | D115: 2012-02-28 | E115: of:=[.D115]-ObamaInauguration -> 1134 | G115: 113 | H115: Presidential Memorandum--Delegation of Certain Functions Under Section 1264 of the Victims of Iranian Censorship Act | I115: 2010-07-21 | J115: of:=[.I115]-ObamaInauguration -> 547
B116: 13602 | C116: Establishing a White House Council on Strong Cities, Strong Communities | D116: 2012-03-15 | E116: of:=[.D116]-ObamaInauguration -> 1150 | G116: 114 | H116: Presidential Memorandum--Arctic Research and Policy Act | I116: 2010-07-22 | J116: of:=[.I116]-ObamaInauguration -> 548
B117: 13603 | C117: National Defense Resources Preparedness | D117: 2012-03-16 | E117: of:=[.D117]-ObamaInauguration -> 1151 | G117: 115 | H117: Presidential Memorandum--Freeze Discretionary Awards, Bonuses and Similar Payments | I117: 2010-08-03 | J117: of:=[.I117]-ObamaInauguration -> 560
B118: 13604 | C118: Improving Performance of Federal Permitting and Review of Infrastructure Projects | D118: 2012-03-22 | E118: of:=[.D118]-ObamaInauguration -> 1157 | G118: 116 | H118: Presidential Memorandum--Continuation of U.S. Drug Interdiction Assistance to the Government of Columbia | I118: 2010-08-12 | J118: of:=[.I118]-ObamaInauguration -> 569
B119: 13605 | C119: Supporting Safe and Responsible Development of Unconventional Domestic Natural Gas Resources | D119: 2012-04-13 | E119: of:=[.D119]-ObamaInauguration -> 1179 | G119: 117 | H119: Presidential Memorandum--Designation of Officials to Act as Director of the Court Services and Offender Supervision Agency | I119: 2010-08-17 | J119: of:=[.I119]-ObamaInauguration -> 574
B120: 13606 | C120: Blocking the Property and Suspending Entry into the United States of Certain Persons with Respect to Grave Human Rights Abuses by the Governments of Iran and Syria via Information Technology | D120: 2012-04-23 | E120: of:=[.D120]-ObamaInauguration -> 1189 | G120: 118 | H120: Letter from the President -- Blocking Property of Certain Persons with Respect to North Korea | I120: 2010-08-30 | J120: of:=[.I120]-ObamaInauguration -> 587
B121: 13607 | C121: Establishing Principles of Excellence for Educational Institutions Serving Service Members, Veterans, Spouses, and Other Family Members | D121: 2012-04-27 | E121: of:=[.D121]-ObamaInauguration -> 1193 | G121: 119 | H121: Presidential Memorandum-Continuation of Authorities Under the Trading With the Enemy Act | I121: 2010-09-02 | J121: of:=[.I121]-ObamaInauguration -> 590
B122: 13608 | C122: Prohibiting Certain Transactions with and Suspending Entry into the United States of Foreign Sanctions Evaders with Respect to Iran and Syria | D122: 2012-05-01 | E122: of:=[.D122]-ObamaInauguration -> 1197 | G122: 120 | H122: Presidential Memorandum-- Unexpected Urgent Refugee and Migration Needs Resulting from Flooding in Pakistan | I122: 2010-09-03 | J122: of:=[.I122]-ObamaInauguration -> 591
B123: 13609 | C123: Promoting International Regulatory Cooperation | D123: 2012-05-01 | E123: of:=[.D123]-ObamaInauguration -> 1197 | G123: 121 | H123: Presidential Memorandum--Trafficking in Persons | I123: 2010-09-13 | J123: of:=[.I123]-ObamaInauguration -> 601
B124: 13610 | C124: Identifying and Reducing Regulatory Burdens | D124: 2012-05-10 | E124: of:=[.D124]-ObamaInauguration -> 1206 | G124: 122 | H124: Presidential Memorandum--Accountable Government Initiative | I124: 2010-09-14 | J124: of:=[.I124]-ObamaInauguration -> 602
B125: 13611 | C125: Blocking Property of Persons Threatening the Peace, Security, or Stability of Yemen | D125: 2012-05-16 | E125: of:=[.D125]-ObamaInauguration -> 1212 | G125: 123 | H125: Presidential Memorandum--Major Illicit Drug Transit or Major Illicit Drug Producing Countries | I125: 2010-09-16 | J125: of:=[.I125]-ObamaInauguration -> 604
B126: 13612 | C126: Providing an Order of Succession Within the Department of Agriculture | D126: 2012-05-21 | E126: of:=[.D126]-ObamaInauguration -> 1217 | G126: 124 | H126: Presidential Memorandum--Trafficking Victims Protection Reauthorization Act Delegation of Authority | I126: 2010-09-20 | J126: of:=[.I126]-ObamaInauguration -> 608
B127: 13613 | C127: Providing an Order of Succession Within the Department of Commerce | D127: 2012-05-21 | E127: of:=[.D127]-ObamaInauguration -> 1217 | G127: 125 | H127: Presidential Memorandum--Iran Sanctions Act | I127: 2010-09-23 | J127: of:=[.I127]-ObamaInauguration -> 611
B128: 13614 | C128: Providing an Order of Succession Within the Environmental Protection Agency | D128: 2012-05-21 | E128: of:=[.D128]-ObamaInauguration -> 1217 | G128: 126 | H128: Presidential Memorandum--Aviation Insurance Coverage | I128: 2010-09-29 | J128: of:=[.I128]-ObamaInauguration -> 617
B129: 13615 | C129: Providing an Order of Succession Within the Office of Management and Budget | D129: 2012-05-21 | E129: of:=[.D129]-ObamaInauguration -> 1217 | G129: 127 | H129: Presidential Memorandum--Task Force on Skills for America's Future | I129: 2010-10-04 | J129: of:=[.I129]-ObamaInauguration -> 622
B130: 13616 | C130: Accelerating Broadband Infrastructure Deployment | D130: 2012-06-14 | E130: of:=[.D130]-ObamaInauguration -> 1241 | G130: 128 | H130: Presidential Memorandum--Providing Funds to the Palestinian Authority | I130: 2010-10-07 | J130: of:=[.I130]-ObamaInauguration -> 625
B131: 13617 | C131: Blocking Property of the Government of the Russian Federation Relating to the Disposition of Highly Enriched Uranium Extracted From Nuclear Weapons | D131: 2012-06-25 | E131: of:=[.D131]-ObamaInauguration -> 1252 | G131: 129 | H131: Presidential Memorandum--H.R. 3808 | I131: 2010-10-08 | J131: of:=[.I131]-ObamaInauguration -> 626
B132: 13618 | C132: Assignment of National Security and Emergency Preparedness Communications Functions | D132: 2012-07-06 | E132: of:=[.D132]-ObamaInauguration -> 1263 | G132: 130 | H132: Presidential Memorandum--Refugee Admissions | I132: 2010-10-08 | J132: of:=[.I132]-ObamaInauguration -> 626
B133: 13619 | C133: Blocking Property of Persons Threatening the Peace, Security, or Stability of Burma | D133: 2012-07-11 | E133: of:=[.D133]-ObamaInauguration -> 1268 | G133: 131 | H133: Presidential Memorandum--U.S. Drug Interdiction Assistance to Brazil | I133: 2010-10-15 | J133: of:=[.I133]-ObamaInauguration -> 633
B134: 13620 | C134: Taking Additional Steps to Address the National Emergency With Respect to Somalia | D134: 2012-07-20 | E134: of:=[.D134]-ObamaInauguration -> 1277 | G134: 132 | H134: Presidential Memorandum--Child Soldiers Prevention Act | I134: 2010-10-25 | J134: of:=[.I134]-ObamaInauguration -> 643
B135: 13621 | C135: White House Initiative on Educational Excellence for African Americans | D135: 2012-07-26 | E135: of:=[.D135]-ObamaInauguration -> 1283 | G135: 133 | H135: Message from the President to the Senate on the Bilateral Tax Agreement with Luxembourg | I135: 2010-11-15 | J135: of:=[.I135]-ObamaInauguration -> 664
B136: 13622 | C136: Authorizing Additional Sanctions With Respect to Iran | D136: 2012-07-30 | E136: of:=[.D136]-ObamaInauguration -> 1287 | G136: 134 | H136: Message from the President to the Senate on the Bilateral Tax Agreement with Hungary | I136: 2010-11-15 | J136: of:=[.I136]-ObamaInauguration -> 664
B137: 13623 | C137: Preventing and Responding to Violence Against Women and Girls Globally | D137: 2012-08-10 | E137: of:=[.D137]-ObamaInauguration -> 1298 | G137: 135 | H137: Presidential Memorandum--Sudan | I137: 2010-11-19 | J137: of:=[.I137]-ObamaInauguration -> 668
B138: 13624 | C138: Accelerating Investment in Industrial Energy Efficiency | D138: 2012-08-30 | E138: of:=[.D138]-ObamaInauguration -> 1318 | G138: 136 | H138: Presidential Memorandum--Review of Human Subjects Protection | I138: 2010-11-24 | J138: of:=[.I138]-ObamaInauguration -> 673
B139: 13625 | C139: Improving Access to Mental Health Services for Veterans, Service Members, and Military Families | D139: 2012-08-31 | E139: of:=[.D139]-ObamaInauguration -> 1319 | G139: 137 | H139: Presidential Memorandum--Jerusalem Embassy Act | I139: 2010-12-03 | J139: of:=[.I139]-ObamaInauguration -> 682
B140: 13626 | C140: Gulf Coast Ecosystem Restoration | D140: 2012-09-10 | E140: of:=[.D140]-ObamaInauguration -> 1329 | G140: 138 | H140: Presidential Memorandum--Delegation of Certain Functions and Authorities | I140: 2010-12-20 | J140: of:=[.I140]-ObamaInauguration -> 699
B141: 13627 | C141: Strengthening Protections Against Trafficking In Persons In Federal Contracts | D141: 2012-09-25 | E141: of:=[.D141]-ObamaInauguration -> 1344 | G141: 139 | H141: Memorandum -- Adjustments of Certain Rates of Pay | I141: 2010-12-22 | J141: of:=[.I141]-ObamaInauguration -> 701
B142: 13628 | C142: Authorizing the Implementation of Certain Sanctions Set Forth in the Iran Threat Reduction and Syria Human Rights Act of 2012 and Additional Sanctions with respect to Iran | D142: 2012-10-09 | E142: of:=[.D142]-ObamaInauguration -> 1358 | G142: 140 | H142: Presidential Memorandum -- Disestablishment of United States Joint Forces Command | I142: 2011-01-06 | J142: of:=[.I142]-ObamaInauguration -> 716
B143: 13629 | C143: Establishing the White House Homeland Security Partnership Council | D143: 2012-10-26 | E143: of:=[.D143]-ObamaInauguration -> 1375 | G143: 141 | H143: Memorandum from the President regarding the Richard C. Holbrooke Award for Diplomacy | I143: 2011-01-14 | J143: of:=[.I143]-ObamaInauguration -> 724
B144: 13630 | C144: Establishment of an Interagency Task Force on Commercial Advocacy | D144: 2012-12-06 | E144: of:=[.D144]-ObamaInauguration -> 1416 | G144: 142 | H144: Presidential Memoranda - Regulatory Compliance | I144: 2011-01-18 | J144: of:=[.I144]-ObamaInauguration -> 728
B145: 13631 | C145: Reestablishment of Advisory Group | D145: 2012-12-07 | E145: of:=[.D145]-ObamaInauguration -> 1417 | G145: 143 | H145: Presidential Memoranda - Regulatory Flexibility, Small Business, and Job Creation | I145: 2011-01-18 | J145: of:=[.I145]-ObamaInauguration -> 728
B146: 13632 | C146: Establishing the Hurricane Sandy Rebuilding Task Force | D146: 2012-12-07 | E146: of:=[.D146]-ObamaInauguration -> 1417 | G146: 144 | H146: Presidential Memorandum--National Defense Authorization Act | I146: 2011-02-07 | J146: of:=[.I146]-ObamaInauguration -> 748
B147: 13633 | C147: Closing of Executive Departments and Agencies of the Federal Government on Monday, December 24, 2012 | D147: 2012-12-21 | E147: of:=[.D147]-ObamaInauguration -> 1431 | G147: 145 | H147: Presidential Memorandum -- Delegation of Reporting and Other Authorities | I147: 2011-02-14 | J147: of:=[.I147]-ObamaInauguration -> 755
B148: 13634 | C148: Reestablishment of Advisory Commission | D148: 2012-12-21 | E148: of:=[.D148]-ObamaInauguration -> 1431 | G148: 146 | H148: Presidential Memorandum--Administrative Flexibility | I148: 2011-02-28 | J148: of:=[.I148]-ObamaInauguration -> 769
B149: 13635 | C149: Adjustments of Certain Rates of Pay | D149: 2012-12-27 | E149: of:=[.D149]-ObamaInauguration -> 1437 | G149: 147 | H149: Presidential Memorandum -- Enhanced Collection of Relevant Data and Statistics Relating to Women | I149: 2011-03-04 | J149: of:=[.I149]-ObamaInauguration -> 773
B150: 13636 | C150: Improving Critical Infrastructure Cybersecurity[5] | D150: 2013-02-12 | E150: of:=[.D150]-ObamaInauguration -> 1484 | G150: 148 | H150: Presidential Memorandum-Unexpected Urgent Refugee and Migration Needs Related to Cote d'Ivoire | I150: 2011-03-07 | J150: of:=[.I150]-ObamaInauguration -> 776
B151: 13637 | C151: Administration of Reformed Export Controls | D151: 2013-03-08 | E151: of:=[.D151]-ObamaInauguration -> 1508 | G151: 149 | H151: Presidential Memorandum-Unexpected Urgent Refugee and Migration Needs Related to Libya | I151: 2011-03-07 | J151: of:=[.I151]-ObamaInauguration -> 776
B152: 13638 | C152: Amendments to Executive Order 12777 | D152: 2013-03-15 | E152: of:=[.D152]-ObamaInauguration -> 1515 | G152: 150 | H152: Presidential Memorandum--The Designation of Officers of the Office of the Director of National Intelligence to Act as Director of National Intelligence | I152: 2011-03-08 | J152: of:=[.I152]-ObamaInauguration -> 777
B153: 13639 | C153: Establishment of the Presidential Commission of Election Administration | D153: 2013-03-28 | E153: of:=[.D153]-ObamaInauguration -> 1528 | G153: 151 | H153: Presidential Memorandum--Government Reform for Competitiveness and Innovation | I153: 2011-03-11 | J153: of:=[.I153]-ObamaInauguration -> 780
B154: 13640 | C154: Continuance of Advisory Council | D154: 2013-04-05 | E154: of:=[.D154]-ObamaInauguration -> 1536 | G154: 152 | H154: Letter from the President regarding the commencement of operations in Libya | I154: 2011-03-21 | J154: of:=[.I154]-ObamaInauguration -> 790
B155: 13641 | C155: Adjustments of Certain Rates of Pay | D155: 2013-04-05 | E155: of:=[.D155]-ObamaInauguration -> 1536 | G155: 153 | H155: Letter from the President regarding a Report on Afghanistan and Pakistan | I155: 2011-04-05 | J155: of:=[.I155]-ObamaInauguration -> 805
B156: 13642 | C156: Making Open and Machine Readable the New Default for Government Information | D156: 2013-05-09 | E156: of:=[.D156]-ObamaInauguration -> 1570 | G156: 154 | H156: Presidential Memorandum--Unified Command Plan 2011 | I156: 2011-04-06 | J156: of:=[.I156]-ObamaInauguration -> 806
B157: 13643 | C157: 2013 Amendments to the Manual for Courts-Martial, United States | D157: 2013-05-15 | E157: of:=[.D157]-ObamaInauguration -> 1576 | G157: 155 | H157: Presidential Memorandum--Delegation of Functions and Authority under Sections 315 and 325 of Title 32, United States Code | I157: 2011-04-14 | J157: of:=[.I157]-ObamaInauguration -> 814
B158: 13644 | C158: Amendment to Executive Order 13639 | D158: 2013-05-21 | E158: of:=[.D158]-ObamaInauguration -> 1582 | G158: 156 | H158: Presidential Memorandum--Libya | I158: 2011-04-26 | J158: of:=[.I158]-ObamaInauguration -> 826
B159: 13645 | C159: Authorizing the Implementation of Certain Sanctions Set Forth in the Iran Freedom and Counter-Proliferation Act of 2012 and Additional Sanctions with Respect to Iran | D159: 2013-06-03 | E159: of:=[.D159]-ObamaInauguration -> 1595 | G159: 157 | H159: Text of a Letter--Blocking Property of Senior Officials of the Government of Syria | I159: 2011-05-18 | J159: of:=[.I159]-ObamaInauguration -> 848
B160: 13646 | C160: Establishing the President's Advisory Council on Financial Capability for Young Americans | D160: 2013-06-25 | E160: of:=[.D160]-ObamaInauguration -> 1617 | G160: 158 | H160: Message to the Congress Concerning Further Sanctions on Iran | I160: 2011-05-23 | J160: of:=[.I160]-ObamaInauguration -> 853
B161: 13647 | C161: Establishing the White House Council on Native American Affairs | D161: 2013-06-26 | E161: of:=[.D161]-ObamaInauguration -> 1618 | G161: 159 | H161: Presidential Memorandum--Federal Fleet Performance | I161: 2011-05-24 | J161: of:=[.I161]-ObamaInauguration -> 854
B162: 13648 | C162: Combating Wildlife Trafficking | D162: 2013-07-01 | E162: of:=[.D162]-ObamaInauguration -> 1623 | G162: 160 | H162: Text of a letter from the President regarding Poland and the Visa Waiver Program | I162: 2011-05-28 | J162: of:=[.I162]-ObamaInauguration -> 858
B163: 13649 | C163: Accelerating Improvements in HIV Prevention and Care in the United States Through the HIV Care Continuum Initiative | D163: 2013-07-15 | E163: of:=[.D163]-ObamaInauguration -> 1637 | G163: 161 | H163: Presidential Memorandum--Delegation of Authority to Appoint Commissioned Officers of the Ready Reserve Crops of the Public Health Service | I163: 2011-05-31 | J163: of:=[.I163]-ObamaInauguration -> 861
B164: 13650 | C164: Improving Chemical Facility Safety and Security | D164: 2013-08-01 | E164: of:=[.D164]-ObamaInauguration -> 1654 | G164: 162 | H164: Presidential Memorandum--Jerusalem Embassy Act | I164: 2011-06-03 | J164: of:=[.I164]-ObamaInauguration -> 864
B165: 13651 | C165: Prohibiting Certain Imports of Burmese Jadeite and Rubies | D165: 2013-08-07 | E165: of:=[.D165]-ObamaInauguration -> 1660 | G165: 163 | H165: Presidential Memorandum--Overseas Private Investment Corporation | I165: 2011-06-06 | J165: of:=[.I165]-ObamaInauguration -> 867
B166: 13652 | C166: Continuance of Certain Federal Advisory Committees | D166: 2013-09-30 | E166: of:=[.D166]-ObamaInauguration -> 1714 | G166: 164 | H166: Presidential Memorandum--Unexpected Urgent Refugee and Migration Needs Related to Libya and Cote d'Ivoire | I166: 2011-06-09 | J166: of:=[.I166]-ObamaInauguration -> 870
B167: 13653 | C167: Preparing the United States for the Impacts of Climate Change | D167: 2013-11-01 | E167: of:=[.D167]-ObamaInauguration -> 1746 | G167: 165 | H167: Memorandum--Regulation and Independent Regulatory Agencies | I167: 2011-07-11 | J167: of:=[.I167]-ObamaInauguration -> 902
B168: 13654 | C168: Establishing an Emergency Board to Investigate Disputes Between the Long Island Rail Road Company and Certain of its Employees Represented by Certain Labor Organizations | D168: 2013-11-21 | E168: of:=[.D168]-ObamaInauguration -> 1766 | G168: 166 | H168: Letter from the President Regarding the Cuban Liberty and Democratic Solidarity Act of 1996 | I168: 2011-07-15 | J168: of:=[.I168]-ObamaInauguration -> 906
B169: 13655 | C169: Adjustments of Certain Rates of Pay | D169: 2013-12-23 | E169: of:=[.D169]-ObamaInauguration -> 1798 | G169: 167 | H169: Presidential Memorandum--Ike Skelton National Defense Authorization Act | I169: 2011-07-19 | J169: of:=[.I169]-ObamaInauguration -> 910
B170: 13656 | C170: Establishment of Afghanistan and Pakistan Strategic Partnership Office and Amendment to Executive Order 12163 | D170: 2014-01-17 | E170: of:=[.D170]-ObamaInauguration -> 1823 | G170: 168 | H170: Presidential Memorandum--Blocking Property of Transnational Criminal Organizations | I170: 2011-07-25 | J170: of:=[.I170]-ObamaInauguration -> 916
B171: 13657 | C171: Changing the Name of the National Security Staff to the National Security Council Staff | D171: 2014-02-10 | E171: of:=[.D171]-ObamaInauguration -> 1847 | G171: 169 | H171: Presidential Study Directive on Mass Atrocities | I171: 2011-08-04 | J171: of:=[.I171]-ObamaInauguration -> 926
B172: 13658 | C172: Establishing a Minimum Wage for Contractors | D172: 2014-02-12 | E172: of:=[.D172]-ObamaInauguration -> 1849 | G172: 170 | H172: Memorandum from the President Regarding the Unexpected Urgent Refugee and Migration Needs Related to the Horn of Africa | I172: 2011-08-08 | J172: of:=[.I172]-ObamaInauguration -> 930
B173: 13659 | C173: Streamlining the Export/Import Process for America's Businesses | D173: 2014-02-19 | E173: of:=[.D173]-ObamaInauguration -> 1856 | G173: 171 | H173: Memorandum from the President regarding the Continuation of U.S. Drug Interdiction Assistance to the Government of Colombia | I173: 2011-08-10 | J173: of:=[.I173]-ObamaInauguration -> 932
B174: 13660 | C174: Blocking Property of Certain Persons Contributing to the Situation in Ukraine | D174: 2014-03-06 | E174: of:=[.D174]-ObamaInauguration -> 1871 | G174: 172 | H174: Memorandum from the President Regarding Deferred Enforced Departure for Liberians | I174: 2011-08-16 | J174: of:=[.I174]-ObamaInauguration -> 938
B175: 13661 | C175: Blocking Property of Additional Persons Contributing to the Situation in Ukraine | D175: 2014-03-16 | E175: of:=[.D175]-ObamaInauguration -> 1881 | G175: 173 | H175: Presidential Memorandum--Blocking Property of the Government of Syria and Prohibiting Certain Transactions with Respect to Syria | I175: 2011-08-18 | J175: of:=[.I175]-ObamaInauguration -> 940
B176: 13662 | C176: Blocking Property of Additional Persons Contributing to the Situation in Ukraine pdf | D176: 2014-03-20 | E176: of:=[.D176]-ObamaInauguration -> 1885 | G176: 174 | H176: Letter from the President to the Speaker of the House of Representatives | I176: 2011-08-30 | J176: of:=[.I176]-ObamaInauguration -> 952
B177: 13663 | C177: Establishing an Emergency Board to Investigate Disputes Between the Long Island Rail Road Company and Certain of its Employees Represented by Certain Labor Organizations | D177: 2014-03-20 | E177: of:=[.D177]-ObamaInauguration -> 1885 | G177: 175 | H177: Presidential Memorandum--Waiver of Restriction on Providing Funds to the Palestinian Authority | I177: 2011-08-30 | J177: of:=[.I177]-ObamaInauguration -> 952
B178: 13664 | C178: Blocking Property of Certain Persons With Respect to South Sudan | D178: 2014-04-03 | E178: of:=[.D178]-ObamaInauguration -> 1899 | G178: 176 | H178: Presidential Memorandum--Speeding Infrastructure Development through More Efficient and Effective Permitting and Environmental Review | I178: 2011-08-31 | J178: of:=[.I178]-ObamaInauguration -> 953
B179: 13665 | C179: Non-Retaliation for Disclosure of Compensation Information | D179: 2014-04-08 | E179: of:=[.D179]-ObamaInauguration -> 1904 | G179: 177 | H179: Message from the President Regarding the Continuation of the National Emergency with Respect to Certain Terrorist Attacks | I179: 2011-09-09 | J179: of:=[.I179]-ObamaInauguration -> 962
B180: 13666 | C180: Expanding Eligibility for the Defense Meritorious Service Medal | D180: 2014-04-18 | E180: of:=[.D180]-ObamaInauguration -> 1914 | G180: 178 | H180: Notice from the President Regarding the Continuation of the National Emergency with Respect to Certain Terrorist Attacks | I180: 2011-09-09 | J180: of:=[.I180]-ObamaInauguration -> 962
B181: 13667 | C181: Blocking Property of Certain Persons Contributing to the Conflict in the Central African Republic | D181: 2014-05-12 | E181: of:=[.D181]-ObamaInauguration -> 1938 | G181: 179 | H181: Presidential Memorandum regarding Special Agent Samuel Hicks Families of Fallen Heroes Act | I181: 2011-09-12 | J181: of:=[.I181]-ObamaInauguration -> 965
B182: 13668 | C182: Ending Immunities Granted to the Development Fund for Iraq and Certain Other Iraqi Property and Interests in Property Pursuant to Executive Order 13303, as Amended | D182: 2014-05-27 | E182: of:=[.D182]-ObamaInauguration -> 1953 | G182: 180 | H182: Presidential Memorandum--American Jobs Act of 2011 | I182: 2011-09-12 | J182: of:=[.I182]-ObamaInauguration -> 965
B183: 13669 | C183: 2014 Amendments to the Manual for Courts-Martial, United States | D183: 2014-06-14 | E183: of:=[.D183]-ObamaInauguration -> 1971 | G183: 181 | H183: Memorandum from the President regarding the revisions to the Unified Command Plan 2011 | I183: 2011-09-12 | J183: of:=[.I183]-ObamaInauguration -> 965
B184: 13670 | C184: Establishing an Emergency Board to Investigate Disputes Between the Southeastern Pennsylvania Transportation Authority and Certain of Its Employees Represented by Certain Labor Organizations | D184: 2014-06-14 | E184: of:=[.D184]-ObamaInauguration -> 1971 | G184: 182 | H184: Presidential Memorandum--Trading With the Enemy Act | I184: 2011-09-13 | J184: of:=[.I184]-ObamaInauguration -> 966
B185: 13671 | C185: Taking Additional Steps to Address the National Emergency with Respect to the Conflict in the Democratic Republic of the Congo | D185: 2014-07-08 | E185: of:=[.D185]-ObamaInauguration -> 1995 | G185: 183 | H185: Message from the President to Congress | I185: 2011-09-15 | J185: of:=[.I185]-ObamaInauguration -> 968
B186: 13672 | C186: Further Amendments to Executive Order 11478, Equal Employment Opportunity in the Federal Government, and Executive Order 11246, Equal Employment Opportunity | D186: 2014-07-21 | E186: of:=[.D186]-ObamaInauguration -> 2008 | G186: 184 | H186: Memorandum Regarding Pelly Certification and Icelandic Whaling | I186: 2011-09-15 | J186: of:=[.I186]-ObamaInauguration -> 968
B187: 13673 | C187: Fair Pay and Safe Workplaces | D187: 2014-07-31 | E187: of:=[.D187]-ObamaInauguration -> 2018 | G187: 185 | H187: Presidential Memorandum--Major Illicit Drug Transit | I187: 2011-09-15 | J187: of:=[.I187]-ObamaInauguration -> 968
B188: 13674 | C188: Revised List of Quarantinable Communicable Diseases | D188: 2014-07-31 | E188: of:=[.D188]-ObamaInauguration -> 2018 | G188: 186 | H188: Presidential Memorandum--President’s Plan for Economic Growth and Deficit Reduction | I188: 2011-09-19 | J188: of:=[.I188]-ObamaInauguration -> 972
B189: 13675 | C189: Establishing the President's Advisory Council on Doing Business in Africa | D189: 2014-08-05 | E189: of:=[.D189]-ObamaInauguration -> 2023 | G189: 187 | H189: Notice regarding the Continuation of the National Emergency with Respect to Persons Who Commit, Threaten to Commit, or Support Terrorism | I189: 2011-09-21 | J189: of:=[.I189]-ObamaInauguration -> 974
B190: 13676 | C190: Combating Antibiotic-Resistant Bacteria | D190: 2014-09-18 | E190: of:=[.D190]-ObamaInauguration -> 2067 | G190: 188 | H190: Message from the President to Congress regarding the Continuation of the National Emergency with Respect to Persons Who Commit, Threaten to Commit, or Support Terrorism | I190: 2011-09-21 | J190: of:=[.I190]-ObamaInauguration -> 974
B191: 13677 | C191: Climate-Resilient International Development | D191: 2014-09-23 | E191: of:=[.D191]-ObamaInauguration -> 2072 | G191: 189 | H191: Memorandum from the President Regarding the Provision of Aviation Insurance Coverage for Commercial Air Carrier Service in Domestic and International Operations | I191: 2011-09-28 | J191: of:=[.I191]-ObamaInauguration -> 981
B192: 13678 | C192: Conversion Authority for Criminal Investigators (Special Agents) of the Bureau of Alcohol, Tobacco, Firearms, and Explosives | D192: 2014-10-03 | E192: of:=[.D192]-ObamaInauguration -> 2082 | G192: 190 | H192: Presidential Memorandum--Fiscal Year 2012 Refugee Admissions Numbers and Authorizations of In-Country Refugee Status | I192: 2011-09-30 | J192: of:=[.I192]-ObamaInauguration -> 983
B193: 13679 | C193: Establishing an Emergency Board to Investigate a Dispute Between the Southeastern Pennsylvania Transportation Authority and Its Locomotive Engineers Represented by the Brotherhood of Locomotive Engineers and Trainmen | D193: 2014-10-10 | E193: of:=[.D193]-ObamaInauguration -> 2089 | G193: 191 | H193: Presidential Memorandum--Trafficking in Persons | I193: 2011-09-30 | J193: of:=[.I193]-ObamaInauguration -> 983
B194: 13680 | C194: Ordering the Selected Reserve and Certain Individual Ready Reserve Members of the Armed Forces to Active Duty | D194: 2014-10-16 | E194: of:=[.D194]-ObamaInauguration -> 2095 | G194: 192 | H194: Letter from the President regarding a Report on Afghanistan and Pakistan | I194: 2011-09-30 | J194: of:=[.I194]-ObamaInauguration -> 983
B195: 13681 | C195: Improving the Security of Consumer Financial Transactions | D195: 2014-10-17 | E195: of:=[.D195]-ObamaInauguration -> 2096 | G195: 193 | H195: Messages from the President to Congress Regarding Trade Agreements--U.S.-Korea | I195: 2011-10-03 | J195: of:=[.I195]-ObamaInauguration -> 986
B196: 13682 | C196: Closing of Executive Departments and Agencies of the Federal Government on Friday, December 26, 2014 | D196: 2014-12-05 | E196: of:=[.D196]-ObamaInauguration -> 2145 | G196: 194 | H196: Messages from the President to Congress Regarding Trade Agreements--U.S.-Korea | I196: 2011-10-03 | J196: of:=[.I196]-ObamaInauguration -> 986
B197: 13683 | C197: Further Amendments to Executive Order 11030, Executive Order 13653, and Executive Order 13673 | D197: 2014-12-11 | E197: of:=[.D197]-ObamaInauguration -> 2151 | G197: 195 | H197: Messages from the President to Congress Regarding Trade Agreements--U.S.-Panama | I197: 2011-10-03 | J197: of:=[.I197]-ObamaInauguration -> 986
B198: 13684 | C198: Establishment of the President's Task Force on 21st Century Policing | D198: 2014-12-18 | E198: of:=[.D198]-ObamaInauguration -> 2158 | G198: 196 | H198: Messages from the President to Congress Regarding Trade Agreements--U.S.-Colombia | I198: 2011-10-03 | J198: of:=[.I198]-ObamaInauguration -> 986
B199: 13685 | C199: Blocking Property of Certain Persons and Prohibiting Certain Transactions With Respect to the Crimea Region of Ukraine | D199: 2014-12-19 | E199: of:=[.D199]-ObamaInauguration -> 2159 | G199: 197 | H199: Presidential Memorandum -- Child Soldiers Prevention Act of 2008 | I199: 2011-10-04 | J199: of:=[.I199]-ObamaInauguration -> 987
B200: 13686 | C200: Adjustments of Certain Rates of Pay | D200: 2014-12-19 | E200: of:=[.D200]-ObamaInauguration -> 2159 | G200: 198 | H200: Presidential Memorandum -- Provision of U.S. Drug Interdiction Assistance to the Government of Brazil | I200: 2011-10-14 | J200: of:=[.I200]-ObamaInauguration -> 997
B201: 13687 | C201: Imposing Additional Sanctions with Respect to North Korea | D201: 2015-01-02 | E201: of:=[.D201]-ObamaInauguration -> 2173 | G201: 199 | H201: Letter from the President to the Speaker of the House of Representatives and the President Pro Tempore of the Senate Regarding the Lord's Resistance Army | I201: 2011-10-14 | J201: of:=[.I201]-ObamaInauguration -> 997
B202: 13688 | C202: Federal Support for Local Law Enforcement Equipment Acquisition | D202: 2015-01-16 | E202: of:=[.D202]-ObamaInauguration -> 2187 | G202: 200 | H202: Notice Regarding the Continuation of the National Emergency with Respect to Significant Narcotics Traffickers Centered in Colombia | I202: 2011-10-19 | J202: of:=[.I202]-ObamaInauguration -> 1002
B203: 13689 | C203: Enhancing Coordination of National Efforts in the Arctic | D203: 2015-01-21 | E203: of:=[.D203]-ObamaInauguration -> 2192 | G203: 201 | H203: Message Regarding the Continuation of the National Emergency with Respect to Significant Narcotics Traffickers Centered in Colombia | I203: 2011-10-19 | J203: of:=[.I203]-ObamaInauguration -> 1002
B204: 13690 | C204: Establishing a Federal Flood Risk Management Standard and a Process for Further Soliciting and Considering Stakeholder Input | D204: 2015-01-30 | E204: of:=[.D204]-ObamaInauguration -> 2201 | G204: 202 | H204: Message -- Continuation of the National Emergency with Respect to the Situation in or in Relation to the Democratic Republic of the Congo | I204: 2011-10-25 | J204: of:=[.I204]-ObamaInauguration -> 1008
B205: 13691 | C205: Establishing a Federal Flood Risk Management Standard and a Process for Further Soliciting and Considering Stakeholder Input | D205: 2015-01-30 | E205: of:=[.D205]-ObamaInauguration -> 2201 | G205: 203 | H205: Notice -- Continuation of the National Emergency with Respect to the Situation in or in Relation to the Democratic Republic of the Congo | I205: 2011-10-25 | J205: of:=[.I205]-ObamaInauguration -> 1008
B206: 13692 | C206: Blocking Property and Suspending Entry of Certain Persons Contributing to the Situation in Venezuela | D206: 2015-03-08 | E206: of:=[.D206]-ObamaInauguration -> 2238 | G206: 204 | H206: Presidential Memorandum -- Accelerating Technology Transfer and Commercialization of Federal Research in Support of High-Growth Businesses | I206: 2011-10-28 | J206: of:=[.I206]-ObamaInauguration -> 1011
B207: 13693 | C207: Planning for Federal Sustainability in the Next Decade | D207: 2015-03-19 | E207: of:=[.D207]-ObamaInauguration -> 2249 | G207: 205 | H207: Presidential Memorandum -- Making it Easier for America's Small Businesses and America's Exporters to Access Government Services to Help Them Grow and Hire | I207: 2011-10-28 | J207: of:=[.I207]-ObamaInauguration -> 1011
B208: 13694 | C208: Blocking the Property of Certain Persons Engaging in Significant Malicious Cyber-Enabled Activities | D208: 2015-04-01 | E208: of:=[.D208]-ObamaInauguration -> 2262 | G208: 206 | H208: Message -- Continuation of the National Emergency with Respect to Sudan | I208: 2011-11-01 | J208: of:=[.I208]-ObamaInauguration -> 1015
B209: 13695 | C209: Termination of Emergency With Respect to the Risk of Nuclear Proliferation Created by the Accumulation of a Large Volume of Weapons-Usable Fissile Material in the Territory of the Russian Federation | D209: 2015-05-26 | E209: of:=[.D209]-ObamaInauguration -> 2317 | G209: 207 | H209: Notice -- Continuation of the National Emergency with Respect to Sudan | I209: 2011-11-01 | J209: of:=[.I209]-ObamaInauguration -> 1015
B210: 13696 | C210: 2015 Amendments to the Manual for Courts-Martial, United States | D210: 2015-06-17 | E210: of:=[.D210]-ObamaInauguration -> 2339 | G210: 208 | H210: Presidential Memorandum -- New START Treaty | I210: 2011-11-02 | J210: of:=[.I210]-ObamaInauguration -> 1016
B211: 13697 | C211: Amendment to Executive Order 11155, Awards for Special Capability in Career and Technical Education | D211: 2015-06-22 | E211: of:=[.D211]-ObamaInauguration -> 2344 | G211: 209 | H211: Notice -- Continuation of the National Emergency with Respect to Iran | I211: 2011-11-07 | J211: of:=[.I211]-ObamaInauguration -> 1021
B212: 13698 | C212: Hostage Recovery Activities | D212: 2015-06-24 | E212: of:=[.D212]-ObamaInauguration -> 2346 | G212: 210 | H212: Message -- Continuation of the National Emergency with Respect to Iran | I212: 2011-11-07 | J212: of:=[.I212]-ObamaInauguration -> 1021
B213: 13699 | C213: Establishing the Advisory Board on Toxic Substances and Worker Health | D213: 2015-06-26 | E213: of:=[.D213]-ObamaInauguration -> 2348 | G213: 211 | H213: Notice -- Continuation of the National Emergency with Respect to Weapons of Mass Destruction | I213: 2011-11-09 | J213: of:=[.I213]-ObamaInauguration -> 1023
B214: 13700 | C214: Establishing an Emergency Board to Investigate Disputes Between New Jersey Transit Rail and Certain of Its Employees Represented by Certain Labor Organizations | D214: 2015-07-15 | E214: of:=[.D214]-ObamaInauguration -> 2367 | G214: 212 | H214: Message -- Continuation of the National Emergency with Respect to Weapons of Mass Destruction | I214: 2011-11-09 | J214: of:=[.I214]-ObamaInauguration -> 1023
B215: 13701 | C215: Delegation of Certain Authorities and Assignment of Certain Functions Under the Bipartisan Congressional Trade Priorities and Accountability Act of 2015 | D215: 2015-07-17 | E215: of:=[.D215]-ObamaInauguration -> 2369 | G215: 213 | H215: Message from the President to the Senate -- Agreement on Port State Measures to Prevent, Deter, and Eliminate Illegal, Unreported, and Unregulated Fishing | I215: 2011-11-14 | J215: of:=[.I215]-ObamaInauguration -> 1028
B216: 13702 | C216: Creating a National Strategic Computing Initiative | D216: 2015-07-29 | E216: of:=[.D216]-ObamaInauguration -> 2381 | G216: 214 | H216: Message from the President to Congress -- Naval Petroleum Reserves | I216: 2011-11-17 | J216: of:=[.I216]-ObamaInauguration -> 1031
B217: 13703 | C217: Implementing the National HIV/AIDS Strategy for the United States for 2015-2020 | D217: 2015-07-30 | E217: of:=[.D217]-ObamaInauguration -> 2382 | G217: 215 | H217: Presidential Memorandum -- Managing Government Records | I217: 2011-11-28 | J217: of:=[.I217]-ObamaInauguration -> 1042
B218: 13704 | C218: Presidential Innovation Fellows Program | D218: 2015-08-17 | E218: of:=[.D218]-ObamaInauguration -> 2400 | G218: 216 | H218: We Can't Wait: President Signs Memorandum to Modernize Management of Government Records | I218: 2011-11-28 | J218: of:=[.I218]-ObamaInauguration -> 1042
B219: 13705 | C219: Designating the International Renewable Energy Agency as a Public International Organization Entitled to Enjoy Certain Privileges, Exemptions, and Immunities | D219: 2015-09-03 | E219: of:=[.D219]-ObamaInauguration -> 2417 | G219: 217 | H219: Presidential Memorandum -- Implementation of Energy Savings Projects and Performance-Based Contracting for Energy Savings | I219: 2011-12-02 | J219: of:=[.I219]-ObamaInauguration -> 1046
B220: 13706 | C220: Establishing Paid Sick Leave for Federal Contractors | D220: 2015-09-07 | E220: of:=[.D220]-ObamaInauguration -> 2421 | G220: 218 | H220: Presidential Memorandum -- Suspension of Limitations under the Jerusalem Embassy Act | I220: 2011-12-02 | J220: of:=[.I220]-ObamaInauguration -> 1046
B221: 13707 | C221: Using Behavioral Science Insights to Better Serve the American People | D221: 2015-09-15 | E221: of:=[.D221]-ObamaInauguration -> 2429 | G221: 219 | H221: Presidential Memorandum -- International Initiatives to Advance the Human Rights of Lesbian, Gay, Bisexual, and Transgender Persons | I221: 2011-12-06 | J221: of:=[.I221]-ObamaInauguration -> 1050
B222: 13708 | C222: Continuance or Reestablishment of Certain Federal Advisory Committees | D222: 2015-09-30 | E222: of:=[.D222]-ObamaInauguration -> 2444 | G222: 220 | H222: Presidential Memorandum -- Determinations under Section 1106(a) of the Omnibus Trade and Competitiveness Act of 1988 - Russian Federation | I222: 2011-12-15 | J222: of:=[.I222]-ObamaInauguration -> 1059
B223: 13709 | C223: National Security Medal | D223: 2015-10-02 | E223: of:=[.D223]-ObamaInauguration -> 2446 | G223: 221 | H223: Letter from the President to the Speaker of the House of Representatives and the President Pro Tempore of the Senate Regarding the War Powers Resolution | I223: 2011-12-15 | J223: of:=[.I223]-ObamaInauguration -> 1059
B224: 13710 | C224: Termination of Emergency With Respect to the Actions and Policies of Former Liberian President Charles Taylor | D224: 2015-11-12 | E224: of:=[.D224]-ObamaInauguration -> 2487 | G224: 222 | H224: Presidential Memorandum -- Flexible Implementation of the Mercury and Air Toxics Standards Rule | I224: 2011-12-21 | J224: of:=[.I224]-ObamaInauguration -> 1065
B225: 13711 | C225: Establishing an Emergency Board to Investigate Disputes Between New Jersey Transit Rail and Certain of Its Employees Represented by Certain Labor Organizations | D225: 2015-11-12 | E225: of:=[.D225]-ObamaInauguration -> 2487 | G225: 223 | H225: Statement by the President on H.R. 2055 | I225: 2011-12-23 | J225: of:=[.I225]-ObamaInauguration -> 1067
B226: 13712 | C226: Blocking Property of Certain Persons Contributing to the Situation in Burundi | D226: 2015-11-22 | E226: of:=[.D226]-ObamaInauguration -> 2497 | G226: 224 | H226: Letter from the President to the Speaker of the House of Representatives and the President of the Senate regarding the Consolidated Appropriations Act, 2012 | I226: 2011-12-23 | J226: of:=[.I226]-ObamaInauguration -> 1067
B227: 13713 | C227: Half-Day Closing of Executive Departments and Agencies of the Federal Government on Thursday, December 24, 2015 | D227: 2015-12-11 | E227: of:=[.D227]-ObamaInauguration -> 2516 | G227: 225 | H227: Presidential Memorandum -- Delegation of a Certain Function and Authority Conferred upon the President by Section 1235(c) of the Ike Skelton National Defense Authorization Act for Fiscal Year 2011 | I227: 2012-01-05 | J227: of:=[.I227]-ObamaInauguration -> 1080
B228: 13714 | C228: Strengthening the Senior Executive Service | D228: 2015-12-15 | E228: of:=[.D228]-ObamaInauguration -> 2520 | G228: 226 | H228: Presidential Memorandum--Presidential Determination on the Eligibility of South Sudan to Receive Defense Articles and Defense Services | I228: 2012-01-06 | J228: of:=[.I228]-ObamaInauguration -> 1081
B229: 13715 | C229: Adjustments of Certain Rates of Pay | D229: 2015-12-18 | E229: of:=[.D229]-ObamaInauguration -> 2523 | G229: 227 | H229: Presidential Memorandum -- Certification Concerning U.S. Participation in the United Nations Mission in South Sudan Consistent with Section 2005 of the American Servicemembers' Protection Act | I229: 2012-01-10 | J229: of:=[.I229]-ObamaInauguration -> 1085
B230: 13716 | C230: Revocation of Executive Orders 13574, 13590, 13622, and 13645 With Respect to Iran, Amendment of Executive Order 13628 With Respect to Iran, and Provision of Implementation Authorities for Aspects of Certain Statutory Sanctions Outside the Scope of U.S. Commitments Under the Joint Comprehensive Plan of Action of July 14, 2015 | D230: 2016-01-16 | E230: of:=[.D230]-ObamaInauguration -> 2552 | G230: 228 | H230: Letter from the President Regarding the Cuban Liberty and Democratic Solidarity (LIBERTAD) Act of 1996 | I230: 2012-01-13 | J230: of:=[.I230]-ObamaInauguration -> 1088
B231: 13717 | C231: Establishing a Federal Earthquake Risk Management Standard | D231: 2016-02-02 | E231: of:=[.D231]-ObamaInauguration -> 2569 | G231: 229 | H231: President Obama Announces Presidential Delegation to Monrovia, Liberia to attend the Inauguration of Her Excellency Ellen Johnson Sirleaf | I231: 2012-01-13 | J231: of:=[.I231]-ObamaInauguration -> 1088
B232: 13718 | C232: Commission on Enhancing National Cybersecurity | D232: 2016-02-09 | E232: of:=[.D232]-ObamaInauguration -> 2576 | G232: 230 | H232: Presidential Memorandum -- Implementing Provisions of the Temporary Payroll Tax Cut Continuation Act of 2011 Relating to the Keystone XL Pipeline Permit | I232: 2012-01-18 | J232: of:=[.I232]-ObamaInauguration -> 1093
B233: 13719 | C233: Establishment of the Federal Privacy Council | D233: 2016-02-09 | E233: of:=[.D233]-ObamaInauguration -> 2576 | G233: 231 | H233: Letter -- Continuation of the National Emergency with Respect to Terrorists who Threaten to Disrupt the Middle East Peace Process | I233: 2012-01-19 | J233: of:=[.I233]-ObamaInauguration -> 1094
B234: 13720 | C234: Delegation of Certain Authorities and Assignment of Certain Functions Under the Trade Preferences Extension Act of 2015 | D234: 2016-02-26 | E234: of:=[.D234]-ObamaInauguration -> 2593 | G234: 232 | H234: Notice -- Continuation of the National Emergency with Respect to Terrorists who Threaten to Disrupt the Middle East Peace Process | I234: 2012-01-19 | J234: of:=[.I234]-ObamaInauguration -> 1094
B235: 13721 | C235: Developing an Integrated Global Engagement Center to Support Government-Wide Counterterrorism Communications Activities Directed Abroad and Revoking Executive Order 13584 | D235: 2016-03-14 | E235: of:=[.D235]-ObamaInauguration -> 2610 | G235: 233 | H235: Presidential Memorandum -- Federal Support for the Randolph-Sheppard Vending Facility Program | I235: 2012-01-20 | J235: of:=[.I235]-ObamaInauguration -> 1095
B236: 13722 | C236: Blocking Property of the Government of North Korea and the Workers' Party of Korea, and Prohibiting Certain Transactions With Respect to North Korea | D236: 2016-03-15 | E236: of:=[.D236]-ObamaInauguration -> 2611 | G236: 234 | H236: Presidential Memorandum--Delegation of Certain Function under Section 308(a) of the Intelligence Authorization Act for Fiscal Year 2012 | I236: 2012-01-27 | J236: of:=[.I236]-ObamaInauguration -> 1102
B237: 13723 | C237: Establishing the Inherent Resolve Campaign Medal | D237: 2016-03-30 | E237: of:=[.D237]-ObamaInauguration -> 2626 | G237: 235 | H237: Presidential Memorandum -- Delegation of Authority in Accordance with Sections 610 and 652 of the Foreign Assistance Act of 1961 | I237: 2012-01-30 | J237: of:=[.I237]-ObamaInauguration -> 1105
B238: 13724 | C238: Amending Executive Order 12137 | D238: 2016-04-08 | E238: of:=[.D238]-ObamaInauguration -> 2635 | G238: 236 | H238: Presidential Memorandum -- Delegation of Authority Pursuant to Sections 110(d)(4) and 110(f) of the Trafficking Victims Protection Act of 2000, as Amended | I238: 2012-02-03 | J238: of:=[.I238]-ObamaInauguration -> 1109
B239: 13725 | C239: Steps to Increase Competition and Better Inform Consumers and Workers to Support Continued Growth of the American Economy | D239: 2016-04-15 | E239: of:=[.D239]-ObamaInauguration -> 2642 | G239: 237 | H239: Presidential Memorandum -- Maximizing the Effectiveness of Federal Programs and Functions Supporting Trade and Investment | I239: 2012-02-17 | J239: of:=[.I239]-ObamaInauguration -> 1123
B240: 13726 | C240: Blocking Property and Suspending Entry Into the United States of Persons Contributing to the Situation in Libya | D240: 2016-04-19 | E240: of:=[.D240]-ObamaInauguration -> 2646 | G240: 238 | H240: Presidential Memorandum -- Driving Innovation and Creating Jobs in Rural America through Biobased and Sustainable Product Procurement | I240: 2012-02-21 | J240: of:=[.I240]-ObamaInauguration -> 1127
B241: 13727 | C241: Facilitation of a Presidential Transition | D241: 2016-05-06 | E241: of:=[.D241]-ObamaInauguration -> 2663 | G241: 239 | H241: Letter -- Continuation of the National Emergency with Respect to Cuba and the Emergency Authority Relating to the Regulation of the Anchorage and Movement of vessels | I241: 2012-02-23 | J241: of:=[.I241]-ObamaInauguration -> 1129
B242: 13728 | C242: Wildland-Urban Interface Federal Risk Mitigation | D242: 2016-05-18 | E242: of:=[.D242]-ObamaInauguration -> 2675 | G242: 240 | H242: Notice -- Continuation of the National Emergency with Respect to Cuba and the Emergency Authority Relating to the Regulation of the Anchorage and Movement of vessels | I242: 2012-02-23 | J242: of:=[.I242]-ObamaInauguration -> 1129
B243: 13729 | C243: A Comprehensive Approach to Atrocity Prevention and Response | D243: 2016-05-18 | E243: of:=[.D243]-ObamaInauguration -> 2675 | G243: 241 | H243: Notice -- Continuation of the National Emergency with Respect to Libya | I243: 2012-02-23 | J243: of:=[.I243]-ObamaInauguration -> 1129
B244: 13730 | C244: 2016 Amendments to the Manual for Courts-Martial, United States | D244: 2016-05-18 | E244: of:=[.D244]-ObamaInauguration -> 2675 | G244: 242 | H244: Letter -- Continuation of the National Emergency with Respect to Libya | I244: 2012-02-23 | J244: of:=[.I244]-ObamaInauguration -> 1129
B245: 13731 | C245: Global Entrepreneurship | D245: 2016-06-24 | E245: of:=[.D245]-ObamaInauguration -> 2712 | G245: 243 | H245: Presidential Memorandum -- Delegation of Reporting Function Specified in Section 1043 of the National Defense Authorization Act for Fiscal Year 2012 | I245: 2012-02-27 | J245: of:=[.I245]-ObamaInauguration -> 1133
B246: 13732 | C246: United States Policy on Pre- and Post-Strike Measures to Address Civilian Casualties in U.S. Operations Involving the Use of Force | D246: 2016-07-01 | E246: of:=[.D246]-ObamaInauguration -> 2719 | G246: 244 | H246: Presidential Memorandum -- Proposed Revised Habitat for the Spotted Owl: Minimizing Regulatory Burdens | I246: 2012-02-28 | J246: of:=[.I246]-ObamaInauguration -> 1134
B247: 13733 | C247: Delegation of Certain Authorities and Assignment of Certain Functions Under the Trade Facilitation and Trade Enforcement Act of 2015 | D247: 2016-07-22 | E247: of:=[.D247]-ObamaInauguration -> 2740 | G247: 245 | H247: Presidential Memorandum to Congress -- Requirements of the National Defense Authorization Act | I247: 2012-02-28 | J247: of:=[.I247]-ObamaInauguration -> 1134
B248: 13734 | C248: Amending Executive Order 13675 To Expand Membership on the President's Advisory Council on Doing Business in Africa | D248: 2016-08-03 | E248: of:=[.D248]-ObamaInauguration -> 2752 | G248: 246 | H248: Presidential Message to Congress -- Requirements of the National Defense Authorization Act | I248: 2012-02-28 | J248: of:=[.I248]-ObamaInauguration -> 1134
B249: 13735 | C249: Providing an Order of Succession Within the Department of the Treasury | D249: 2016-08-12 | E249: of:=[.D249]-ObamaInauguration -> 2761 | G249: 247 | H249: Presidential Policy Directive -- Requirements of the National Defense Authorization Act | I249: 2012-02-28 | J249: of:=[.I249]-ObamaInauguration -> 1134
B250: 13736 | C250: Providing an Order of Succession Within the Department of Veterans Affairs | D250: 2016-08-12 | E250: of:=[.D250]-ObamaInauguration -> 2761 | G250: 248 | H250: Presidential Memorandum -- Treaty Between the Government of the United States of America and the Government of the United Kingdom of Great Britain and Northern Ireland Concerning Defense Trade Cooperation | I250: 2012-03-06 | J250: of:=[.I250]-ObamaInauguration -> 1141
B251: 13737 | C251: Providing an Order of Succession Within the Environmental Protection Agency | D251: 2016-08-12 | E251: of:=[.D251]-ObamaInauguration -> 2761 | G251: 249 | H251: Presidential Memorandum -- Delegation of Reporting Functions Specified in Section 1045 of the National Defense Authorization Act for Fiscal Year 2012 | I251: 2012-03-16 | J251: of:=[.I251]-ObamaInauguration -> 1151
B252: 13738 | C252: Amendment to Executive Order 13673 | D252: 2016-08-23 | E252: of:=[.D252]-ObamaInauguration -> 2772 | G252: 250 | H252: Letter from the President Regarding High Performance Computer Export Controls | I252: 2012-03-16 | J252: of:=[.I252]-ObamaInauguration -> 1151
B253: 13749 | C253: Providing for the Appointment in the Competitive Service of Certain Employees of the Foreign Service | D253: 2016-11-29 | E253: of:=[.D253]-ObamaInauguration -> 2870 | G253: 251 | H253: Presidential Memorandum -- Expediting Review of Pipeline Projects from Cushing, Oklahoma, to Port Arthur, Texas, and Other Domestic Pipeline Infrastructure Projects | I253: 2012-03-22 | J253: of:=[.I253]-ObamaInauguration -> 1157
B254: 13750 | C254: Providing for the Appointment of Alumni of the Fulbright U.S. Student Program, the Benjamin A. Gilman International Scholarship Program, and the Critical Language Scholarship Program to the Competitive Service | D254: 2016-11-29 | E254: of:=[.D254]-ObamaInauguration -> 2870 | G254: 252 | H254: Presidential Memoranda -- Trade Act of 1974 Argentina | I254: 2012-03-26 | J254: of:=[.I254]-ObamaInauguration -> 1161
B255: 13751 | C255: Safeguarding the Nation From the Impacts of Invasive Species | D255: 2016-12-05 | E255: of:=[.D255]-ObamaInauguration -> 2876 | G255: 253 | H255: Presidential Memoranda -- Trade Act of 1974 South Sudan | I255: 2012-03-26 | J255: of:=[.I255]-ObamaInauguration -> 1161
B256: 13752 | C256: Relating to the Implementation of the Convention on the International Recovery of Child Support and Other Forms of Family Maintenance | D256: 2016-12-08 | E256: of:=[.D256]-ObamaInauguration -> 2879 | G256: 254 | H256: Presidential Memorandum -- Establishing a Working Group on the Intersection of HIV/AIDS, Violence Against Women and Girls, and Gender-related Health Disparities | I256: 2012-03-30 | J256: of:=[.I256]-ObamaInauguration -> 1165
B257: 13753 | C257: Amending the Order of Succession in the Department of Homeland Security | D257: 2016-12-09 | E257: of:=[.D257]-ObamaInauguration -> 2880 | G257: 255 | H257: Presidential Memorandum -- Presidential Determination Pursuant to Section 1245(d)(4)(B) and (C) of the National Defense Authorization Act for Fiscal Year 2012 | I257: 2012-03-30 | J257: of:=[.I257]-ObamaInauguration -> 1165
B258: 13754 | C258: Northern Bering Sea Climate Resilience | D258: 2016-12-09 | E258: of:=[.D258]-ObamaInauguration -> 2880 | G258: 256 | H258: Presidential Memorandum -- Unexpected Urgent Refugee and Migration Needs | I258: 2012-04-03 | J258: of:=[.I258]-ObamaInauguration -> 1169
B259: 13755 | C259: Providing an Order of Succession Within the Department of Labor | D259: 2016-12-23 | E259: of:=[.D259]-ObamaInauguration -> 2894 | G259: 257 | H259: Presidential Memorandum -- Establishing Policies for Addressing Domestic Violence in the Federal Workforce | I259: 2012-04-18 | J259: of:=[.I259]-ObamaInauguration -> 1184
B260: 13756 | C260: Adjustments of Certain Rates of Pay | D260: 2016-12-27 | E260: of:=[.D260]-ObamaInauguration -> 2898 | G260: 258 | H260: Presidential Memorandum -- Delegation of Reporting Functions Specified in Section 1235(c) of the National Defense Authorization Act for Fiscal Year 2012 | I260: 2012-04-20 | J260: of:=[.I260]-ObamaInauguration -> 1186
B261: 13757 | C261: Taking Additional Steps to Address the National Emergency With Respect to Significant Malicious Cyber- Enabled Activities | D261: 2016-12-28 | E261: of:=[.D261]-ObamaInauguration -> 2899 | G261: 259 | H261: Presidential Memorandum -- Delegation of Reporting Functions Specified in Section 8 of the Belarus Democracy Act of 2004, as Amended | I261: 2012-04-24 | J261: of:=[.I261]-ObamaInauguration -> 1190
B262: 13758 | C262: Amending Executive Order 11016 To Update Eligibility Criteria for Award of the Purple Heart | D262: 2017-01-12 | E262: of:=[.D262]-ObamaInauguration -> 2914 | G262: 260 | H262: Presidential Memorandum -- Waiver of Restriction on Providing Funds to the Palestinian Authority | I262: 2012-04-25 | J262: of:=[.I262]-ObamaInauguration -> 1191
B263: 13759 | C263: Designating the World Organisation for Animal Health as a Public International Organization Entitled To Enjoy Certain Privileges, Exemptions, and Immunities | D263: 2017-01-12 | E263: of:=[.D263]-ObamaInauguration -> 2914 | G263: 261 | H263: Message -- Continuation of the National Emergency with Respect to Burma | I263: 2012-05-17 | J263: of:=[.I263]-ObamaInauguration -> 1213
B264: 13760 | C264: Exclusions From the Federal Labor-Management Relations Program | D264: 2017-01-12 | E264: of:=[.D264]-ObamaInauguration -> 2914 | G264: 262 | H264: Notice -- Continuation of the National Emergency with Respect to Burma | I264: 2012-05-17 | J264: of:=[.I264]-ObamaInauguration -> 1213
B265: 13761 | C265: Recognizing Positive Actions by the Government of Sudan and Providing for the Revocation of Certain Sudan-Related Sanctions | D265: 2017-01-13 | E265: of:=[.D265]-ObamaInauguration -> 2915 | G265: 263 | H265: Presidential Memorandum -- Implementing the Prison Rape Elimination Act | I265: 2012-05-17 | J265: of:=[.I265]-ObamaInauguration -> 1213
B266: 13762 | C266: Providing an Order of Succession Within the Department of Justice | D266: 2017-01-13 | E266: of:=[.D266]-ObamaInauguration -> 2915 | G266: 264 | H266: Message from the President to the Senate Regarding a Tax Treaty with Chile | I266: 2012-05-17 | J266: of:=[.I266]-ObamaInauguration -> 1213
B267: 13763 | C267: Providing an Order of Succession Within the Environmental Protection Agency | D267: 2017-01-13 | E267: of:=[.D267]-ObamaInauguration -> 2915 | G267: 265 | H267: Presidential Memorandum -- Designation of Officers of the Office of Personnel Management to Act as Director of the Office of Personnel Management | I267: 2012-05-21 | J267: of:=[.I267]-ObamaInauguration -> 1217
B268: 13764 | C268: Amending the Civil Service Rules, Executive Order 13488, and Executive Order 13467 To Modernize the Executive Branch-Wide Governance Structure and Processes for Security Clearances, Suitability and Fitness for Employment, and Credentialing, and Related Matters | D268: 2017-01-17 | E268: of:=[.D268]-ObamaInauguration -> 2919 | G268: 266 | H268: Presidential Memorandum -- Designation of Officers of the National Archives and Records Administration to Act as Archivist of the United States | I268: 2012-05-21 | J268: of:=[.I268]-ObamaInauguration -> 1217
G269: 267 | H269: Presidential Memorandum -- Designation of Officers of the Millennium Challenge Corporation to Act as Chief Executive Officer of the Millennium Challenge Corporation | I269: 2012-05-21 | J269: of:=[.I269]-ObamaInauguration -> 1217
G270: 268 | H270: Presidential Memorandum -- Building a 21st Century Digital Government | I270: 2012-05-23 | J270: of:=[.I270]-ObamaInauguration -> 1219
G271: 269 | H271: Letter from the President Regarding Sanctions on Foreign Narcotics Kingpins | I271: 2012-06-01 | J271: of:=[.I271]-ObamaInauguration -> 1228
G272: 270 | H272: Presidential Memorandum -- Suspension of Limitations Under the Jerusalem Embassy Act | I272: 2012-06-01 | J272: of:=[.I272]-ObamaInauguration -> 1228
G273: 271 | H273: Presidential Memorandum--Improving Repayment Options for Federal Student Loan Borrowers | I273: 2012-06-07 | J273: of:=[.I273]-ObamaInauguration -> 1234
G274: 272 | H274: Presidential Memorandum--Presidential Determination Pursuant to Section 1245(d)(4)(B) and (C) of the National Defense Authorization Act for Fiscal Year 2012 | I274: 2012-06-11 | J274: of:=[.I274]-ObamaInauguration -> 1238
G275: 273 | H275: Presidential Memorandum -- Delegation of Authority, Child Soldiers Prevention Act of 2008 | I275: 2012-06-14 | J275: of:=[.I275]-ObamaInauguration -> 1241
G276: 274 | H276: Notice--Continuation of the National Emergency with Respect to the Western Balkans | I276: 2012-06-22 | J276: of:=[.I276]-ObamaInauguration -> 1249
G277: 275 | H277: Letter--Continuation of the National Emergency with Respect to the Western Balkans | I277: 2012-06-22 | J277: of:=[.I277]-ObamaInauguration -> 1249
G278: 276 | H278: Presidential Memorandum--Presidential Determination on a U.S. Export-Import Bank Transaction with Vietnam | I278: 2012-06-25 | J278: of:=[.I278]-ObamaInauguration -> 1252
G279: 277 | H279: Letter--Russian Highly Enriched Uranium | I279: 2012-06-25 | J279: of:=[.I279]-ObamaInauguration -> 1252
G280: 278 | H280: Letter--Designation of the Chair of the United States International Trade Commission | I280: 2012-06-25 | J280: of:=[.I280]-ObamaInauguration -> 1252
G281: 279 | H281: Presidential Memorandum -- Designation of the Islamic Republic of Afghanistan as a Major Non-NATO A | I281: 2012-07-06 | J281: of:=[.I281]-ObamaInauguration -> 1263
G282: 280 | H282: Presidential Memorandum -- Delegation of Certain Functions under Section 570(e) of the Foreign Operations, Export Financing, and Related Programs Appropriations Act, 1997 | I282: 2012-07-11 | J282: of:=[.I282]-ObamaInauguration -> 1268
G283: 281 | H283: Presidential Memorandum -- Unexpected Urgent Refugee and Migration Needs With Respect to Mali | I283: 2012-07-12 | J283: of:=[.I283]-ObamaInauguration -> 1269
G284: 282 | H284: Presidential Memorandum -- Uniformed Services Employment and Reemployment Rights Act (USERRA) | I284: 2012-07-19 | J284: of:=[.I284]-ObamaInauguration -> 1276
G285: 283 | H285: Fact Sheet: Presidential Memorandum Supporting Veterans’ Employment and Reemployment Across the Federal Workforce | I285: 2012-07-19 | J285: of:=[.I285]-ObamaInauguration -> 1276
G286: 284 | H286: Presidential Memorandum -- Continuation of U.S. Drug Interdiction Assistance to the Government of Colombia | I286: 2012-08-10 | J286: of:=[.I286]-ObamaInauguration -> 1298
G287: 285 | H287: Letter from the President Regarding An Alternative Plan for Pay Increases for Civilian Federal Employees | I287: 2012-08-21 | J287: of:=[.I287]-ObamaInauguration -> 1309
G288: 286 | H288: Presidential Memorandum -- Delegation of Certain Functions and Authority under Section 5(a) of the Tom Lantos Block Burmese Junta's Anti-Democratic Efforts Act of 2008 | I288: 2012-08-29 | J288: of:=[.I288]-ObamaInauguration -> 1317
G289: 287 | H289: Presidential Memorandum -- Presidential Determination on Trading With the Enemy Act | I289: 2012-09-10 | J289: of:=[.I289]-ObamaInauguration -> 1329
G290: 288 | H290: Notice -- Continuation of the National Emergency with Respect to Certain Terrorist Attacks | I290: 2012-09-11 | J290: of:=[.I290]-ObamaInauguration -> 1330
G291: 289 | H291: Message -- Continuation of the National Emergency with Respect to Certain Terrorist Attacks | I291: 2012-09-11 | J291: of:=[.I291]-ObamaInauguration -> 1330
G292: 290 | H292: Notice -- Continuation of the National Emergency with Respect to Persons Who Commit, Threaten to Commit, or Support Terrorism | I292: 2012-09-11 | J292: of:=[.I292]-ObamaInauguration -> 1330
G293: 291 | H293: Message -- Continuation of the National Emergency with Respect to Persons Who Commit, Threaten to Commit, or Support Terrorism | I293: 2012-09-11 | J293: of:=[.I293]-ObamaInauguration -> 1330
G294: 292 | H294: Presidential Memorandum -- Presidential Determination on the annual Presidential Determination on Major Illicit Drug Transit and Drug Producing Countries | I294: 2012-09-14 | J294: of:=[.I294]-ObamaInauguration -> 1333
G295: 293 | H295: Presidential Memorandum -- Presidential Determination with Respect to Foreign Governments' Efforts Regarding Trafficking in Persons | I295: 2012-09-14 | J295: of:=[.I295]-ObamaInauguration -> 1333
G296: 294 | H296: Presidential Memorandum -- Aviation Insurance Coverage for Commercial Air Carrier Service in Domestic and International Operations | I296: 2012-09-27 | J296: of:=[.I296]-ObamaInauguration -> 1346
G297: 295 | H297: Presidential Memorandum -- Presidential Determination with respect to the Child Soldiers Prevention Act of 2008 | I297: 2012-09-28 | J297: of:=[.I297]-ObamaInauguration -> 1347
G298: 296 | H298: Presidential Memorandum -- Annual Refugee Admissions Numbers | I298: 2012-09-28 | J298: of:=[.I298]-ObamaInauguration -> 1347
G299: 297 | H299: Presidential Memorandum -- Delegation of Certain Functions and Authorities under the Iran Threat Reduction and Syria Human Rights Act of 2012 | I299: 2012-10-09 | J299: of:=[.I299]-ObamaInauguration -> 1358
G300: 298 | H300: Presidential Memorandum -- Delegation of Functions to the Secretary of State to Support Assistance by International Financial Institutions for Burma | I300: 2012-10-10 | J300: of:=[.I300]-ObamaInauguration -> 1359
G301: 299 | H301: Presidential Memorandum -- Provision of U.S. Drug Interdiction Assistance to the Government of Brazil | I301: 2012-10-11 | J301: of:=[.I301]-ObamaInauguration -> 1360
G302: 300 | H302: Presidential Memorandum -- Directing a Transfer of Ultra-Low Sulfur Diesel Oil from the Northeast Home Heating Oil Reserve for Communities Affected by Hurricane Sandy | I302: 2012-11-02 | J302: of:=[.I302]-ObamaInauguration -> 1382
G303: 301 | H303: Presidential Memorandum -- Emergency Leave Transfer Program for Federal Employees Adversely Affected by Hurricane Sandy | I303: 2012-11-09 | J303: of:=[.I303]-ObamaInauguration -> 1389
G304: 302 | H304: Presidential Proclamation -- National Child's Day, 2012 | I304: 2012-11-20 | J304: of:=[.I304]-ObamaInauguration -> 1400
G305: 303 | H305: Presidential Proclamation -- Thanksgiving Day, 2012 | I305: 2012-11-20 | J305: of:=[.I305]-ObamaInauguration -> 1400
G306: 304 | H306: Presidential Memorandum -- National Insider Threat Policy and Minimum Standards for Executive Branch Insider Threat Programs | I306: 2012-11-21 | J306: of:=[.I306]-ObamaInauguration -> 1401
G307: 305 | H307: Presidential Memorandum -- Designation of Authorized Representative of the Federal Government under Section 7302 of the National Intelligence Reform and Terrorism Prevention Act of 2004 | I307: 2012-11-28 | J307: of:=[.I307]-ObamaInauguration -> 1408
G308: 306 | H308: Presidential Memorandum -- Presidential Determination with respect to the Suspension of Limitations under the Jerusalem Embassy Act | I308: 2012-12-04 | J308: of:=[.I308]-ObamaInauguration -> 1414
G309: 307 | H309: Presidential Memorandum -- Presidential Determination Pursuant to Section 1245 (d) (4) (B) and (C) of the National Defense Authorization Act for Fiscal Year 2012 | I309: 2012-12-07 | J309: of:=[.I309]-ObamaInauguration -> 1417
G310: 308 | H310: Presidential Memorandum -- Federal Employee Pay Schedules and Rates that are Set by Administrative Discretion | I310: 2012-12-21 | J310: of:=[.I310]-ObamaInauguration -> 1431
G311: 309 | H311: Presidential Memorandum -- Authorized Representative of the Federal Government Under Section 7302 of the National Intelligence Reform and Terrorism Prevention Act of 2004 | I311: 2012-12-21 | J311: of:=[.I311]-ObamaInauguration -> 1431
G312: 310 | H312: Presidential Memorandum -- National Flood Insurance Program | I312: 2013-01-07 | J312: of:=[.I312]-ObamaInauguration -> 1448
G313: 311 | H313: Letter from the President to the Speaker of the House of Representatives and the President Pro Tempore of the Senate Regarding the War Powers Resolution | I313: 2013-01-13 | J313: of:=[.I313]-ObamaInauguration -> 1454
G314: 312 | H314: Presidential Memorandum -- Delegation of Certain Functions Under Section 6 of Public Law 112-150 | I314: 2013-01-15 | J314: of:=[.I314]-ObamaInauguration -> 1456
G315: 313 | H315: Presidential Memorandum -- Tracing of Firearms in Connection with Criminal Investigations | I315: 2013-01-16 | J315: of:=[.I315]-ObamaInauguration -> 1457
G316: 314 | H316: Presidential Memorandum -- Improving Availability of Relevant Executive Branch Records to the National Instant Criminal Background Check System | I316: 2013-01-16 | J316: of:=[.I316]-ObamaInauguration -> 1457
G317: 315 | H317: Presidential Memorandum -- Engaging in Public Health Research on the Causes and Prevention of Gun Violence | I317: 2013-01-16 | J317: of:=[.I317]-ObamaInauguration -> 1457
G318: 316 | H318: Presidential Memorandum -- Rulemaking Concerning the Standards for Designating Positions in the Competitive Service as National Security Sensitive and Related Matters | I318: 2013-01-25 | J318: of:=[.I318]-ObamaInauguration -> 1466
G319: 317 | H319: Presidential Memorandum -- Presidential Determination Regarding the Unexpected Urgent Refugee and Migration Needs Relating to Syria | I319: 2013-01-28 | J319: of:=[.I319]-ObamaInauguration -> 1469
G320: 318 | H320: Presidential Memorandum -- Coordination of Policies and Programs to Promote Gender Equality and Empower Women and Girls Globally | I320: 2013-01-30 | J320: of:=[.I320]-ObamaInauguration -> 1471
G321: 319 | H321: Presidential Memorandum -- Delegation of a Reporting Authority | I321: 2013-01-31 | J321: of:=[.I321]-ObamaInauguration -> 1472
G322: 320 | H322: Presidential Memorandum -- Delegation of Authority to Suspend the Provisions of Title III of the Cuban Liberty and Democratic Solidarity (LIBERTAD) Act of 1996 | I322: 2013-01-31 | J322: of:=[.I322]-ObamaInauguration -> 1472
G323: 321 | H323: Presidential Memorandum -- Designation of Officers of the Pension Benefit Guaranty Corporation to Act as Director of the Pension Benefit Guaranty Corporation | I323: 2013-02-01 | J323: of:=[.I323]-ObamaInauguration -> 1473
G324: 322 | H324: Presidential Memorandum -- Presidential Determination Regarding Waiver of Restriction on Providing Funds to the Palestinian Authority | I324: 2013-02-08 | J324: of:=[.I324]-ObamaInauguration -> 1480
G325: 323 | H325: Presidential Memorandum -- Presidential Determination Regarding Drawdown Under Section 506 (a)(1) of the Foreign Assistance Act of 1961, as Amended, for Chad and France to Support Their Efforts in Mali | I325: 2013-02-11 | J325: of:=[.I325]-ObamaInauguration -> 1483
G326: 324 | H326: Presidential Nominations Sent to the Senate | I326: 2013-02-13 | J326: of:=[.I326]-ObamaInauguration -> 1485
G327: 325 | H327: Presidential Memorandum - Delegation of Authority to Submit to the Congress Certain Certifications, Reports, and Notifications | I327: 2013-02-20 | J327: of:=[.I327]-ObamaInauguration -> 1492
G328: 326 | H328: Presidential Memorandum -- Deferred Enforced Departure for Liberians | I328: 2013-03-15 | J328: of:=[.I328]-ObamaInauguration -> 1515
G329: 327 | H329: Presidential Memorandum - Delegation of Authority to Appoint Commissioned Officers of the Ready Reserve Corps of the Public Health Service | I329: 2013-03-29 | J329: of:=[.I329]-ObamaInauguration -> 1529
G330: 328 | H330: Presidential Memorandum -- Delegation of Functions Under Sections 404 and 406 of Public Law 112-208 | I330: 2013-04-05 | J330: of:=[.I330]-ObamaInauguration -> 1536
G331: 329 | H331: Presidential Memorandum -- Federal Employee Pay Schedules and Rates that are set by Administrative Discretion | I331: 2013-04-05 | J331: of:=[.I331]-ObamaInauguration -> 1536
G332: 330 | H332: Presidential Memorandum -- Presidential Determination on Eligibility of the Federal Republic of Somalia to Receive Defense Articles and Defense Services under the Foreign Assistance Act of 1961, as Amended, and the Arms Export Control Act, as Amended | I332: 2013-04-08 | J332: of:=[.I332]-ObamaInauguration -> 1539
G333: 331 | H333: Presidential Memorandum -- Presidential Determination on Syria Drawdown | I333: 2013-04-11 | J333: of:=[.I333]-ObamaInauguration -> 1542
G334: 332 | H334: Presidential Memorandum -- Advancing Pay Equality in the Federal Government and Learning from Successful Practices | I334: 2013-05-10 | J334: of:=[.I334]-ObamaInauguration -> 1571
G335: 333 | H335: Presidential Memorandum -- Modernizing Federal Infrastructure Review and Permitting Regulations, Policies, and Procedures | I335: 2013-05-17 | J335: of:=[.I335]-ObamaInauguration -> 1578
G336: 334 | H336: Presidential Memorandum -- Delegation of Functions under Subsection 804(h)(2)(A) of the Foreign Narcotics Kingpin Designation Act | I336: 2013-05-31 | J336: of:=[.I336]-ObamaInauguration -> 1592
G337: 335 | H337: Presidential Memorandum -- Delegation of Certain Functions and Authorities Under the Iran Freedom and Counter-Proliferation Act of 2012 | I337: 2013-06-03 | J337: of:=[.I337]-ObamaInauguration -> 1595
G338: 336 | H338: Presidential Memorandum -- Emergency Leave Transfer Program for Federal Employees Adversely Affected by the Severe Storms and Tornadoes in Oklahoma | I338: 2013-06-03 | J338: of:=[.I338]-ObamaInauguration -> 1595
G339: 337 | H339: Presidential Memorandum -- Suspension of Limitations Under the Jerusalem Embassy Act | I339: 2013-06-04 | J339: of:=[.I339]-ObamaInauguration -> 1596
G340: 338 | H340: Presidential Memorandum -- Presidential Determination Pursuant to Section 1245(d)(4)(B) and (C) of the National Defense Authorization Act for Fiscal Year 2012 | I340: 2013-06-05 | J340: of:=[.I340]-ObamaInauguration -> 1597
G341: 339 | H341: Presidential Memorandum -- Transforming our Nation's Electric Grid Through Improved Siting, Permitting, and Review | I341: 2013-06-07 | J341: of:=[.I341]-ObamaInauguration -> 1599
G342: 340 | H342: Presidential Memorandum -- Expanding America's Leadership in Wireless Innovation | I342: 2013-06-14 | J342: of:=[.I342]-ObamaInauguration -> 1606
G343: 341 | H343: Presidential Memorandum -- Delegation of Reporting Functions | I343: 2013-06-19 | J343: of:=[.I343]-ObamaInauguration -> 1611
G344: 342 | H344: Presidential Memorandum -- Power Sector Carbon Pollution Standards | I344: 2013-06-25 | J344: of:=[.I344]-ObamaInauguration -> 1617
G345: 343 | H345: Presidential Memorandum -- Expanding National Service | I345: 2013-07-15 | J345: of:=[.I345]-ObamaInauguration -> 1637
G346: 344 | H346: Presidential Memorandum -- Waiver of Restriction on Providing Funds to the Palestinian Authority | I346: 2013-07-26 | J346: of:=[.I346]-ObamaInauguration -> 1648
G347: 345 | H347: Presidential Memorandum -- Delegation of Authority to Sections 110(d)(4) and 110(f) of the Trafficking Victims Protection Act of 2000, as Amended | I347: 2013-07-29 | J347: of:=[.I347]-ObamaInauguration -> 1651
G348: 346 | H348: Presidential Memorandum -- Delegation of Authority Pursuant to Section 404(c) of the Child Soldiers Prevention Act of 2008, as Amended | I348: 2013-08-02 | J348: of:=[.I348]-ObamaInauguration -> 1655
G349: 347 | H349: Presidential Memorandum -- Continuation of U.S. Drug Interdiction Assistance to the Government of Colombia | I349: 2013-08-09 | J349: of:=[.I349]-ObamaInauguration -> 1662
G350: 348 | H350: Presidential Memorandum -- Reviewing Our Global Signals Intelligence Collection and Communications Technologies | I350: 2013-08-12 | J350: of:=[.I350]-ObamaInauguration -> 1665
G351: 349 | H351: Presidential Determination -- Major Drug Transit and Drug Producing Countries for FY 2014 | I351: 2013-09-13 | J351: of:=[.I351]-ObamaInauguration -> 1697
G352: 350 | H352: Presidential Memorandum -- Presidential Determination on Traficking in Persons | I352: 2013-09-17 | J352: of:=[.I352]-ObamaInauguration -> 1701
G353: 351 | H353: Presidential Memorandum -- Designation of Officers of the General Services Administration to Act as Administrator of General Services | I353: 2013-09-20 | J353: of:=[.I353]-ObamaInauguration -> 1704
G354: 352 | H354: Presidential Memorandum -- Designation of Officers of the Office of the Director of National Intelligence to Act as Director of National Intelligence | I354: 2013-09-20 | J354: of:=[.I354]-ObamaInauguration -> 1704
G355: 353 | H355: Presidential Memorandum -- Delegation of Authority Under Sections 552(c)(2) and 614 of the Foreign Assistance Act of 1961, as Amended | I355: 2013-09-27 | J355: of:=[.I355]-ObamaInauguration -> 1711
G356: 354 | H356: Presidential Determination-- Child Soldiers | I356: 2013-09-30 | J356: of:=[.I356]-ObamaInauguration -> 1714
G357: 355 | H357: Presidential Memorandum -- Refugee Admissions for Fiscal Year 2014 | I357: 2013-10-02 | J357: of:=[.I357]-ObamaInauguration -> 1716
G358: 356 | H358: Presidential Memorandum -- Provision of U.S. Drug Interdiction Assistance to the Government of Brazil | I358: 2013-10-10 | J358: of:=[.I358]-ObamaInauguration -> 1724
G359: 357 | H359: Presidential Memorandum -- Delegation of Functions Under Sections 1261(b) and 1262(a) of Public Law 112-239 | I359: 2013-10-28 | J359: of:=[.I359]-ObamaInauguration -> 1742
G360: 358 | H360: Presidential Determination -- Iran Oil | I360: 2013-11-29 | J360: of:=[.I360]-ObamaInauguration -> 1774
G361: 359 | H361: Presidential Memorandum -- Federal Leadership on Energy Management | I361: 2013-12-05 | J361: of:=[.I361]-ObamaInauguration -> 1780
G362: 360 | H362: Presidential Memorandum -- Central African Republic Drawdown | I362: 2013-12-10 | J362: of:=[.I362]-ObamaInauguration -> 1785
G363: 361 | H363: Presidential Memorandum -- Aviation Insurance | I363: 2013-12-27 | J363: of:=[.I363]-ObamaInauguration -> 1802
G364: 362 | H364: Presidential Memorandum -- Establishing a Quadrennial Energy Review | I364: 2014-01-09 | J364: of:=[.I364]-ObamaInauguration -> 1815
G365: 363 | H365: Presidential Determination -- Proposed Third Amendment to the Agreement for Co-operation Between the United States of America and the International Atomic Energy Agency | I365: 2014-01-17 | J365: of:=[.I365]-ObamaInauguration -> 1823
G366: 364 | H366: Presidential Memorandum -- Delegation of Authority under Section 1245(d)(5) of the National Defense Authorization Act for Fiscal Year 2012 | I366: 2014-01-20 | J366: of:=[.I366]-ObamaInauguration -> 1826
G367: 365 | H367: Memorandum -- Establishing a White House Task Force to Protect Students from Sexual Assault | I367: 2014-01-22 | J367: of:=[.I367]-ObamaInauguration -> 1828
G368: 366 | H368: Presidential Memorandum -- Retirement Savings Security | I368: 2014-01-28 | J368: of:=[.I368]-ObamaInauguration -> 1834
G369: 367 | H369: Presidential Memorandum -- Job-Driven Training for Workers | I369: 2014-01-30 | J369: of:=[.I369]-ObamaInauguration -> 1836
G370: 368 | H370: Presidential Memorandum -- Enhancing Safeguards to Prevent the Undue Denial of Federal Employment Opportunities to the Unemployed and Those Facing Financial Difficulty Through no Fault of Their Own | I370: 2014-01-31 | J370: of:=[.I370]-ObamaInauguration -> 1837
G371: 369 | H371: Presidential Memorandum -- Certification Concerning U.S. Participation in the United Nations Multidimensional | I371: 2014-01-31 | J371: of:=[.I371]-ObamaInauguration -> 1837
G372: 370 | H372: Presidential Determination -- Proposed Nuclear Agreement with Vietnam | I372: 2014-02-24 | J372: of:=[.I372]-ObamaInauguration -> 1861
G373: 371 | H373: Presidential Memorandum -- Creating and Expanding Ladders of Opportunity for Boys and Young Men of Color | I373: 2014-02-27 | J373: of:=[.I373]-ObamaInauguration -> 1864
G374: 372 | H374: Presidential Memorandum -- Updating and Modernizing Overtime Regulations | I374: 2014-03-13 | J374: of:=[.I374]-ObamaInauguration -> 1878
G375: 373 | H375: Memorandum -- Iceland and the Fisherman’s Protective Act | I375: 2014-04-01 | J375: of:=[.I375]-ObamaInauguration -> 1897
G376: 374 | H376: Memorandum -- Pelly Certification and Icelandic Whaling | I376: 2014-04-01 | J376: of:=[.I376]-ObamaInauguration -> 1897
G377: 375 | H377: Presidential Memorandum -- Advancing Pay Equality Through Compensation Data Collection | I377: 2014-04-08 | J377: of:=[.I377]-ObamaInauguration -> 1904
G378: 376 | H378: Presidential Determination -- South Sudan | I378: 2014-05-19 | J378: of:=[.I378]-ObamaInauguration -> 1945
G379: 377 | H379: Presidential Memorandum -- Establishing a National Goal and Developing Airport Specific Action Plans to Enhance the Entry Process for International Travelers to the United States | I379: 2014-05-22 | J379: of:=[.I379]-ObamaInauguration -> 1948
G380: 378 | H380: Presidential Memorandum -- Response to the Influx of Unaccompanied Alien Children Across the Southwest Border | I380: 2014-06-02 | J380: of:=[.I380]-ObamaInauguration -> 1959
G381: 379 | H381: Presidential Memorandum -- Suspension of Limitations under the Jerusalem Embassy Act | I381: 2014-06-02 | J381: of:=[.I381]-ObamaInauguration -> 1959
G382: 380 | H382: Presidential Memorandum --Presidential Determination Pursuant to Section 1245(d)(4)(B) and (C) of the National Defense Authorization Act for Fiscal Year 2012 | I382: 2014-06-04 | J382: of:=[.I382]-ObamaInauguration -> 1961
G383: 381 | H383: Presidential Memorandum -- Federal Student Loan Repayments | I383: 2014-06-09 | J383: of:=[.I383]-ObamaInauguration -> 1966
G384: 382 | H384: Text of a Letter from the President to the Speaker of the House of Representatives and the President Pro Tempore of the Senate | I384: 2014-06-16 | J384: of:=[.I384]-ObamaInauguration -> 1973
G385: 383 | H385: Presidential Memorandum -- Comprehensive Framework to Combat Illegal, Unreported, and Unregulated Fishing and Seafood Fraud | I385: 2014-06-17 | J385: of:=[.I385]-ObamaInauguration -> 1974
G386: 384 | H386: Presidential Memorandum -- Creating a Federal Strategy to Promote the Health of Honey Bees and Other Pollinators | I386: 2014-06-20 | J386: of:=[.I386]-ObamaInauguration -> 1977
G387: 385 | H387: Presidential Memorandum -- Enhancing Workplace Flexibilities and Work-Life Program | I387: 2014-06-23 | J387: of:=[.I387]-ObamaInauguration -> 1980
G388: 386 | H388: Presidential Memorandum -- Delegation of Reporting Functions Specified in Section 1206(b) of the National Defense Authorization Act for Fiscal Year 2014 | I388: 2014-06-24 | J388: of:=[.I388]-ObamaInauguration -> 1981
G389: 387 | H389: Presidential Memorandum -- Delegation of Authority Pursuant to Section 4 of the Support for United States-Republic of Korea Civil Nuclear Cooperation Act | I389: 2014-07-11 | J389: of:=[.I389]-ObamaInauguration -> 1998
G390: 388 | H390: Presidential Memorandum -- Expanding Public-Private Collaboration on Infrastructure Development and Financing | I390: 2014-07-17 | J390: of:=[.I390]-ObamaInauguration -> 2004
G391: 389 | H391: Presidential Memorandum -- Proposed Amendment to the 1958 Agreement Between the Government of the United States of America and the Government of the United Kingdom of Great Britain and Northern Ireland | I391: 2014-07-18 | J391: of:=[.I391]-ObamaInauguration -> 2005
G392: 390 | H392: Presidential Memorandum -- Establishing a Comprehensive Approach to Expanding Sub-Saharan Africa's Capacity for Trade and Investment | I392: 2014-08-04 | J392: of:=[.I392]-ObamaInauguration -> 2022
G393: 391 | H393: Presidential Memorandum -- Drawdown Under Section 506(a)(1) of the Foreign Assistance Act of 1961 for France to Support its Counterterrorism Efforts in Mali, Niger, and Chad | I393: 2014-08-11 | J393: of:=[.I393]-ObamaInauguration -> 2029
G394: 392 | H394: Presidential Memorandum -- Delegation of Authority Under Section 506(a) (1) of the Foreign Assistance Act of 1961 | I394: 2014-09-10 | J394: of:=[.I394]-ObamaInauguration -> 2059
G395: 393 | H395: Presidential Memorandum -- Civil Society | I395: 2014-09-23 | J395: of:=[.I395]-ObamaInauguration -> 2072
G396: 394 | H396: Presidential Memorandum -- Assistance to Ukraine | I396: 2014-09-24 | J396: of:=[.I396]-ObamaInauguration -> 2073
G397: 395 | H397: Presidential Memorandum -- Deferred Enforced Departure for Liberians | I397: 2014-09-26 | J397: of:=[.I397]-ObamaInauguration -> 2075
G398: 396 | H398: Presidential Memorandum -- Certification Concerning U.S. Participation in the United Nations Multidimensional Integrated Stabilization Mission in the Central African Republic Consistent with Section 2005 of the American Servicemembers’ Protection Act | I398: 2014-09-26 | J398: of:=[.I398]-ObamaInauguration -> 2075
G399: 397 | H399: Presidential Memorandum -- Delegation of Authority under Section 614 of the Foreign Assistance Act of 1961 | I399: 2014-09-30 | J399: of:=[.I399]-ObamaInauguration -> 2079
G400: 398 | H400: Presidential Memorandum -- FY 2015 Refugee Admissions | I400: 2014-09-30 | J400: of:=[.I400]-ObamaInauguration -> 2079
G401: 399 | H401: Presidential Memorandum -- Determination with Respect to the Child Soldiers Prevention Act of 2008 | I401: 2014-09-30 | J401: of:=[.I401]-ObamaInauguration -> 2079
G402: 400 | H402: Presidential Memorandum -- Providing an Order of Succession Within the Federal Mediation and Conciliation Service | I402: 2014-10-17 | J402: of:=[.I402]-ObamaInauguration -> 2096
G403: 401 | H403: Memorandum Release -- Providing an Order of Succession Within the Social Security Administration | I403: 2014-10-17 | J403: of:=[.I403]-ObamaInauguration -> 2096
G404: 402 | H404: Presidential Memorandum -- Authorizing the Exercise of Authority Under Public Law 85-804 | I404: 2014-11-13 | J404: of:=[.I404]-ObamaInauguration -> 2123
G405: 403 | H405: Presidential Memorandum -- Modernizing and Streamlining the U.S. Immigrant Visa System for the 21st Century | I405: 2014-11-21 | J405: of:=[.I405]-ObamaInauguration -> 2131
G406: 404 | H406: Presidential Memorandum -- Creating Welcoming Communities and Fully Integrating Immigrants and Refugees | I406: 2014-11-21 | J406: of:=[.I406]-ObamaInauguration -> 2131
G407: 405 | H407: Presidential Memorandum -- Suspension of Limitations under the Jerusalem Embassy Act | I407: 2014-12-03 | J407: of:=[.I407]-ObamaInauguration -> 2143
G408: 406 | H408: Presidential Memorandum -- Withdrawal of Certain Areas of the United States Outer Continental Shelf from Leasing Disposition | I408: 2014-12-16 | J408: of:=[.I408]-ObamaInauguration -> 2156
G409: 407 | H409: Presidential Memorandum -- Twelfth Quadrennial Review of Military Compensation Memorandum | I409: 2015-01-09 | J409: of:=[.I409]-ObamaInauguration -> 2180
G410: 408 | H410: Presidential Memorandum -- Modernizing Federal Leave Policies for Childbirth, Adoption and Foster Care to Recruit and Retain Talent and Improve Productivity | I410: 2015-01-15 | J410: of:=[.I410]-ObamaInauguration -> 2186
G411: 409 | H411: Presidential Memorandum -- Expanding Federal Support for Predevelopment Activities for Nonfederal Domestic Infrastructure Assets | I411: 2015-01-16 | J411: of:=[.I411]-ObamaInauguration -> 2187
G412: 410 | H412: Presidential Memorandum -- Withdrawal of Certain Areas of the United States Outer Continental Shelf Offshore Alaska from Leasing Disposition | I412: 2015-01-27 | J412: of:=[.I412]-ObamaInauguration -> 2198
G413: 411 | H413: Presidential Memorandum: Promoting Economic Competitiveness While Safeguarding Privacy, Civil Rights, and Civil Liberties in Domestic Use of Unmanned Aircraft Systems | I413: 2015-02-15 | J413: of:=[.I413]-ObamaInauguration -> 2217
G414: 412 | H414: Presidential Memorandum -- Delegation of Authority Under the Ukraine Freedom Support Act of 2014 | I414: 2015-02-19 | J414: of:=[.I414]-ObamaInauguration -> 2221
G415: 413 | H415: Presidential Memorandum -- Determination and Waiver Pursuant to Section 1209 of the Carl Levin and Howard P. "Buck" McKeon National Defense Authorization Act for Fiscal Year 2015 | I415: 2015-02-20 | J415: of:=[.I415]-ObamaInauguration -> 2222
G416: 414 | H416: Presidential Memorandum -- Establishment of the Cyber Threat Intelligence Integration Center | I416: 2015-02-25 | J416: of:=[.I416]-ObamaInauguration -> 2227
G417: 415 | H417: Presidential Memorandum -- Delegation of Authority Pursuant to Section 1209(b) (2) of the National Defense Authorization Act for Fiscal Year 2015 | I417: 2015-03-04 | J417: of:=[.I417]-ObamaInauguration -> 2234
G418: 416 | H418: Presidential Memorandum -- Student Aid Bill of Rights | I418: 2015-03-10 | J418: of:=[.I418]-ObamaInauguration -> 2240
G419: 417 | H419: Presidential Memorandum -- Delegation of Authority Pursuant to Section 1278(b)(1) of the National Defense Authorization Act for Fiscal Year 2015 | I419: 2015-03-12 | J419: of:=[.I419]-ObamaInauguration -> 2242
G420: 418 | H420: Presidential Memorandum --Providing an Order of Succession Within the Council on Environmental Quality | I420: 2015-03-13 | J420: of:=[.I420]-ObamaInauguration -> 2243
G421: 419 | H421: Presidential Memorandum -- Delegation of Authority Under the National Defense Authorization Act for Fiscal Year 2015 | I421: 2015-03-18 | J421: of:=[.I421]-ObamaInauguration -> 2248
G422: 420 | H422: Presidential Memorandum -- Establishing the Director of White House Information Technology and the Executive Committee for Presidential Information Technology | I422: 2015-03-19 | J422: of:=[.I422]-ObamaInauguration -> 2249
G423: 421 | H423: Presidential Memorandum -- Expanding Broadband Deployment and Adoption by Addressing Regulatory Barriers and Encouraging Investment and Training | I423: 2015-03-23 | J423: of:=[.I423]-ObamaInauguration -> 2253
G424: 422 | H424: Presidential Memorandum -- Disposal of Defense High-Level Radioactive Waste in a Separate Repository | I424: 2015-03-24 | J424: of:=[.I424]-ObamaInauguration -> 2254
G425: 423 | H425: Presidential Memorandum -- Delegation of Authority Pursuant to Section 1236(b)(2) of the National Defense Authorization Act for Fiscal Year 2015 | I425: 2015-03-25 | J425: of:=[.I425]-ObamaInauguration -> 2255
G426: 424 | H426: Presidential Memorandum -- Delegation of Authority Under the National Defense Authorization Act for Fiscal Year 2015 | I426: 2015-03-27 | J426: of:=[.I426]-ObamaInauguration -> 2257
G427: 425 | H427: Presidential Memorandum -- Delegation of Authority to Transfer Certain Funds in Accordance With Section 610 of the Foreign Assistance Act of 1961, for Ukraine loan guarantees | I427: 2015-03-31 | J427: of:=[.I427]-ObamaInauguration -> 2261
G428: 426 | H428: Memorandum of Disapproval Regarding S.J. Res. 8 | I428: 2015-03-31 | J428: of:=[.I428]-ObamaInauguration -> 2261
G429: 427 | H429: Presidential Memorandum -- Delegation of Reporting Functions Specified in Section 1637(a) of the National Defense Authorization Act for Fiscal Year 2015 | I429: 2015-04-13 | J429: of:=[.I429]-ObamaInauguration -> 2274
G430: 428 | H430: Presidential Memorandum -- Delegation of Authority to Transfer Certain Funds in Accordance with Section 610 of the Foreign Assistance Act of 1961, as Amended | I430: 2015-04-16 | J430: of:=[.I430]-ObamaInauguration -> 2277
G431: 429 | H431: Delegation of Authority Under Section 506(a)(1) of the Foreign Assistance Act of 1961 | I431: 2015-04-29 | J431: of:=[.I431]-ObamaInauguration -> 2290
G432: 430 | H432: Message to the Congress -- Military Compensation and Retirement Modernization Commission | I432: 2015-04-30 | J432: of:=[.I432]-ObamaInauguration -> 2291
G433: 431 | H433: Presidential Memorandum -- International Child Abduction Prevention and Return Act | I433: 2015-05-07 | J433: of:=[.I433]-ObamaInauguration -> 2298
G434: 432 | H434: Presidential Memorandum -- Delegation of Functions Under the Foreign Narcotics Kingpin Designation Act | I434: 2015-05-15 | J434: of:=[.I434]-ObamaInauguration -> 2306
G435: 433 | H435: Presidential Memorandum -- Creating a Preference for Meat and Poultry Produced According to Responsible Antibiotic-Use Policies | I435: 2015-06-02 | J435: of:=[.I435]-ObamaInauguration -> 2324
G436: 434 | H436: Letter from the President -- Six Month Consolidated War Powers Resolution Report | I436: 2015-06-11 | J436: of:=[.I436]-ObamaInauguration -> 2333
G437: 435 | H437: Presidential Determination -- Proposed Agreement for Cooperation Between the Government of the United States of America and the Government of the Republic of Korea Concerning Peaceful Uses of Nuclear Energy | I437: 2015-06-11 | J437: of:=[.I437]-ObamaInauguration -> 2333
G438: 436 | H438: Message to the Congress --Proposed Agreement for Cooperation Between the Government of the United States of America and the Government of the Republic of Korea Concerning Peaceful Uses of Nuclear Energy | I438: 2015-06-16 | J438: of:=[.I438]-ObamaInauguration -> 2338
G439: 437 | H439: Presidential Memorandum -- Delegation of Authority Pursuant to Section 8 of the United States-Israel Strategic Partnership Act of 2014 | I439: 2015-06-19 | J439: of:=[.I439]-ObamaInauguration -> 2341
G440: 438 | H440: Notice -- Continuation of the National Emergency with Respect to North Korea | I440: 2015-06-22 | J440: of:=[.I440]-ObamaInauguration -> 2344
G441: 439 | H441: Presidential Policy Directive -- Hostage Recovery Activities | I441: 2015-06-24 | J441: of:=[.I441]-ObamaInauguration -> 2346
G442: 440 | H442: Presidential Memorandum -- Delegation of Authority Pursuant to Section 1035 of the National Defense Authorization Act for Fiscal | I442: 2015-06-29 | J442: of:=[.I442]-ObamaInauguration -> 2351
G443: 441 | H443: Letter from Raul Castro -- Re-establishing Diplomatic Relations and Permanent Diplomatic Missions | I443: 2015-07-01 | J443: of:=[.I443]-ObamaInauguration -> 2353
G444: 442 | H444: Presidential Letter -- Re-establishing Diplomatic Relations and Permanent Diplomatic Missions | I444: 2015-07-01 | J444: of:=[.I444]-ObamaInauguration -> 2353
G445: 443 | H445: Presidential Memorandum -- Designation of the Republic of Tunisia as a Major Non-NATO Ally | I445: 2015-07-10 | J445: of:=[.I445]-ObamaInauguration -> 2362
G446: 444 | H446: Presidential Memorandum -- Delegation of Authority Memorandum | I446: 2015-07-17 | J446: of:=[.I446]-ObamaInauguration -> 2369
G447: 445 | H447: Presidential Memorandum -- Continuation of U.S. Drug Interdiction Assistance to the Government of Colombia | I447: 2015-08-05 | J447: of:=[.I447]-ObamaInauguration -> 2388
G448: 446 | H448: Presidential Memorandum -- Delegation of Authority to Transfer Certain Funds in Accordance with Section 610 of the Foreign Assistance Act of 1961 | I448: 2015-08-28 | J448: of:=[.I448]-ObamaInauguration -> 2411
G449: 447 | H449: Letter from the President -- Alternative Pay Plan for the Uniformed Services | I449: 2015-08-28 | J449: of:=[.I449]-ObamaInauguration -> 2411
G450: 448 | H450: Letter from the President -- Alternative Pay Plan for Federal Civilian Employees | I450: 2015-08-28 | J450: of:=[.I450]-ObamaInauguration -> 2411
G451: 449 | H451: Notice -- Continuation of the National Emergency with Respect to Persons Who Commit, Threaten to Commit, or Support Terrorism | I451: 2015-09-18 | J451: of:=[.I451]-ObamaInauguration -> 2432
G452: 450 | H452: Letter -- Continuation of the National Emergency with Respect to Persons Who Commit, Threaten to Commit, or Support Terrorism | I452: 2015-09-18 | J452: of:=[.I452]-ObamaInauguration -> 2432
G453: 451 | H453: Memorandum for the Heads of Executive Departments and Agencies | I453: 2015-09-28 | J453: of:=[.I453]-ObamaInauguration -> 2442
G454: 452 | H454: Memorandum -- Determination with Respect to the Child Soldiers Prevention Act of 2008 and Delegation of Authority Under Section 404(c) of the Child Soldiers Prevention Act of 2008 | I454: 2015-09-29 | J454: of:=[.I454]-ObamaInauguration -> 2443
G455: 453 | H455: Presidential Determination and Memorandum -- Determination with Respect to the Child Soldiers Prevention Act of 2008 and Delegation of Authority Under Section 404(c) of the Child Soldiers Prevention Act of 2008 | I455: 2015-09-29 | J455: of:=[.I455]-ObamaInauguration -> 2443
G456: 454 | H456: Presidential Memorandum -- Delegation of Authority Under Sections 506(a)(1) and 552(c)(2) of the Foreign Assistance Act of 1961 | I456: 2015-09-29 | J456: of:=[.I456]-ObamaInauguration -> 2443
G457: 455 | H457: Presidential Determination -- Presidential Determination on Refugee Admissions for Fiscal Year 2016 | I457: 2015-09-29 | J457: of:=[.I457]-ObamaInauguration -> 2443
G458: 456 | H458: Presidential Memorandum -- Presidential Determination with Respect to Foreign Governments' Efforts Regarding Trafficking in Persons | I458: 2015-10-05 | J458: of:=[.I458]-ObamaInauguration -> 2449
G459: 457 | H459: Presidential Determination with Respect to Foreign Governments' Efforts Regarding Trafficking in Persons | I459: 2015-10-05 | J459: of:=[.I459]-ObamaInauguration -> 2449
G460: 458 | H460: Message to the Senate -- Treaty between the Government of the United States of America and the Government of the People's Democratic Republic of Algeria on Mutual Legal Assistance in Criminal Matters | I460: 2015-10-05 | J460: of:=[.I460]-ObamaInauguration -> 2449
G461: 459 | H461: Letter From The President-- War Powers Resolution Regarding Cameroon | I461: 2015-10-14 | J461: of:=[.I461]-ObamaInauguration -> 2458
G462: 460 | H462: Presidential Memorandum -- Preparing for Implementation of the Joint Comprehensive Plan of Action of July 14, 2015 (JCPOA) | I462: 2015-10-18 | J462: of:=[.I462]-ObamaInauguration -> 2462
G463: 461 | H463: Presidential Memorandum -- Delegation of Certain Functions and Authorities under Section 213(b)(1) of the Iran Threat Reduction and Syria Human Rights Act of 2012 | I463: 2015-10-18 | J463: of:=[.I463]-ObamaInauguration -> 2462
G464: 462 | H464: Presidential Memoranda -- Adoption Day for the Joint Comprehensive Plan of Action | I464: 2015-10-18 | J464: of:=[.I464]-ObamaInauguration -> 2462
G465: 463 | H465: Letters -- Continuation of the National Emergency with Respect to Significant Narcotics Traffickers Centered in Colombia | I465: 2015-10-19 | J465: of:=[.I465]-ObamaInauguration -> 2463
G466: 464 | H466: Notice -- Continuation of the National Emergency with Respect to Significant Narcotics Traffickers Centered in Colombia | I466: 2015-10-19 | J466: of:=[.I466]-ObamaInauguration -> 2463
G467: 465 | H467: Presidential Memorandum -- Delegation of Authority for Drafting and Submission of the International Trade Data System Annual Report to the Congress | I467: 2015-10-20 | J467: of:=[.I467]-ObamaInauguration -> 2464
G468: 466 | H468: Presidential Memorandum -- Addressing Prescription Drug Abuse and Heroin Use | I468: 2015-10-21 | J468: of:=[.I468]-ObamaInauguration -> 2465
G469: 467 | H469: Veto Message -- H.R. 1735 | I469: 2015-10-22 | J469: of:=[.I469]-ObamaInauguration -> 2466
G470: 468 | H470: Presidential Memorandum: Mitigating Impacts on Natural Resources from Development and Encouraging Related Private Investment | I470: 2015-11-03 | J470: of:=[.I470]-ObamaInauguration -> 2478
G471: 469 | H471: Letter -- Continuation of the National Emergency with Respect to Weapons of Mass Destruction | I471: 2015-11-12 | J471: of:=[.I471]-ObamaInauguration -> 2487
G472: 470 | H472: Notice -- Continuation of the National Emergency with Respect to Weapons of Mass Destruction | I472: 2015-11-12 | J472: of:=[.I472]-ObamaInauguration -> 2487
G473: 471 | H473: Memorandum -- Distribution of Department of Defense Funded Humanitarian Assistance in Syria | I473: 2015-11-13 | J473: of:=[.I473]-ObamaInauguration -> 2488
G474: 472 | H474: Presidential Determination -- Oil and Petroleum Products Purchased from Iran | I474: 2015-11-18 | J474: of:=[.I474]-ObamaInauguration -> 2493
G475: 473 | H475: Letter -- Blocking Property of Certain Persons Contributing to the Situation in Burundi | I475: 2015-11-23 | J475: of:=[.I475]-ObamaInauguration -> 2498
G476: 474 | H476: Message -- 2016 Alternate Pay Plan | I476: 2015-11-30 | J476: of:=[.I476]-ObamaInauguration -> 2505
G477: 475 | H477: Presidential Memorandum -- Suspension of Limitations under the Jerusalem Embassy Act | I477: 2015-12-02 | J477: of:=[.I477]-ObamaInauguration -> 2507
G478: 476 | H478: Memorandum -- Delegation of Reporting Functions Specified in Section 941 of the Fiscal Year 2014 National Defense Authorization Act | I478: 2015-12-02 | J478: of:=[.I478]-ObamaInauguration -> 2507
G479: 477 | H479: Letter From The President-- OCO Designation and IMF Emergency Designation | I479: 2015-12-18 | J479: of:=[.I479]-ObamaInauguration -> 2523
G480: 478 | H480: Memorandum of Disapproval on S.J. Res. 24 | I480: 2015-12-18 | J480: of:=[.I480]-ObamaInauguration -> 2523
G481: 479 | H481: Memorandum of Disapproval on S.J. Res. 23 | I481: 2015-12-19 | J481: of:=[.I481]-ObamaInauguration -> 2524
G482: 480 | H482: Memorandum -- Promoting Smart Gun Technology | I482: 2016-01-04 | J482: of:=[.I482]-ObamaInauguration -> 2540
G483: 481 | H483: Veto Message from the President -- H.R. 3762 | I483: 2016-01-08 | J483: of:=[.I483]-ObamaInauguration -> 2544
G484: 482 | H484: Presidential Determination -- Unexpected Urgent Refugee and Migration Needs | I484: 2016-01-13 | J484: of:=[.I484]-ObamaInauguration -> 2549
G485: 483 | H485: Presidential Memorandum ---Delegation of Certain Functions and Authorities under Section 103(b)(2) | I485: 2016-01-15 | J485: of:=[.I485]-ObamaInauguration -> 2551
G486: 484 | H486: Letter -- Continuation of the National Emergency with Respect to Terrorists Who Threaten to Disrupt the Middle East Peace Process | I486: 2016-01-20 | J486: of:=[.I486]-ObamaInauguration -> 2556
G487: 485 | H487: Notice -- Continuation of the National Emergency with Respect to Terrorists Who Threaten to Disrupt the Middle East Peace Process | I487: 2016-01-20 | J487: of:=[.I487]-ObamaInauguration -> 2556
G488: 486 | H488: Memorandum -- Delegation of Authority under the NDAA | I488: 2016-01-21 | J488: of:=[.I488]-ObamaInauguration -> 2557
G489: 487 | H489: Memorandum -- White House Cancer Moonshot Task Force | I489: 2016-01-28 | J489: of:=[.I489]-ObamaInauguration -> 2564
G490: 488 | H490: Presidential Memorandum -- Bipartisan Congressional Trade Priorities and Accountability Act of 2015 | I490: 2016-01-29 | J490: of:=[.I490]-ObamaInauguration -> 2565
G491: 489 | H491: Message to the Congress -- District of Columbia’s FY 2016 Budget and Financial Plan | I491: 2016-02-02 | J491: of:=[.I491]-ObamaInauguration -> 2569
G492: 490 | H492: Sequestration Order for Fiscal Year 2017 | I492: 2016-02-09 | J492: of:=[.I492]-ObamaInauguration -> 2576
G493: 491 | H493: Message to the Senate -- The UN Convention on the Use of Electronic Communications in International Contracts | I493: 2016-02-10 | J493: of:=[.I493]-ObamaInauguration -> 2577
G494: 492 | H494: Message to the Senate -- The UN Convention on the Assignment of Receivables in International Trade | I494: 2016-02-10 | J494: of:=[.I494]-ObamaInauguration -> 2577
G495: 493 | H495: Notice -- Continuation of the National Emergency With Respect to Libya | I495: 2016-02-22 | J495: of:=[.I495]-ObamaInauguration -> 2589
G496: 494 | H496: Letter -- Continuation of the National Emergency With Respect to Libya | I496: 2016-02-22 | J496: of:=[.I496]-ObamaInauguration -> 2589
G497: 495 | H497: Message -- Continuation of the National Emergency With Respect to Cuba | I497: 2016-02-24 | J497: of:=[.I497]-ObamaInauguration -> 2591
G498: 496 | H498: Presidential Memorandum -- Limiting the Use of Restrictive Housing by the Federal Government | I498: 2016-03-01 | J498: of:=[.I498]-ObamaInauguration -> 2597
G499: 497 | H499: Notice -- Continuation of the National Emergency with Respect to Zimbabwe | I499: 2016-03-02 | J499: of:=[.I499]-ObamaInauguration -> 2598
G500: 498 | H500: Message -- Continuation of the National Emergency with Respect to Zimbabwe | I500: 2016-03-02 | J500: of:=[.I500]-ObamaInauguration -> 2598
G501: 499 | H501: Notice -- Continuation of the National Emergency with Respect to Ukraine | I501: 2016-03-02 | J501: of:=[.I501]-ObamaInauguration -> 2598
G502: 500 | H502: Message -- Continuation of the National Emergency with Respect to Ukraine | I502: 2016-03-02 | J502: of:=[.I502]-ObamaInauguration -> 2598
G503: 501 | H503: Notice -- Continuation of the National Emergency with Respect to Venezuela | I503: 2016-03-03 | J503: of:=[.I503]-ObamaInauguration -> 2599
G504: 502 | H504: Letter -- Continuation of the National Emergency with Respect to Venezuela | I504: 2016-03-04 | J504: of:=[.I504]-ObamaInauguration -> 2600
G505: 503 | H505: Notice -- Continuation of the National Emergency with Respect to Iran | I505: 2016-03-09 | J505: of:=[.I505]-ObamaInauguration -> 2605
G506: 504 | H506: Letter -- Continuation of the National Emergency with Respect to Iran | I506: 2016-03-09 | J506: of:=[.I506]-ObamaInauguration -> 2605
G507: 505 | H507: Presidential Memorandum -- Delegation of Authority Under Section 11 of the Export-Import Bank Reauthorization Act of 2012 | I507: 2016-03-11 | J507: of:=[.I507]-ObamaInauguration -> 2607
G508: 506 | H508: Message -- Blocking Property of the Government of North Korea and the Workers' Party of Korea, and Prohibiting Certain Transactions with Respect to North Korea | I508: 2016-03-16 | J508: of:=[.I508]-ObamaInauguration -> 2612
G509: 507 | H509: Message to the Senate -- Treaty between the United States of America and the Republic of Kazakhstan on Mutual Legal Assistance in Criminal Matters | I509: 2016-03-17 | J509: of:=[.I509]-ObamaInauguration -> 2613
G510: 508 | H510: Presidential Memoranda -- Delegation of Authority Pursuant to the Hizballah International Financing Prevention Act of 2015 ( Director of National Intelligence) | I510: 2016-03-18 | J510: of:=[.I510]-ObamaInauguration -> 2614
G511: 509 | H511: Presidential Memoranda -- Delegation of Authority Pursuant to the Hizballah International Financing Prevention Act of 2015 (Secretary of State) | I511: 2016-03-18 | J511: of:=[.I511]-ObamaInauguration -> 2614
G512: 510 | H512: Presidential Memoranda -- Delegation of Authority Pursuant to the Hizballah International Financing Prevention Act of 2015 (Secretary of the Treasury) | I512: 2016-03-18 | J512: of:=[.I512]-ObamaInauguration -> 2614
G513: 511 | H513: Presidential Memorandum -- Delegation of Authority Pursuant to Section 3139(a) and (b) of the National Defense Authorization Act for Fiscal Year 2016 | I513: 2016-03-18 | J513: of:=[.I513]-ObamaInauguration -> 2614
G514: 512 | H514: Presidential Memorandum: Building National Capabilities for Long-Term Drought Resilience | I514: 2016-03-21 | J514: of:=[.I514]-ObamaInauguration -> 2617
G515: 513 | H515: Presidential Memorandum -- Mental Health and Substance Use Disorder Parity Task Force | I515: 2016-03-29 | J515: of:=[.I515]-ObamaInauguration -> 2625
G516: 514 | H516: Letter -- Continuation of the National Emergency with Respect to Somalia | I516: 2016-04-04 | J516: of:=[.I516]-ObamaInauguration -> 2631
G517: 515 | H517: Presidential Memorandum -- Delegations of Authority Under Sections 610, 614(a)(1), and 506(a)(2)(A)(i)(II) of the Foreign Assistance Act of 1961 | I517: 2016-04-12 | J517: of:=[.I517]-ObamaInauguration -> 2639
G518: 516 | H518: Message -- Blocking Property And Suspending Entry Into The United States Of Persons Contributing To The Situation In Libya | I518: 2016-04-19 | J518: of:=[.I518]-ObamaInauguration -> 2646
G519: 517 | H519: Presidential Memorandum -- Promoting Rehabilitation and Reintegration of Formerly Incarcerated Individuals | I519: 2016-04-29 | J519: of:=[.I519]-ObamaInauguration -> 2656
G520: 518 | H520: Presidential Memorandum -- Delegation of Authority Pursuant to Section 3136(h) of the National Defense Authorization Act for Fiscal Year 2016 | I520: 2016-05-10 | J520: of:=[.I520]-ObamaInauguration -> 2667
G521: 519 | H521: Message -- Continuation of the National Emergency with Respect to Yemen | I521: 2016-05-12 | J521: of:=[.I521]-ObamaInauguration -> 2669
G522: 520 | H522: Notice -- Continuation of the National Emergency with Respect to Yemen | I522: 2016-05-12 | J522: of:=[.I522]-ObamaInauguration -> 2669
G523: 521 | H523: Notice -- Continuation of the National Emergency with Respect to Burma | I523: 2016-05-17 | J523: of:=[.I523]-ObamaInauguration -> 2674
G524: 522 | H524: Message -- Continuation of the National Emergency with Respect to Burma | I524: 2016-05-17 | J524: of:=[.I524]-ObamaInauguration -> 2674
G525: 523 | H525: Presidential Memorandum -- Delegation of Certain Functions and Authorities under the North Korea Sanctions and Policy Enhancement Act of 2016 | I525: 2016-05-18 | J525: of:=[.I525]-ObamaInauguration -> 2675
G526: 524 | H526: Presidential Memorandum -- Delegation of Authority Under Section 106 of the Bipartisan Congressional Trade Priorities and Accountability Act of 2015 | I526: 2016-05-24 | J526: of:=[.I526]-ObamaInauguration -> 2681
G527: 525 | H527: Presidential Memorandum -- Suspension of Limitations under the Jerusalem Embassy Act | I527: 2016-06-01 | J527: of:=[.I527]-ObamaInauguration -> 2689
G528: 526 | H528: Veto Message from the President -- - H.J. Res. 88 | I528: 2016-06-08 | J528: of:=[.I528]-ObamaInauguration -> 2696
G529: 527 | H529: Message -- Continuation of the National Emergency With Respect to the Actions and Policies of Certain Members of the Government of Belarus and Other Persons to Undermine Belarus's Democratic Processes or Institutions | I529: 2016-06-10 | J529: of:=[.I529]-ObamaInauguration -> 2698
G530: 528 | H530: Notice -- Continuation of the National Emergency With Respect to the Actions and Policies of Certain Members of the Government of Belarus and Other Persons to Undermine Belarus's Democratic Processes or Institutions | I530: 2016-06-10 | J530: of:=[.I530]-ObamaInauguration -> 2698
G531: 529 | H531: Presidential Memorandum -- Proposed Agreement for Cooperation Between the Government of the United States of America and the Government of the Kingdom of Norway Concerning Peaceful Uses of Nuclear Energy | I531: 2016-06-10 | J531: of:=[.I531]-ObamaInauguration -> 2698
G532: 530 | H532: Letter From The President -- War Powers Resolution | I532: 2016-06-13 | J532: of:=[.I532]-ObamaInauguration -> 2701
G533: 531 | H533: Message to Congress -- Agreement for Cooperation Between the Government of the United States of America and the Government of the Kingdom of Norway Concerning Peaceful Uses of Nuclear Energy | I533: 2016-06-14 | J533: of:=[.I533]-ObamaInauguration -> 2702
G534: 532 | H534: Message -- Continuation of the National Emergency with Respect to the Western Balkans | I534: 2016-06-21 | J534: of:=[.I534]-ObamaInauguration -> 2709
G535: 533 | H535: Message -- Continuation of the National Emergency with Respect to North Korea | I535: 2016-06-21 | J535: of:=[.I535]-ObamaInauguration -> 2709
G536: 534 | H536: Message to the Senate -- Protocol to the North Atlantic Treaty of 1949 on the Accession of Montenegro | I536: 2016-06-28 | J536: of:=[.I536]-ObamaInauguration -> 2716
G537: 535 | H537: Presidential Memorandum -- Delegation of Authority Under Sections 614(a)(1) and 610 of the Foreign Assistance Act of 1961 | I537: 2016-07-13 | J537: of:=[.I537]-ObamaInauguration -> 2731
G538: 536 | H538: Presidential Memorandum -- Delegation of Authority Under Section 610 of the Foreign Assistance Act of 1961 | I538: 2016-07-13 | J538: of:=[.I538]-ObamaInauguration -> 2731
G539: 537 | H539: Letter from the President -- War Powers Resolution | I539: 2016-07-13 | J539: of:=[.I539]-ObamaInauguration -> 2731
G540: 538 | H540: Letter from the President -- War Powers Resolution | I540: 2016-07-15 | J540: of:=[.I540]-ObamaInauguration -> 2733
G541: 539 | H541: Notice -- Continuation of the National Emergency with Respect to Transnational Criminal Organizations | I541: 2016-07-20 | J541: of:=[.I541]-ObamaInauguration -> 2738
G542: 540 | H542: Letter -- Continuation of the National Emergency with Respect to Transnational Criminal Organizations | I542: 2016-07-20 | J542: of:=[.I542]-ObamaInauguration -> 2738
G543: 541 | H543: Presidential Policy Directive -- United States Cyber Incident Coordination | I543: 2016-07-26 | J543: of:=[.I543]-ObamaInauguration -> 2744
G544: 542 | H544: Annex for Presidential Policy Directive -- United States Cyber Incident Coordination | I544: 2016-07-26 | J544: of:=[.I544]-ObamaInauguration -> 2744
G545: 543 | H545: Presidential Memorandum -- Delegation of Authority Under Section 1247 of the National Defense Authorization Act for Fiscal Year 2016 | I545: 2016-07-26 | J545: of:=[.I545]-ObamaInauguration -> 2744
G546: 544 | H546: Notice -- Continuation of the National Emergency With Respect to Lebanon | I546: 2016-07-27 | J546: of:=[.I546]-ObamaInauguration -> 2745
G547: 545 | H547: Letter -- Continuation of the National Emergency With Respect to Lebanon | I547: 2016-07-27 | J547: of:=[.I547]-ObamaInauguration -> 2745
G548: 546 | H548: Presidential Memorandum -- Delegation of Functions and Authorities under the Protect and Preserve International Cultural Property Act | I548: 2016-08-01 | J548: of:=[.I548]-ObamaInauguration -> 2750
G549: 547 | H549: Presidential Memorandum -- Delegation of Authority Pursuant to Section 4 and Section 7 of the Electrify Africa Act of 2015 | I549: 2016-08-03 | J549: of:=[.I549]-ObamaInauguration -> 2752
G550: 548 | H550: Presidential Determination -- Continuation of U.S. Drug Interdiction Assistance to the Government of Colombia | I550: 2016-08-04 | J550: of:=[.I550]-ObamaInauguration -> 2753
G551: 549 | H551: Notice -- Continuation of the National Emergency with Respect to Export Control Regulations | I551: 2016-08-04 | J551: of:=[.I551]-ObamaInauguration -> 2753
G552: 550 | H552: Letter -- Continuation of the National Emergency with Respect to Export Control Regulations | I552: 2016-08-04 | J552: of:=[.I552]-ObamaInauguration -> 2753
G553: 551 | H553: Presidential Memorandum -- Delegation of Authority Under Section 614(a)(1) of the Foreign Assistance Act of 1961 | I553: 2016-08-05 | J553: of:=[.I553]-ObamaInauguration -> 2754
G554: 552 | H554: Presidential Memorandum -- Delegation of Authority of Unified Command Plan Responsibilities | I554: 2016-08-05 | J554: of:=[.I554]-ObamaInauguration -> 2754
G555: 553 | H555: Letter from the President -- Designation of Vice Chair of the United States International Trade Commission | I555: 2016-08-11 | J555: of:=[.I555]-ObamaInauguration -> 2760
G556: 554 | H556: Presidential Memorandum -- Designation of Officers of the Office of Personnel Management to Act as Director of the Office of Personnel Management | I556: 2016-08-12 | J556: of:=[.I556]-ObamaInauguration -> 2761
G557: 555 | H557: Presidential Memorandum -- Providing an Order of Succession within the National Endowment for the Humanities | I557: 2016-08-12 | J557: of:=[.I557]-ObamaInauguration -> 2761
G558: 556 | H558: Notice -- Continuation of the National Emergency with Respect to Certain Terrorist Attacks | I558: 2016-08-30 | J558: of:=[.I558]-ObamaInauguration -> 2779
G559: 557 | H559: Letter -- Continuation of the National Emergency with Respect to Certain Terrorist Attacks | I559: 2016-08-30 | J559: of:=[.I559]-ObamaInauguration -> 2779
G560: 558 | H560: Letter from the President -- Pay for Uniformed Services for 2017 | I560: 2016-08-31 | J560: of:=[.I560]-ObamaInauguration -> 2780
G561: 559 | H561: Letter from the President -- Pay for Federal Civilian Employees for 2017 | I561: 2016-08-31 | J561: of:=[.I561]-ObamaInauguration -> 2780
G562: 560 | H562: Letter from the President -- Report of the VA Commission on Care | I562: 2016-09-01 | J562: of:=[.I562]-ObamaInauguration -> 2781
G563: 561 | H563: Presidential Memorandum -- Emergency Leave Transfer Program for Federal Employees Adversely Affected by the Severe Storms and Flooding in Louisiana | I563: 2016-09-06 | J563: of:=[.I563]-ObamaInauguration -> 2786
G564: 562 | H564: Presidential Determination -- Major Drug Transit or Major Illicit Drug Producing Countries for Fiscal Year 2017 | I564: 2016-09-12 | J564: of:=[.I564]-ObamaInauguration -> 2792
G565: 563 | H565: Presidential Determination -- Continuation of the Exercise of Certain Authorities Under the Trading With the Enemy Act | I565: 2016-09-13 | J565: of:=[.I565]-ObamaInauguration -> 2793
G566: 564 | H566: Message to Congress -- Termination of the National Emergency with the Situation in or in Relation to Côte d’Ivoire | I566: 2016-09-14 | J566: of:=[.I566]-ObamaInauguration -> 2794
G567: 565 | H567: Presidential Message to the Congress -- Restoring Burma’s Trade Benefits Under the Generalized System of Preferences (GSP) | I567: 2016-09-14 | J567: of:=[.I567]-ObamaInauguration -> 2794
G568: 566 | H568: Letter -- Continuation of the National Emergency with Respect to Persons who Commit, Threaten to Commit, or Support Terrorism | I568: 2016-09-15 | J568: of:=[.I568]-ObamaInauguration -> 2795
G569: 567 | H569: Notice -- Continuation of the National Emergency with Respect to Persons who Commit, Threaten to Commit, or Support Terrorism | I569: 2016-09-15 | J569: of:=[.I569]-ObamaInauguration -> 2795
G570: 568 | H570: Presidential Memorandum -- Climate Change and National Security | I570: 2016-09-21 | J570: of:=[.I570]-ObamaInauguration -> 2801
G571: 569 | H571: Letter from the President -- Report to the Congress Regarding the Accession of Montenegro to the North Atlantic Treaty | I571: 2016-09-22 | J571: of:=[.I571]-ObamaInauguration -> 2802
G572: 570 | H572: Veto Message from the President -- S.2040 | I572: 2016-09-23 | J572: of:=[.I572]-ObamaInauguration -> 2803
G573: 571 | H573: Presidential Proclamation -- National Voter Registration Day, 2016 | I573: 2016-09-26 | J573: of:=[.I573]-ObamaInauguration -> 2806
G574: 572 | H574: Presidential Determination -- Foreign Governments' Efforts Regarding Trafficking in Persons | I574: 2016-09-27 | J574: of:=[.I574]-ObamaInauguration -> 2807
G575: 573 | H575: Presidential Memorandum -- Deferred Enforced Departure for Liberians | I575: 2016-09-28 | J575: of:=[.I575]-ObamaInauguration -> 2808
G576: 574 | H576: Presidential Determination -- Refugee Admissions for Fiscal Year 2017 | I576: 2016-09-28 | J576: of:=[.I576]-ObamaInauguration -> 2808
G577: 575 | H577: Presidential Determinations with Respect to the Child Soldiers Prevention Act of 2008, and Delegation of Authority Under Section 404(c) of the Child Soldiers Prevention Act of 2008 | I577: 2016-09-28 | J577: of:=[.I577]-ObamaInauguration -> 2808
G578: 576 | H578: Letter from the President -- Designations for Emergency Funding for Zika Response in Accordance with Section 5 of the Continuing Appropriations and Military Construction, Veterans Affairs, and Related Agencies Appropriations Act, 2017 | I578: 2016-09-29 | J578: of:=[.I578]-ObamaInauguration -> 2809
G579: 577 | H579: Letter from the President -- Funding Designations for Overseas Contingency Operations/Global War on Terrorism in accordance with section 401 of division A and section 114(c) of division C of the Continuing Appropriations and Military | I579: 2016-09-29 | J579: of:=[.I579]-ObamaInauguration -> 2809
G580: 578 | H580: Presidential Memorandum -- Transfer of Unified Command Plan Responsibilities | I580: 2016-09-30 | J580: of:=[.I580]-ObamaInauguration -> 2810
G581: 579 | H581: Presidential Memorandum -- Promoting Diversity and Inclusion in the National Security Workforce | I581: 2016-10-05 | J581: of:=[.I581]-ObamaInauguration -> 2815
G582: 580 | H582: Letter -- Termination of Emergency with Respect to the Actions and Policies of the Government of Burma | I582: 2016-10-07 | J582: of:=[.I582]-ObamaInauguration -> 2817
G583: 581 | H583: Presidential Policy Directive -- United States-Cuba Normalization | I583: 2016-10-14 | J583: of:=[.I583]-ObamaInauguration -> 2824
G584: 582 | H584: Letter from the President -- War Powers Resolution | I584: 2016-10-14 | J584: of:=[.I584]-ObamaInauguration -> 2824
G585: 583 | H585: Letter -- Continuation of the National Emergency with Respect to Significant Narcotics Traffickers Centered in Colombia | I585: 2016-10-18 | J585: of:=[.I585]-ObamaInauguration -> 2828
G586: 584 | H586: Notice -- Continuation of the National Emergency with Respect to Significant Narcotics Traffickers Centered in Colombia | I586: 2016-10-18 | J586: of:=[.I586]-ObamaInauguration -> 2828
G587: 585 | H587: Letter -- Continuation of National Emergency with respect to the Democratic Republic of the Congo | I587: 2016-10-21 | J587: of:=[.I587]-ObamaInauguration -> 2831
G588: 586 | H588: Notice -- Continuation of National Emergency with respect to the Democratic Republic of the Congo | I588: 2016-10-21 | J588: of:=[.I588]-ObamaInauguration -> 2831
G589: 587 | H589: Letter -- Continuation of National Emergency with Respect to Sudan | I589: 2016-10-31 | J589: of:=[.I589]-ObamaInauguration -> 2841
G590: 588 | H590: Notice -- Continuation of National Emergency with Respect to Sudan | I590: 2016-10-31 | J590: of:=[.I590]-ObamaInauguration -> 2841
G591: 589 | H591: Letter -- Continuation of National Emergency with Respect to Iran | I591: 2016-11-03 | J591: of:=[.I591]-ObamaInauguration -> 2844
G592: 590 | H592: Notice -- Continuation of National Emergency with Respect to Iran | I592: 2016-11-03 | J592: of:=[.I592]-ObamaInauguration -> 2844
G593: 591 | H593: Letter -- Continuation of the National Emergency with Respect to the Proliferation of Weapons of Mass Destruction | I593: 2016-11-08 | J593: of:=[.I593]-ObamaInauguration -> 2849
G594: 592 | H594: Notice -- Continuation of the National Emergency with Respect to The Proliferation of Weapons of Mass Destruction | I594: 2016-11-08 | J594: of:=[.I594]-ObamaInauguration -> 2849
G595: 593 | H595: Letter -- Continuation of the National Emergency with Respect to Burundi | I595: 2016-11-09 | J595: of:=[.I595]-ObamaInauguration -> 2850
G596: 594 | H596: Notice -- Continuation of the National Emergency with Respect to Burundi | I596: 2016-11-09 | J596: of:=[.I596]-ObamaInauguration -> 2850
G597: 595 | H597: Letter from the President -- Fiscal Year 2017 Budget amendments | I597: 2016-11-10 | J597: of:=[.I597]-ObamaInauguration -> 2851
G598: 596 | H598: Presidential Memorandum: Advancing Fair Practices by Education and Training Institutions Serving Service Members, Veterans, Eligible Spouses, and Other Family Members | I598: 2016-11-11 | J598: of:=[.I598]-ObamaInauguration -> 2852
G599: 597 | H599: Presidential Determination Pursuant to Section 1245(d)(4)(B) and (C) of the National Defense Authorization Act for Fiscal Year 2012 | I599: 2016-11-14 | J599: of:=[.I599]-ObamaInauguration -> 2855
G600: 598 | H600: Presidential Memorandum -- Eligibility of the Multinational Force and Observers to Receive Defense Articles and Defense Services | I600: 2016-11-16 | J600: of:=[.I600]-ObamaInauguration -> 2857
G601: 599 | H601: Presidential Determination -- Suspension of Limitations under the Jerusalem Embassy Act | I601: 2016-12-01 | J601: of:=[.I601]-ObamaInauguration -> 2872
G602: 600 | H602: Presidential Determination -- Pursuant to Section 570(a) of the Foreign Operations, Export Financing, and Related Programs Appropriations Act, 1997 | I602: 2016-12-02 | J602: of:=[.I602]-ObamaInauguration -> 2873
G603: 601 | H603: Letter from the President -- Supplemental 6-month War Powers Letter | I603: 2016-12-05 | J603: of:=[.I603]-ObamaInauguration -> 2876
G604: 602 | H604: Presidential Memorandum -- Steps for Increased Legal and Policy Transparency Concerning the United States Use of Military Force and Related National Security Operations | I604: 2016-12-05 | J604: of:=[.I604]-ObamaInauguration -> 2876
G605: 603 | H605: Message to Congress -- Brazil Social Security Agreement | I605: 2016-12-08 | J605: of:=[.I605]-ObamaInauguration -> 2879
G606: 604 | H606: Presidential Determination and Waiver -- Pursuant to Section 2249a of Title 10, United States Code, and Sections 40 and 40A of the Arms Export Control Act to Support U.S. Special Operations to Combat Terrorism in Syria | I606: 2016-12-08 | J606: of:=[.I606]-ObamaInauguration -> 2879
G607: 605 | H607: Message to the Senate -- Arms Trade Treaty | I607: 2016-12-09 | J607: of:=[.I607]-ObamaInauguration -> 2880
G608: 606 | H608: Message to the Senate -- UN Convention on Transparency in Treaty-Based Investor-State Arbitration | I608: 2016-12-09 | J608: of:=[.I608]-ObamaInauguration -> 2880
G609: 607 | H609: Presidential Memoranda -- Minnesota World's Fair 2023 | I609: 2016-12-09 | J609: of:=[.I609]-ObamaInauguration -> 2880
G610: 608 | H610: Presidential Memorandum -- Withdrawal of Certain Portions of the United States Arctic Outer Continental Shelf from Mineral Leasing | I610: 2016-12-20 | J610: of:=[.I610]-ObamaInauguration -> 2891
G611: 609 | H611: Presidential Memorandum -- Withdrawal of Certain Areas off the Atlantic Coast on the Outer Continental Shelf from Mineral Leasing | I611: 2016-12-20 | J611: of:=[.I611]-ObamaInauguration -> 2891
G612: 610 | H612: Presidential Memorandum -- Supporting New American Service Members, Veterans, and their Families | I612: 2016-12-22 | J612: of:=[.I612]-ObamaInauguration -> 2893
G613: 611 | H613: Presidential Memorandum -- Designation of Officers of the National Archives and Records Administration to Act as Archivist of the United States | I613: 2016-12-23 | J613: of:=[.I613]-ObamaInauguration -> 2894
G614: 612 | H614: Presidential Memorandum -- Providing an Order of Succession within the National Endowment for the Arts | I614: 2016-12-23 | J614: of:=[.I614]-ObamaInauguration -> 2894
G615: 613 | H615: Presidential Memorandum -- Providing an Order of Succession within the Social Security Administration | I615: 2016-12-23 | J615: of:=[.I615]-ObamaInauguration -> 2894
G616: 614 | H616: Presidential Memorandum -- Providing an Order of Succession within the Federal Mediation and Conciliation Service | I616: 2016-12-23 | J616: of:=[.I616]-ObamaInauguration -> 2894
G617: 615 | H617: Letter from the President -- Taking Additional Steps to Address the National Emergency with Respect to Significant Malicious Cyber-Enabled Activities | I617: 2016-12-29 | J617: of:=[.I617]-ObamaInauguration -> 2900
G618: 616 | H618: Letter from President Obama on Cabinet Exit Memoranda | I618: 2017-01-05 | J618: of:=[.I618]-ObamaInauguration -> 2907
G619: 617 | H619: Presidential Proclamation -- Boundary Enlargement of the Cascade-Siskiyou National Monument | I619: 2017-01-12 | J619: of:=[.I619]-ObamaInauguration -> 2914
G620: 618 | H620: Presidential Memorandum -- Promoting Diversity and Inclusion in Our National Parks, National Forests, and Other Public Lands and Waters | I620: 2017-01-12 | J620: of:=[.I620]-ObamaInauguration -> 2914
G621: 619 | H621: Presidential Proclamations -- Establishment of the Freedom Riders National Monument | I621: 2017-01-12 | J621: of:=[.I621]-ObamaInauguration -> 2914
G622: 620 | H622: Letter -- Recognizing Positive Actions by the Government of Sudan and Providing for the Revocation of Certain Sudan-Related Sanctions | I622: 2017-01-13 | J622: of:=[.I622]-ObamaInauguration -> 2915
G623: 621 | H623: Presidential Memorandum -- The Director of the Federal Mediation and Conciliation Service | I623: 2017-01-13 | J623: of:=[.I623]-ObamaInauguration -> 2915
G624: 622 | H624: Presidential Memorandum -- The Director of the Office of Science and Technology Policy | I624: 2017-01-13 | J624: of:=[.I624]-ObamaInauguration -> 2915
G625: 623 | H625: Presidential Memorandum -- The Chairman of the Council on Environmental Quality | I625: 2017-01-13 | J625: of:=[.I625]-ObamaInauguration -> 2915
G626: 624 | H626: Letters from the President -- Designation of the Chair of the United States International Trade Commission | I626: 2017-01-13 | J626: of:=[.I626]-ObamaInauguration -> 2915
G627: 625 | H627: Presidential Memorandum -- Continuing to Expand Opportunity for All Young People | I627: 2017-01-13 | J627: of:=[.I627]-ObamaInauguration -> 2915
G628: 626 | H628: Letter -- Continuation of National Emergency with Respect to Terrorists Who Threaten to Disrupt the Middle East Peace Process | I628: 2017-01-13 | J628: of:=[.I628]-ObamaInauguration -> 2915
G629: 627 | H629: Notice -- Continuation of National Emergency with Respect to Terrorists Who Threaten to Disrupt the Middle East Peace Process | I629: 2017-01-13 | J629: of:=[.I629]-ObamaInauguration -> 2915
G630: 628 | H630: Notice -- Continuation of the National Emergency with Respect to Libya | I630: 2017-01-13 | J630: of:=[.I630]-ObamaInauguration -> 2915
G631: 629 | H631: Notice -- Continuation of National Emergency with Respect to Ukraine | I631: 2017-01-13 | J631: of:=[.I631]-ObamaInauguration -> 2915
G632: 630 | H632: Letter -- Continuation of National Emergency with Respect to Ukraine | I632: 2017-01-13 | J632: of:=[.I632]-ObamaInauguration -> 2915
G633: 631 | H633: Notice -- Continuation of National Emergency with Respect to Zimbabwe | I633: 2017-01-13 | J633: of:=[.I633]-ObamaInauguration -> 2915
G634: 632 | H634: Letter -- Continuation of National Emergency with Respect to Zimbabwe | I634: 2017-01-13 | J634: of:=[.I634]-ObamaInauguration -> 2915
G635: 633 | H635: Letter -- Continuation of National Emergency with Respect to Cuba | I635: 2017-01-13 | J635: of:=[.I635]-ObamaInauguration -> 2915
G636: 634 | H636: Notice -- Continuation of National Emergency with Respect to Cuba | I636: 2017-01-13 | J636: of:=[.I636]-ObamaInauguration -> 2915
G637: 635 | H637: Letter -- Continuation of the National Emergency with Respect to Libya | I637: 2017-01-13 | J637: of:=[.I637]-ObamaInauguration -> 2915
G638: 636 | H638: Notice -- Continuation of the National Emergency with Respect to Venezuela | I638: 2017-01-13 | J638: of:=[.I638]-ObamaInauguration -> 2915
G639: 637 | H639: Letter -- Continuation of the National Emergency with Respect to Venezuela | I639: 2017-01-13 | J639: of:=[.I639]-ObamaInauguration -> 2915
G640: 638 | H640: Notice -- Continuation of the National Emergency With Respect to Iran | I640: 2017-01-13 | J640: of:=[.I640]-ObamaInauguration -> 2915
G641: 639 | H641: Letter -- Continuation of the National Emergency With Respect to Iran | I641: 2017-01-13 | J641: of:=[.I641]-ObamaInauguration -> 2915
G642: 640 | H642: Presidential Proclamation -- Religious Freedom Day, 2017 | I642: 2017-01-13 | J642: of:=[.I642]-ObamaInauguration -> 2915
G643: 641 | H643: Presidential Memorandum -- Delegating Authority under the National Defense Authorization Act for Fiscal Year 2017 | I643: 2017-01-17 | J643: of:=[.I643]-ObamaInauguration -> 2919
G644: 642 | H644: Messages to the Senate -- Kosovo | I644: 2017-01-17 | J644: of:=[.I644]-ObamaInauguration -> 2919
G645: 643 | H645: Messages to the Senate -- Serbia Treaties | I645: 2017-01-17 | J645: of:=[.I645]-ObamaInauguration -> 2919
G646: 644 | H646: Letter from the President -- Report with Respect to Guantanamo | I646: 2017-01-19 | J646: of:=[.I646]-ObamaInauguration -> 2921

Sheet: Reagan Executive Orders
B1: Executive Orders
B2: No. | C2: Title/Description | D2: Date signed | E2: Days since Inauguration
B3: 12287 | C3: Decontrol of crude oil and refined petroleum products | D3: January 28, 1981 | E3: of:=[.D3]-ReaganInauguration -> 8
B4: 12288 | C4: Termination of the Wage and Price Regulatory Program | D4: January 29, 1981 | E4: of:=[.D4]-ReaganInauguration -> 9
B5: 12289 | C5: Foreign Service Retirement and Disability System | D5: February 14, 1981 | E5: of:=[.D5]-ReaganInauguration -> 25
B6: 12290 | C6: Federal exports and excessive regulation | D6: February 17, 1981 | E6: of:=[.D6]-ReaganInauguration -> 28
B7: 12291 | C7: Federal Regulation | D7: February 17, 1981 | E7: of:=[.D7]-ReaganInauguration -> 28
B8: 12292 | C8: Foreign Service Act of 1980 | D8: February 23, 1981 | E8: of:=[.D8]-ReaganInauguration -> 34
B9: 12293 | C9: The Foreign Service of the United States | D9: February 23, 1981 | E9: of:=[.D9]-ReaganInauguration -> 34
B10: 12294 | C10: Suspension of litigation against Iran | D10: February 24, 1981 | E10: of:=[.D10]-ReaganInauguration -> 35
B11: 12295 | C11: Nuclear Cooperation with EURATOM | D11: February 24, 1981 | E11: of:=[.D11]-ReaganInauguration -> 35
B12: 12296 | C12: President's Economic Policy Advisory Board | D12: March 2, 1981 | E12: of:=[.D12]-ReaganInauguration -> 41
B13: 12297 | C13: International Coffee Agreement of 1976 | D13: March 12, 1981 | E13: of:=[.D13]-ReaganInauguration -> 51
B14: 12298 | C14: Lake Tahoe region | D14: March 12, 1981 | E14: of:=[.D14]-ReaganInauguration -> 51
B15: 12299 | C15: Presidential Advisory Board on Ambassadorial Appointments | D15: March 17, 1981 | E15: of:=[.D15]-ReaganInauguration -> 56
B16: 12300 | C16: Exceptions from the Competitive Service | D16: March 23, 1981 | E16: of:=[.D16]-ReaganInauguration -> 62
B17: 12301 | C17: Integrity and efficiency in Federal programs | D17: March 26, 1981 | E17: of:=[.D17]-ReaganInauguration -> 65
B18: 12302 | C18: Amending the Generalized System of Preferences | D18: April 1, 1981 | E18: of:=[.D18]-ReaganInauguration -> 71
B19: 12303 | C19: Presidential Advisory Committee on Federalism | D19: April 8, 1981 | E19: of:=[.D19]-ReaganInauguration -> 78
B20: 12304 | C20: Seal for the Panama Canal Commission | D20: April 29, 1981 | E20: of:=[.D20]-ReaganInauguration -> 99
B21: 12305 | C21: Termination of certain Federal advisory committees | D21: May 5, 1981 | E21: of:=[.D21]-ReaganInauguration -> 105
B22: 12306 | C22: Amendments to the Manual for Courts-Martial, United States, 1969 (Revised Edition) | D22: June 1, 1981 | E22: of:=[.D22]-ReaganInauguration -> 132
B23: 12307 | C23: President's Commission on Hostage Compensation | D23: June 4, 1981 | E23: of:=[.D23]-ReaganInauguration -> 135
B24: 12308 | C24: Presidential Task Force on the Arts and Humanities | D24: June 5, 1981 | E24: of:=[.D24]-ReaganInauguration -> 136
B25: 12309 | C25: President's Economic Policy Advisory Board | D25: June 9, 1981 | E25: of:=[.D25]-ReaganInauguration -> 140
B26: 12310 | C26: President's Commission on Housing | D26: June 16, 1981 | E26: of:=[.D26]-ReaganInauguration -> 147
B27: 12311 | C27: Amending the Generalized System of Preferences | D27: June 29, 1981 | E27: of:=[.D27]-ReaganInauguration -> 160
B28: 12312 | C28: The Meritorious Service Medal | D28: July 2, 1981 | E28: of:=[.D28]-ReaganInauguration -> 163
B29: 12313 | C29: Specification of hostage return date under Hostage Relief Act of 1980 | D29: July 13, 1981 | E29: of:=[.D29]-ReaganInauguration -> 174
B30: 12314 | C30: Federal Regional Councils | D30: July 22, 1981 | E30: of:=[.D30]-ReaganInauguration -> 183
B31: 12315 | C31: Amending the Manual for Courts-Martial, United States, 1969 (Revised Edition) | D31: July 29, 1981 | E31: of:=[.D31]-ReaganInauguration -> 190
B32: 12316 | C32: Responses to environmental damage | D32: August 14, 1981 | E32: of:=[.D32]-ReaganInauguration -> 206
B33: 12317 | C33: President's Commission on Hostage Compensation | D33: August 14, 1981 | E33: of:=[.D33]-ReaganInauguration -> 206
B34: 12318 | C34: Statistical policy functions | D34: August 21, 1981 | E34: of:=[.D34]-ReaganInauguration -> 213
B35: 12319 | C35: River Basin Commissions | D35: September 9, 1981 | E35: of:=[.D35]-ReaganInauguration -> 232
B36: 12320 | C36: Historically Black Colleges and Universities | D36: September 15, 1981 | E36: of:=[.D36]-ReaganInauguration -> 238
B37: 12321 | C37: Foreign assistance and arms export control | D37: September 14, 1981 | E37: of:=[.D37]-ReaganInauguration -> 237
B38: 12322 | C38: Water resources projects | D38: September 17, 1981 | E38: of:=[.D38]-ReaganInauguration -> 240
B39: 12323 | C39: Presidential Commission on Broadcasting to Cuba | D39: September 22, 1981 | E39: of:=[.D39]-ReaganInauguration -> 245
B40: 12324 | C40: Interdiction of illegal aliens | D40: September 29, 1981 | E40: of:=[.D40]-ReaganInauguration -> 252
B41: 12325 | C41: Presidential Task Force on the Arts and Humanities | D41: September 30, 1981 | E41: of:=[.D41]-ReaganInauguration -> 253
B42: 12326 | C42: Central Intelligence Agency Retirement and Disability System | D42: September 30, 1981 | E42: of:=[.D42]-ReaganInauguration -> 253
B43: 12327 | C43: Exemption for Fort Allen | D43: October 1, 1981 | E43: of:=[.D43]-ReaganInauguration -> 254
B44: 12328 | C44: Federal employees contracting or trading with Indians | D44: October 8, 1981 | E44: of:=[.D44]-ReaganInauguration -> 261
B45: 12329 | C45: President's Task Force on Private Sector Initiatives | D45: October 14, 1981 | E45: of:=[.D45]-ReaganInauguration -> 267
B46: 12330 | C46: Adjustments of certain rates of pay and allowances | D46: October 15, 1981 | E46: of:=[.D46]-ReaganInauguration -> 268
B47: 12331 | C47: President's Foreign Intelligence Advisory Board | D47: October 20, 1981 | E47: of:=[.D47]-ReaganInauguration -> 273
B48: 12332 | C48: Establishment of the National Productivity Advisory Committee | D48: November 10, 1981 | E48: of:=[.D48]-ReaganInauguration -> 294
B49: 12333 | C49: United States Intelligence Activities | D49: December 4, 1981 | E49: of:=[.D49]-ReaganInauguration -> 318
B50: 12334 | C50: President's Intelligence Oversight Board | D50: December 4, 1981 | E50: of:=[.D50]-ReaganInauguration -> 318
B51: 12335 | C51: National Commission on Social Security Reform | D51: December 16, 1981 | E51: of:=[.D51]-ReaganInauguration -> 330
B52: 12336 | C52: The Task Force on Legal Equity for Women | D52: December 21, 1981 | E52: of:=[.D52]-ReaganInauguration -> 335
B53: 12337 | C53: Basic allowance for subsistence for Uniformed Services | D53: January 11, 1982 | E53: of:=[.D53]-ReaganInauguration -> 356
B54: 12338 | C54: Exclusions from the Federal Labor-Management Relations Program | D54: January 11, 1982 | E54: of:=[.D54]-ReaganInauguration -> 356
B55: 12339 | C55: President's Commission on Housing | D55: January 13, 1982 | E55: of:=[.D55]-ReaganInauguration -> 358
B56: 12340 | C56: Amendments to the Manual for Courts-Martial, United States, 1969 (Revised Edition) | D56: January 20, 1982 | E56: of:=[.D56]-ReaganInauguration -> 365
B57: 12341 | C57: Cuban and Haitian entrants | D57: January 21, 1982 | E57: of:=[.D57]-ReaganInauguration -> 366
B58: 12342 | C58: Environmental safeguards for animal damage control on Federal lands | D58: January 27, 1982 | E58: of:=[.D58]-ReaganInauguration -> 372
B59: 12343 | C59: Designation of certain officers to act as Secretary of State | D59: January 27, 1982 | E59: of:=[.D59]-ReaganInauguration -> 372
B60: 12344 | C60: Naval Nuclear Propulsion Program | D60: February 1, 1982 | E60: of:=[.D60]-ReaganInauguration -> 377
B61: 12345 | C61: Physical fitness and sports | D61: February 2, 1982 | E61: of:=[.D61]-ReaganInauguration -> 378
B62: 12346 | C62: Synthetic Fuels | D62: February 8, 1982 | E62: of:=[.D62]-ReaganInauguration -> 384
B63: 12347 | C63: Agreement on Government Procurement | D63: February 23, 1982 | E63: of:=[.D63]-ReaganInauguration -> 399
B64: 12348 | C64: Federal Real Property | D64: February 25, 1982 | E64: of:=[.D64]-ReaganInauguration -> 401
B65: 12349 | C65: Amending the Generalized System of Preferences | D65: February 26, 1982 | E65: of:=[.D65]-ReaganInauguration -> 402
B66: 12350 | C66: Termination of Urban and Community Impact Analyses | D66: March 9, 1982 | E66: of:=[.D66]-ReaganInauguration -> 413
B67: 12351 | C67: Nuclear cooperation with EURATOM | D67: March 9, 1982 | E67: of:=[.D67]-ReaganInauguration -> 413
B68: 12352 | C68: Federal procurement reforms | D68: March 17, 1982 | E68: of:=[.D68]-ReaganInauguration -> 421
B69: 12353 | C69: Charitable fund-raising | D69: March 23, 1982 | E69: of:=[.D69]-ReaganInauguration -> 427
B70: 12354 | C70: Amending the Generalized System of Preferences | D70: March 30, 1982 | E70: of:=[.D70]-ReaganInauguration -> 434
B71: 12355 | C71: The Task Force on Legal Equity for Women | D71: April 1, 1982 | E71: of:=[.D71]-ReaganInauguration -> 436
B72: 12356 | C72: National Security Information | D72: April 2, 1982 | E72: of:=[.D72]-ReaganInauguration -> 437
B73: 12357 | C73: Sinai Support Mission | D73: April 6, 1982 | E73: of:=[.D73]-ReaganInauguration -> 441
B74: 12358 | C74: Presidential Commission on Drunk Driving | D74: April 14, 1982 | E74: of:=[.D74]-ReaganInauguration -> 449
B75: 12359 | C75: Public international organizations entitled to enjoy privileges, exemptions, and immunities | D75: April 23, 1982 | E75: of:=[.D75]-ReaganInauguration -> 458
B76: 12360 | C76: President's Task Force on Victims of Crime | D76: April 23, 1982 | E76: of:=[.D76]-ReaganInauguration -> 458
B77: 12361 | C77: Multinational Force and Observers reports | D77: April 27, 1982 | E77: of:=[.D77]-ReaganInauguration -> 462
B78: 12362 | C78: Overseas employment | D78: May 12, 1982 | E78: of:=[.D78]-ReaganInauguration -> 477
B79: 12363 | C79: The Foreign Service of the United States | D79: May 21, 1982 | E79: of:=[.D79]-ReaganInauguration -> 486
B80: 12364 | C80: Presidential Management Intern Program | D80: May 24, 1982 | E80: of:=[.D80]-ReaganInauguration -> 489
B81: 12365 | C81: Foreign assistance and arms control | D81: May 24, 1982 | E81: of:=[.D81]-ReaganInauguration -> 489
B82: 12366 | C82: Presidential Commission on Broadcasting to Cuba | D82: May 25, 1982 | E82: of:=[.D82]-ReaganInauguration -> 490
B83: 12367 | C83: President's Committee on the Arts and the Humanities | D83: June 15, 1982 | E83: of:=[.D83]-ReaganInauguration -> 511
B84: 12368 | C84: Drug Abuse Policy Functions | D84: June 24, 1982 | E84: of:=[.D84]-ReaganInauguration -> 520
B85: 12369 | C85: President's private sector survey on cost control in the Federal Government | D85: June 30, 1982 | E85: of:=[.D85]-ReaganInauguration -> 526
B86: 12370 | C86: Creating an emergency board to investigate a dispute between the Brotherhood of Locomotive Engineers and certain railroads represented by the National Carriers' Conference Committee of the National Railway Labor Conference | D86: July 8, 1982 | E86: of:=[.D86]-ReaganInauguration -> 534
B87: 12371 | C87: Amending the Generalized System of Preferences | D87: July 12, 1982 | E87: of:=[.D87]-ReaganInauguration -> 538
B88: 12372 | C88: Intergovernmental Review of Federal Programs | D88: July 14, 1982 | E88: of:=[.D88]-ReaganInauguration -> 540
B89: 12373 | C89: Establishing an emergency board to investigate a dispute between the United Transportation Union and certain railroads represented by the National Carriers' Conference Committee of the National Railway Labor Conference | D89: July 21, 1982 | E89: of:=[.D89]-ReaganInauguration -> 547
B90: 12374 | C90: Reports on international organizations | D90: July 28, 1982 | E90: of:=[.D90]-ReaganInauguration -> 554
B91: 12375 | C91: Motor Vehicles | D91: August 4, 1982 | E91: of:=[.D91]-ReaganInauguration -> 561
B92: 12376 | C92: Presidential Commission on Drunk Driving | D92: August 5, 1982 | E92: of:=[.D92]-ReaganInauguration -> 562
B93: 12377 | C93: Joint Mexican-United States Defense Commission | D93: August 6, 1982 | E93: of:=[.D93]-ReaganInauguration -> 563
B94: 12378 | C94: President's Committee on the Arts and the Humanities | D94: August 6, 1982 | E94: of:=[.D94]-ReaganInauguration -> 563
B95: 12379 | C95: Termination of boards, committees, and commissions | D95: August 17, 1982 | E95: of:=[.D95]-ReaganInauguration -> 574
B96: 12380 | C96: Submarine duty incentive pay | D96: August 18, 1982 | E96: of:=[.D96]-ReaganInauguration -> 575
B97: 12381 | C97: Delegation of emergency management functions | D97: September 8, 1982 | E97: of:=[.D97]-ReaganInauguration -> 596
B98: 12382 | C98: President's National Security Telecommunications Advisory Committee | D98: September 13, 1982 | E98: of:=[.D98]-ReaganInauguration -> 601
B99: 12383 | C99: Amendments to the Manual for Courts-Martial, United States, 1969 (Revised Edition) | D99: September 23, 1982 | E99: of:=[.D99]-ReaganInauguration -> 611
B100: 12384 | C100: Establishing an emergency board to investigate a dispute between the Southeastern Pennsylvania Transportation Authority and the Delaware Transportation Authority, and certain labor organizations | D100: October 1, 1982 | E100: of:=[.D100]-ReaganInauguration -> 619
B101: 12385 | C101: Establishing an emergency board to investigate a dispute between New Jersey Transit Rail Operations, Inc. and certain labor organizations | D101: October 1, 1982 | E101: of:=[.D101]-ReaganInauguration -> 619
B102: 12386 | C102: Establishing an emergency board to investigate a dispute between the New York Metropolitan Transportation Authority and the Connecticut Department of Transportation, and certain labor organizations | D102: October 1, 1982 | E102: of:=[.D102]-ReaganInauguration -> 619
B103: 12387 | C103: Adjustments of certain rates of pay and allowances | D103: October 8, 1982 | E103: of:=[.D103]-ReaganInauguration -> 626
B104: 12388 | C104: United States Information Agency | D104: October 14, 1982 | E104: of:=[.D104]-ReaganInauguration -> 632
B105: 12389 | C105: Amending the Generalized System of Preferences | D105: October 25, 1982 | E105: of:=[.D105]-ReaganInauguration -> 643
B106: 12390 | C106: Delegation to the Secretary of State | D106: October 25, 1982 | E106: of:=[.D106]-ReaganInauguration -> 643
B107: 12391 | C107: Partial suspension of Federal service labor-management relations | D107: November 4, 1982 | E107: of:=[.D107]-ReaganInauguration -> 653
B108: 12392 | C108: International financial institutions | D108: November 15, 1982 | E108: of:=[.D108]-ReaganInauguration -> 664
B109: 12393 | C109: Establishing an emergency board to investigate a dispute between the Long Island Rail Road and certain labor organizations | D109: November 16, 1982 | E109: of:=[.D109]-ReaganInauguration -> 665
B110: 12394 | C110: Incentive pay for hazardous duty | D110: November 18, 1982 | E110: of:=[.D110]-ReaganInauguration -> 667
B111: 12395 | C111: International Private Enterprise Task Force | D111: November 20, 1982 | E111: of:=[.D111]-ReaganInauguration -> 669
B112: 12396 | C112: Defense officer personnel management | D112: December 9, 1982 | E112: of:=[.D112]-ReaganInauguration -> 688
B113: 12397 | C113: National Commission on Social Security Reform | D113: December 23, 1982 | E113: of:=[.D113]-ReaganInauguration -> 702
B114: 12398 | C114: President's private sector survey on cost control in the Federal Government | D114: December 31, 1982 | E114: of:=[.D114]-ReaganInauguration -> 710
B115: 12399 | C115: Continuance of certain Federal advisory committees | D115: December 31, 1982 | E115: of:=[.D115]-ReaganInauguration -> 710
B116: 12400 | C116: President's Commission on Strategic Forces | D116: January 3, 1983 | E116: of:=[.D116]-ReaganInauguration -> 713
B117: 12401 | C117: Presidential Commission on Indian Reservation Economies | D117: January 14, 1983 | E117: of:=[.D117]-ReaganInauguration -> 724
B118: 12402 | C118: National Commission on Social Security Reform | D118: January 15, 1983 | E118: of:=[.D118]-ReaganInauguration -> 725
B119: 12403 | C119: African Development Bank | D119: February 8, 1983 | E119: of:=[.D119]-ReaganInauguration -> 749
B120: 12404 | C120: Charitable fund-raising | D120: February 10, 1983 | E120: of:=[.D120]-ReaganInauguration -> 751
B121: 12405 | C121: Establishing an emergency board to investigate a dispute between the Consolidated Rail Corporation and the Brotherhood of Locomotive Engineers | D121: February 14, 1983 | E121: of:=[.D121]-ReaganInauguration -> 755
B122: 12406 | C122: President's Commission on Strategic Forces | D122: February 18, 1983 | E122: of:=[.D122]-ReaganInauguration -> 759
B123: 12407 | C123: Federal Regional Councils | D123: February 22, 1983 | E123: of:=[.D123]-ReaganInauguration -> 763
B124: 12408 | C124: Reports on international organizations | D124: February 23, 1983 | E124: of:=[.D124]-ReaganInauguration -> 764
B125: 12409 | C125: Nuclear cooperation with EURATOM | D125: March 7, 1983 | E125: of:=[.D125]-ReaganInauguration -> 776
B126: 12410 | C126: Exclusions from the Federal Labor-Management Relations Program | D126: March 28, 1983 | E126: of:=[.D126]-ReaganInauguration -> 797
B127: 12411 | C127: Government work space management reforms | D127: March 29, 1983 | E127: of:=[.D127]-ReaganInauguration -> 798
B128: 12412 | C128: Peace Corps Advisory Council | D128: March 29, 1983 | E128: of:=[.D128]-ReaganInauguration -> 798
B129: 12413 | C129: Amending the Generalized System of Preferences | D129: March 30, 1983 | E129: of:=[.D129]-ReaganInauguration -> 799
B130: 12414 | C130: Establishing an emergency board to investigate a dispute between The Long Island Rail Road and certain labor organizations | D130: April 4, 1983 | E130: of:=[.D130]-ReaganInauguration -> 804
B131: 12415 | C131: Extension of the Presidential Commission on Drunk Driving | D131: April 5, 1983 | E131: of:=[.D131]-ReaganInauguration -> 805
B132: 12416 | C132: Intergovernmental review of Federal programs | D132: April 8, 1983 | E132: of:=[.D132]-ReaganInauguration -> 808
B133: 12417 | C133: Strategic and critical materials | D133: May 2, 1983 | E133: of:=[.D133]-ReaganInauguration -> 832
B134: 12418 | C134: Transfer of functions relating to financial responsibility of vessels for pollution liability | D134: May 5, 1983 | E134: of:=[.D134]-ReaganInauguration -> 835
B135: 12419 | C135: Implementation of the International Convention on Tonnage Measurement of Ships | D135: May 5, 1983 | E135: of:=[.D135]-ReaganInauguration -> 835
B136: 12420 | C136: Incentive pay for hazardous duty | D136: May 11, 1983 | E136: of:=[.D136]-ReaganInauguration -> 841
B137: 12421 | C137: Presidential Commission on the Conduct of United States-Japan Relations | D137: May 12, 1983 | E137: of:=[.D137]-ReaganInauguration -> 842
B138: 12422 | C138: Level IV of the Executive Schedule | D138: May 20, 1983 | E138: of:=[.D138]-ReaganInauguration -> 850
B139: 12423 | C139: Foreign assistance and arms control | D139: May 26, 1983 | E139: of:=[.D139]-ReaganInauguration -> 856
B140: 12424 | C140: President's Commission on Strategic Forces | D140: June 10, 1983 | E140: of:=[.D140]-ReaganInauguration -> 871
B141: 12425 | C141: International Criminal Police Organizations | D141: June 16, 1983 | E141: of:=[.D141]-ReaganInauguration -> 877
B142: 12426 | C142: President's Advisory Committee on Women's Business Ownership | D142: June 22, 1983 | E142: of:=[.D142]-ReaganInauguration -> 883
B143: 12427 | C143: President's Advisory Council on Private Sector Initiatives | D143: June 27, 1983 | E143: of:=[.D143]-ReaganInauguration -> 888
B144: 12428 | C144: President's Commission on Industrial Competitiveness | D144: June 28, 1983 | E144: of:=[.D144]-ReaganInauguration -> 889
B145: 12429 | C145: President's Private Sector Survey on Cost Control in the Federal Government | D145: June 28, 1983 | E145: of:=[.D145]-ReaganInauguration -> 889
B146: 12430 | C146: Reports of Identical Bids | D146: July 6, 1983 | E146: of:=[.D146]-ReaganInauguration -> 897
B147: 12431 | C147: Level IV of the Executive Schedule | D147: July 8, 1983 | E147: of:=[.D147]-ReaganInauguration -> 899
B148: 12432 | C148: Minority Business Enterprise Development | D148: July 14, 1983 | E148: of:=[.D148]-ReaganInauguration -> 905
B149: 12433 | C149: National Bipartisan Commission on Central America | D149: July 19, 1983 | E149: of:=[.D149]-ReaganInauguration -> 910
B150: 12434 | C150: Alaska Railroad Rates | D150: July 19, 1983 | E150: of:=[.D150]-ReaganInauguration -> 910
B151: 12435 | C151: President's Commission on Organized Crime | D151: July 28, 1983 | E151: of:=[.D151]-ReaganInauguration -> 919
B152: 12436 | C152: Payment of certain benefits to survivors of persons who died in or as a result of military service | D152: July 29, 1983 | E152: of:=[.D152]-ReaganInauguration -> 920
B153: 12437 | C153: Fuel use prohibitions | D153: August 11, 1983 | E153: of:=[.D153]-ReaganInauguration -> 933
B154: 12438 | C154: Review of increases in rates of basic pay for employees of the Veterans' Administration | D154: August 23, 1983 | E154: of:=[.D154]-ReaganInauguration -> 945
B155: 12439 | C155: President's Task Force on Food Assistance | D155: September 8, 1983 | E155: of:=[.D155]-ReaganInauguration -> 961
B156: 12440 | C156: President's Commission on Industrial Competitiveness | D156: September 8, 1983 | E156: of:=[.D156]-ReaganInauguration -> 961
B157: 12441 | C157: Amending the Generalized System of Preferences | D157: September 20, 1983 | E157: of:=[.D157]-ReaganInauguration -> 973
B158: 12442 | C158: Presidential Commission on Indian Reservation Economies | D158: September 21, 1983 | E158: of:=[.D158]-ReaganInauguration -> 974
B159: 12443 | C159: Central Intelligence Agency Retirement and Disability System | D159: September 27, 1983 | E159: of:=[.D159]-ReaganInauguration -> 980
B160: 12444 | C160: Continuation of export control regulations | D160: October 14, 1983 | E160: of:=[.D160]-ReaganInauguration -> 997
B161: 12445 | C161: Certification of containers and vehicles for use in international transport | D161: October 17, 1983 | E161: of:=[.D161]-ReaganInauguration -> 1000
B162: 12446 | C162: Foreign Service Retirement and Disability System | D162: October 17, 1983 | E162: of:=[.D162]-ReaganInauguration -> 1000
B163: 12447 | C163: President's private sector survey on cost control in the Federal Government | D163: October 27, 1983 | E163: of:=[.D163]-ReaganInauguration -> 1010
B164: 12448 | C164: Exercise of Authority Under Section 218 of Title 18, United States Code | D164: November 4, 1983 | E164: of:=[.D164]-ReaganInauguration -> 1018
B165: 12449 | C165: National Bipartisan Commission on Central America | D165: November 18, 1983 | E165: of:=[.D165]-ReaganInauguration -> 1032
B166: 12450 | C166: Interagency Committee on Handicapped Employees | D166: December 9, 1983 | E166: of:=[.D166]-ReaganInauguration -> 1053
B167: 12451 | C167: Continuation of export control regulations | D167: December 20, 1983 | E167: of:=[.D167]-ReaganInauguration -> 1064
B168: 12452 | C168: Revised list of quarantinable communicable diseases | D168: December 22, 1983 | E168: of:=[.D168]-ReaganInauguration -> 1066
B169: 12453 | C169: Delegation to the Secretary of State | D169: December 23, 1983 | E169: of:=[.D169]-ReaganInauguration -> 1067
B170: 12454 | C170: President's National Security Telecommunications Advisory Committee | D170: December 29, 1983 | E170: of:=[.D170]-ReaganInauguration -> 1073
B171: 12455 | C171: President's Private Sector Survey on Cost Control in the Federal Government | D171: December 29, 1983 | E171: of:=[.D171]-ReaganInauguration -> 1073
B172: 12456 | C172: Adjustments of certain rates of pay and allowances | D172: December 30, 1983 | E172: of:=[.D172]-ReaganInauguration -> 1074
B173: 12457 | C173: President's Commission on Industrial Competitiveness | D173: January 6, 1984 | E173: of:=[.D173]-ReaganInauguration -> 1081
B174: 12458 | C174: Delegation to the Secretary of State concerning foreign assistance | D174: January 14, 1984 | E174: of:=[.D174]-ReaganInauguration -> 1089
B175: 12459 | C175: Amending the Generalized System of Preferences | D175: January 16, 1984 | E175: of:=[.D175]-ReaganInauguration -> 1091
B176: 12460 | C176: Amendments to the Manual for Courts-Martial, United States, 1969 (Revised Edition) | D176: January 24, 1984 | E176: of:=[.D176]-ReaganInauguration -> 1099
B177: 12461 | C177: Designating a Federal Retirement System Under Pub. L. 98-168 | D177: February 17, 1984 | E177: of:=[.D177]-ReaganInauguration -> 1123
B178: 12462 | C178: President's Advisory Committee on Mediation and Conciliation | D178: February 17, 1984 | E178: of:=[.D178]-ReaganInauguration -> 1123
B179: 12463 | C179: Nuclear Cooperation With EURATOM | D179: February 23, 1984 | E179: of:=[.D179]-ReaganInauguration -> 1129
B180: 12464 | C180: Award of the Purple Heart | D180: February 23, 1984 | E180: of:=[.D180]-ReaganInauguration -> 1129
B181: 12465 | C181: Commercial expendable launch vehicle activities | D181: February 24, 1984 | E181: of:=[.D181]-ReaganInauguration -> 1130
B182: 12466 | C182: Reimbursement of Federal employee relocation expenses | D182: February 27, 1984 | E182: of:=[.D182]-ReaganInauguration -> 1133
B183: 12467 | C183: International Boundary and Water Commission, United States and Mexico | D183: March 2, 1984 | E183: of:=[.D183]-ReaganInauguration -> 1137
B184: 12468 | C184: Presidential Advisory Council on the Peace Corps | D184: March 22, 1984 | E184: of:=[.D184]-ReaganInauguration -> 1157
B185: 12469 | C185: East-West Foreign Trade Report | D185: March 26, 1984 | E185: of:=[.D185]-ReaganInauguration -> 1161
B186: 12470 | C186: Continuation of export control regulations | D186: March 30, 1984 | E186: of:=[.D186]-ReaganInauguration -> 1165
B187: 12471 | C187: Amending the Generalized System of Preferences | D187: March 30, 1984 | E187: of:=[.D187]-ReaganInauguration -> 1165
B188: 12472 | C188: Assignment of national security and emergency preparedness telecommunications functions | D188: April 3, 1984 | E188: of:=[.D188]-ReaganInauguration -> 1169
B189: 12473 | C189: Courts-Martial Manual, United States, 1984 | D189: April 13, 1984 | E189: of:=[.D189]-ReaganInauguration -> 1179
B190: 12474 | C190: Agreement on Government procurement | D190: April 17, 1984 | E190: of:=[.D190]-ReaganInauguration -> 1183
B191: 12475 | C191: Textile Import Program Implementation | D191: May 9, 1984 | E191: of:=[.D191]-ReaganInauguration -> 1205
B192: 12476 | C192: Presidential Commission on the Conduct of United States-Japan Relations | D192: May 11, 1984 | E192: of:=[.D192]-ReaganInauguration -> 1207
B193: 12477 | C193: Adjustments of certain rates of pay | D193: May 23, 1984 | E193: of:=[.D193]-ReaganInauguration -> 1219
B194: 12478 | C194: Transfer of authority to the Secretary of State to make reimbursements for protection of foreign missions to international organizations | D194: May 23, 1984 | E194: of:=[.D194]-ReaganInauguration -> 1219
B195: 12479 | C195: Management Reform in the Federal Government | D195: May 24, 1984 | E195: of:=[.D195]-ReaganInauguration -> 1220
B196: 12480 | C196: Establishing an emergency board to investigate a dispute between The Long Island Rail Road and the Brotherhood of Locomotive Engineers | D196: June 20, 1984 | E196: of:=[.D196]-ReaganInauguration -> 1247
B197: 12481 | C197: Establishing an emergency board to investigate a dispute between The Long Island Rail Road and the Brotherhood of Railway, Airline and Steamship Clerks, Freight Handlers, Express and Station Employees | D197: June 20, 1984 | E197: of:=[.D197]-ReaganInauguration -> 1247
B198: 12482 | C198: President's Advisory Committee on Women's Business Ownership | D198: June 21, 1984 | E198: of:=[.D198]-ReaganInauguration -> 1248
B199: 12483 | C199: Amending the Generalized System of Preferences | D199: June 25, 1984 | E199: of:=[.D199]-ReaganInauguration -> 1252
B200: 12484 | C200: Amendments to the Manual for Courts-Martial, United States, 1984 | D200: July 13, 1984 | E200: of:=[.D200]-ReaganInauguration -> 1270
B201: 12485 | C201: Central Intelligence Agency Retirement and Disability System | D201: July 13, 1984 | E201: of:=[.D201]-ReaganInauguration -> 1270
B202: 12486 | C202: Establishing an emergency board to investigate a dispute between Port Authority Trans-Hudson Corporation and the Brotherhood of Railroad Signalmen | D202: August 24, 1984 | E202: of:=[.D202]-ReaganInauguration -> 1312
B203: 12487 | C203: Adjustments of certain rates of pay | D203: September 14, 1984 | E203: of:=[.D203]-ReaganInauguration -> 1333
B204: 12488 | C204: Amending Executive Order No. 11157 as it relates to incentive pay for hazardous duty | D204: September 27, 1984 | E204: of:=[.D204]-ReaganInauguration -> 1346
B205: 12489 | C205: Continuance of certain Federal advisory committees | D205: September 28, 1984 | E205: of:=[.D205]-ReaganInauguration -> 1347
B206: 12490 | C206: National Commission on Space | D206: October 12, 1984 | E206: of:=[.D206]-ReaganInauguration -> 1361
B207: 12491 | C207: Establishing an emergency board to investigate a dispute between the Long Island Rail Road and the Brotherhood of Locomotive Engineers | D207: October 25, 1984 | E207: of:=[.D207]-ReaganInauguration -> 1374
B208: 12492 | C208: Establishing an emergency board to investigate a dispute between the Long Island Rail Road and the Brotherhood of Railway, Airline and Steamship Clerks, Freight Handlers, Express and Station Employees | D208: October 25, 1984 | E208: of:=[.D208]-ReaganInauguration -> 1374
B209: 12493 | C209: President's Commission on Executive Exchange | D209: December 5, 1984 | E209: of:=[.D209]-ReaganInauguration -> 1415
B210: 12494 | C210: Amending Executive Order No. 11157 as it relates to pay for hazardous duty | D210: December 6, 1984 | E210: of:=[.D210]-ReaganInauguration -> 1416
B211: 12495 | C211: Establishing an emergency board to investigate a dispute between Port Authority Trans-Hudson Corporation and the Brotherhood of Railroad Signalmen | D211: December 21, 1984 | E211: of:=[.D211]-ReaganInauguration -> 1431
B212: 12496 | C212: Adjustments of certain rates of pay and allowances | D212: December 28, 1984 | E212: of:=[.D212]-ReaganInauguration -> 1438
B213: 12497 | C213: President's Advisory Committee on Mediation and Conciliation | D213: December 29, 1984 | E213: of:=[.D213]-ReaganInauguration -> 1439
B214: 12498 | C214: Regulatory planning process | D214: January 4, 1985 | E214: of:=[.D214]-ReaganInauguration -> 1445
B215: 12499 | C215: President's Blue Ribbon Task Group on Nuclear Weapons Program Management | D215: January 18, 1985 | E215: of:=[.D215]-ReaganInauguration -> 1459
B216: 12500 | C216: Delegation to the Secretary of State and the Director of the International Development Cooperation Agency concerning foreign assistance | D216: January 24, 1985 | E216: of:=[.D216]-ReaganInauguration -> 1465
B217: 12501 | C217: Arctic Research | D217: January 28, 1985 | E217: of:=[.D217]-ReaganInauguration -> 1469
B218: 12502 | C218: Chemical Warfare Review Commission | D218: January 28, 1985 | E218: of:=[.D218]-ReaganInauguration -> 1469
B219: 12503 | C219: Presidential Commission on Outdoor Recreation Resources Review | D219: January 28, 1985 | E219: of:=[.D219]-ReaganInauguration -> 1469
B220: 12504 | C220: Protection of semiconductor chip products | D220: January 31, 1985 | E220: of:=[.D220]-ReaganInauguration -> 1472
B221: 12505 | C221: Conversion of appointments | D221: February 12, 1985 | E221: of:=[.D221]-ReaganInauguration -> 1484
B222: 12506 | C222: Nuclear Cooperation With EURATOM | D222: March 4, 1985 | E222: of:=[.D222]-ReaganInauguration -> 1504
B223: 12507 | C223: Continuance of the President's Commission on Organized Crime | D223: March 22, 1985 | E223: of:=[.D223]-ReaganInauguration -> 1522
B224: 12508 | C224: World Tourism Organization | D224: March 22, 1985 | E224: of:=[.D224]-ReaganInauguration -> 1522
B225: 12509 | C225: Technical Review Group on Inertial Confinement Fusion | D225: April 14, 1985 | E225: of:=[.D225]-ReaganInauguration -> 1545
B226: 12510 | C226: Non-foreign area cost-of-living allowances | D226: April 17, 1985 | E226: of:=[.D226]-ReaganInauguration -> 1548
B227: 12511 | C227: President's Child Safety Partnership | D227: April 29, 1985 | E227: of:=[.D227]-ReaganInauguration -> 1560
B228: 12512 | C228: Federal Real Property Management | D228: April 29, 1985 | E228: of:=[.D228]-ReaganInauguration -> 1560
B229: 12513 | C229: Prohibiting trade and certain other transactions involving Nicaragua | D229: May 1, 1985 | E229: of:=[.D229]-ReaganInauguration -> 1562
B230: 12514 | C230: Prescribing the Order of Succession of Officers To Act as Secretary of Defense, Secretary of the Army, Secretary of the Navy, and Secretary of the Air Force | D230: May 14, 1985 | E230: of:=[.D230]-ReaganInauguration -> 1575
B231: 12515 | C231: Amending the Generalized System of Preferences | D231: May 14, 1985 | E231: of:=[.D231]-ReaganInauguration -> 1575
B232: 12516 | C232: President's Commission on Executive Exchange | D232: May 21, 1985 | E232: of:=[.D232]-ReaganInauguration -> 1582
B233: 12517 | C233: Delegation concerning the United States-India Fund for Cultural, Educational, and Scientific Cooperation | D233: May 29, 1985 | E233: of:=[.D233]-ReaganInauguration -> 1590
B234: 12518 | C234: Trade in Services | D234: June 3, 1985 | E234: of:=[.D234]-ReaganInauguration -> 1595
B235: 12519 | C235: Amending the Generalized System of Preferences | D235: June 13, 1985 | E235: of:=[.D235]-ReaganInauguration -> 1605
B236: 12520 | C236: Quarters allowance to Department of Defense employees in Panama | D236: June 19, 1985 | E236: of:=[.D236]-ReaganInauguration -> 1611
B237: 12521 | C237: Offsets in Military-related exports | D237: June 24, 1985 | E237: of:=[.D237]-ReaganInauguration -> 1616
B238: 12522 | C238: Reimbursement of Federal employee relocation expenses | D238: June 24, 1985 | E238: of:=[.D238]-ReaganInauguration -> 1616
B239: 12523 | C239: National White House Conference on Small Business | D239: June 27, 1985 | E239: of:=[.D239]-ReaganInauguration -> 1619
B240: 12524 | C240: Amending the Generalized System of Preferences | D240: July 1, 1985 | E240: of:=[.D240]-ReaganInauguration -> 1623
B241: 12525 | C241: Termination of Emergency Authority for Export Controls | D241: July 12, 1985 | E241: of:=[.D241]-ReaganInauguration -> 1634
B242: 12526 | C242: President's Blue Ribbon Commission on Defense Management | D242: July 15, 1985 | E242: of:=[.D242]-ReaganInauguration -> 1637
B243: 12527 | C243: Repealing Provisions Establishing an Administrative Position in the Food-for-Peace Program | D243: August 7, 1985 | E243: of:=[.D243]-ReaganInauguration -> 1660
B244: 12528 | C244: Presidential Board of Advisors on Private Sector Initiatives | D244: August 8, 1985 | E244: of:=[.D244]-ReaganInauguration -> 1661
B245: 12529 | C245: President's Commission on Americans Outdoors | D245: August 14, 1985 | E245: of:=[.D245]-ReaganInauguration -> 1667
B246: 12530 | C246: Establishment of Nicaraguan Humanitarian Aid Office | D246: August 29, 1985 | E246: of:=[.D246]-ReaganInauguration -> 1682
B247: 12531 | C247: Establishing an emergency board to investigate a dispute between the United Transportation Union and certain railroads represented by the National Carriers' Conference Committee of the National Railway Labor Conference | D247: August 30, 1985 | E247: of:=[.D247]-ReaganInauguration -> 1683
B248: 12532 | C248: Prohibiting trade and certain other transactions involving South Africa | D248: September 9, 1985 | E248: of:=[.D248]-ReaganInauguration -> 1693
B249: 12533 | C249: President's Advisory Committee on Mediation and Conciliation | D249: September 30, 1985 | E249: of:=[.D249]-ReaganInauguration -> 1714
B250: 12534 | C250: Continuance of certain Federal advisory committees | D250: September 30, 1985 | E250: of:=[.D250]-ReaganInauguration -> 1714
B251: 12535 | C251: Prohibition of the importation of the South African krugerrand | D251: October 1, 1985 | E251: of:=[.D251]-ReaganInauguration -> 1715
B252: 12536 | C252: Board of the Foreign Service | D252: October 9, 1985 | E252: of:=[.D252]-ReaganInauguration -> 1723
B253: 12537 | C253: President's Foreign Intelligence Advisory Board | D253: October 28, 1985 | E253: of:=[.D253]-ReaganInauguration -> 1742
B254: 12538 | C254: Imports of refined petroleum products from Libya | D254: November 15, 1985 | E254: of:=[.D254]-ReaganInauguration -> 1760
B255: 12539 | C255: President's Council on Physical Fitness and Sports | D255: December 3, 1985 | E255: of:=[.D255]-ReaganInauguration -> 1778
B256: 12540 | C256: Adjustments of certain rates of pay and allowances | D256: December 30, 1985 | E256: of:=[.D256]-ReaganInauguration -> 1805
B257: 12541 | C257: Amending Executive Order 11157 as it relates to a basic allowance for quarters while on sea duty | D257: December 30, 1985 | E257: of:=[.D257]-ReaganInauguration -> 1805
B258: 12542 | C258: President's Blue Ribbon Commission on Defense Management | D258: December 30, 1985 | E258: of:=[.D258]-ReaganInauguration -> 1805
B259: 12543 | C259: Prohibiting trade and certain transactions involving Libya | D259: January 7, 1986 | E259: of:=[.D259]-ReaganInauguration -> 1813
B260: 12544 | C260: Blocking Libyan Government property in the United States or held by U.S. persons | D260: January 8, 1986 | E260: of:=[.D260]-ReaganInauguration -> 1814
B261: 12545 | C261: National Commission on Space | D261: January 14, 1986 | E261: of:=[.D261]-ReaganInauguration -> 1820
B262: 12546 | C262: Presidential Commission on the Space Shuttle Challenger Accident | D262: February 3, 1986 | E262: of:=[.D262]-ReaganInauguration -> 1840
B263: 12547 | C263: Establishing procedures for facilitating Presidential review of international aviation decisions submitted by the Department of Transportation | D263: February 6, 1986 | E263: of:=[.D263]-ReaganInauguration -> 1843
B264: 12548 | C264: Grazing Fees | D264: February 14, 1986 | E264: of:=[.D264]-ReaganInauguration -> 1851
B265: 12549 | C265: Debarment and Suspension | D265: February 18, 1986 | E265: of:=[.D265]-ReaganInauguration -> 1855
B266: 12550 | C266: Amendments to the Manual for Courts-Martial, United States, 1984 | D266: February 19, 1986 | E266: of:=[.D266]-ReaganInauguration -> 1856
B267: 12551 | C267: The President's Export Council | D267: February 21, 1986 | E267: of:=[.D267]-ReaganInauguration -> 1858
B268: 12552 | C268: Productivity Improvement Program for the Federal Government | D268: February 25, 1986 | E268: of:=[.D268]-ReaganInauguration -> 1862
B269: 12553 | C269: Revocation of Various Executive Orders | D269: February 25, 1986 | E269: of:=[.D269]-ReaganInauguration -> 1862
B270: 12554 | C270: Nuclear Cooperation With EURATOM | D270: February 28, 1986 | E270: of:=[.D270]-ReaganInauguration -> 1865
B271: 12555 | C271: Protection of Cultural Property | D271: March 10, 1986 | E271: of:=[.D271]-ReaganInauguration -> 1875
B272: 12556 | C272: Mailing privileges of members of Armed Forces of the United States and of friendly foreign nations | D272: April 16, 1986 | E272: of:=[.D272]-ReaganInauguration -> 1912
B273: 12557 | C273: Establishing an emergency board to investigate disputes between the Maine Central Railroad Company/Portland Terminal Company and certain of their employees represented by the Brotherhood of Maintenance of Way Employees | D273: May 16, 1986 | E273: of:=[.D273]-ReaganInauguration -> 1942
B274: 12558 | C274: Establishing an emergency board to investigate a dispute between the Long Island Rail Road and certain labor organizations representing Its employees | D274: May 16, 1986 | E274: of:=[.D274]-ReaganInauguration -> 1942
B275: 12559 | C275: Exclusions From the Federal-Labor Management Relations Program | D275: May 20, 1986 | E275: of:=[.D275]-ReaganInauguration -> 1946
B276: 12560 | C276: Administration of foreign relations and related functions | D276: May 24, 1986 | E276: of:=[.D276]-ReaganInauguration -> 1950
B277: 12561 | C277: Delegating certain functions of the President relating to Federal civilian employee and contractor travel expenses | D277: July 1, 1986 | E277: of:=[.D277]-ReaganInauguration -> 1988
B278: 12562 | C278: Establishing an emergency board to investigate disputes between certain railroads represented by the National Carriers' Conference Committee of the National Railway Labor Conference and their employees represented by certain labor organizations | D278: July 15, 1986 | E278: of:=[.D278]-ReaganInauguration -> 2002
B279: 12563 | C279: Establishing an emergency board to investigate a dispute between the Long Island Rail Road and certain labor organizations representing its employees | D279: September 12, 1986 | E279: of:=[.D279]-ReaganInauguration -> 2061
B280: 12564 | C280: Drug-Free Federal Workplace | D280: September 15, 1986 | E280: of:=[.D280]-ReaganInauguration -> 2064
B281: 12565 | C281: Prescribing a comprehensive system of financial reporting for officers and employees in the executive branch | D281: September 25, 1986 | E281: of:=[.D281]-ReaganInauguration -> 2074
B282: 12566 | C282: Safety belt use requirements for Federal employees | D282: September 26, 1986 | E282: of:=[.D282]-ReaganInauguration -> 2075
B283: 12567 | C283: Inter-American Investment Corporation, Commission for the Study of Alternatives to the Panama Canal, and Pacific Salmon Commission | D283: October 2, 1986 | E283: of:=[.D283]-ReaganInauguration -> 2081
B284: 12568 | C284: Employment opportunities for military spouses at nonappropriated fund activities | D284: October 2, 1986 | E284: of:=[.D284]-ReaganInauguration -> 2081
B285: 12569 | C285: Management of the Compact of Free Association With the Republic of the Marshall Islands, the Federated States of Micronesia, and the Republic of Palau | D285: October 16, 1986 | E285: of:=[.D285]-ReaganInauguration -> 2095
B286: 12570 | C286: Delegating authority to implement assistance for Central American democracies and the Nicaraquan Democratic Resistance | D286: October 24, 1986 | E286: of:=[.D286]-ReaganInauguration -> 2103
B287: 12571 | C287: Implementation of the Comprehensive Anti-Apartheid Act | D287: October 27, 1986 | E287: of:=[.D287]-ReaganInauguration -> 2106
B288: 12572 | C288: Relations With the Northern Mariana Islands | D288: November 3, 1986 | E288: of:=[.D288]-ReaganInauguration -> 2113
B289: 12573 | C289: Amending Executive Order No. 11157 as it relates to incentive pay for hazardous duty | D289: November 6, 1986 | E289: of:=[.D289]-ReaganInauguration -> 2116
B290: 12574 | C290: Establishing an experimental program within the President's Commission on Executive Exchange | D290: November 20, 1986 | E290: of:=[.D290]-ReaganInauguration -> 2130
B291: 12575 | C291: President's Special Review Board | D291: December 1, 1986 | E291: of:=[.D291]-ReaganInauguration -> 2141
B292: 12576 | C292: Victims of terrorism compensation | D292: December 2, 1986 | E292: of:=[.D292]-ReaganInauguration -> 2142
B293: 12577 | C293: Closing of Government departments and agencies on Friday, December 26, 1986 | D293: December 22, 1986 | E293: of:=[.D293]-ReaganInauguration -> 2162
B294: 12578 | C294: Adjustments of certain rates of pay and allowances | D294: December 31, 1986 | E294: of:=[.D294]-ReaganInauguration -> 2171
B295: 12579 | C295: President's Advisory Committee on Mediation and Conciliation | D295: December 31, 1986 | E295: of:=[.D295]-ReaganInauguration -> 2171
B296: 12580 | C296: Superfund Implementation | D296: January 23, 1987 | E296: of:=[.D296]-ReaganInauguration -> 2194
B297: 12581 | C297: President's Special Review Board | D297: January 28, 1987 | E297: of:=[.D297]-ReaganInauguration -> 2199
B298: 12582 | C298: Naturalization requirements exceptions for aliens and non-citizen nationals of the United States who served in the Grenada campaign | D298: February 2, 1987 | E298: of:=[.D298]-ReaganInauguration -> 2204
B299: 12583 | C299: Food for Progress | D299: February 19, 1987 | E299: of:=[.D299]-ReaganInauguration -> 2221
B300: 12584 | C300: President's Special Review Board | D300: February 19, 1987 | E300: of:=[.D300]-ReaganInauguration -> 2221
B301: 12585 | C301: Eligibility of overseas employees for noncompetitive appointment | D301: March 3, 1987 | E301: of:=[.D301]-ReaganInauguration -> 2233
B302: 12586 | C302: Amendments to the Manual for Courts-Martial, United States, 1984 | D302: March 3, 1987 | E302: of:=[.D302]-ReaganInauguration -> 2233
B303: 12587 | C303: Nuclear Cooperation With EURATOM | D303: March 9, 1987 | E303: of:=[.D303]-ReaganInauguration -> 2239
B304: 12588 | C304: Action against certain assets of disputed title | D304: March 18, 1987 | E304: of:=[.D304]-ReaganInauguration -> 2248
B305: 12589 | C305: Transfer of annual and sick leave of Federal Employees | D305: March 18, 1987 | E305: of:=[.D305]-ReaganInauguration -> 2248
B306: 12590 | C306: National Drug Policy Board | D306: March 26, 1987 | E306: of:=[.D306]-ReaganInauguration -> 2256
B307: 12591 | C307: Facilitating access to science and technology | D307: April 10, 1987 | E307: of:=[.D307]-ReaganInauguration -> 2271
B308: 12592 | C308: President's Commission on Compensation of Career Federal Executives | D308: April 10, 1987 | E308: of:=[.D308]-ReaganInauguration -> 2271
B309: 12593 | C309: President's Committee on the Arts and the Humanities | D309: April 21, 1987 | E309: of:=[.D309]-ReaganInauguration -> 2282
B310: 12594 | C310: President's Volunteer Action Award | D310: April 28, 1987 | E310: of:=[.D310]-ReaganInauguration -> 2289
B311: 12595 | C311: White House Conference for a Drug Free America | D311: May 5, 1987 | E311: of:=[.D311]-ReaganInauguration -> 2296
B312: 12596 | C312: Noncompetitive conversion to career status of certain employees in professional and administrative career positions | D312: May 7, 1987 | E312: of:=[.D312]-ReaganInauguration -> 2298
B313: 12597 | C313: Establishing procedures for facilitating Presidential review of international aviation decisions by the Department of Transportation | D313: May 13, 1987 | E313: of:=[.D313]-ReaganInauguration -> 2304
B314: 12598 | C314: Victims of terrorism compensation | D314: June 17, 1987 | E314: of:=[.D314]-ReaganInauguration -> 2339
B315: 12599 | C315: Coordination of economic policies for Sub-Saharan Africa | D315: June 23, 1987 | E315: of:=[.D315]-ReaganInauguration -> 2345
B316: 12600 | C316: Predisclosure notification procedures for confidential commercial information | D316: June 23, 1987 | E316: of:=[.D316]-ReaganInauguration -> 2345
B317: 12601 | C317: Presidential Commission on the Human Immunodeficiency Virus Epidemic | D317: June 24, 1987 | E317: of:=[.D317]-ReaganInauguration -> 2346
B318: 12602 | C318: President's Commission on Executive Exchange | D318: July 15, 1987 | E318: of:=[.D318]-ReaganInauguration -> 2367
B319: 12603 | C319: Presidential Commission on the Human Immunodeficiency Virus Epidemic | D319: July 16, 1987 | E319: of:=[.D319]-ReaganInauguration -> 2368
B320: 12604 | C320: Presidential Board of Advisors on Private Sector Initiatives | D320: August 5, 1987 | E320: of:=[.D320]-ReaganInauguration -> 2388
B321: 12605 | C321: Navy and Marine Corps Reserve Officer Promotions | D321: August 12, 1987 | E321: of:=[.D321]-ReaganInauguration -> 2395
B322: 12606 | C322: The Family | D322: September 2, 1987 | E322: of:=[.D322]-ReaganInauguration -> 2416
B323: 12607 | C323: President's Commission on Privatization | D323: September 2, 1987 | E323: of:=[.D323]-ReaganInauguration -> 2416
B324: 12608 | C324: Elimination of unnecessary Executive orders and technical amendments to others | D324: September 9, 1987 | E324: of:=[.D324]-ReaganInauguration -> 2423
B325: 12609 | C325: President's Commission on Compensation of Career Federal Employees | D325: September 23, 1987 | E325: of:=[.D325]-ReaganInauguration -> 2437
B326: 12610 | C326: Continuance of Certain Federal Advisory Committees | D326: September 30, 1987 | E326: of:=[.D326]-ReaganInauguration -> 2444
B327: 12611 | C327: Delegating authority to implement assistance for Central American democracies and the Nicaraguan Democratic Resistance | D327: October 15, 1987 | E327: of:=[.D327]-ReaganInauguration -> 2459
B328: 12612 | C328: Federalism | D328: October 26, 1987 | E328: of:=[.D328]-ReaganInauguration -> 2470
B329: 12613 | C329: Prohibiting Imports From Iran | D329: October 29, 1987 | E329: of:=[.D329]-ReaganInauguration -> 2473
B330: 12614 | C330: Presidential Task Force on Market Mechanisms | D330: November 5, 1987 | E330: of:=[.D330]-ReaganInauguration -> 2480
B331: 12615 | C331: Performance of Commercial Activities | D331: November 19, 1987 | E331: of:=[.D331]-ReaganInauguration -> 2494
B332: 12616 | C332: Providing for the restoration of law and order in the State of Georgia | D332: November 24, 1987 | E332: of:=[.D332]-ReaganInauguration -> 2499
B333: 12617 | C333: President's Advisory Committee on Mediation and Conciliation | D333: December 17, 1987 | E333: of:=[.D333]-ReaganInauguration -> 2522
B334: 12618 | C334: Uniform treatment of Federally funded inventions | D334: December 22, 1987 | E334: of:=[.D334]-ReaganInauguration -> 2527
B335: 12619 | C335: Half-day closing of Government departments and agencies on Thursday, December 24, 1987 | D335: December 22, 1987 | E335: of:=[.D335]-ReaganInauguration -> 2527
B336: 12620 | C336: Delegation of authority with respect to the Administration of Justice Program | D336: December 24, 1987 | E336: of:=[.D336]-ReaganInauguration -> 2529
B337: 12621 | C337: President's Task Force on Market Mechanisms | D337: December 29, 1987 | E337: of:=[.D337]-ReaganInauguration -> 2534
B338: 12622 | C338: Adjustments of certain rates of pay and allowances | D338: December 31, 1987 | E338: of:=[.D338]-ReaganInauguration -> 2536
B339: 12623 | C339: Delegating authority to implement assistance to the Nicaraguan Democratic Resistance | D339: January 6, 1988 | E339: of:=[.D339]-ReaganInauguration -> 2542
B340: 12624 | C340: Increasing the number of members on the President's Foreign Intelligence Advisory Board | D340: January 6, 1988 | E340: of:=[.D340]-ReaganInauguration -> 2542
B341: 12625 | C341: Integrity and Efficiency in Federal Programs | D341: January 27, 1988 | E341: of:=[.D341]-ReaganInauguration -> 2563
B342: 12626 | C342: National Defense Stockpile Manager | D342: February 25, 1988 | E342: of:=[.D342]-ReaganInauguration -> 2592
B343: 12627 | C343: Amending the President's Commission on Privatization | D343: February 29, 1988 | E343: of:=[.D343]-ReaganInauguration -> 2596
B344: 12628 | C344: United Nations Industrial Development Organization | D344: March 8, 1988 | E344: of:=[.D344]-ReaganInauguration -> 2604
B345: 12629 | C345: Nuclear Cooperation With EURATOM | D345: March 9, 1988 | E345: of:=[.D345]-ReaganInauguration -> 2605
B346: 12630 | C346: Governmental actions and interference with constitutionally protected property rights | D346: March 15, 1988 | E346: of:=[.D346]-ReaganInauguration -> 2611
B347: 12631 | C347: Working Group on Financial Markets | D347: March 18, 1988 | E347: of:=[.D347]-ReaganInauguration -> 2614
B348: 12632 | C348: Exclusions From the Federal Labor-Management Relations Program | D348: March 23, 1988 | E348: of:=[.D348]-ReaganInauguration -> 2619
B349: 12633 | C349: Amending the Code of Conduct for Members of the Armed Forces of the United States | D349: March 28, 1988 | E349: of:=[.D349]-ReaganInauguration -> 2624
B350: 12634 | C350: Delegating authority to provide assistance and support for peace, democracy, and reconciliation in Central America | D350: April 1, 1988 | E350: of:=[.D350]-ReaganInauguration -> 2628
B351: 12635 | C351: Prohibiting certain transactions with respect to Panama | D351: April 8, 1988 | E351: of:=[.D351]-ReaganInauguration -> 2635
B352: 12636 | C352: Establishing an emergency board to investigate a dispute between the Chicago and North Western Transportation Company and certain of its employees represented by the United Transportation Union | D352: April 20, 1988 | E352: of:=[.D352]-ReaganInauguration -> 2647
B353: 12637 | C353: Productivity improvement program for the Federal Government | D353: April 27, 1988 | E353: of:=[.D353]-ReaganInauguration -> 2654
B354: 12638 | C354: Delegation of functions relating to the implementation of the Inter-American Convention on Letters Rogatory and Additional Protocol | D354: April 28, 1988 | E354: of:=[.D354]-ReaganInauguration -> 2655
B355: 12639 | C355: Administration of foreign relations and related functions | D355: May 6, 1988 | E355: of:=[.D355]-ReaganInauguration -> 2663
B356: 12640 | C356: The President's Committee on Employment of People With Disabilities | D356: May 10, 1988 | E356: of:=[.D356]-ReaganInauguration -> 2667
B357: 12641 | C357: Designating certain facilities of the National Aeronautics and Space Administration in the State of Mississippi as the John C. Stennis Space Center | D357: May 20, 1988 | E357: of:=[.D357]-ReaganInauguration -> 2677
B358: 12642 | C358: Designation of the Secretary of Defense as the Presidential designee Under Title I of the Uniformed and Overseas Citizens Absentee Voting Act | D358: June 8, 1988 | E358: of:=[.D358]-ReaganInauguration -> 2696
B359: 12643 | C359: International Committee of the Red Cross | D359: June 23, 1988 | E359: of:=[.D359]-ReaganInauguration -> 2711
B360: 12644 | C360: Establishing an Emergency Board To Investigate a Dispute Between the Port Authority Trans-Hudson Corporation and Certain of its Employees Represented by the Transportation Communications Union-Carmen Division | D360: July 9, 1988 | E360: of:=[.D360]-ReaganInauguration -> 2727
B361: 12645 | C361: Amending Executive Order 12364, Relating to the Presidential Management Intern Program | D361: July 12, 1988 | E361: of:=[.D361]-ReaganInauguration -> 2730
B362: 12646 | C362: Establishing an emergency board to investigate a dispute between the Port Authority Trans-Hudson Corporation and certain of its employees Represented by the International Brotherhood of Electrical Workers | D362: July 13, 1988 | E362: of:=[.D362]-ReaganInauguration -> 2731
B363: 12647 | C363: Multilateral Investment Guarantee Agency | D363: August 2, 1988 | E363: of:=[.D363]-ReaganInauguration -> 2751
B364: 12648 | C364: Relating to the Implementation of the Convention on the Civil Aspects of International Child Abduction | D364: August 11, 1988 | E364: of:=[.D364]-ReaganInauguration -> 2760
B365: 12649 | C365: Offsets in military-related exports | D365: August 11, 1988 | E365: of:=[.D365]-ReaganInauguration -> 2760
B366: 12650 | C366: Establishing an emergency board to investigate a dispute between the Port Authority Trans-Hudson Corporation and certain of its employees represented by the Brotherhood of Locomotive Engineers | D366: September 9, 1988 | E366: of:=[.D366]-ReaganInauguration -> 2789
B367: 12651 | C367: Offices of the Commission of the European Communities | D367: September 9, 1988 | E367: of:=[.D367]-ReaganInauguration -> 2789
B368: 12652 | C368: Return of authority to administer Federal Employees' Compensation Act to the Department of Labor from the Panama Canal Commission | D368: September 19, 1988 | E368: of:=[.D368]-ReaganInauguration -> 2799
B369: 12653 | C369: Amending Executive Order 11183, relating to the President's Commission on White House Fellowships | D369: September 29, 1988 | E369: of:=[.D369]-ReaganInauguration -> 2809
B370: 12654 | C370: Delegating authority to provide assistance for the Nicaraguan Resistance | D370: October 7, 1988 | E370: of:=[.D370]-ReaganInauguration -> 2817
B371: 12655 | C371: Establishing an emergency board to investigate a dispute between the Port Authority Trans-Hudson Corporation and certain of its employees represented by the Transportation Communications Union-Carmen Division | D371: November 7, 1988 | E371: of:=[.D371]-ReaganInauguration -> 2848
B372: 12656 | C372: Assignment of emergency preparedness responsibilities | D372: November 18, 1988 | E372: of:=[.D372]-ReaganInauguration -> 2859
B373: 12657 | C373: Federal Emergency Management Agency assistance in emergency preparedness planning at commercial nuclear power plants | D373: November 18, 1988 | E373: of:=[.D373]-ReaganInauguration -> 2859
B374: 12658 | C374: President's Commission on Catastrophic Nuclear Accidents | D374: November 18, 1988 | E374: of:=[.D374]-ReaganInauguration -> 2859
B375: 12659 | C375: Delegation of authority regarding the naval petroleum and oil shale reserves | D375: December 15, 1988 | E375: of:=[.D375]-ReaganInauguration -> 2886
B376: 12660 | C376: National Microgravity Research Board | D376: December 16, 1988 | E376: of:=[.D376]-ReaganInauguration -> 2887
B377: 12661 | C377: Implementing the Omnibus Trade and Competitiveness Act of 1988 and Related International Trade Matters | D377: December 27, 1988 | E377: of:=[.D377]-ReaganInauguration -> 2898
B378: 12662 | C378: Implementing the United States-Canada Free-Trade Implementation Act | D378: December 31, 1988 | E378: of:=[.D378]-ReaganInauguration -> 2902
B379: 12663 | C379: Adjustments of certain rates of pay and allowances | D379: January 10, 1989 | E379: of:=[.D379]-ReaganInauguration -> 2912
B380: 12664 | C380: Establishing an emergency board to investigate a dispute between the Port Authority Trans-Hudson Corporation and certain of its employees represented by the Brotherhood of Locomotive Engineers | D380: January 6, 1989 | E380: of:=[.D380]-ReaganInauguration -> 2908
B381: 12665 | C381: Amending Executive Order No. 12658, the President's Commission on Catastrophic Nuclear Accidents | D381: January 12, 1989 | E381: of:=[.D381]-ReaganInauguration -> 2914
B382: 12666 | C382: Exclusions From the Federal Labor-Management Relations Program | D382: January 12, 1989 | E382: of:=[.D382]-ReaganInauguration -> 2914
B383: 12667 | C383: Presidential Records | D383: January 18, 1989 | E383: of:=[.D383]-ReaganInauguration -> 2920